Timestamp,Session_ID,Cycle_Number,Symbol,Current_Price,Position,Unrealized_PnL,Portfolio_Allocation_Pct,AI_Action,AI_Priority,AI_Reasoning,Technical_Score,AI_Confidence,AI_Trend,Trend_Confidence,Risk_Level,RSI,SMA_20,SMA_50,MACD_Histogram,Daily_Change_Pct,Volume_Ratio,Strategy_Mode
2025-08-18T10:27:55.754627,session_20250818_093728_3660,8,AAPL,231.56,0,0.0,23.787804076265616,SELL,HIGH,"The comprehensive analysis indicates strong bearish technicals for AAPL, with the AI Trend Analysis providing a very low technical score of 1/10 and high confidence in a BEARISH trend. This is further confirmed by a bearish MACD crossover (MACD line below signal line) and the price trading below key short-term moving averages (SMA 20, EMA 12, EMA 26) and the middle Bollinger Band. The news sentiment is NEUTRAL (score: -0.20), which is borderline negative and aligns with avoiding a BUY recommendation and does not contradict a SELL. According to the Balanced Trading Mode, a technical score of 4 or less warrants a high-priority SELL, and the neutral/negative news aligns with these weak technical signals for capital preservation. Selling the existing 1 share aligns with risk management to prevent further potential losses from a confirmed bearish trend.",1.0,HIGH,BEARISH,HIGH,HIGH,50.112866817155655,231.76999999999998,231.19120000000004,-0.08674285487033206,-0.0517955801104992,-1.0,BALANCED
2025-08-18T10:27:55.754652,session_20250818_093728_3660,8,XOM,0.0,0,0.0,0.0,HOLD,LOW,No valid market data available,0.0,LOW,NEUTRAL,LOW,HIGH,50.0,0.0,0.0,0.0,0.0,0.0,BALANCED
2025-08-18T10:27:55.754662,session_20250818_093728_3660,8,META,767.19,0,0.0,0.0,HOLD,LOW,"A BUY order is not possible due to insufficient available cash ($248.90 available vs. $767.19 share price, and $90 minimum cash reserve). Despite this, a SELL recommendation is strongly advised against due to the overwhelmingly positive news sentiment (+0.60), which exceeds the threshold for avoiding a SELL. Technical indicators are mixed: while RSI (25.2), MACD, and Stochastic show oversold conditions and potential for a short-term bounce, the broader AI trend analysis confirms a strong established bearish trend with high risk. Given the balanced trading mode's emphasis on capital preservation and avoiding trades during high volatility or conflicting signals, coupled with the absolute financial constraint and news-based sell restriction, the prudent action is to HOLD.",0.0,HIGH,BEARISH,MEDIUM,HIGH,25.194621372965415,772.7125,782.1734,0.0876620281003051,0.059995043887683584,-1.0,BALANCED
2025-08-18T10:27:55.754670,session_20250818_093728_3660,8,AMZN,230.33,0,0.0,0.0,HOLD,LOW,"A BUY order for AMZN is not possible at this time due to portfolio cash constraints. Purchasing 1 share at $230.33 would reduce available cash to $18.57, which falls significantly below the required minimum cash reserve of $90. Although technical indicators such as price trading above key moving averages (SMA 20, SMA 50, EMA 12, EMA 26), a bullish MACD crossover, and positive Stochastic momentum suggest strong underlying bullishness, the neutral news sentiment (-0.20) with a cautionary headline (""Amazon pulls back... AWS was a bit lackluster"") does not align positively for a high-priority BUY, as required by the Balanced Trading Mode. The combination of non-confirming news and the critical cash constraint makes a BUY action unfeasible and risky for capital preservation.",8.0,HIGH,BULLISH,HIGH,MEDIUM,40.639269406393,230.103,230.28220000000002,0.04571916387415595,0.039089645587214825,-1.0,BALANCED
2025-08-18T10:27:55.754678,session_20250818_093728_3660,8,NFLX,1250.84,0,0.0,0.0,HOLD,LOW,"The primary reason for a HOLD recommendation is the insufficient available cash ($248.90) to purchase even 1 share of NFLX at its current price ($1250.84), which violates portfolio constraints. Beyond this, even if cash were available, the technical indicators present a mixed signal. While NFLX is in a strong bullish trend confirmed by MACD and moving averages (SMA 20/50, EMA 12/26 crossovers), indicating a positive underlying momentum, multiple key momentum indicators suggest the stock is significantly overbought. The price is above the Bollinger Band Upper, and both Williams %R (-1.8) and Stochastic K (98.2) are at extreme overbought levels. The AI trend analysis corroborates the bullish trend but warns of a ""MEDIUM-HIGH"" risk and a ""high probability of a near-term correction"" due to these overbought conditions. The BALANCED TRADING MODE prioritizes capital preservation, demands multiple confirming indicators for a BUY (Technical Score 6+), and avoids trades during high volatility or when signals are conflicting. Entering a BUY position on an extremely overbought stock with a high risk of correction would contradict these principles, despite the overall bullish trend. No news data is available to influence the decision.",3.0,HIGH,BULLISH,MEDIUM,MEDIUM-HIGH,66.86251468860146,1240.7065,1239.1012,1.332362937959125,0.0031979533098787675,-1.0,BALANCED
2025-08-18T10:27:55.754686,session_20250818_093728_3660,8,MSFT,519.6,0,0.0,0.0,HOLD,LOW,"MSFT exhibits a strong bearish technical trend, confirmed by the price being consistently below all major moving averages (SMA20, SMA50, EMA12, EMA26), bearish MACD signals (negative MACD Histogram, MACD Line below Signal), and a ""BEARISH"" AI Trend with ""HIGH Confidence"" and ""HIGH Risk."" While some momentum indicators (RSI, Williams %R, Stochastic) are in oversold territory, suggesting a potential bounce, these are insufficient to counter the dominant bearish trend for a BUY recommendation. The technical score for a BUY is significantly below the required 6+. Crucially, the news sentiment is strongly positive (+1.20), driven by a strong earnings report. In ""BALANCED TRADING MODE,"" this presents a direct conflict: strong bearish technicals are misaligned with strongly positive news. The strategy explicitly requires news alignment for high-priority trades and, more importantly, states to ""Avoid SELL on strongly positive news (sentiment > +0.5)."" While we don't hold shares to sell, this rule highlights the impact of positive news. Given the capital preservation priority and the demand for multiple confirming indicators with strong technical alignment, the conflicting signals (bearish technicals vs. bullish news) make initiating any new position highly risky and non-compliant with the balanced strategy's requirements for clear alignment. Therefore, the prudent action is to remain on the sidelines.",2.0,HIGH,BEARISH,HIGH,HIGH,36.39846743295032,520.8965000000001,522.9596,-0.10372378924438896,0.13297103543968214,-1.0,BALANCED
2025-08-18T10:27:55.754693,session_20250818_093728_3660,8,NVDA,182.76,0,0.0,0.0,HOLD,LOW,"NVDA exhibits a strong underlying bullish trend with price comfortably above all key moving averages and a positive MACD. However, multiple critical momentum indicators (RSI 77.4, Stochastic K 94.6, Stochastic D 89.0, Williams %R -5.4) are deeply overbought, indicating a high probability of an imminent pullback or consolidation. The AI trend analysis explicitly notes a ""HIGH Risk Level"" despite the bullish trend. Furthermore, the provided volume data is invalid, which is a critical missing piece preventing proper confirmation of the trend's strength or potential reversal. In a balanced trading mode that prioritizes capital preservation, demands multiple confirming indicators, and avoids high-risk entries, initiating a BUY position under these overbought and high-risk conditions, compounded by missing vital volume data, is not prudent. We do not hold shares to SELL. Therefore, the recommendation is to HOLD and wait for a healthier entry point or a clearer technical picture.",3.0,HIGH,BULLISH,HIGH,HIGH,77.41273100615985,181.44400000000002,180.4962,0.07989839500025298,0.07118217160378659,-1.0,BALANCED
2025-08-18T10:27:55.754700,session_20250818_093728_3660,8,TSLA,334.18,1,0.0,34.329799474030246,HOLD,MEDIUM,"TSLA exhibits a strong underlying bullish trend, with price comfortably above key moving averages (SMA 20, SMA 50, EMA 12, EMA 26) and a confirmed bullish MACD crossover. The AI trend analysis reinforces this with a HIGH Confidence BULLISH outlook. However, multiple critical momentum indicators (RSI at 67.8, Williams %R at -0.5, Stochastic K at 99.5, Stochastic D at 90.3) signal extreme overbought conditions, indicating that a short-term pullback is highly probable, as explicitly stated by the AI analysis. The price is also nearing the upper Bollinger Band, suggesting overextension. In 'BALANCED TRADING MODE', capital preservation and avoiding trades during high volatility/risk are prioritized. Initiating a new BUY position at these overbought levels, with a high probability of a pullback and a HIGH Risk Level identified by AI, would violate the principle of capital preservation and strong technical alignment. While a SELL might be considered due to overbought conditions, the robust underlying bullish trend suggests that any pullback could be temporary. Therefore, holding the existing small position is the most prudent action to manage risk and await clearer, less conflicted signals, aligning with the balanced strategy.",5.0,MEDIUM,BULLISH,HIGH,HIGH,67.78625954198488,331.358,330.6168,0.2822965368952043,0.11384062312761996,-1.0,BALANCED
2025-08-18T10:27:55.754707,session_20250818_093728_3660,8,JPM,0.0,0,0.0,0.0,HOLD,LOW,No valid market data available,0.0,LOW,NEUTRAL,LOW,HIGH,50.0,0.0,0.0,0.0,0.0,0.0,BALANCED
2025-08-18T10:27:55.754713,session_20250818_093728_3660,8,ADBE,356.33,0,0.0,0.0,HOLD,LOW,"The primary reason for the HOLD recommendation is insufficient available cash ($248.90) to purchase 1 share of ADBE at the current price ($356.33). Even if funds were available, the technical picture for ADBE is mixed and does not meet the ""BALANCED TRADING MODE"" requirements for a high-priority BUY. While MACD and EMA indicate short-term bullish momentum, other key indicators like RSI, Williams %R, and Stochastic are neutral. Crucially, the volume data is reported as negative/unreliable, preventing confirmation of any trend. The AI trend analysis notes a ""weak bullish bias"" with ""low confidence"" and highlights a ""weak or sideways trend"" with ""bearish volume/OBV data"". The overall technical alignment is not strong enough, nor does it provide the multiple confirming indicators demanded by the strategy, especially failing to meet the required technical score of 6+ for a high-priority BUY. No news sentiment data is available, leading to a neutral impact.",3.0,HIGH,BULLISH,LOW,MEDIUM,49.25962487660398,356.169,356.34579999999994,0.1185593558025293,-0.1736937946491118,-1.0,BALANCED
