Timestamp,Session_ID,Cycle_Number,Symbol,Current_Price,Position,Unrealized_PnL,Portfolio_Allocation_Pct,AI_Action,AI_Priority,AI_Reasoning,Technical_Score,AI_Confidence,AI_Trend,Trend_Confidence,Risk_Level,RSI,SMA_20,SMA_50,MACD_Histogram,Daily_Change_Pct,Volume_Ratio,Strategy_Mode
2025-08-20T00:14:36.624079,session_20250819_235240_1250,4,BTCUSD,107807.83,0.0,0.0,0.0,HOLD,LOW,"The 5-minute timeframe presents conflicting technical signals. While the current price is positioned bullishly above both the SMA 20 and SMA 50, momentum indicators like MACD show a bearish crossover and negative histogram. Additionally, oscillators such as Williams %R and Stochastic K are in overbought territory, suggesting potential downside reversal. The AI trend analysis identifies the trend as NEUTRAL with LOW confidence due to these conflicting signals and a 0.00% daily change. Crucially, there is NO 1-HOUR TIMEFRAME DATA available, which significantly compromises the ability to establish a reliable medium-term trend and align with the critical dual-timeframe analysis requirement. Per crypto-adjusted rules, a technical score of 5+ is required for a high-priority BUY. Given the predominant bearish momentum/oscillator signals (4 bearish indicators) countering the bullish price positioning (2 bullish indicators), the overall technical strength is insufficient and lacks conviction for a BUY order (technical score estimated at 3). As there is no current position, a SELL action is not applicable. Therefore, it is prudent to HOLD and await clearer signals or the availability of the critical 1-hour timeframe data for a more confident assessment.",3.0,LOW,NEUTRAL,LOW,MEDIUM,44.44444444444444,107775.4875,107769.019,-6.897159740265509,0.0,30691268.882041004,BALANCED
2025-08-20T00:14:36.624105,session_20250819_235240_1250,4,ETHUSD,2480.44,0.0,0.0,0.0,HOLD,LOW,"The 5-minute timeframe for ETHUSD exhibits strong bearish technical signals. The MACD shows a bearish crossover with a negative histogram, and the current price ($2480.44) is trading below both its 20-period ($2481.93) and 50-period ($2481.93) Simple Moving Averages, reinforcing a downward bias. Furthermore, the AI trend analysis confirms a BEARISH trend with medium confidence, supported by high volume coinciding with negative price movement. The technical score of 2 clearly indicates strong bearish conditions, falling significantly below the crypto-adjusted threshold of 5+ required for a high-priority BUY recommendation. No 1-hour data is available to confirm a broader trend, making a dual-timeframe analysis impossible. With no current position and overwhelmingly bearish technicals, initiating a BUY trade is not advisable.",2.0,MEDIUM,BEARISH,MEDIUM,MEDIUM,50.0,2481.9285,2481.9282000000003,-0.05422296842043646,-0.09988239653311497,714740.0670682056,BALANCED
2025-08-20T00:14:36.624117,session_20250819_235240_1250,4,LINKUSD,18.82231,0.0,0.0,0.0,HOLD,LOW,"The provided data indicates a perfectly flat market for LINKUSD. All key technical indicators (RSI, MACD, SMAs, Williams %R, Stochastic K, ATR, and Volatility) register zero movement or NaN values, confirming no discernible trend, momentum, or volatility. The AI Trend Analysis explicitly states a ""NEUTRAL"" trend with ""HIGH"" confidence due to these flat metrics. There is no 1-hour data available to confirm a broader trend, and news sentiment is neutral. Without any technical signals or market movement, there is no basis to initiate a BUY or SELL trade, as per the crypto-adjusted technical score requirements (5+ for BUY, 5- for SELL). Initiating a trade in a completely flat market with no technical triggers would be purely speculative.",0.0,HIGH,NEUTRAL,HIGH,LOW,,18.82231,18.82231,1.8932661725304283e-29,0.0,5000000.0,BALANCED
2025-08-20T00:14:36.624127,session_20250819_235240_1250,4,LTCUSD,120.3,0.0,0.0,0.0,HOLD,LOW,"Lack of 1-hour timeframe data prevents a comprehensive dual-timeframe analysis, which is critical for medium-term trend confirmation. Short-term 5-minute indicators present conflicting signals: the current price ($120.30) is below both the SMA 20 ($120.35) and SMA 50 ($120.40), indicating short-term bearishness. However, momentum indicators Williams %R (-100.0) and Stochastic K (0.0) are at extreme oversold levels, typically signaling a potential bounce or reversal. The AI trend analysis accurately identifies a NEUTRAL trend with LOW confidence and MEDIUM risk due to these conflicting signals, indicating indecision within a tight trading range. While extreme oversold conditions can lead to strong bounces in crypto, the overall technical score of +3 does not meet the crypto-adjusted threshold of 5+ required for a high-priority BUY recommendation. Given the low confidence in the trend, conflicting indicators, and absence of crucial 1-hour data, holding is the most prudent action until clearer signals emerge.",3.0,LOW,NEUTRAL,LOW,MEDIUM,50.0,120.354,120.40180000000001,0.00019088540360259407,-0.09965122072745768,34263.82557577459,BALANCED
2025-08-20T00:14:36.624136,session_20250819_235240_1250,4,BCHUSD,577.66,0.0,0.0,0.0,HOLD,LOW,"The analysis is severely hampered by a significant lack of critical data. There is no 1-hour timeframe data available, which is heavily weighted for trend direction, forcing reliance solely on incomplete 5-minute data. Key technical indicators such as RSI, MACD, Williams %R, Stochastic, ATR, and 20-day Volatility are either 'nan' or '0.000', preventing any robust confirmation of market momentum or volatility. While the current price is above the SMA 20 and SMA 50, and the AI identifies a 'BULLISH' trend, the AI's confidence is explicitly LOW due to the missing data and an additional flag that the asset is 'overbought' by Bollinger Bands (as per AI reasoning). The absence of multiple confirming indicators and the critical data gaps lead to a very low technical score, well below the crypto-adjusted threshold of 5+ required for a high-priority BUY. Without news sentiment, and with such incomplete and conflicting technical information, it is prudent to HOLD and await more comprehensive data before considering a trade.",3.0,LOW,BULLISH,LOW,MEDIUM,,575.53,575.53,0.0,0.37009365280697715,5000000.0,BALANCED
2025-08-20T00:14:36.624145,session_20250819_235240_1250,4,ZECUSD,38.47,0.0,0.0,0.0,HOLD,LOW,"A BUY recommendation cannot be justified at this time due to significant data deficiencies and conflicting signals. Crucial 1-hour timeframe data is unavailable, preventing a robust dual-timeframe analysis. On the 5-minute timeframe, key momentum indicators (RSI, Williams %R, Stochastic K) are 'nan', rendering them unusable. Volatility metrics (ATR, 20-day Volatility) and Volume Moving Average are '0.000', indicating either extremely low price movement (making profitable trades unlikely) or severe data integrity issues. While the AI trend analysis indicates a ""weak bullish trend"" supported by ""explicit bullish MACD"" and ""high volume with positive price movement,"" it simultaneously flags an ""overbought Bollinger Band position,"" which is a short-term bearish signal suggesting a potential pullback. The AI's overall confidence is ""LOW,"" and the risk level is ""MEDIUM."" The combination of missing critical data, contradictory signals (weak bullish trend vs. overbought conditions), and extremely low volatility metrics means there is insufficient technical conviction to meet the crypto-adjusted threshold of 5+ for a high-priority BUY, especially when a potential pullback is indicated.",3.0,LOW,BULLISH,LOW,MEDIUM,,38.42,38.42,2.524354896707238e-29,0.13014055179593223,5000000.0,BALANCED
2025-08-20T00:14:36.624154,session_20250819_235240_1250,4,XLMUSD,0.0,0.0,0.0,0.0,HOLD,LOW,No valid market data available,0.0,LOW,NEUTRAL,LOW,HIGH,50.0,0.0,0.0,0.0,0.0,0.0,BALANCED
2025-08-20T00:14:36.624164,session_20250819_235240_1250,4,BATUSD,0.1529,0.0,0.0,0.0,HOLD,LOW,"The market for BATUSD exhibits extremely low volatility and complete price stagnation, with a 0.00% daily change and an ATR of 0.000. Most short-term technical indicators (RSI, Williams %R, Stochastic) display 'nan' values, and MACD components are zero, indicating an absence of discernible momentum or trends. Both SMA 20 and SMA 50 are flat at the current price, offering no directional insight. While the AI trend analysis states 'BULLISH', it does so with 'LOW' confidence, explicitly noting the ""extremely low volatility and strong consolidation with many indicators showing no movement or 'nan' values."" Furthermore, crucial 1-hour timeframe data is unavailable, preventing a robust dual-timeframe analysis for trend confirmation. With a technical score of 1, far below the crypto-adjusted threshold of 5+ for a BUY or 5- for a SELL, and no news sentiment to influence the decision, there is no actionable signal or basis for a trade. It is prudent to HOLD until meaningful price action or clear technical signals emerge.",1.0,LOW,BULLISH,LOW,MEDIUM,,0.1529,0.1529,4.930380657631324e-32,0.0,5000000.0,BALANCED
2025-08-20T00:14:36.624174,session_20250819_235240_1250,4,OXTUSD,0.06989,0.0,0.0,0.0,HOLD,LOW,"The asset OXTUSD exhibits extreme price flatness and zero volatility across all available 5-minute technical indicators (MACD at 0, SMAs collapsed to current price, ATR at 0, RSI/Williams %R/Stochastic are NaN), confirming the AI trend analysis of a NEUTRAL, stagnant market. There is no discernible trend or momentum to suggest a BUY or SELL action. The absence of 1-hour data prevents comprehensive dual-timeframe analysis, and the anomalous volume data (Volume MA 0 leading to an extremely high Volume Ratio) suggests potential illiquidity or data inconsistencies, making any trade based on this data unreliable. Without any clear technical signals or volatility, and no news sentiment to consider, a trading action is not warranted under crypto-adjusted thresholds.",0.0,HIGH,NEUTRAL,MEDIUM,LOW,,0.06989,0.06989,0.0,0.0,5000000.0,BALANCED
2025-08-20T00:14:36.624188,session_20250819_235240_1250,4,1INCHUSD,0.0,0.0,0.0,0.0,HOLD,LOW,No valid market data available,0.0,LOW,NEUTRAL,LOW,HIGH,50.0,0.0,0.0,0.0,0.0,0.0,BALANCED
