Timestamp,Session_ID,Cycle_Number,Symbol,Current_Price,Position,Unrealized_PnL,Portfolio_Allocation_Pct,AI_Action,AI_Priority,AI_Reasoning,Technical_Score,AI_Confidence,AI_Trend,Trend_Confidence,Risk_Level,RSI,SMA_20,SMA_50,MACD_Histogram,Daily_Change_Pct,Volume_Ratio,Strategy_Mode
2025-08-22T03:39:56.812822,session_20250821_220904_4013,48,BTCUSD,107700.02,0.0,0.0,0.0,HOLD,LOW,"Despite individual bearish technical indicators such as a MACD bearish crossover with a negative histogram and the price trading below both the SMA 20 and SMA 50, the AI trend analysis explicitly highlights an ""extreme lack of current momentum and trend strength."" The 0.00% daily change further confirms this absence of significant movement. As an aggressive trader, prioritizing momentum for decisive action to maximize profit is crucial. With the AI indicating ""low confidence in an immediate directional move"" due to this lack of momentum, entering a new short position (SELL) carries high risk of stagnation or whipsaw, counter to aggressive trading principles. Furthermore, the absence of 1-hour data prevents confirmation of any medium-term trend. Therefore, the most prudent action is to HOLD and wait for clearer directional momentum to emerge.",3.0,LOW,BEARISH,LOW,MEDIUM,50.0,107753.92550000001,107753.92520000001,-6.966158765370534,0.0,29765273.993496917,AGGRESSIVE
2025-08-22T03:39:56.812855,session_20250821_220904_4013,48,ETHUSD,2482.92,0.023158999999999996,-0.0501,0.0,HOLD,LOW,"The current ETHUSD position (0.023158999999999996 shares) is unprofitable with a Net P&L of $-0.06. According to CRITICAL FEE-AWARE SELL RULE 4, an unprofitable position must be held unless it triggers an emergency stop-loss (2%+ loss from purchase price). The current price ($2482.92) is not below the 2% stop-loss threshold ($2435.38), therefore an immediate SELL is not justified.",5.0,LOW,BULLISH,LOW,MEDIUM,42.873563218390416,2482.0535,2481.9788,-0.2766080271460008,0.09998226121172124,704274.955848217,AGGRESSIVE
2025-08-22T03:39:56.812871,session_20250821_220904_4013,48,LINKUSD,18.82231,0.0,0.0,0.0,HOLD,LOW,"Despite the AI's weak bullish bias, the market for LINKUSD is in extreme consolidation with zero volatility across all key indicators including RSI (50.0), MACD (0.000), SMA (price exactly on MAs), ATR (0.000), and 20-day Volatility (0.000). There is no 1-hour timeframe data available, which significantly lowers confidence for any directional trade, especially since we are instructed to weigh 1-hour trends more heavily. Momentum and volume are prioritized in aggressive mode, but both are absent or anomalous (Volume MA 0 despite Current Volume 5M, contradicting zero volatility). With no clear directional momentum or actionable technical signals (no score 4+ for BUY or 6- for SELL), and given the high risk associated with trading an asset showing no movement, a HOLD decision is prudent. Entering a position under these conditions would be speculative rather than based on technical analysis or momentum.",2.0,LOW,BULLISH,LOW,HIGH,50.0,18.82231,18.82231,1.8932661725304283e-29,0.0,5000000.0,AGGRESSIVE
2025-08-22T03:39:56.812884,session_20250821_220904_4013,48,LTCUSD,120.42,0.013244999999999618,0.0012,0.0,HOLD,MEDIUM,"The current position is unprofitable to sell after accounting for trading fees (Net P&L: $-0.01), and the 2%+ stop-loss trigger has not been met. Aggressive trading rules and critical fee-aware sell rules mandate a HOLD in this scenario to avoid locking in a loss. Technically, the 5-minute timeframe shows conflicting signals: strong oversold momentum from Williams %R (-95.9) and Stochastic K (4.1) along with extremely high volume (34459.67x average) suggest potential for a short-term bullish bounce. However, this is countered by a bearish MACD crossover (MACD Line: -0.019, Signal: 0.015) and price trading below SMA20 ($120.42 < $120.51). The AI Trend Analysis confirms a NEUTRAL trend with medium confidence due to these conflicting indicators. Given the mandatory sell rules, HOLD is the appropriate action while awaiting a profitable exit or a stop-loss trigger.",5.0,HIGH,NEUTRAL,MEDIUM,MEDIUM,50.0,120.50550000000001,120.4158,-0.03450383347684167,0.0997506234414003,34459.67280754221,AGGRESSIVE
2025-08-22T03:39:56.812899,session_20250821_220904_4013,48,BCHUSD,577.66,0.5213359999999999,-0.0,0.0,HOLD,MEDIUM,"The current position is unprofitable to sell (Net P&L After Fees: $-0.01), which, according to critical fee-aware sell rules, mandates a HOLD unless it's an emergency stop-loss, which is not triggered here. For new trades, the 5-minute technical data presents significant inconsistencies and missing information (MACD, ATR, Stochastic, Williams %R are zero or 'nan'), leading to low data reliability as explicitly stated by the AI trend analysis. While the price is above SMAs and current volume is high, the absence of volatility data (ATR, 20-day Volatility are 0.000) severely limits confidence in current momentum. No 1-hour data is available, preventing a comprehensive dual timeframe assessment. Given the unreliable technical signals and the mandatory hold on the existing position, no new aggressive action is advisable.",3.0,LOW,BULLISH,LOW,HIGH,50.0,575.53,575.53,0.0,0.37009365280697715,5000000.0,AGGRESSIVE
2025-08-22T03:39:56.812915,session_20250821_220904_4013,48,ZECUSD,38.47,1.300714,0.0,0.0,HOLD,LOW,"The current position is unprofitable to sell (Net P&L: $-0.01) after accounting for fees. According to the critical fee-aware sell rules, we MUST HOLD unless it's an emergency stop-loss, which is not triggered here.",5.0,LOW,BULLISH,LOW,MEDIUM,50.0,38.42,38.42,3.889999471156234e-09,0.13014055179593223,5000000.0,AGGRESSIVE
2025-08-22T03:39:56.812929,session_20250821_220904_4013,48,BATUSD,0.1529,327.011118,0.0,0.0,HOLD,LOW,"The current position is explicitly marked as ""âŒ UNPROFITABLE to sell"" after accounting for trading fees, which, by critical trading rules, mandates a HOLD unless a stop-loss is triggered (none indicated here). All technical indicators (RSI, MACD, SMA 20/50, ATR, 20-day Volatility) are completely flat or zero, indicating an absolute absence of price movement, volatility, or momentum. The AI trend analysis confirms a NEUTRAL trend with HIGH confidence and LOW risk, due to the static price. Despite the aggressive trading mode, there are no actionable buy or sell signals (technical score far below 4+ for BUY or 6- for SELL) to maximize profit through decisive action, as the asset is not moving. Therefore, the strategy is to hold the existing unprofitable position and wait for any market movement or valid technical signal.",1.0,HIGH,NEUTRAL,HIGH,LOW,50.0,0.1529,0.1529,4.930380657631324e-32,0.0,5000000.0,AGGRESSIVE
2025-08-22T03:39:56.812944,session_20250821_220904_4013,48,OXTUSD,0.06989,0.0,0.0,0.0,HOLD,LOW,"All available technical indicators on the 5-minute timeframe, including RSI, MACD, SMA 20, and SMA 50, are completely flat and neutral, indicating an absolute absence of price movement or a discernible trend. Volatility measures (ATR, 20-day Volatility) are also at zero. The AI trend analysis confirms a NEUTRAL trend with HIGH confidence, explicitly stating ""signaling an absolute absence of price movement or a discernible trend."" While current volume is high, the Volume MA is 0, making comparative analysis difficult, and high volume without price movement often suggests consolidation. Aggressive trading prioritizes momentum and clear signals for decisive action, neither of which are present for OXTUSD. Furthermore, no 1-hour data is available for trend confirmation, forcing reliance solely on the extremely neutral 5-minute data. The technical score for any directional trade is extremely low.",1.0,HIGH,NEUTRAL,HIGH,LOW,50.0,0.06989,0.06989,0.0,0.0,5000000.0,AGGRESSIVE
