Timestamp,Session_ID,Cycle_Number,Symbol,Current_Price,Position,Unrealized_PnL,Portfolio_Allocation_Pct,AI_Action,AI_Priority,AI_Reasoning,Technical_Score,AI_Confidence,AI_Trend,Trend_Confidence,Risk_Level,RSI,SMA_20,SMA_50,MACD_Histogram,Daily_Change_Pct,Volume_Ratio,Strategy_Mode
2025-08-22T15:22:35.217830,session_20250822_131922_2405,17,BTCUSD,107700.02,1.8600000000000127e-06,-0.0,0.0,HOLD,MEDIUM,"The current position is ❌ UNPROFITABLE to sell after accounting for trading fees (Net P&L: $-0.01), which triggers the mandatory rule to HOLD unless a stop-loss is activated. From a technical perspective, the overall trend for BTCUSD is strongly BEARISH with HIGH confidence according to the AI analysis. This is supported by the price trading below key moving averages (SMA 20 and SMA 50), which are also in a bearish alignment, alongside negative MACD momentum. While short-term oscillators like Williams %R (-20.0) and Stochastic K (80.0) indicate overbought conditions or short-term strength, within a confirmed bearish trend, these often signal an impending reversal downwards or exhaustion of a minor bounce, reinforcing the bearish outlook. Given the aggressive trading mode, a new BUY order is not advisable due to the strong bearish signals, and we are constrained from selling the existing unprofitable position.",3.0,HIGH,BEARISH,HIGH,MEDIUM,57.142857142857146,107753.925,107758.23760000002,-0.030774289736815952,0.0,30541585.75329807,AGGRESSIVE
2025-08-22T15:22:35.217857,session_20250822_131922_2405,17,ETHUSD,2482.92,0.040276,0.0,0.0,HOLD,MEDIUM,"The current ETHUSD position is unprofitable ($0.01 net loss after fees), which triggers the mandatory 'HOLD' rule for positions not at a stop-loss level. Technical analysis on the 5-minute timeframe is mixed: MACD shows a bearish bias (Line: -0.046, Signal: -0.002), and the AI Trend analysis indicates ""NEUTRAL"" with ""WEAK_BEARISH"" strength and LOW confidence. While there's an exceptionally high volume ratio (704045.35x average), indicating strong activity and potential for an impending move (prioritized in AGGRESSIVE mode), the price has shown no change (0.00% daily). This suggests a consolidation phase where the direction of the next move is unclear despite significant interest. The absence of 1-hour data further limits trend confirmation and overall confidence. Given the lack of strong, confirmed directional technical signals for a decisive BUY (score 4+) or SELL (score 6-), and the unprofitability of the existing position, holding is the prudent action.",3.0,LOW,NEUTRAL,LOW,MEDIUM,50.0,2482.0525000000002,2482.2268,-0.043795319699545386,0.0,704045.3503452565,AGGRESSIVE
2025-08-22T15:22:35.217867,session_20250822_131922_2405,17,LINKUSD,18.82231,0.0,0.0,0.0,BUY,MEDIUM,"The AI analysis indicates a ""weak bullish bias"" and a ""bullish MACD signal"" with a ""higher count of bullish signals."" Price is holding at key SMA 20/50 levels. Crucially, current volume is extremely high at 5,000,000, which in an aggressive trading mode can signal accumulation preceding a significant move. Although there's extreme flatness with zero volatility (0.00% daily change, ATR 0.000), the aggressive trading mandate to ""maximize profit"" through decisive action and ""accept higher risk for higher potential returns"" supports an entry based on these underlying bullish hints and strong volume. This action speculates on an imminent bullish breakout despite the current lack of momentum. The absence of 1-hour timeframe data limits overall confidence.",4.0,LOW,BULLISH,LOW,LOW,50.0,18.82231,18.82231,1.004981065270378e-18,0.0,5000000.0,AGGRESSIVE
2025-08-22T15:22:35.217877,session_20250822_131922_2405,17,LTCUSD,120.42,3.7406519999999994,0.4489,0.0,BUY,HIGH,"The AI trend analysis confirms a ""BULLISH"" trend with ""HIGH"" confidence, explicitly stating that ""despite extreme overbought readings from Williams %R and Stochastic, the overall technical strength and buying pressure are robust."" This, combined with exceptionally high volume (33947x average) and a bullish MACD crossover with price above key SMAs, indicates powerful upward momentum. In AGGRESSIVE TRADING MODE, we prioritize momentum and volume for maximizing profit. The derived technical score of 6.5 is actionable for BUY (score 4+). Our current profitable position allows for further accumulation to capitalize on this strong bullish trend, remaining within the maximum share limit of 5.",6.5,HIGH,BULLISH,HIGH,MEDIUM,50.0,120.354,120.35040000000001,0.005209670906594167,0.0997506234414003,33947.18286194578,AGGRESSIVE
2025-08-22T15:22:35.217887,session_20250822_131922_2405,17,BCHUSD,577.66,0.259668,0.0,0.0,HOLD,MEDIUM,"The current position is unprofitable to sell with a net P&L of $-0.01 after fees, mandating a HOLD as per fee-aware sell rule #4. For a new trade, despite the AGGRESSIVE TRADING MODE, a BUY recommendation cannot be justified. The critical 1-hour timeframe data is unavailable, which significantly impairs trend confirmation as per the DUAL TIMEFRAME INSTRUCTION to weight it more heavily. The available 5-minute data presents mixed signals: price is slightly above SMAs ($577.66 > $575.53) and current volume is high (5,000,000), suggesting some weak bullish momentum. However, RSI is neutral (50.0), MACD is flat (0.000), and critical volatility indicators like ATR and 20-day Volatility are reported as 0.000, indicating a lack of reliable price movement data. The AI Trend Analysis, while stating BULLISH, has LOW confidence and explicitly notes ""low conviction and high uncertainty"" and mentions an ""overbought Bollinger Band signal."" Calculating a technical score based on reliable signals (Price > SMAs: +2, High Volume: +1, Neutral RSI/MACD: 0, Problematic 0-values for Volatility/ATR: -1, AI low confidence/overbought: -0.5) results in a score of approximately 1.5, which falls well below the ""4+"" threshold required for an actionable BUY in aggressive mode. Without clear, confirmed bullish signals and lacking the primary 1-hour trend, initiating a new BUY order carries excessive, unquantifiable risk. No news data is available to influence the decision.",2.0,MEDIUM,BULLISH,LOW,MEDIUM,50.0,575.53,575.53,0.0,0.37009365280697715,5000000.0,AGGRESSIVE
2025-08-22T15:22:35.217896,session_20250822_131922_2405,17,ZECUSD,38.47,1.299714,0.0,0.0,HOLD,LOW,"The current ZECUSD position is unprofitable to sell after accounting for round-trip trading fees, mandating a HOLD as per trading rules. On the 5-minute timeframe, technical indicators are mixed: the RSI is neutral (50), and MACD lines are flat near zero, indicating a lack of strong short-term momentum. While current volume is exceptionally high, which typically signals interest, the AI's analysis presents conflicting signals, noting both weak bullish momentum and an overbought condition (price above the upper Bollinger Band), leading to low confidence in its ""BULLISH"" trend assessment. The critical absence of 1-hour timeframe data prevents a robust medium-term trend confirmation. Given the aggressive trading mode's focus on momentum, the ambiguous technical signals, coupled with the mandatory rule against selling at a net loss, dictates holding the position and awaiting clearer directional signals or price appreciation above the breakeven point.",3.0,LOW,BULLISH,LOW,HIGH,50.0,38.42,38.42,0.00019534693908261494,0.13014055179593223,4576273.5,AGGRESSIVE
2025-08-22T15:22:35.217905,session_20250822_131922_2405,17,BATUSD,0.1529,327.011118,0.0,0.0,HOLD,LOW,"The market for BATUSD is experiencing an extremely flat and trendless period. All 5-minute technical indicators (RSI 50, MACD 0, SMAs converged at $0.15, 0% daily change, 0 volatility) point to perfect neutrality. The AI trend analysis confirms a NEUTRAL trend with LOW confidence. Crucially, 1-hour data is unavailable, limiting medium-term trend confirmation. While ""AGGRESSIVE TRADING MODE"" prioritizes decisive action, the ""CRITICAL FEE-AWARE SELL RULES"" are mandatory. The current position is explicitly stated as ""❌ UNPROFITABLE to sell"" (Net P&L After Fees: $-0.01). According to these rules, a hold is required unless a stop-loss is triggered, which is not the case here as the gross P&L is $0.00. No news is available to influence a directional trade. Therefore, holding is the only permissible action, awaiting a significant price movement that allows for a profitable exit or triggers a stop-loss.",0.0,HIGH,NEUTRAL,LOW,LOW,50.0,0.1529,0.1529,2.7920814916656273e-18,0.0,5000000.0,AGGRESSIVE
2025-08-22T15:22:35.217914,session_20250822_131922_2405,17,OXTUSD,0.06989,0.0,0.0,0.0,HOLD,LOW,"All available technical indicators (RSI, MACD, SMAs, ATR, and Volatility) across the 5-minute timeframe show absolutely no price movement, zero volatility, and perfectly neutral readings. The price has remained static at $0.07 with a 0.00% daily change. While a current volume of 5,000,000 is reported, the Volume MA is 0 and the AI Trend Analysis explicitly states a ""complete lack of price movement and zero volatility,"" indicating this volume is not translating into any market action or trend. There is no 1-hour data available for medium-term confirmation, and the AI Trend itself is NEUTRAL with HIGH confidence. In an aggressive trading mode, the priority is to maximize profit through decisive action based on momentum and volume. With no momentum, no volatility, and no discernible trend, there is no actionable signal for either a BUY (requiring a technical score of 4+) or a SELL (requiring 6-). Entering a position in a completely stagnant asset would tie up capital without any potential for profit.",0.0,HIGH,NEUTRAL,HIGH,LOW,50.0,0.06989,0.06989,0.0,0.0,5000000.0,AGGRESSIVE
