Timestamp,Session_ID,Cycle_Number,Symbol,Current_Price,Position,Unrealized_PnL,Portfolio_Allocation_Pct,AI_Action,AI_Priority,AI_Reasoning,Technical_Score,AI_Confidence,AI_Trend,Trend_Confidence,Risk_Level,RSI,SMA_20,SMA_50,MACD_Histogram,Daily_Change_Pct,Volume_Ratio,Strategy_Mode
2025-08-21T14:02:16.846853,session_20250821_122042_5417,14,BTCUSD,107807.83,0.0,0.0236,0.0,SELL,MEDIUM,"The current BTCUSD position is profitable, allowing for a strategic exit to secure gains. While the price remains above bullishly aligned SMAs (SMA 20 above SMA 50), indicating an underlying uptrend, the 5-minute MACD shows a clear bearish crossover (MACD line below signal line) and a negative histogram, signifying a loss of short-term upward momentum. The AI trend analysis, despite identifying a bullish trend, assigns LOW confidence and HIGH risk, reinforcing the need for caution. In aggressive trading mode, prioritizing momentum indicators (like MACD) and being quick to exit profitable positions when signals are conflicting or risk is high is crucial. The absence of 1-hour timeframe data also reduces overall trend confirmation, making it prudent to take profit on a conflicting short-term outlook.",6.0,MEDIUM,BULLISH,LOW,HIGH,33.33539431786457,107770.0975,107762.55099999999,-1.8561742480727528,0.0,31103153.051127076,AGGRESSIVE
2025-08-21T14:02:16.846884,session_20250821_122042_5417,14,ETHUSD,2480.44,0.023158999999999996,-0.1075,0.0,HOLD,LOW,"The current ETHUSD position is significantly unprofitable with a Net P&L of $-0.12, triggering the ""UNPROFITABLE to sell"" rule. As there is no emergency stop-loss condition (loss is negligible compared to 2%+), we **MUST** recommend HOLD for the existing shares, as per critical fee-aware sell rules. For new trading opportunities, while 5-minute technicals show a bearish alignment (Price below SMAs, SMA 20 below SMA 50, MACD Line below Signal Line with negative histogram), the 0.00% daily price change indicates severe stagnation. The AI trend analysis confirms a BEARISH outlook but explicitly states LOW confidence due to static data and the critical absence of 1-hour timeframe data. Despite the aggressive trading mode, the lack of medium-term trend confirmation, stagnant price action despite anomalous high volume, and the low confidence in the technical analysis prevent any high-conviction BUY or aggressive SELL (for a new short position). The best approach is to HOLD the existing unprofitable position and wait for clearer directional momentum or a recovery in price.",5.0,LOW,BEARISH,LOW,MEDIUM,50.0,2481.3095000000003,2481.8792,-0.031858637581055504,0.0,714581.2895594323,AGGRESSIVE
2025-08-21T14:02:16.846898,session_20250821_122042_5417,14,LINKUSD,18.82231,0.0,0.0,0.0,HOLD,LOW,"The market for LINKUSD exhibits extreme stagnation with a 0.00% daily price change, 0.000 ATR, and 0.000 20-day Volatility, indicating no discernible price movement or momentum. All key 5-minute technical indicators (RSI 50.0, MACD at 0.000, price resting precisely on SMA 20 and SMA 50) are perfectly neutral, offering no bullish or bearish signals. While the AI Trend Analysis mentions a 'WEAK_BULLISH' trend, it explicitly states that 'the provided data set contains significant internal contradictions' and reflects 'extreme market stagnation and neutrality,' making its overall assessment unreliable. There is no 1-hour data available for medium-term trend confirmation, and no news sentiment to influence the decision. In an aggressive trading mode aimed at maximizing profit, entering a position in a perfectly flat market with zero volatility would only incur trading fees ($0.01 per trade) without any potential for price appreciation or depreciation, directly contradicting the objective to maximize profit and accept risk for *potential* returns. Therefore, despite a technical score of 5 which nominally falls within 'actionable for BUY' (4+) and 'actionable for SELL' (6-), the complete lack of movement and contradictory data renders any trade attempt unprofitable and highly uncertain. The most prudent action is to HOLD and wait for clearer, actionable signals or market volatility.",5.0,HIGH,WEAK_BULLISH,LOW,MEDIUM,50.0,18.82231,18.82231,1.8932661725304283e-29,0.0,5000000.0,AGGRESSIVE
2025-08-21T14:02:16.846909,session_20250821_122042_5417,14,LTCUSD,120.42,0.013244999999999618,0.0384,0.0,SELL,HIGH,"The current position is profitable with a net P&L of $+0.03, satisfying the mandatory fee-aware sell rules. The AI Trend Analysis indicates a ""NEUTRAL"" trend with ""HIGH CONFIDENCE,"" highlighting a stagnant market with no discernible upward momentum. While some oscillators are oversold, the overall market stagnation and 0.00% daily change override these as strong buy signals. In an aggressive trading mode, maximizing profit through decisive action means locking in gains when there is no strong indication of further upside. The extremely high volume paired with zero price change suggests a balanced but potentially volatile market, lacking a clear bullish catalyst. Selling now allows for profit realization and capital redeployment in a market that shows no immediate potential for further gains.",5.0,HIGH,NEUTRAL,HIGH,LOW,50.0,120.354,120.36,-0.0014438775196495167,0.0,34307.12593936251,AGGRESSIVE
2025-08-21T14:02:16.846917,session_20250821_122042_5417,14,BCHUSD,577.66,0.5213359999999999,-0.0,0.0,HOLD,MEDIUM,"The current position is unprofitable to sell (Net P&L: $-0.01), and the mandatory fee-aware sell rules dictate HOLD unless an emergency stop-loss (2%+ loss) is triggered, which is not the case here. While the 5-minute timeframe shows some bullish signs like price trading above key moving averages ($577.66 vs SMAs at $575.53) and an extremely high current volume (5,000,000x average volume ratio), indicating upward momentum as per aggressive mode's prioritization, the overall technical picture is highly ambiguous. Critical indicators such as MACD, Williams %R, Stochastic K, ATR, and 20-day Volatility are either zero or unavailable, severely compromising the reliability of a comprehensive technical assessment. The AI trend analysis confirms a BULLISH trend but with LOW confidence and a HIGH risk level, noting a potential overbought condition and the significant data gaps. The absence of 1-hour data prevents medium-term trend confirmation. Given the paramount constraint of not selling at a loss, coupled with the mixed and incomplete technical signals, holding is the most prudent action to await either a return to profitability or a clear stop-loss trigger, rather than adding to an already unprofitable position under uncertain conditions.",3.0,LOW,BULLISH,LOW,HIGH,50.0,575.53,575.53,0.0,0.37009365280697715,5000000.0,AGGRESSIVE
2025-08-21T14:02:16.846924,session_20250821_122042_5417,14,ZECUSD,38.47,1.300714,0.0,0.0,HOLD,LOW,"Current position is unprofitable to sell as per the portfolio analysis (Net P&L $-0.01 after fees) and does not meet the 2%+ stop-loss trigger, mandating a HOLD as per aggressive trading rules. Technical indicators from the 5-minute timeframe show market stagnation (RSI 50, flat MACD, zero ATR/volatility) despite a slight positive price change and high current volume. The AI trend analysis labels the trend as 'BULLISH' but with 'LOW Confidence', crucially highlighting the asset is 'overbought by Bollinger Bands' and has 'negative On-Balance Volume', indicating potential downside or lack of sustainable momentum. These contradictory signals and the absence of 1-hour timeframe data prevent a high-conviction BUY, and the 'UNPROFITABLE to sell' status overrides any potential SELL signal.",3.0,LOW,BULLISH,LOW,HIGH,50.0,38.42,38.42,2.0507360517743436e-15,0.13014055179593223,5000000.0,AGGRESSIVE
2025-08-21T14:02:16.846945,session_20250821_122042_5417,14,BATUSD,0.1529,327.011118,0.0,0.0,HOLD,LOW,"The current position in BATUSD is explicitly stated as ""❌ UNPROFITABLE to sell"" due to the total fees exceeding the gross P&L, which mandates a HOLD action as per critical fee-aware sell rules. All available technical indicators for the 5-minute timeframe (RSI 50.0, MACD at 0, SMA 20 and 50 at current price, ATR 0.000, 20-day Volatility 0.000) show extreme neutrality and stagnation, with zero price movement. The AI Trend Analysis confirms a NEUTRAL trend with HIGH confidence. No 1-hour data is available for medium-term trend confirmation, and no news sentiment is present to influence the decision. Given the lack of any discernible momentum, volatility, or directional signal, coupled with the unprofitable state of the current position, holding is the most prudent action to avoid locking in a loss.",5.0,HIGH,NEUTRAL,HIGH,LOW,50.0,0.1529,0.1529,4.930380657631324e-32,0.0,5000000.0,AGGRESSIVE
2025-08-21T14:02:16.846961,session_20250821_122042_5417,14,OXTUSD,0.06989,0.0,0.0,0.0,HOLD,LOW,"The price of OXTUSD is completely static at $0.07, leading to zero volatility across all related indicators (ATR, Standard Deviation, Bollinger Bands, etc.) and flat moving averages (SMA 20, SMA 50). Momentum indicators like RSI (50.0) and MACD (0.000) are perfectly neutral, signaling a complete lack of directional movement or discernible trend. Despite a high current volume, its MA is 0, and the price remains stagnant, indicating no actionable liquidity or momentum for trading. In an aggressive trading mode, capital must be deployed where there is potential for profit driven by price movement and momentum. With a static price, there is no opportunity for short-term gains, and attempting to trade would only incur non-recoverable fees ($0.01 per trade). There are no technical signals (neither BUY (4+) nor SELL (6-)) to justify an entry or exit, as all indicators point to absolute neutrality. Holding cash and waiting for an asset with actual price action is the most profitable strategy here.",1.0,HIGH,NEUTRAL,HIGH,LOW,50.0,0.06989,0.06989,0.0,0.0,5000000.0,AGGRESSIVE
