Timestamp,Session_ID,Cycle_Number,Symbol,Current_Price,Position,Unrealized_PnL,Portfolio_Allocation_Pct,AI_Action,AI_Priority,AI_Reasoning,Technical_Score,AI_Confidence,AI_Trend,Trend_Confidence,Risk_Level,RSI,SMA_20,SMA_50,MACD_Histogram,Daily_Change_Pct,Volume_Ratio,Strategy_Mode
2025-08-22T03:53:49.670205,session_20250821_220904_4013,50,BTCUSD,107700.02,0.0,0.0,0.0,SELL,HIGH,"The 5-minute timeframe indicates a strong bearish trend with high confidence. The current price ($107700.02) is trading below both the 20-period ($107764.71) and 50-period ($107756.08) Simple Moving Averages, confirming downward pressure. MACD shows significant bearish momentum with a negative histogram (-2.561) and the MACD line (-4.634) below its signal line (-2.072), indicating a bearish crossover. Crucially, the exceptionally high current volume (77,703,433) coupled with negative price movement (-0.10% daily change) confirms strong selling pressure. The AI Trend Analysis reinforces this with a ""STRONG_BEARISH"" trend and HIGH confidence, citing price below MAs, bearish MACD, and negative volume indicators. Given the AGGRESSIVE TRADING MODE and no current position, these decisive bearish signals warrant an immediate SELL action, capitalizing on the observed momentum.",2.0,HIGH,BEARISH,HIGH,HIGH,40.0,107764.7065,107756.08140000001,-2.561397025969287,-0.10000201284080912,30035927.01902182,AGGRESSIVE
2025-08-22T03:53:49.670238,session_20250821_220904_4013,50,ETHUSD,2482.92,0.023158999999999996,-0.0501,0.0,HOLD,HIGH,"The current position in ETHUSD is unprofitable to sell (Net P&L: $-0.06) and does not meet the 2%+ stop-loss threshold. According to mandatory fee-aware sell rule #4, the existing position MUST be held to avoid realizing a loss. While the aggressive trading mode encourages decisive action and the 5-minute technical analysis did generate a BUY signal score of 5 (due to price being above key moving averages, strong Williams %R and Stochastic K momentum, and extremely high volume), these bullish signals are contradicted by a bearish MACD histogram and crossover, a neutral RSI, and the AI's low confidence in the overall BULLISH trend, which is described as a ""low-conviction, consolidating market."" The absence of 1-hour timeframe data also prevents strong trend confirmation. Therefore, the critical profitability constraint on the existing position, combined with the mixed underlying technical signals and low AI confidence, overrides any aggressive BUY consideration for new shares at this time, mandating a HOLD.",5.0,MEDIUM,BULLISH,LOW,MEDIUM,50.0,2482.1775,2482.0284,-0.02370310344322374,0.09998226121172124,703543.9714236594,AGGRESSIVE
2025-08-22T03:53:49.670252,session_20250821_220904_4013,50,LINKUSD,18.82231,0.0,0.0,0.0,HOLD,LOW,"All available technical indicators (RSI 50.0, MACD at 0.000, SMAs 20 & 50 precisely at $18.82) are perfectly neutral, indicating a complete absence of price movement, momentum, and volatility. The AI Trend Analysis confirms a ""NEUTRAL"" trend with ""HIGH"" confidence due to a ""flat market."" Despite the 'AGGRESSIVE TRADING MODE', there are no technical signals (neither >=4 for BUY nor <=6 for SELL) to warrant an entry or exit. No news sentiment is available to provide additional conviction. Trading in a completely flat market with no signals does not align with maximizing profit or identifying higher potential returns, as there is no discernible edge.",0.0,HIGH,NEUTRAL,HIGH,LOW,50.0,18.82231,18.82231,1.8932661725304283e-29,0.0,5000000.0,AGGRESSIVE
2025-08-22T03:53:49.670263,session_20250821_220904_4013,50,LTCUSD,120.42,0.013244999999999618,0.0012,0.0,BUY,MEDIUM,"Under AGGRESSIVE TRADING MODE, we prioritize momentum. LTCUSD's Williams %R (-95.9) and Stochastic K (4.1) are both deeply oversold, indicating a strong potential for a bullish reversal, a powerful signal in crypto markets. The extremely high volume ratio (35278.34x) despite 0.00% daily change, though contradictory to immediate price action, could suggest accumulation at current levels. While the MACD shows a minor bearish crossover and AI indicates ""extreme stagnation"" with ""conflicting signals,"" the aggressive strategy allows taking on higher risk for potential higher returns by acting on the strong oversold momentum, anticipating a bounce. The existing position is currently unprofitable to sell (Net P&L $-0.01), therefore, we implicitly hold the current shares while adding a new buy order to capitalize on the potential reversal.",4.0,MEDIUM,NEUTRAL,MEDIUM,MEDIUM,50.0,120.50550000000001,120.4158,-0.03779098419279277,0.0,35278.33820656844,AGGRESSIVE
2025-08-22T03:53:49.670273,session_20250821_220904_4013,50,BCHUSD,577.66,0.5213359999999999,-0.0,0.0,HOLD,HIGH,"The current position of 0.5213359999999999 shares is explicitly marked as ""âŒ UNPROFITABLE to sell"" with a net P&L of $-0.01, and no stop-loss trigger (2%+ loss) has been met. Per critical fee-aware sell rules, selling is not permitted. Therefore, holding the existing position is mandatory. For potential new actions, the technical analysis presents a highly ambiguous picture. While the daily change is slightly positive (+0.37%) and current volume is high, key momentum indicators like RSI (50.0) and MACD (0.000) are neutral. Crucially, there is no 1-hour timeframe data available, preventing medium-term trend confirmation, and a significant amount of critical volatility (ATR, 20-day Volatility) and momentum data (Williams %R, Stochastic) is missing or zero. The AI trend analysis, though bullish, has ""LOW Confidence"" and ""HIGH Risk,"" citing that the asset is ""signaled as overbought by Bollinger Bands,"" which contradicts a strong buy signal and suggests potential weakness. Given the aggressive trading mode requires strong, clear signals, the combination of a mandated hold on the existing position due to unprofitability and the lack of decisive, confirmed technical signals (especially missing critical data and contradictory AI insights) dictates no new buy or sell action.",2.0,LOW,BULLISH,LOW,HIGH,50.0,575.53,575.53,0.0,0.37009365280697715,5000000.0,AGGRESSIVE
2025-08-22T03:53:49.670283,session_20250821_220904_4013,50,ZECUSD,38.47,1.300714,0.0,0.0,HOLD,LOW,"The current position is unprofitable to sell (Net P&L: $-0.01) and does not meet the 2%+ stop-loss trigger, making a SELL action prohibited by the critical fee-aware rules. Despite an AI-identified ""BULLISH"" trend, its confidence is LOW, and the reasoning describes ""weak bullish momentum"" and a ""fragile upward move."" Most 5-minute technical indicators, including RSI (50.0), MACD (0.000 for all components), ATR (0.000), and 20-day Volatility (0.000), are flat or show no strong momentum. While current volume is high (5,000,000), the Volume MA of 0 makes the volume ratio misleading and limits its reliability as a strong momentum signal. The price is slightly above flat moving averages (SMAs 20 and 50), which is a minor positive. There is no 1-hour data, which prevents the critical dual-timeframe analysis and weighting, further reducing confidence in any strong directional call. No news sentiment is available to provide a boost or trigger. The combined technical signals are too weak (below the required 4+ score) to justify a BUY in aggressive mode, and a SELL is currently unprofitable.",2.0,LOW,BULLISH,LOW,MEDIUM,50.0,38.42,38.42,4.900285334092961e-09,0.13014055179593223,5000000.0,AGGRESSIVE
2025-08-22T03:53:49.670293,session_20250821_220904_4013,50,BATUSD,0.1529,327.011118,0.0,0.0,HOLD,HIGH,"The market for BATUSD is experiencing extreme stagnation, with the current price at $0.15, matching the previous close and all significant moving averages (SMA 20, SMA 50). All 5-minute technical indicators including RSI (50.0), MACD Histogram (0.000), MACD Line (-0.000), and MACD Signal (-0.000) are perfectly neutral, indicating a complete lack of momentum. Furthermore, volatility (ATR and 20-day Volatility) is zero, and the AI Trend Analysis confirms a ""NEUTRAL"" trend with ""HIGH"" confidence due to the overwhelming lack of movement across all indicators. There is no 1-hour data available for medium-term trend confirmation, nor is there any news sentiment to influence the decision.",5.0,LOW,NEUTRAL,HIGH,LOW,50.0,0.1529,0.1529,1.232595164407831e-31,0.0,5000000.0,AGGRESSIVE
2025-08-22T03:53:49.670303,session_20250821_220904_4013,50,OXTUSD,0.06989,0.0,0.0,0.0,HOLD,LOW,"All available technical indicators across the 5-minute timeframe, including RSI at 50, MACD at zero, flat SMA 20 and 50, and zero ATR and 20-day volatility, confirm an extreme lack of price movement and market activity. The AI trend analysis also indicates a NEUTRAL trend with HIGH confidence. Despite high current volume, this has not translated into any price action, and the Volume MA is zero, suggesting an anomaly or lack of historical movement. With no 1-hour data available for trend confirmation, and no momentum or directional signals whatsoever, there is no actionable BUY or SELL trigger. Initiating a trade in such a flat market would purely incur fees without any technical basis for potential profit, directly conflicting with the aggressive mode's aim to maximize profit through decisive action based on signals.",1.0,HIGH,NEUTRAL,HIGH,LOW,50.0,0.06989,0.06989,0.0,0.0,5000000.0,AGGRESSIVE
