Timestamp,Session_ID,Cycle_Number,Symbol,Current_Price,Position,Unrealized_PnL,Portfolio_Allocation_Pct,AI_Action,AI_Priority,AI_Reasoning,Technical_Score,AI_Confidence,AI_Trend,Trend_Confidence,Risk_Level,RSI,SMA_20,SMA_50,MACD_Histogram,Daily_Change_Pct,Volume_Ratio,Strategy_Mode
2025-08-22T12:46:01.032927,session_20250822_103709_8422,18,BTCUSD,107700.02,0.0009285,0.0,0.0,HOLD,MEDIUM,"The AI trend analysis indicates a strong BEARISH trend with medium confidence, supported by multiple indicators including MACD (bearish crossover with negative histogram) and price trading below key moving averages (SMA 20 & 50). The overall technical score for BTCUSD is 7, signifying a strong bearish outlook on a scale of 1-10 (1=Strong Buy, 10=Strong Sell). While this score would typically trigger a SELL action under aggressive trading mode, the current position of 0.0009285 shares is âŒ UNPROFITABLE to sell (Net P&L: $-0.01). According to the CRITICAL FEE-AWARE SELL RULES, an unprofitable position cannot be sold unless it hits a stop-loss trigger, which is not the case here. Therefore, for the existing position, a HOLD is mandatory. Given the strong bearish technicals, initiating a new BUY order is not advisable. The lack of 1-hour data prevents higher confidence from timeframe alignment.",7.0,MEDIUM,BEARISH,MEDIUM,MEDIUM,45.454622110917136,107753.926,107749.61299999998,-6.010322854151181,0.0,28294291.171138313,AGGRESSIVE
2025-08-22T12:46:01.032957,session_20250822_103709_8422,18,ETHUSD,2482.92,0.040276,0.0,0.0,HOLD,MEDIUM,"Current position of 0.040276 shares is unprofitable to sell (Net P&L $-0.01 after fees), mandating a HOLD as per critical fee-aware sell rules. For potential new trades, the 5-minute technicals present a mixed picture: price is above the SMA 20 and SMA 50, and MACD shows a weak bullish crossover. However, momentum indicators like Stochastic K (79.9) and Williams %R (-20.1) are in or nearing overbought territory, suggesting potential for a pullback. Despite extremely high volume (711437.14x average), the daily price change is flat (+0.00%), indicating a lack of immediate directional momentum. The AI trend is BULLISH with MEDIUM confidence but notes flat price action and overbought momentum indicators. No 1-hour timeframe data is available to confirm a stronger trend. The aggregated technical score does not meet the '4+' threshold for an aggressive BUY due to the conflicting signals and overbought oscillators.",2.0,MEDIUM,BULLISH,MEDIUM,MEDIUM,50.0,2482.798,2482.4251999999997,0.013554158870055899,0.0,711437.1352161246,AGGRESSIVE
2025-08-22T12:46:01.032969,session_20250822_103709_8422,18,LINKUSD,18.82231,0.0,0.0,0.0,HOLD,LOW,"The maximum number of trades (10) for the current session has been reached, preventing any further trading activity. Even if trades were permissible, the comprehensive dual timeframe analysis for LINKUSD reveals a complete lack of directional signals. All 5-minute technical indicators (RSI, MACD, SMAs) are perfectly flat or neutral. Crucially, the 1-hour timeframe data, which is prioritized for trend direction, is unavailable. The volume data (5,000,000 current) contradicts the zero values for ATR and 20-day volatility, creating a highly ambiguous and unreliable market picture, as highlighted by the AI Trend Analysis (NEUTRAL, LOW Confidence, HIGH Risk). No news sentiment is available for confirmation. Given the absence of any actionable technical signals and the inability to assess medium-term trends, coupled with the trading limits, a HOLD decision is warranted.",0.0,LOW,NEUTRAL,LOW,HIGH,50.0,18.82231,18.82231,7.962280393495474e-22,0.0,5000000.0,AGGRESSIVE
2025-08-22T12:46:01.032980,session_20250822_103709_8422,18,LTCUSD,120.3,2.07814,0.0,0.0,BUY,HIGH,"The aggressive trading mode prioritizes momentum and volume. Despite a slight daily price dip (-0.10%), the 5-minute timeframe shows compelling bullish signals for a rebound. Both Williams %R (-95.0) and Stochastic K (5.0) are deeply oversold, which are strong crypto-adjusted BUY signals indicating a high probability of an upward reversal. The MACD also exhibits a bullish crossover (MACD Line 0.013 > Signal Line 0.004) from a consolidated state, confirming increasing upward momentum. While current volume is extremely high and the AI notes it on a ""negative movement,"" the overall technical picture, especially the oversold momentum, strongly suggests this could be a capitulation or shake-out phase before a bounce. The AI Trend Analysis explicitly confirms a BULLISH trend with MEDIUM confidence, aligning with this interpretation. Given the current position is at cost ($120.30) and ""UNPROFITABLE to sell"" as per fee-aware rules, and the strong buy signals, accumulating more shares to capitalize on the anticipated rebound is the optimal aggressive strategy to maximize profit.",8.0,HIGH,BULLISH,MEDIUM,MEDIUM,50.0,120.35999999999999,120.3528,0.008381609215489786,-0.09965122072745768,34643.3086524706,AGGRESSIVE
2025-08-22T12:46:01.032990,session_20250822_103709_8422,18,BCHUSD,577.66,0.086556,0.0,0.0,HOLD,MEDIUM,"Current position is unprofitable to sell (Net P&L: $-0.01), and it has not triggered a stop-loss, therefore a SELL is prohibited by the mandatory rules. A BUY recommendation is not justified due to significant data quality issues and a lack of reliable multi-timeframe confirmation. Specifically, no 1-hour data is available, which critically undermines the ability to assess the medium-term trend and contradicts the instruction to weight 1-hour trends more heavily. While the 5-minute data shows some weak bullish momentum (price above SMAs, positive daily change, high current volume), these are heavily counteracted by the AI's warning of an ""overbought condition,"" ""low confidence,"" ""high risk level,"" and the fact that ""most other technical indicators are non-functional due to data anomalies, leading to high uncertainty."" Aggressive mode accepts higher risk, but not blind action on fundamentally unreliable and incomplete data. Therefore, holding the current position is the most prudent action until clearer, more robust technical signals emerge, ideally with multi-timeframe alignment.",5.0,LOW,BULLISH,LOW,HIGH,50.0,575.53,575.53,0.0,0.37009365280697715,5000000.0,AGGRESSIVE
2025-08-22T12:46:01.032999,session_20250822_103709_8422,18,ZECUSD,38.47,1.299714,0.0,0.0,HOLD,MEDIUM,"The current position of ZECUSD is unprofitable to sell (Net P&L After Fees: -$0.01), making a HOLD action mandatory as per the critical fee-aware sell rules. For any new trading consideration, the technical analysis provides ambiguous signals and significant data quality concerns. The 5-minute data shows a slight positive daily change (+0.13%) and the price is marginally above SMA 20 and SMA 50, suggesting weak bullish momentum. However, RSI (50.0) and MACD (0.000) are neutral, indicating no clear short-term momentum. Critical data points like ATR and 20-day Volatility are 0.000, and Volume MA is 0, which points to unreliable volatility and volume comparisons. Furthermore, the 1-hour timeframe data is unavailable, significantly reducing confidence in any directional trend. The AI trend analysis confirms ""weak bullish momentum"" with ""LOW Confidence"" and ""HIGH Risk,"" citing ""significant uncertainty and data quality concerns."" Under aggressive trading mode, while seeking higher returns, actionable signals are crucial. The current technical scores do not meet the 4+ threshold for a BUY, nor is there a strong SELL signal that would justify taking further action beyond holding the existing position, especially given the ""unprofitable to sell"" status. Therefore, holding is the most prudent action until clearer signals emerge and data quality improves.",2.0,LOW,BULLISH,LOW,HIGH,50.0,38.42,38.42,1.7079108977403e-05,0.13014055179593223,4576273.5,AGGRESSIVE
2025-08-22T12:46:01.033010,session_20250822_103709_8422,18,BATUSD,0.1529,0.0,0.0,0.0,HOLD,LOW,"The absence of 1-hour timeframe data forces reliance solely on the 5-minute analysis. On this shorter timeframe, all core technical indicators (RSI at 50, MACD at 0.000, price at SMA 20 & 50) are flat and neutral, indicating no discernible short-term momentum or trend. Critically, both the ATR and 20-day Volatility are reported as 0.000, signifying absolutely no price movement. While the current volume of 5,000,000 is high relative to the zero Volume MA (suggesting *some* activity), the lack of volatility means there is no actual price action to capitalize on. The AI's ""BULLISH"" trend with ""LOW confidence"" and its reasoning of ""low volatility and no discernible trend"" contradicts the overall technical score of 6/10. As an aggressive trader, we prioritize momentum, which is completely absent here. Entering a position with zero volatility offers no opportunity for profit and increases risk due to stagnant capital. Without any price movement, there is no actionable signal for either a buy or a sell.",6.0,LOW,BULLISH,LOW,MEDIUM,50.0,0.1529,0.1529,2.2121148617579484e-21,0.0,5000000.0,AGGRESSIVE
2025-08-22T12:46:01.033050,session_20250822_103709_8422,18,OXTUSD,0.06989,0.0,0.0,0.0,HOLD,LOW,"The primary reason for HOLD is that the trading session appears to have reached its maximum allowed trades for the day (Total Trades This Session: 10, Today's Trades: 10), preventing any further BUY or SELL actions. Even if trades were possible, the technical analysis for OXTUSD is overwhelmingly neutral across all available 5-minute indicators. RSI is perfectly at 50.0, MACD Line, Signal, and Histogram are all zero, and both SMA 20 and SMA 50 converge precisely at the current price of $0.07. Volatility measures (ATR and 20-day Volatility) are also zero, indicating a completely stagnant price with no discernible movement or momentum. The AI Trend Analysis confirms a NEUTRAL trend with HIGH confidence and LOW risk, further supporting a non-actionable stance. In an aggressive trading mode, this lack of momentum and volatility offers no opportunity for profit, and taking a position would only incur fees without potential returns. No news is available to influence this assessment.",1.0,HIGH,NEUTRAL,HIGH,LOW,50.0,0.06989,0.06989,0.0,0.0,5000000.0,AGGRESSIVE
