Timestamp,Session_ID,Cycle_Number,Symbol,Current_Price,Position,Unrealized_PnL,Portfolio_Allocation_Pct,AI_Action,AI_Priority,AI_Reasoning,Technical_Score,AI_Confidence,AI_Trend,Trend_Confidence,Risk_Level,RSI,SMA_20,SMA_50,MACD_Histogram,Daily_Change_Pct,Volume_Ratio,Strategy_Mode
2025-08-20T00:08:00.457485,session_20250819_235240_1250,3,BTCUSD,107807.83,0.0,0.0,0.0,HOLD,LOW,"Despite some short-term bearish signals on the 5-minute timeframe (bearish MACD cross, Stochastic K and Williams %R in overbought territory indicating potential for a pullback), a strong directional trade is not recommended. The critical 1-hour timeframe data, which is weighted more heavily for trend direction, is unavailable. Furthermore, the AI trend analysis indicates a ""NEUTRAL"" trend with ""LOW Confidence"" and ""HIGH Risk,"" explicitly stating that ADX shows ""no discernible trend strength,"" suggesting a consolidating or ranging market. Entering a new position in a non-trending, high-risk environment without higher timeframe confirmation does not align with a balanced trading strategy, even under crypto-adjusted thresholds.",3.0,LOW,NEUTRAL,LOW,HIGH,50.0,107780.878,107769.019,-2.2360019399394675,0.10010211697267805,30769835.995102126,BALANCED
2025-08-20T00:08:00.457513,session_20250819_235240_1250,3,ETHUSD,2480.44,0.0,0.0,0.0,HOLD,LOW,"The market for ETHUSD is experiencing extreme consolidation with a 0.00% daily price change, indicating significant indecision and no clear trend. Both the SMA 20 and SMA 50 are identical ($2481.93) and very close to the current price, reinforcing the flat, sideways movement. Short-term momentum indicators are conflicting: MACD shows a slight bullish bias (MACD Line 0.026 above Signal -0.006, Histogram 0.032), and Williams %R (-20.1) suggests oversold conditions (potentially bullish). However, Stochastic K (79.9) indicates overbought conditions (potentially bearish), while RSI (50.0) is perfectly neutral. The AI Trend Analysis confirms a ""NEUTRAL"" trend with ""LOW"" confidence, citing ""no discernible trend strength"" and ""conflicting pressures."" Crucially, the absence of 1-hour timeframe data prevents a comprehensive dual-timeframe analysis and trend confirmation, which is a critical factor for establishing higher confidence trades in crypto. Despite the high absolute volume, the extremely high Volume Ratio (716501.20x average) suggests potential data anomalies or highly unusual market conditions. Given the lack of a clear directional signal, conflicting indicators, and the inability to confirm a trend on a higher timeframe, entering a position carries high uncertainty and does not meet the technical score requirements for a high-priority BUY (5+) or SELL (5-).",5.0,LOW,NEUTRAL,LOW,MEDIUM,50.0,2481.928,2481.9282000000003,0.031793794255426666,0.0,716501.2040546694,BALANCED
2025-08-20T00:08:00.457523,session_20250819_235240_1250,3,LINKUSD,18.82231,0.0,0.0,0.0,HOLD,LOW,"The market for LINKUSD is experiencing extreme stagnation. All available 5-minute technical indicators (RSI, MACD, SMAs, Williams %R, Stochastic K) are either NaN or zero, indicating a complete absence of momentum or trend. The current price has remained flat at $18.82 with 0.00% daily change. Both ATR and 20-day Volatility are 0.000, confirming a total lack of price movement. Crucially, no 1-hour timeframe data is available, preventing the necessary dual-timeframe analysis for trend confirmation and significantly lowering overall confidence. Without any discernible price movement or technical signals, there is no actionable trade opportunity, and attempting a trade would incur fees without any prospect of profit, rendering it an irrational decision. The AI trend analysis confirms this with a 'NEUTRAL' trend and 'LOW' confidence due to 'extreme market stagnation'.",1.0,LOW,NEUTRAL,LOW,MEDIUM,,18.82231,18.82231,1.8932661725304283e-29,0.0,5000000.0,BALANCED
2025-08-20T00:08:00.457532,session_20250819_235240_1250,3,LTCUSD,120.3,0.0,0.0,0.0,BUY,HIGH,"The 5-minute timeframe presents a compelling bullish setup. Both Williams %R (-93.7) and Stochastic K (6.3) are deeply in oversold territory, signaling a high probability of an imminent price rebound. This strong oversold condition is further validated by a bullish MACD crossover, with the MACD line ($0.009) now above the signal line ($-0.013) and a positive histogram ($0.005), indicating emerging upward momentum. Despite the price currently sitting slightly below the 20 and 50-period Simple Moving Averages, the strength of the momentum indicators and the MACD crossover, coupled with an exceptionally high volume (34263x average), suggest significant buying interest at these suppressed levels. The 20-day volatility (0.061, approx 6.1% daily move) is within the normal range for crypto, allowing for a trade. The AI analysis also identifies a bullish trend based on these factors. No news sentiment is available to alter the decision.",6.0,MEDIUM,BULLISH,LOW,MEDIUM,50.0,120.354,120.40180000000001,0.004623653193577425,0.0,34263.825575774594,BALANCED
2025-08-20T00:08:00.457542,session_20250819_235240_1250,3,BCHUSD,577.66,0.0,0.0,0.0,HOLD,LOW,"Comprehensive analysis is severely hampered by critical missing data. There is no 1-hour timeframe data available, preventing essential dual-timeframe trend confirmation and alignment, which is weighted more heavily. Key technical indicators such as RSI, Williams %R, Stochastic K, MACD, ATR, and 20-day Volatility are either 'nan' or '0', rendering them unusable for a robust technical assessment. While the price is currently above its 20 and 50-period Simple Moving Averages, indicating a bullish signal, this is the only clear confirming indicator. The AI trend analysis, despite identifying a 'BULLISH' trend, explicitly carries 'LOW' confidence and flags a 'HIGH' risk level. Critically, the AI also notes an ""overbought status"" suggesting a ""potential for a short-term reversal,"" which directly contradicts a strong BUY signal. With a lack of sufficient clear confirming indicators (less than the required 2-3 for crypto mode) and conflicting signals from the limited data, the technical score is well below the 5+ threshold for a high-priority BUY. Therefore, a HOLD recommendation is prudent due to the high uncertainty and insufficient actionable signals.",1.0,LOW,BULLISH,LOW,HIGH,,575.53,575.53,0.0,0.37009365280697715,5000000.0,BALANCED
2025-08-20T00:08:00.457551,session_20250819_235240_1250,3,ZECUSD,38.47,0.0,0.0,0.0,HOLD,LOW,"A comprehensive analysis for ZECUSD is severely hampered by critical missing data across key technical indicators (RSI, Williams %R, Stochastic K, ATR, and 20-day Volatility are all 'nan' or '0.000'). Furthermore, there is no 1-hour timeframe data available, making the crucial dual-timeframe analysis impossible. While the 5-minute timeframe shows the current price slightly above the SMAs, and the MACD is flat but slightly positive, these indicators alone are insufficient and lack confirmation. The AI trend analysis indicates a 'BULLISH' trend but with 'LOW' confidence and 'HIGH' risk, explicitly stating ""pervasive data inconsistencies... render the overall assessment highly unreliable."" Given the crypto-adjusted rules requiring strong technical alignment and at least 2-3 confirming indicators for a BUY, and with a required technical score of 5+, the current data set provides very limited actionable insights and does not meet these thresholds. Without reliable technical confirmation from multiple indicators and across timeframes, initiating a trade is not advisable. No news sentiment is available to influence the decision.",2.0,LOW,BULLISH,LOW,HIGH,,38.42,38.42,2.524354896707238e-29,0.13014055179593223,5000000.0,BALANCED
2025-08-20T00:08:00.457561,session_20250819_235240_1250,3,XLMUSD,0.0,0.0,0.0,0.0,HOLD,LOW,No valid market data available,0.0,LOW,NEUTRAL,LOW,HIGH,50.0,0.0,0.0,0.0,0.0,0.0,BALANCED
2025-08-20T00:08:00.457575,session_20250819_235240_1250,3,BATUSD,0.1529,0.0,0.0,0.0,HOLD,LOW,"The market for BATUSD is exhibiting extreme stagnation across the 5-minute timeframe. The price is perfectly flat at $0.15 with a 0.00% daily change. All key technical indicators such as RSI, Williams %R, and Stochastic K are displaying 'nan', while MACD and volatility metrics (ATR, 20-day Volatility) are zero, indicating a complete absence of price movement or trend strength. The AI trend analysis confirms a 'NEUTRAL' trend with 'MEDIUM' confidence, explicitly stating ""no discernible directional momentum"". Furthermore, the critical 1-hour timeframe data is unavailable, preventing a robust dual-timeframe analysis for trend confirmation. Most importantly, given the trade size of 0.001 shares and the $0.01 round-trip trading fee, it is mathematically impossible to achieve profitability from the current price of $0.15, as the asset's value would need to increase by an impractical magnitude just to cover the transaction costs. Without any technical signals, trend, or viable profitability, initiating a trade is unwarranted.",0.0,HIGH,NEUTRAL,MEDIUM,MEDIUM,,0.1529,0.1529,4.930380657631324e-32,0.0,5000000.0,BALANCED
2025-08-20T00:08:00.457585,session_20250819_235240_1250,3,OXTUSD,0.06989,0.0,0.0,0.0,HOLD,LOW,"The price for OXTUSD is completely static at $0.07, with a daily change of 0.00%. All momentum and volatility indicators (RSI, MACD, Williams %R, Stochastic K, ATR, 20-day Volatility) are either NaN or zero, confirming a complete lack of price movement or market activity. The Simple Moving Averages (SMA 20 and SMA 50) are also converged at $0.07. The AI trend analysis accurately identifies the market as NEUTRAL with HIGH confidence, citing the absence of price discovery or directional movement. With no 1-hour data available and the 5-minute data showing a ""dead market"" scenario, there is no technical basis to initiate a BUY or SELL trade. No news sentiment is available to provide additional context. Trading in such conditions would be pure speculation without any technical signals.",1.0,HIGH,NEUTRAL,HIGH,LOW,,0.06989,0.06989,0.0,0.0,5000000.0,BALANCED
2025-08-20T00:08:00.457594,session_20250819_235240_1250,3,1INCHUSD,0.0,0.0,0.0,0.0,HOLD,LOW,No valid market data available,0.0,LOW,NEUTRAL,LOW,HIGH,50.0,0.0,0.0,0.0,0.0,0.0,BALANCED
