Timestamp,Session_ID,Cycle_Number,Symbol,Current_Price,Position,Unrealized_PnL,Portfolio_Allocation_Pct,AI_Action,AI_Priority,AI_Reasoning,Technical_Score,AI_Confidence,AI_Trend,Trend_Confidence,Risk_Level,RSI,SMA_20,SMA_50,MACD_Histogram,Daily_Change_Pct,Volume_Ratio,Strategy_Mode
2025-08-20T05:35:05.254502,session_20250820_052029_2049,3,BTCUSD,107807.84,0.0,0.0,0.0,HOLD,LOW,"Mixed technical signals observed on the 5-minute timeframe. While the price is currently positioned above key moving averages (SMA20, SMA50), indicating a short-term bullish bias, momentum indicators present a conflicting picture. MACD shows a bearish crossover with a negative histogram, suggesting weakening bullish momentum. Concurrently, Stochastic K and Williams %R are in overbought territory, signaling a potential for a near-term pullback. The AI trend analysis, despite identifying a 'BULLISH' trend, assigns 'LOW' confidence and 'HIGH' risk, specifically citing weakening momentum. Crucially, the absence of 1-hour timeframe data prevents proper trend confirmation and dual-timeframe alignment, which is critical for higher conviction crypto trades. Given the conflicting signals, the high risk assessment, and the lack of a confirming longer timeframe, it is prudent to hold and await clearer directional signals or a more favorable risk-reward setup.",4.0,LOW,BULLISH,LOW,HIGH,46.15357173435329,107753.92749999999,107429.38,-21.737889075928933,0.0,31009203.95967177,BALANCED
2025-08-20T05:35:05.254528,session_20250820_052029_2049,3,ETHUSD,2480.44,0.001,-0.0025,0.0,HOLD,LOW,"The current ETHUSD position is unprofitable to sell after accounting for trading fees (Net P&L: $-0.01). According to the CRITICAL FEE-AWARE SELL RULES, an unprofitable position cannot be sold unless a stop-loss (2%+ loss) is triggered, which is not the case. Therefore, the position must be held despite the bearish technical outlook. The 5-minute technical analysis shows strong bearish signals, including price below both SMA 20 and SMA 50, a bearish MACD crossover (MACD line below signal line, negative histogram), and an AI Trend analysis indicating a HIGH confidence BEARISH trend. Volume is extremely high, indicating conviction in the current price action. While these technicals would normally suggest a SELL, the unprofitability of the existing position mandates a HOLD.",2.0,HIGH,BEARISH,HIGH,HIGH,40.01610305958094,2481.6805,2481.8294,-0.009999356854937844,-0.09988239653311497,723444.608187023,BALANCED
2025-08-20T05:35:05.254540,session_20250820_052029_2049,3,LINKUSD,18.82231,0.0,0.0,0.0,HOLD,LOW,"The provided data for LINKUSD indicates a completely static price at $18.82 with 0.00% daily change and zero volatility (ATR 0.000, 20-day Volatility 0.000). All short-term technical indicators (RSI, MACD, SMAs, Williams %R, Stochastic K) are either NaN or zero, providing no actionable signals. There is no 1-hour data available, preventing dual-timeframe analysis and trend confirmation. The AI trend analysis explicitly states a NEUTRAL trend with LOW confidence, noting that a reliable directional assessment is impossible due to the lack of movement. Without any valid technical signals or market activity, and given the requirement for strong technical alignment and confirming indicators, there is no basis to initiate a trade.",1.0,LOW,NEUTRAL,LOW,MEDIUM,,18.82231,18.82231,1.8932661725304283e-29,0.0,5000000.0,BALANCED
2025-08-20T05:35:05.254551,session_20250820_052029_2049,3,LTCUSD,120.42,0.006,0.0006,0.0,HOLD,MEDIUM,"The primary reason for this recommendation is that the current LTCUSD position is unprofitable to sell (Net P&L: -$0.01), which, according to the critical fee-aware sell rules, mandates a HOLD unless a stop-loss is triggered. While analyzing the technicals for a potential new buy, strong bullish momentum is evident with price firmly above key moving averages, a bullish MACD crossover, and exceptionally high trading volume, contributing to a technical score of 5. The AI trend analysis is also BULLISH with MEDIUM confidence. However, momentum indicators such as Williams %R and Stochastic K are extremely overbought, suggesting the current upward move might be extended or lack sustained conviction, which tempers the bullish outlook and prevents a high-priority buy that would override the 'MUST HOLD' directive for an existing unprofitable position. No news sentiment is available to influence the decision.",5.0,MEDIUM,BULLISH,MEDIUM,MEDIUM,50.0,120.36600000000001,120.36,0.0013252529662906984,0.0997506234414003,33486.76667870963,BALANCED
2025-08-20T05:35:05.254560,session_20250820_052029_2049,3,BCHUSD,577.66,0.0,0.0,0.0,HOLD,LOW,"Crucial technical indicators (RSI, MACD, Stochastic, Williams %R, ATR, and 20-day Volatility) are entirely missing or zero, preventing comprehensive momentum and volatility assessment. Additionally, critical 1-hour timeframe data is unavailable, making long-term trend confirmation impossible. While the price is above the identical SMA 20 and 50, indicating a weak bullish leaning, the AI's analysis points to an ""extreme overbought condition,"" ""low confidence"" in the bullish trend, and ""high risk of reversal and significant uncertainty."" Without robust technical confirmation from multiple indicators across timeframes, and with the explicit high-risk warning, initiating a trade is not advisable under the BALANCED CRYPTO TRADING MODE.",2.0,LOW,BULLISH,LOW,HIGH,,575.53,575.53,0.0,0.37009365280697715,5000000.0,BALANCED
2025-08-20T05:35:05.254573,session_20250820_052029_2049,3,ZECUSD,38.47,0.0,0.0,0.0,HOLD,LOW,"The analysis for ZECUSD reveals a significant lack of reliable technical data across the 5-minute timeframe, with key indicators such as RSI, Williams %R, and Stochastic K showing 'nan' values, and MACD, ATR, and 20-day volatility showing 0.000. While the daily change is slightly positive (+0.13%) and current volume is high, the Volume MA is zero, rendering the volume ratio meaningless and suggesting data anomalies. Both SMA 20 and SMA 50 are identical and at the previous close, indicating flat price action. The AI trend analysis, despite stating a ""BULLISH"" trend, assigns ""LOW"" confidence and highlights the ""significant number of key volatility and momentum indicators are at zero or unavailable,"" aligning with our observation of poor data quality. Without any 1-hour data, a dual-timeframe confirmation is impossible, further reducing conviction. In crypto trading, even with adjusted thresholds, a minimum of 2-3 confirming indicators are required for a BUY, which are entirely absent here. Due to the extreme lack of actionable technical signals and the unreliable nature of the available data, initiating a trade would be speculative and against our risk management principles.",2.0,LOW,BULLISH,LOW,MEDIUM,,38.42,38.42,2.524354896707238e-29,0.13014055179593223,5000000.0,BALANCED
2025-08-20T05:35:05.254592,session_20250820_052029_2049,3,BATUSD,0.1529,0.0,0.0,0.0,HOLD,LOW,"The analysis for BATUSD reveals extreme price flatness with 0.00% daily change and zero volatility (ATR: 0.000, 20-day Volatility: 0.000). All short-term technical indicators (RSI, MACD, SMAs, Williams %R, Stochastic K) are either flat, near zero, or NaN, indicating a complete lack of momentum or trend. There is no 1-hour data available, preventing dual-timeframe analysis and trend confirmation. The AI Trend Analysis explicitly identifies the asset as NEUTRAL with ""a complete lack of discernible trend or momentum."" Despite the crypto-adjusted trading mode allowing for higher volatility, the complete absence of any price movement or technical signal means there is no actionable edge for either a buy or sell. This falls under the ""Weak Technical + No News"" scenario, leading to a decision to hold.",1.0,MEDIUM,NEUTRAL,MEDIUM,LOW,,0.1529,0.1529,4.930380657631324e-32,0.0,5000000.0,BALANCED
2025-08-20T05:35:05.254602,session_20250820_052029_2049,3,OXTUSD,0.06989,0.0,0.0,0.0,HOLD,HIGH,"The data for OXTUSD shows a complete lack of price movement and volatility. The current price is static at $0.07 with a 0.00% daily change. All 5-minute technical indicators (RSI, Williams %R, Stochastic K) are 'nan', and others like MACD, ATR, and 20-day Volatility are 0.000. This indicates an illiquid or non-moving asset with no discernible trend or momentum. The Volume Moving Average is also 0, further confirming the lack of activity, despite a high current volume which suggests a data anomaly. Furthermore, there is no 1-hour data available, which prevents any dual-timeframe analysis or confirmation of a medium-term trend. The AI Trend Analysis correctly identifies the trend as NEUTRAL with HIGH confidence due to the static price and lack of volatility. Without any technical signals, price action, or liquidity, initiating a trade is not advisable.",1.0,HIGH,NEUTRAL,HIGH,MEDIUM,,0.06989,0.06989,0.0,0.0,5000000.0,BALANCED
