Timestamp,Session_ID,Cycle_Number,Symbol,Current_Price,Position,Unrealized_PnL,Portfolio_Allocation_Pct,AI_Action,AI_Priority,AI_Reasoning,Technical_Score,AI_Confidence,AI_Trend,Trend_Confidence,Risk_Level,RSI,SMA_20,SMA_50,MACD_Histogram,Daily_Change_Pct,Volume_Ratio,Strategy_Mode
2025-08-20T10:50:15.576594,session_20250820_102017_8161,5,BTCUSD,107700.02,0.00439275,-0.0,0.0,BUY,MEDIUM,"Current price of BTCUSD is trading above both the 20-period and 50-period Simple Moving Averages, indicating bullish short-term price action. Critically, current volume is extraordinarily high, registering over 23 million times the average, which provides strong confirmation of price stability and potential continuation, aligning with the aggressive trading mode's priority on volume. While the MACD histogram and line indicate bearish momentum, other short-term oscillators such as Stochastic K (74.1) and Williams %R (-25.9) show strong recent buying pressure, approaching overbought conditions but not extreme, suggesting continued strength. The AI trend analysis identifies conflicting signals, resulting in a neutral trend with low confidence; however, in aggressive trading, the overwhelming volume and positive price relationship to SMAs warrant a BUY. The existing position is currently unprofitable and, as per critical fee-aware sell rules, must be held.",6.0,MEDIUM,NEUTRAL,LOW,MEDIUM,43.989844817935904,107099.65900000001,107490.0626,-133.31315011629596,0.90909048320642,23220325.824608997,AGGRESSIVE
2025-08-20T10:50:15.576625,session_20250820_102017_8161,5,ETHUSD,2485.41,0.023158999999999996,0.0076,0.0,HOLD,MEDIUM,"The existing position for ETHUSD is currently ""❌ UNPROFITABLE to sell"" with a net P&L of $-0.00 after fees, mandating a HOLD as per the critical fee-aware sell rules. For any new action, while the 5-minute timeframe shows a strong bullish trend with price above key moving averages (SMA 20, SMA 50), a positive MACD histogram (0.099), and extremely high current volume (78,461,096) indicating strong momentum, there are significant overbought signals. Stochastic K (79.9) and Williams %R (-20.1) are in/near overbought territory, and the AI analysis explicitly warns that ""the price is significantly above the upper Bollinger Band, indicating overbought conditions and potential for a short-term pullback."" Given the aggressive trading mode, while momentum is prioritized, entering a new position when immediate technical indicators suggest a high probability of a short-term pullback contradicts the goal to maximize profit, despite accepting higher risk. The lack of 1-hour data also reduces confidence in the medium-term trend confirmation. Therefore, holding the existing position and refraining from adding more shares at potentially overextended levels is the most prudent action to avoid immediate losses and preserve capital for a better entry point.",4.0,MEDIUM,BULLISH,MEDIUM,MEDIUM,50.0,2482.3010000000004,2482.0284,0.09873526278645031,0.0,731347.1698842028,AGGRESSIVE
2025-08-20T10:50:15.576637,session_20250820_102017_8161,5,LINKUSD,18.82231,0.0,0.0,0.0,HOLD,LOW,"All 5-minute technical indicators including RSI (50.0), MACD (0.000), SMAs ($18.82), ATR (0.000), and 20-day volatility (0.000) show perfectly neutral or zero values, indicating a completely static market with no discernible price movement or trend. No 1-hour timeframe data is available for medium-term trend confirmation. Volume MA is 0, making volume ratio unreliable and suggesting a lack of historical activity. The AI trend analysis confirms a ""NEUTRAL"" trend with ""HIGH"" confidence due to these static conditions. Despite being in AGGRESSIVE TRADING MODE and prioritizing momentum and volume, there are no such signals present to justify a BUY or SELL action. Entering a position in a completely flat market is purely speculative without any technical basis, which is not aligned with maximizing profit through decisive action based on signals.",1.0,HIGH,NEUTRAL,HIGH,HIGH,50.0,18.82231,18.82231,1.8932661725304283e-29,0.0,5000000.0,AGGRESSIVE
2025-08-20T10:50:15.576645,session_20250820_102017_8161,5,LTCUSD,120.3,1.6740969999999997,-0.0507,0.0,HOLD,MEDIUM,"Current position in LTCUSD is at a net loss of $-0.06 and is explicitly marked as ""❌ UNPROFITABLE to sell."" As per the mandatory fee-aware sell rules, a position showing ""UNPROFITABLE to sell"" MUST be held unless an emergency stop-loss (2%+ loss) is triggered, which is not the case here. Technical analysis on the 5-minute timeframe shows mixed signals: MACD has a bearish crossover with a negative histogram, and the current price ($120.30) is below both the SMA 20 ($120.35) and SMA 50 ($120.36), indicating short-term bearish momentum. However, both Williams %R (-100.0) and Stochastic K (0.0) are at extreme oversold levels, which could indicate a potential bounce or lack of selling interest at this floor. The current volume (31,863,283) is exceptionally high (37153.67x average) for a 0.00% daily price change, suggesting a significant standoff between buyers and sellers, resulting in a current equilibrium without clear directional momentum. There is no 1-hour data available for medium-term trend confirmation, and the AI trend analysis is NEUTRAL with LOW confidence. Given these mixed technical signals and the critical profitability constraint, holding the current unprofitable position is the only permissible action to wait for a price recovery.",5.0,LOW,N/A,N/A,N/A,42.857142857142854,120.348,120.3576,-0.00588928925357919,0.0,37153.670163866234,AGGRESSIVE
2025-08-20T10:50:15.576653,session_20250820_102017_8161,5,BCHUSD,577.66,0.43477999999999994,0.0,0.0,BUY,HIGH,"The AI trend analysis confirms a BULLISH outlook for BCHUSD, supported by the current price ($577.66) trading above both its 5-minute SMA 20 and SMA 50, indicating a positive short-term moving average alignment. Crucially, current volume is an exceptionally high 5,000,000, representing a 5,000,000x increase over average, which signifies very strong buying pressure and momentum – a key priority for aggressive trading. While the AI notes ""extreme overbought conditions"" suggesting a ""potential short-term pullback,"" in an aggressive trading mode with a mandate to maximize profit and accept higher risk, the prevailing bullish trend, strong volume, and positive price action provide a compelling actionable BUY signal. We are entering to capitalize on this momentum, acknowledging the high risk associated with potential short-term volatility, but prioritizing the overall bullish drive. The current position's unprofitability to sell does not deter adding to a position with strong bullish technicals in this aggressive stance.",6.0,MEDIUM,BULLISH,MEDIUM,HIGH,50.0,575.53,575.53,0.0,0.37009365280697715,5000000.0,AGGRESSIVE
2025-08-20T10:50:15.576661,session_20250820_102017_8161,5,ZECUSD,38.47,1.300714,0.0,0.0,BUY,HIGH,"Operating in AGGRESSIVE TRADING MODE, the critical factors for ZECUSD are the extremely high current volume (5,000,000) and volume ratio (5000000.00x), which indicate strong market interest and potential for upward momentum, a key priority for this aggressive strategy. The AI Trend Analysis identifies a ""BULLISH"" trend with ""MEDIUM"" confidence, further supporting a positive outlook. While the 5-minute RSI (50.0) and MACD (0.000) are neutral, contradicting the AI's specific reasoning about being ""overbought"" or having a ""positive MACD,"" the overall bullish trend and dominant volume are compelling. The current price is slightly above the flat 5-minute SMAs, indicating a weak but existing bullish bias. Given the existing position is ""❌ UNPROFITABLE to sell"", and no stop-loss is triggered, an aggressive stance dictates adding to the position to capitalize on the identified bullish momentum and high volume, rather than passively holding. This action aligns with maximizing profit and accepting higher risk, leveraging volume as a primary indicator.",7.0,HIGH,BULLISH,MEDIUM,HIGH,50.0,38.42,38.42,2.524354896707238e-29,0.13014055179593223,5000000.0,AGGRESSIVE
2025-08-20T10:50:15.576668,session_20250820_102017_8161,5,BATUSD,0.1529,0.0,0.0,0.0,HOLD,LOW,"The analysis for BATUSD reveals extreme price stagnation. The price has remained flat at $0.15, with all short-term technical indicators (RSI, MACD, SMAs) converging and showing zero movement. Both ATR and 20-day Volatility are 0.000, confirming a complete absence of price action or a discernible trend. The AI trend analysis explicitly states a ""NEUTRAL"" trend with ""HIGH"" confidence due to ""extreme stagnation"" and ""complete absence of price movement."" While current volume is high, it is not translating into any price volatility, rendering it non-actionable for profit maximization. In aggressive trading mode, we require clear momentum and actionable signals, which are entirely absent here. Without any identifiable trend, momentum, or volatility, there is no profitable entry or exit point, and initiating a trade would only incur fees without potential for return.",0.0,HIGH,NEUTRAL,HIGH,MEDIUM,50.0,0.1529,0.1529,4.930380657631324e-32,0.0,5000000.0,AGGRESSIVE
2025-08-20T10:50:15.576675,session_20250820_102017_8161,5,OXTUSD,0.06989,0.0,0.0,0.0,HOLD,LOW,"The price of OXTUSD is completely static at $0.07 with 0.00% daily change. All short-term technical indicators (RSI, MACD, SMAs) are neutral, showing no momentum or trend. Volume, while a high absolute number, does not translate into any price movement or volatility (ATR and 20-day Volatility are 0.000). The AI trend analysis strongly confirms a NEUTRAL trend with HIGH confidence due to extreme consolidation and lack of a discernible trend. There is no 1-hour data available to establish a medium-term direction, forcing reliance on the highly neutral 5-minute data. As an aggressive trading strategy, there is no momentum, no clear direction, and no actionable technical signal (technical score is well below 4 for BUY) to justify an entry or exit. Maximizing profit requires movement, which is absent here.",1.0,HIGH,NEUTRAL,HIGH,LOW,50.0,0.06989,0.06989,0.0,0.0,5000000.0,AGGRESSIVE
