Timestamp,Session_ID,Cycle_Number,Symbol,Current_Price,Position,Unrealized_PnL,Portfolio_Allocation_Pct,AI_Action,AI_Priority,AI_Reasoning,Technical_Score,AI_Confidence,AI_Trend,Trend_Confidence,Risk_Level,RSI,SMA_20,SMA_50,MACD_Histogram,Daily_Change_Pct,Volume_Ratio,Strategy_Mode
2025-08-12T14:32:16.430458,session_20250812_142327_7182,2,AAPL,228.8,10,0.0,0.22890960649778325,HOLD,LOW,"Despite a bullish technical score (7.0), the negative MACD histogram (-0.508), below-average volume, and ""HIGH risk"" AI trend contradict a strong buy signal for a balanced strategy. We demand multiple confirming indicators and avoid high-risk trades.",7.0,MEDIUM,BULLISH,MEDIUM,HIGH,66.0626029654037,225.84949999999998,214.8732,-0.5081355949916881,0.4037212568018325,-1.0,BALANCED
2025-08-12T14:32:16.430500,session_20250812_142327_7182,2,XOM,107.2,10,0.0,0.0,BUY,HIGH,"XOM exhibits strong technical alignment for a buy, with a high technical score (7.5), healthy bullish RSI (56.6), and positive MACD histogram (0.125). The AI trend is bullish with acceptable medium risk, aligning with our capital preservation focus.",7.5,HIGH,BULLISH,MEDIUM,MEDIUM,56.56324582338902,106.50750000000001,107.331,0.125254787350153,0.3369524522650687,-1.0,BALANCED
2025-08-12T14:32:16.430514,session_20250812_142327_7182,2,META,785.69,6,0.0,0.47163983058368003,HOLD,LOW,"Although the technical score is bullish (7.0), META's RSI (76.9) is significantly overbought, and the price is at the Bollinger Upper Band, indicating potential overextension and a high likelihood of a pullback. The AI trend also flags ""HIGH risk,"" which is to be avoided.",7.0,MEDIUM,BULLISH,MEDIUM,HIGH,76.938827745073,767.807,766.8198,1.3640355126486157,0.7501538777185093,-1.0,BALANCED
2025-08-12T14:32:16.430526,session_20250812_142327_7182,2,AMZN,220.86,9,0.0,0.19886922256114672,HOLD,LOW,"While AMZN shows bearish signals (Technical Score 4.0, negative MACD, bearish AI Trend), we hold 9 shares. Due to the strict ""Trade size: 10 shares per order"" constraint, a sell order cannot be executed as we do not hold 10 or more shares.",4.0,HIGH,BEARISH,MEDIUM,MEDIUM,36.84210526315792,221.904,218.54039999999998,-0.30387699539940105,0.47311436629970904,-1.0,BALANCED
2025-08-12T14:32:16.430539,session_20250812_142327_7182,2,NFLX,1213.94,2,0.0,0.24290430744048863,HOLD,LOW,"Despite a bullish technical score (7.0), the negative MACD histogram (-0.423) and below-average volume contradict a strong, confirmed bullish trend. Balanced mode requires strong technical alignment with multiple confirming indicators.",7.0,MEDIUM,BULLISH,MEDIUM,MEDIUM,65.2490647765309,1203.54,1181.0146,-0.42292826248480075,0.34801153976507454,-1.0,BALANCED
2025-08-12T14:32:16.430550,session_20250812_142327_7182,2,MSFT,526.21,9,0.0,0.47381587251607815,HOLD,LOW,"MSFT has strong bullish indicators (Technical Score 7.5, positive MACD, bullish RSI). However, our current position (9 shares) combined with the ""Trade size: 10 shares per order"" constraint would exceed the ""Max shares per stock: 15"" limit (9 + 10 = 19 shares). Therefore, a buy order cannot be initiated.",7.5,HIGH,BULLISH,MEDIUM,MEDIUM,67.73977196512465,522.7915,526.524,0.4318911408622902,0.29160631241901475,-1.0,BALANCED
2025-08-12T14:32:16.430559,session_20250812_142327_7182,2,NVDA,180.95,9,0.0,0.16293301558652312,HOLD,LOW,"NVDA shows bearish signals (Technical Score 4.0, negative MACD, bearish AI Trend). We hold 9 shares. Due to the strict ""Trade size: 10 shares per order"" constraint, a sell order cannot be executed as we do not hold 10 or more shares.",4.0,HIGH,BEARISH,MEDIUM,MEDIUM,41.22699386503061,182.0225,179.6062,-0.3715535413863781,0.494279684549587,-1.0,BALANCED
2025-08-12T14:32:16.430570,session_20250812_142327_7182,2,TSLA,334.19,2,0.0,0.06687001870235505,HOLD,LOW,"TSLA exhibits a bearish technical score (4.0) and negative MACD. However, we hold only 2 shares, preventing a ""10 shares per order"" sell. Additionally, the ""HIGH risk"" AI trend goes against the balanced trading mode's principle of avoiding high volatility.",4.0,MEDIUM,BEARISH,MEDIUM,HIGH,51.547897196261694,333.1175,319.804,-0.5896314481676113,-0.51204191598941,-1.0,BALANCED
2025-08-12T14:32:16.430579,session_20250812_142327_7182,2,JPM,292.38,10,0.0,0.2925200644572634,HOLD,LOW,"Despite a bullish technical score (6.0) and positive MACD, JPM's RSI (68.1) is nearing overbought and the price is at the Bollinger Upper Band, suggesting potential overextension. The ""HIGH risk"" AI trend further indicates caution for a balanced portfolio.",6.0,MEDIUM,BULLISH,MEDIUM,HIGH,68.06526806526787,289.35299999999995,290.4342,0.38549369801369265,0.5640778702620851,-1.0,BALANCED
2025-08-12T14:32:16.430589,session_20250812_142327_7182,2,ADBE,336.31,8,0.0,0.26917688727716604,HOLD,LOW,"ADBE shows strong bearish signals (Technical Score 1.0, negative MACD, high confidence bearish AI trend). However, we hold 8 shares. Due to the strict ""Trade size: 10 shares per order"" constraint, a sell order cannot be executed. The ""HIGH risk"" AI trend also advises against trading.",1.0,HIGH,BEARISH,HIGH,HIGH,48.20683903252708,337.3875,340.91839999999996,-0.24803598942999616,1.5980907498036434,-1.0,BALANCED
