Timestamp,Session_ID,Cycle_Number,Symbol,Current_Price,Position,Unrealized_PnL,Portfolio_Allocation_Pct,AI_Action,AI_Priority,AI_Reasoning,Technical_Score,AI_Confidence,AI_Trend,Trend_Confidence,Risk_Level,RSI,SMA_20,SMA_50,MACD_Histogram,Daily_Change_Pct,Volume_Ratio,Strategy_Mode
2025-08-20T10:56:56.775542,session_20250820_102017_8161,6,BTCUSD,107700.02,0.004857,0.0,0.0,BUY,HIGH,"BTCUSD exhibits strong positive daily price action (+3.59%) on extremely high volume (Volume Ratio 24M+x average), indicating significant buying interest and momentum. Despite lagging bearish signals from MACD, all key momentum oscillators (RSI at 26.5, Williams %R at -72.6, Stochastic K at 27.4) are deeply oversold, signaling a high probability of an imminent bounce, which is a prime opportunity for an aggressive BUY. The current price is also trading above both the SMA 20 and SMA 50. Given the ""AGGRESSIVE TRADING MODE"" and prioritization of momentum/volume, these oversold conditions combined with strong overall price action and volume provide a high-conviction buy signal to capitalize on the expected bounce. We cannot sell the existing unprofitable position as per critical fee-aware sell rules, making a BUY action suitable to average down or add to the position.",7.0,HIGH,BULLISH,MEDIUM,MEDIUM,26.49563520050559,107196.68600000002,107531.02960000001,-364.88874399821,3.586247557620439,24905555.982569184,AGGRESSIVE
2025-08-20T10:56:56.775573,session_20250820_102017_8161,6,ETHUSD,2485.41,0.023158999999999996,0.0076,0.0,HOLD,MEDIUM,"The current ETHUSD position is explicitly designated as ""❌ UNPROFITABLE to sell"" with a Net P&L of $-0.00 after accounting for trading fees. According to the critical fee-aware sell rules, a HOLD recommendation is mandatory in this scenario unless a 2%+ stop-loss trigger is met, which it is not. Technical analysis on the available 5-minute timeframe shows mixed signals: while volume is exceptionally high (723608.07x average) and SMA 20 is above SMA 50 indicating short-term bullish momentum, the MACD line is below its signal, suggesting bearish short-term momentum. RSI (40.0) and Stochastic K (59.9) are neutral. No 1-hour data is available, preventing a comprehensive dual timeframe analysis and reducing overall confidence in a directional trade. The AI trend analysis is NEUTRAL with MEDIUM confidence, aligning with the conflicting indicators. Therefore, holding the position is prudent to await a profitable exit opportunity or clearer bullish signals.",5.0,MEDIUM,NEUTRAL,MEDIUM,MEDIUM,40.01610305958094,2482.1765,2481.9786000000004,-0.23072707923731015,0.20036767670251246,723608.070562926,AGGRESSIVE
2025-08-20T10:56:56.775585,session_20250820_102017_8161,6,LINKUSD,18.82231,0.0,0.0,0.0,HOLD,LOW,"All available 5-minute price data and technical indicators for LINKUSD are completely static. The current price, previous close, daily change, ATR, and 20-day volatility are all reported as $18.82, +0.00%, $18.82, 0.000, and 0.000 respectively. This indicates zero price movement. Consequently, momentum indicators like RSI (50.0) and MACD (all zero values) are perfectly neutral, and others like Williams %R and Stochastic K are undefined. Moving Averages (SMA 20, SMA 50) are stuck at the current static price. The AI Trend Analysis explicitly confirms a ""NEUTRAL"" trend with ""HIGH"" confidence due to ""All price-related indicators... show the price as completely static with zero movement or trend."" While current volume is high, the Volume MA is 0, suggesting data inconsistency or a frozen market. There is no 1-hour data available, preventing dual timeframe analysis. Under AGGRESSIVE TRADING MODE, which prioritizes momentum and decisive action for profit maximization, trading an asset with no price movement offers no potential for returns and presents an unquantifiable, high risk of being stuck. There are no technical signals for a BUY (requires score 4+) or SELL, as all indicators point to a frozen state. Given the lack of actionable price movement, the most prudent action is to HOLD and monitor for valid data or price action.",0.0,HIGH,NEUTRAL,HIGH,HIGH,50.0,18.82231,18.82231,1.8932661725304283e-29,0.0,5000000.0,AGGRESSIVE
2025-08-20T10:56:56.775595,session_20250820_102017_8161,6,LTCUSD,120.3,1.6740969999999997,-0.0507,0.0,HOLD,HIGH,"The current position is unprofitable to sell, with a Net P&L After Fees of $-0.06. This falls under the critical rule that mandates holding positions unless a 2%+ stop-loss is triggered. The current loss of 0.0249% is well below the stop-loss threshold. From a technical perspective, the 5-minute timeframe shows a bearish trend with the price below SMA 20 and SMA 50, and MACD indicating negative momentum with a bearish alignment. The AI trend analysis also confirms a BEARISH outlook with MEDIUM confidence. However, extremely oversold indicators like Williams %R (-100.0) and Stochastic K (0.0) suggest a potential for a near-term bounce, which could help recover the position. The extremely high volume (36734.79x average) accompanying a slight negative price change indicates significant activity, which could be either persistent selling pressure or a capitulation event preceding a bounce. Given the mandatory HOLD due to unprofitability and no stop-loss trigger, the strategy is to wait for price recovery to achieve a profitable exit or for a stop-loss to be hit.",4.0,MEDIUM,BEARISH,MEDIUM,MEDIUM,50.0,120.35400000000001,120.3624,-0.002178086258828757,-0.09965122072745768,36734.7912130597,AGGRESSIVE
2025-08-20T10:56:56.775605,session_20250820_102017_8161,6,BCHUSD,577.66,0.43477999999999994,-0.0,0.0,HOLD,MEDIUM,"Current position is unprofitable to sell, making a sell action impermissible according to critical fee-aware sell rules. While the asset shows some bullish momentum with current price above SMAs and high current volume (5,000,000), key technical indicators such as RSI (neutral at 50), MACD (zero values), and critical volatility/oscillator data (ATR, Williams %R, Stochastic K, 20-day Volatility) are either neutral or missing. The AI trend analysis, despite identifying a 'BULLISH' trend, assigns 'LOW' confidence and 'HIGH' risk, and notes an 'overbought state' (according to Bollinger Bands, though raw data not shown). The absence of 1-hour timeframe data prevents crucial medium-term trend confirmation. Given the aggressive trading mode requires a technical score of 4+ for actionable BUYs, and the significant gaps in data combined with the AI's low confidence, the overall technical picture does not provide sufficient conviction to add to the position at this time. Therefore, the most prudent action is to HOLD the existing unprofitable position and wait for clearer signals or price recovery.",2.0,MEDIUM,BULLISH,LOW,HIGH,50.0,575.53,575.53,0.0,0.37009365280697715,5000000.0,AGGRESSIVE
2025-08-20T10:56:56.775614,session_20250820_102017_8161,6,ZECUSD,38.47,1.300714,0.0,0.0,HOLD,LOW,"The current position is unprofitable to sell (Net P&L: $-0.01 after fees), which mandates a HOLD action as per critical fee-aware sell rules. Despite the aggressive trading mode, selling at a loss is prohibited unless a stop-loss is triggered, which is not the case here. Analyzing the 5-minute data, there are bullish signals such as exceptionally high current volume (5,000,000x average) on a positive price change, and the AI identifies bullish MACD signals, with price trading above SMAs. However, the AI's overall trend confidence is LOW, warning of the asset being overbought by Bollinger Bands and an extreme lack of historical volatility, suggesting high uncertainty and potential for reversal. The critical absence of 1-hour timeframe data prevents a comprehensive dual timeframe analysis and confirmation of a stronger medium-term trend. Given the conflicting technical signals and the unprofitable status of the current position, the most prudent action is to HOLD and await clearer directional cues or price recovery for a profitable exit.",5.0,HIGH,BULLISH,LOW,HIGH,50.0,38.42,38.42,2.524354896707238e-29,0.13014055179593223,5000000.0,AGGRESSIVE
2025-08-20T10:56:56.775624,session_20250820_102017_8161,6,BATUSD,0.1529,0.0,0.0,0.0,HOLD,LOW,"Despite the AI suggesting a ""BULLISH"" trend, its confidence is ""LOW"" and it explicitly states ""extreme stagnation with zero volatility and no discernible price movement."" All 5-minute technical indicators (RSI at 50.0, MACD lines at 0.000, SMAs at $0.15, ATR at 0.000, 20-day Volatility at 0.000) confirm a complete lack of price action and momentum. While current volume is high, the zero Volume MA and absence of price movement despite this volume suggest a highly illiquid or frozen market, not a strong bullish signal for aggressive entry. Without 1-hour data for medium-term trend confirmation and with no news sentiment to provide a boost, there is no actionable signal to enter based on momentum or volatility, which are prioritized in AGGRESSIVE TRADING MODE. Entering a market with zero discernible movement risks incurring fees without opportunity for profit.",3.0,LOW,BULLISH,LOW,LOW,50.0,0.1529,0.1529,4.930380657631324e-32,0.0,5000000.0,AGGRESSIVE
2025-08-20T10:56:56.775635,session_20250820_102017_8161,6,OXTUSD,0.06989,0.0,0.0,0.0,HOLD,LOW,"All technical indicators across the 5-minute timeframe (RSI 50, MACD 0, Converged SMAs, Zero ATR and Volatility) show extreme market stagnation and complete lack of momentum. The AI Trend Analysis confirms a NEUTRAL trend with HIGH confidence, explicitly stating ""complete market stagnation."" There is no 1-hour data available to confirm a medium-term trend, and no news sentiment to provide a directional bias. Aggressive trading requires strong signals for decisive action; this asset provides none, rendering any trade highly speculative without a clear edge to maximize profit.",5.0,HIGH,NEUTRAL,HIGH,LOW,50.0,0.06989,0.06989,0.0,0.0,5000000.0,AGGRESSIVE
