Timestamp,Session_ID,Cycle_Number,Symbol,Current_Price,Position,Unrealized_PnL,Portfolio_Allocation_Pct,AI_Action,AI_Priority,AI_Reasoning,Technical_Score,AI_Confidence,AI_Trend,Trend_Confidence,Risk_Level,RSI,SMA_20,SMA_50,MACD_Histogram,Daily_Change_Pct,Volume_Ratio,Strategy_Mode
2025-08-22T12:11:19.609416,session_20250822_103709_8422,13,BTCUSD,107700.02,0.0,0.0,0.0,HOLD,LOW,"The overall AI trend analysis indicates a NEUTRAL market with MEDIUM confidence, citing conflicting pressures. While MACD shows a bullish signal (MACD Line > MACD Signal, positive histogram), this is contradicted by the current price being below both the 20-period and 50-period SMAs, indicating short-term bearish pressure. Crucially, the AI reasoning points to ""high volume on a negative price day and bearish OBV confirmation,"" which strongly negates any potential bullish momentum despite the MACD. RSI, Williams %R, and Stochastic K are all in neutral territory, providing no strong directional conviction. Given the aggressive trading mode, clear momentum and alignment are required for a BUY. The conflicting technical signals and the absence of critical 1-hour timeframe data prevent a high-conviction trade. Since there is no current position, HOLD means to refrain from opening a new position at this time.",3.0,LOW,NEUTRAL,MEDIUM,MEDIUM,50.0,107759.3165,107753.92559999999,5.752111532738485,-0.19981346542414388,30651382.681929998,AGGRESSIVE
2025-08-22T12:11:19.609443,session_20250822_103709_8422,13,ETHUSD,2482.92,0.020138,0.0,0.0,HOLD,LOW,"The current position is ❌ UNPROFITABLE to sell, showing a net P&L of -$0.01 after fees. As per critical fee-aware sell rules, a sell is not permissible unless it's a stop-loss trigger, which is not indicated. Technical analysis presents a neutral to slightly bearish outlook; while MACD shows a bearish crossover and negative histogram, oscillators like RSI, Williams %R, and Stochastic K are neutral. The AI trend analysis indicates ""NEUTRAL"" with ""extreme market stagnation"" and a ""weak underlying bearish bias."" Despite extremely high current volume, the zero daily price change points to consolidation. There is no strong bullish momentum to justify a BUY, nor is an unprofitable SELL permitted by the trading rules. Therefore, holding the current position is the mandated action.",5.0,MEDIUM,NEUTRAL,MEDIUM,LOW,40.01610305958094,2482.177,2482.3756,-0.05542905727340794,0.0,712031.3905025417,AGGRESSIVE
2025-08-22T12:11:19.609455,session_20250822_103709_8422,13,LINKUSD,18.82231,0.0,0.0,0.0,HOLD,LOW,"The market for LINKUSD is overwhelmingly static and lacks any discernible trend or momentum on the 5-minute timeframe. Price change is 0.00%, RSI is neutral at 50.0, and all MACD components are flat at 0.000. Both SMA 20 and SMA 50 are aligned with the current price, indicating no price movement. Furthermore, ATR and 20-day Volatility are zero, confirming a complete absence of price action. While the AI trend analysis identifies a ""BULLISH"" trend, it explicitly states ""LOW"" confidence, ""HIGH"" risk, and acknowledges an ""overwhelmingly static market"" in its reasoning. The high current volume with a zero Volume MA is a clear data anomaly given the lack of any price movement. Without clear technical signals, momentum, or confirming news sentiment, and with contradictory AI analysis on a static market, there is no actionable buy signal that aligns with aggressive profit maximization through decisive, signal-based action.",1.0,HIGH,BULLISH,LOW,HIGH,50.0,18.82231,18.82231,1.66981122370699e-22,0.0,5000000.0,AGGRESSIVE
2025-08-22T12:11:19.609466,session_20250822_103709_8422,13,LTCUSD,120.3,0.415628,0.0,0.0,HOLD,HIGH,"Current position is unprofitable to sell after accounting for fees ($0.01 net P&L after fees), which mandates a HOLD recommendation per the critical fee-aware sell rules. Furthermore, despite the flat current price action, short-term momentum indicators Williams %R (-95.9) and Stochastic K (4.1) are significantly oversold, signaling a strong potential for an upward reversal. This is reinforced by a bullish MACD crossover and an exceptionally high current volume (34707x average), indicating strong market interest and potential for upward momentum. The AI trend analysis also confirms a HIGH confidence BULLISH outlook. Holding is recommended to allow for price recovery and potential profit.",8.0,HIGH,BULLISH,HIGH,MEDIUM,55.55555555555556,120.372,120.36,0.00045005465724234917,0.0,34707.68757868841,AGGRESSIVE
2025-08-22T12:11:19.609476,session_20250822_103709_8422,13,BCHUSD,577.66,0.086556,0.0,0.0,HOLD,MEDIUM,"The current BCHUSD position is unprofitable with a net P&L of $-0.01 after accounting for the $0.01 round-trip fee. According to the critical fee-aware sell rules, a position showing ""❌ UNPROFITABLE to sell"" must be held unless a stop-loss is triggered, which is not the case here as the price is at the purchase level. Therefore, a SELL action is prohibited.",5.0,LOW,BULLISH,LOW,HIGH,50.0,575.53,575.53,0.0,0.37009365280697715,5000000.0,AGGRESSIVE
2025-08-22T12:11:19.609486,session_20250822_103709_8422,13,ZECUSD,38.47,0.0,0.0,0.0,HOLD,LOW,"The technical analysis for ZECUSD presents highly anomalous and unreliable data. Critical indicators such as MACD (0.000), ATR (0.000), Volume MA (0), and 20-day Volatility (0.000) are all reported as zero. This severely compromises the validity and reliability of any potential trading signals, a concern explicitly echoed by the AI trend analysis which notes ""highly anomalous data or extreme market conditions that reduce reliability."" While the AI indicates a ""BULLISH"" trend, its confidence is ""LOW,"" and its reasoning contradicts the raw MACD data (stating ""positive MACD signal"" when MACD is flat). The RSI is neutral at 50.0, and SMAs are flat, offering no strong momentum or trend confirmation. Despite the ""AGGRESSIVE TRADING MODE ACTIVE"" and a mandate to prioritize momentum and volume, the absence of reliable data for these key categories means there are no strong technical signals (score 4+ required for BUY) to act upon. Taking a position based on flawed data is not strategically aggressive; it is purely speculative. Therefore, a HOLD is the most prudent action until clearer and more reliable technical data emerges.",2.0,LOW,BULLISH,LOW,HIGH,50.0,38.42,38.42,9.972723501592159e-06,0.13014055179593223,4576273.5,AGGRESSIVE
2025-08-22T12:11:19.609496,session_20250822_103709_8422,13,BATUSD,0.1529,0.0,0.0,0.0,HOLD,LOW,"The comprehensive 5-minute analysis (the only timeframe available) reveals absolute zero volatility and extreme consolidation for BATUSD. All major technical indicators, including RSI (50.0), MACD (all zero), SMA 20 ($0.15), SMA 50 ($0.15), ATR (0.000), and 20-day Volatility (0.000), indicate a complete lack of price movement or discernible trend. The AI trend analysis confirms a ""NEUTRAL"" trend with ""HIGH"" confidence, citing the ""absolute zero volatility"" and ""extreme consolidation."" While current volume is high (5,000,000), the Volume MA is 0 and ATR is 0, strongly suggesting a stagnant asset rather than one with actionable momentum. Given the AGGRESSIVE TRADING MODE, which prioritizes momentum and clear signals, the complete absence of any trend or volatility means there is no basis for an aggressive BUY, and without an existing position, no SELL action is relevant. This asset offers no actionable opportunities for profit maximization under current conditions.",1.0,HIGH,NEUTRAL,HIGH,LOW,50.0,0.1529,0.1529,4.639141106688792e-22,0.0,5000000.0,AGGRESSIVE
2025-08-22T12:11:19.609510,session_20250822_103709_8422,13,OXTUSD,0.06989,0.0,0.0,0.0,HOLD,LOW,"All available 5-minute technical indicators for OXTUSD (RSI, MACD, SMAs, ATR, 20-day Volatility) are at perfectly neutral or zero values, indicating an extreme lack of price movement and volatility. The AI Trend Analysis confirms a NEUTRAL trend with HIGH confidence, citing the price alignment with all moving averages and the absolute neutrality of momentum and volatility indicators. Despite a high current volume, the zero ATR and volatility suggest this volume is not translating into price action. There is no 1-hour data for trend confirmation, and no news sentiment to influence the decision. Under aggressive trading, we prioritize momentum and volume, but here, there is no discernable momentum. A technical score of 1 does not meet the minimum '4+' threshold for a BUY action, and there is no position to SELL.",1.0,HIGH,NEUTRAL,HIGH,LOW,50.0,0.06989,0.06989,0.0,0.0,5000000.0,AGGRESSIVE
