Timestamp,Session_ID,Cycle_Number,Symbol,Current_Price,Position,Unrealized_PnL,Portfolio_Allocation_Pct,AI_Action,AI_Priority,AI_Reasoning,Technical_Score,AI_Confidence,AI_Trend,Trend_Confidence,Risk_Level,RSI,SMA_20,SMA_50,MACD_Histogram,Daily_Change_Pct,Volume_Ratio,Strategy_Mode
2025-08-21T11:44:18.749736,session_20250821_101142_3154,14,BTCUSD,107807.83,0.0020742599999999996,0.2236,0.0,BUY,HIGH,"Operating in AGGRESSIVE TRADING MODE, the current position is profitable to sell, but decisive action is taken to maximize potential returns. While there is no 1-hour data, the 5-minute timeframe presents a compelling opportunity. The price is trading above key moving averages (SMA 20 and SMA 50), indicating short-term bullish sentiment. Crucially, both Williams %R (-100.0) and Stochastic K (0.0) are at extreme oversold levels. In crypto markets, these are powerful leading indicators of an imminent upward rebound, which aligns with the AI's ""BULLISH"" trend analysis (medium confidence) explicitly citing these oversold conditions as suggesting a potential rebound. Furthermore, the extremely high Current Volume and Volume Ratio suggest significant market interest and confirm that any directional move, especially a rebound, will likely be strong. Although a bearish MACD crossover introduces some uncertainty, it is considered a lagging indicator; in an aggressive strategy, prioritizing leading indicators like extreme oversold oscillators and high momentum for a potential reversal is paramount. Adding 0.001 shares leverages the profitable existing position to capitalize on the anticipated rebound, accepting higher risk for higher potential returns. All portfolio constraints and cash reserves are met.",6.0,MEDIUM,BULLISH,MEDIUM,MEDIUM,50.0,107770.09650000001,107771.17520000001,-6.6632519893887885,0.10010211697267805,31694288.938832354,AGGRESSIVE
2025-08-21T11:44:18.749765,session_20250821_101142_3154,14,ETHUSD,2482.92,0.023158999999999996,-0.0501,0.0,HOLD,HIGH,"The current ETHUSD position is unprofitable (Net P&L: $-0.06), and the loss of 0.086% does not trigger the 2% stop-loss threshold. Therefore, according to the critical fee-aware sell rules, a SELL action is not permissible at this time; the position must be held.",5.0,LOW,NEUTRAL,HIGH,MEDIUM,45.45787545787538,2482.053,2481.681,-0.07664432463266643,0.0,714963.7876206205,AGGRESSIVE
2025-08-21T11:44:18.749777,session_20250821_101142_3154,14,LINKUSD,18.82231,0.0,0.0,0.0,HOLD,LOW,"All primary price-based indicators (RSI 50.0, MACD 0.000, Price at SMAs) consistently indicate zero price movement for LINKUSD, rendering any trend identification impossible. The absence of 1-hour timeframe data prevents a comprehensive dual-timeframe analysis, which significantly reduces confidence in any directional trade. Furthermore, the provided data is contradictory, showing 5,000,000 current volume and a 5,000,000x volume ratio, yet zero ATR, zero 20-day volatility, and an AI trend analysis confirming ""zero price movement."" This severe data inconsistency means no reliable technical signals (momentum or volume indicators) are present to justify a BUY (technical score needs 4+) or SELL action, even under aggressive trading rules. Entering a position under such unreliable and contradictory data would constitute pure speculation, not profit maximization.",1.0,LOW,NEUTRAL,LOW,HIGH,50.0,18.82231,18.82231,1.8932661725304283e-29,0.0,5000000.0,AGGRESSIVE
2025-08-21T11:44:18.749788,session_20250821_101142_3154,14,LTCUSD,120.3,0.4284579999999996,-0.013,0.0,HOLD,HIGH,"The current position is unprofitable to sell (Net P&L $-0.02) and does not meet the 2%+ stop-loss threshold, thus mandating a HOLD per critical fee-aware trading rules. Technically, the 5-minute timeframe indicates a strongly bearish trend, with the price trading below key moving averages (SMA20 at $120.35, SMA50 at $120.36) and MACD showing clear negative momentum (MACD Line: -0.012, MACD Signal: -0.006). This is corroborated by the AI's ""BEARISH"" trend analysis with ""HIGH"" confidence. However, momentum indicators such as Williams %R (-100.0) and Stochastic K (0.0) are in extremely oversold territory. In crypto, these extreme oversold signals often suggest a potential short-term bounce or consolidation, providing a basis to hold the current position in anticipation of a price recovery to become profitable. The exceptionally high current volume (34532.66x average) confirms significant market activity, which, while accompanying the bearish trend, could also precede a turning point. No news sentiment is available to impact this decision.",7.0,HIGH,BEARISH,HIGH,MEDIUM,50.0,120.354,120.3576,-0.006292769052095219,0.0,34532.65539289502,AGGRESSIVE
2025-08-21T11:44:18.749799,session_20250821_101142_3154,14,BCHUSD,577.66,0.5213359999999999,-0.0,0.0,HOLD,MEDIUM,"The current position in BCHUSD is UNPROFITABLE to sell with a net P&L of $-0.01 after fees. According to the critical fee-aware sell rules, a HOLD recommendation is mandatory unless a 2%+ stop-loss is triggered, which is not the case here. For initiating a new BUY, while the AI trend analysis indicates a BULLISH trend with medium confidence, citing price above key moving averages and high volume, it also critically warns that the asset is ""overbought by Bollinger Bands,"" suggesting a ""potential near-term correction."" Furthermore, short-term momentum indicators like RSI (50.0) and MACD (0.000) are neutral. With no 1-hour timeframe data available to confirm medium-term trends and the explicit overbought warning, new aggressive BUY entries are not prudent at this moment. We will HOLD the existing position and await either a clearer bullish continuation without the overbought signal or a price recovery to achieve a profitable exit.",3.0,MEDIUM,BULLISH,MEDIUM,HIGH,50.0,575.53,575.53,0.0,0.37009365280697715,5000000.0,AGGRESSIVE
2025-08-21T11:44:18.749808,session_20250821_101142_3154,14,ZECUSD,38.47,1.300714,0.0,0.0,HOLD,LOW,"Current position is unprofitable to sell (Net P&L $-0.01) and does not meet the minimum profit threshold after accounting for fees, mandating a HOLD according to critical trading rules. The gross P&L is $0.00, meaning the price is exactly at the purchase price, thus a sale would incur a loss after fees. Furthermore, technical indicators provide no clear actionable signal for an aggressive trade. The 5-minute RSI (50.0) and MACD (0.000) are neutral, indicating no current momentum. Crucially, the ATR and 20-day Volatility are both 0.000, suggesting an extreme lack of price movement, which makes any directional bias highly speculative. No 1-hour data is available for medium-term trend confirmation. While the AI suggests a low-confidence BULLISH trend, it also notes an ""overbought"" condition (not supported by provided raw data) and the ""extreme lack of volatility or a clear trend."" Given the unprofitability of the current position for selling and the ambiguous, low-volatility technical landscape, holding is the only prudent action.",3.0,MEDIUM,BULLISH,LOW,MEDIUM,50.0,38.42,38.42,3.966700419543589e-18,0.13014055179593223,5000000.0,AGGRESSIVE
2025-08-21T11:44:18.749817,session_20250821_101142_3154,14,BATUSD,0.1529,327.011118,0.0,0.0,HOLD,LOW,"The primary reason for HOLDing is that the current BATUSD position is ""❌ UNPROFITABLE to sell"" (Net P&L After Fees: $-0.01). According to the CRITICAL FEE-AWARE SELL RULES, I am mandated to HOLD this position unless a stop-loss trigger (2%+ loss) is met, which is not the case as the price is at the purchase point. For potential new actions, the technical analysis for BATUSD shows extreme price stagnation across all indicators: RSI is neutral (50.0), MACD Line/Histogram/Signal are flat (0.000), and both SMA 20 and SMA 50 are exactly at the current price ($0.15). Volatility indicators (ATR 0.000, 20-day Volatility 0.000) confirm a complete lack of price movement. While current volume is high (5,000,000), it is not translating into any price action, negating its use as a momentum indicator. The AI Trend Analysis identifies a ""BULLISH"" trend but with ""LOW"" confidence and ""HIGH"" risk, explicitly stating the market exhibits ""extreme price stagnation and no discernible market movement,"" which contradicts a strong bullish signal. No 1-hour data is available for medium-term trend confirmation. In aggressive trading mode, actionable signals are prioritized; however, there are no clear technical signals (neither buy nor sell, with a technical score well below actionable thresholds of 4+ for BUY or 6- for SELL) to justify a new trade or an exit of the existing unprofitable position. No news sentiment is available to influence the decision.",1.0,LOW,BULLISH,LOW,HIGH,50.0,0.1529,0.1529,4.930380657631324e-32,0.0,5000000.0,AGGRESSIVE
2025-08-21T11:44:18.749827,session_20250821_101142_3154,14,OXTUSD,0.06989,0.0,0.0,0.0,HOLD,LOW,"The asset exhibits extreme stagnation across all 5-minute technical indicators. Price is perfectly flat at $0.07 with 0% daily change. RSI (50.0), MACD Histogram (0.000), MACD Line (0.000), and MACD Signal (0.000) are all perfectly neutral, indicating no momentum. Both SMA 20 and SMA 50 are at the current price, showing no trend. Volatility metrics (ATR: 0.000, 20-day Volatility: 0.000) are zero, confirming a complete lack of price movement. The AI Trend Analysis explicitly identifies a ""NEUTRAL"" trend with ""HIGH"" confidence due to this stagnation. No 1-hour data is available to provide medium-term confirmation. While current volume is reported, a Volume MA of 0 makes the volume ratio unreliable for momentum analysis. In an aggressive trading mode, a clear directional signal with technical score 4+ is required for a BUY. This asset presents no such signal, making it unsuitable for an aggressive entry.",1.0,HIGH,NEUTRAL,HIGH,LOW,50.0,0.06989,0.06989,0.0,0.0,5000000.0,AGGRESSIVE
