Timestamp,Session_ID,Cycle_Number,Symbol,Current_Price,Position,Unrealized_PnL,Portfolio_Allocation_Pct,AI_Action,AI_Priority,AI_Reasoning,Technical_Score,AI_Confidence,AI_Trend,Trend_Confidence,Risk_Level,RSI,SMA_20,SMA_50,MACD_Histogram,Daily_Change_Pct,Volume_Ratio,Strategy_Mode
2025-08-13T15:38:09.429540,session_20250813_153608_2294,1,AAPL,232.15,0,0.0,0.0,HOLD,LOW,"Technical Score 5.5 is neutral, falling below the required 6+ for a high-priority BUY. The AI Trend is also NEUTRAL (MEDIUM conf), and Key Signals are balanced (3.5 bullish, 3 bearish), indicating no clear directional bias or strong technical alignment for a trade.",5.5,HIGH,NEUTRAL,MEDIUM,MEDIUM,64.76510067114107,229.209,219.1864,-0.20474443072009807,-0.5994433740098504,-1.0,BALANCED
2025-08-13T15:38:09.429576,session_20250813_153608_2294,1,XOM,106.5,10,0.0,0.10652305691566939,HOLD,LOW,"Technical Score is 8.5 (STRONG_BULLISH) with confirming bullish RSI (57.7), positive MACD Histogram (0.057), and a BULLISH AI Trend (HIGH conf). However, the current position of 10 shares prevents a buy order of 10 shares, as it would exceed the 15-share maximum per stock.",8.5,HIGH,BULLISH,HIGH,MEDIUM,57.67441860465111,106.42049999999999,106.86080000000001,0.056881168250403374,0.45274476513865686,-1.0,BALANCED
2025-08-13T15:38:09.429592,session_20250813_153608_2294,1,META,785.25,6,0.0,0.47125200249594024,HOLD,LOW,"Technical Score is 9.0 (STRONG_BULLISH) with strong confirming bullish RSI (67.8), positive MACD Histogram (0.630), and a BULLISH AI Trend (HIGH conf). However, the current position of 6 shares prevents a buy order of 10 shares, as it would exceed the 15-share maximum per stock.",9.0,HIGH,BULLISH,HIGH,MEDIUM,67.80110497237567,777.995,772.347,0.630186536591089,-0.07635044855888817,-1.0,BALANCED
2025-08-13T15:38:09.429604,session_20250813_153608_2294,1,AMZN,223.59,9,0.0,0.20127456587978468,HOLD,LOW,"Technical Score is 10/10 (STRONG_BULLISH) with robust bullish signals from RSI (60.1), positive MACD Histogram (0.176), and a BULLISH AI Trend (HIGH conf) with 6.5 bullish key signals. However, the current position of 9 shares prevents a buy order of 10 shares, as it would exceed the 15-share maximum per stock.",10.0,HIGH,BULLISH,HIGH,MEDIUM,60.11673151750979,221.90050000000002,219.78220000000002,0.17636944088091544,0.17024326867075643,-1.0,BALANCED
2025-08-13T15:38:09.429615,session_20250813_153608_2294,1,NFLX,1220.79,2,0.0,0.24421085944052587,HOLD,MEDIUM,"Despite an overall Technical Score of 7.5 (WEAK_BULLISH) and BULLISH AI Trend, the significant negative MACD Histogram (-1.276) indicates strong bearish momentum. This key contradiction prevents the ""strong technical alignment"" and ""multiple confirming indicators"" required for a balanced trading approach.",7.5,MEDIUM,BULLISH,MEDIUM,MEDIUM,51.73177607732584,1218.02,1190.8146,-1.2758628392709497,0.22494971470793557,-1.0,BALANCED
2025-08-13T15:38:09.429625,session_20250813_153608_2294,1,MSFT,527.99,9,0.0,0.4752938773597544,HOLD,LOW,"Technical Score is 7.5 (WEAK_BULLISH) supported by bullish RSI (56.1), positive MACD Histogram (0.580), and a BULLISH AI Trend (MEDIUM conf). However, the current position of 9 shares prevents a buy order of 10 shares, as it would exceed the 15-share maximum per stock.",7.5,HIGH,BULLISH,MEDIUM,MEDIUM,56.1347743165927,525.846,526.8696,0.5802418973157619,-0.444989158103142,-1.0,BALANCED
2025-08-13T15:38:09.429635,session_20250813_153608_2294,1,NVDA,180.41,9,0.0,0.1624041523787824,HOLD,MEDIUM,"Technical Score of 3/10 (WEAK_BEARISH) meets the 4- threshold for a high-priority SELL, confirmed by bearish RSI (33.9), negative MACD Histogram (-0.288), and price at the Bollinger Lower band. However, the current position of 9 shares prevents executing the required 10-share sell order.",3.0,HIGH,BEARISH,MEDIUM,HIGH,33.859095688748795,182.404,180.79059999999998,-0.2878919341477574,-0.6279261911319276,-1.0,BALANCED
2025-08-13T15:38:09.429646,session_20250813_153608_2294,1,TSLA,341.81,2,0.0,0.06837680015839429,HOLD,LOW,"Technical Score 5.5 is neutral, neither meeting the 6+ for a high-priority BUY nor the 4- for a high-priority SELL. RSI (44.3) and MACD Hist (-0.453) show slight bearish momentum, while the AI Trend is NEUTRAL, indicating no strong trade signal.",5.5,HIGH,NEUTRAL,MEDIUM,MEDIUM,44.334650856389985,339.3295,325.58299999999997,-0.4529592370829052,-0.4485219164118306,-1.0,BALANCED
2025-08-13T15:38:09.429656,session_20250813_153608_2294,1,JPM,291.39,10,0.0,0.2914530850202526,HOLD,LOW,"Technical Score is 8.5 (STRONG_BULLISH) with confirming bullish RSI (54.7), positive MACD Histogram (0.146), and a BULLISH AI Trend (HIGH conf). However, the current position of 10 shares prevents a buy order of 10 shares, as it would exceed the 15-share maximum per stock.",8.5,HIGH,BULLISH,HIGH,MEDIUM,54.676952748312274,291.14500000000004,290.839,0.14621201440534204,-0.4135338345864785,-1.0,BALANCED
2025-08-13T15:38:09.429665,session_20250813_153608_2294,1,ADBE,346.87,8,0.0,0.27755607701286944,HOLD,LOW,"Technical Score is 6/10 (WEAK_BULLISH) supported by strong bullish RSI (65.9) and a very strong positive MACD Histogram (1.346), with price at the Bollinger Upper band. However, the current position of 8 shares prevents a buy order of 10 shares, as it would exceed the 15-share maximum per stock.",6.0,HIGH,BULLISH,MEDIUM,MEDIUM,65.94095940959406,338.467,339.34680000000003,1.3464392135271828,0.6207756795172994,-1.0,BALANCED
