Timestamp,Session_ID,Cycle_Number,Symbol,Current_Price,Position,Unrealized_PnL,Portfolio_Allocation_Pct,AI_Action,AI_Priority,AI_Reasoning,Technical_Score,AI_Confidence,AI_Trend,Trend_Confidence,Risk_Level,RSI,SMA_20,SMA_50,MACD_Histogram,Daily_Change_Pct,Volume_Ratio,Strategy_Mode
2025-08-12T16:00:04.653892,session_20250812_155630_8854,1,AAPL,229.78,10,0.0,0.22986322887791213,HOLD,LOW,"While the Technical Score is borderline bullish, the negative MACD Histogram, below-average volume, and ""HIGH risk"" AI trend contradict a high-conviction buy signal for a balanced strategy. Furthermore, buying 10 shares would exceed the max shares per stock (10 current + 10 buy = 20 > 15 max).",6.0,HIGH,BULLISH,MEDIUM,HIGH,61.71003717472122,226.41349999999997,215.40239999999997,-0.42203672160956085,0.1176419328133895,-1.0,BALANCED
2025-08-12T16:00:04.654651,session_20250812_155630_8854,1,XOM,106.73,10,0.0,0.10676865879597683,HOLD,LOW,"The Technical Score is bullish, but the neutral RSI, below-average volume, and position constraints (10 current + 10 buy = 20 > 15 max) prevent a buy. There isn't enough strong confirmation for a balanced strategy focused on capital preservation.",6.5,HIGH,BULLISH,MEDIUM,MEDIUM,49.6083550913838,106.499,107.2682,0.11997773114313559,-0.06554307116104231,-1.0,BALANCED
2025-08-12T16:00:04.654693,session_20250812_155630_8854,1,META,788.08,6,0.0,0.4730192708175777,HOLD,LOW,"Despite a high technical score, the stock is extremely overbought (RSI 81.4), trading at the upper Bollinger band, and the AI trend indicates ""HIGH risk"". This makes it unsuitable for a balanced strategy focused on capital preservation and avoiding high volatility. Position constraints (6 current + 10 buy = 16 > 15 max) also prevent a buy.",7.0,HIGH,BULLISH,MEDIUM,HIGH,81.43036386449191,768.8895,767.5060000000001,1.9326087217559142,0.2939791542054366,-1.0,BALANCED
2025-08-12T16:00:04.654733,session_20250812_155630_8854,1,AMZN,221.68,9,0.0,0.19958426547084165,HOLD,LOW,"The stock is technically neutral across multiple indicators, including its Technical Score (5/10), balanced key signals, and neutral AI trend. The MACD Histogram is negative, and there is no clear directional bias for trading. Position constraints (9 current + 10 buy = 19 > 15 max) also prevent a buy.",5.0,HIGH,NEUTRAL,MEDIUM,MEDIUM,42.647058823529456,221.8395,218.64600000000002,-0.22169660794051238,0.3894574766778433,-1.0,BALANCED
2025-08-12T16:00:04.654756,session_20250812_155630_8854,1,NFLX,1222.35,2,0.0,0.24455854975969699,HOLD,LOW,"Despite allowing a 10-share buy based on current position, the Technical Score is neutral, RSI is at overbought levels (70.0), MACD Histogram is negative, and AI trend shows ""HIGH risk"". This lack of strong alignment and high risk profile makes it unsuitable for a balanced buy.",5.0,HIGH,NEUTRAL,MEDIUM,HIGH,70.03395585738545,1205.6695000000002,1182.0212,-0.33130200019240164,0.8647792254944853,-1.0,BALANCED
2025-08-12T16:00:04.654770,session_20250812_155630_8854,1,MSFT,526.8,9,0.0,0.47429173155015963,HOLD,LOW,"While MSFT exhibits strong bullish signals with a high Technical Score (7.5), healthy RSI (68.1), positive MACD Histogram (0.501), and a bullish AI Trend (MEDIUM risk), the current position of 9 shares means a 10-share order would exceed the 15-share maximum per stock (9 current + 10 buy = 19 > 15 max). Thus, a buy cannot be executed under current constraints.",7.5,HIGH,BULLISH,MEDIUM,MEDIUM,68.1456953642386,522.975,526.5244,0.5011332240052474,0.3485913480770191,-1.0,BALANCED
2025-08-12T16:00:04.654782,session_20250812_155630_8854,1,NVDA,182.47,9,0.0,0.16428248340159005,HOLD,LOW,"Despite a high technical score and bullish AI trend, the RSI is neutral/bearish and the MACD Histogram is negative, indicating a lack of confirming momentum for a strong buy. Position constraints (9 current + 10 buy = 19 > 15 max) also prevent a buy.",7.5,HIGH,BULLISH,MEDIUM,MEDIUM,46.11923509561306,182.15349999999998,179.76899999999998,-0.2735495082803566,0.5067474524924194,-1.0,BALANCED
2025-08-12T16:00:04.654793,session_20250812_155630_8854,1,TSLA,338.26,2,0.0,0.06767650430868008,HOLD,LOW,"Despite allowing a 10-share buy based on current position, the stock exhibits conflicting signals, specifically a significantly negative MACD Histogram (-0.692) strongly contrasting with a bullish technical score and RSI. This lack of strong technical alignment makes it unsuitable for a balanced buy.",7.0,HIGH,BULLISH,MEDIUM,MEDIUM,60.533104041272544,334.12600000000003,320.47180000000003,-0.6915951754840561,1.0364706233758387,-1.0,BALANCED
2025-08-12T16:00:04.654804,session_20250812_155630_8854,1,JPM,292.94,0,0.0,0.0,HOLD,LOW,"While the Technical Score (2/10) and AI Trend (HIGH conf BEARISH) are strongly bearish, there are no shares held to sell. The strategy does not imply initiating short positions for capital preservation.",2.0,HIGH,BEARISH,HIGH,HIGH,72.08067940552,289.65749999999997,290.53679999999997,0.5183224811091258,-0.13295605631881716,-1.0,BALANCED
2025-08-12T16:00:04.654816,session_20250812_155630_8854,1,ADBE,336.06,8,0.0,0.2689453797430974,SELL,HIGH,"This stock exhibits strong bearish alignment across multiple indicators including an extremely low Technical Score (0/10), negative MACD Histogram, a highly confident bearish AI trend, and a strong count of bearish key signals. Selling 8 shares aligns with capital preservation in a balanced trading mode, liquidating a position with poor technical outlook.",0.0,HIGH,BEARISH,HIGH,HIGH,46.05318699873364,337.394,340.6232,-0.09480678443038815,-0.10700909577314477,-1.0,BALANCED
