Timestamp,Session_ID,Cycle_Number,Symbol,Current_Price,Position,Unrealized_PnL,Portfolio_Allocation_Pct,AI_Action,AI_Priority,AI_Reasoning,Technical_Score,AI_Confidence,AI_Trend,Trend_Confidence,Risk_Level,RSI,SMA_20,SMA_50,MACD_Histogram,Daily_Change_Pct,Volume_Ratio,Strategy_Mode
2025-08-21T10:07:09.646726,session_20250821_100538_9517,1,BTCUSD,107700.02,0.0030018399999999995,0.0,0.0,HOLD,MEDIUM,"The current BTCUSD position is unprofitable to sell due to the $0.01 round-trip fee, with a gross P&L of $0.00. Per the critical fee-aware sell rules, I am mandated to HOLD this position unless a stop-loss is triggered, which it is not (0% loss, not 2%+). From a technical standpoint, the 5-minute timeframe shows a bearish bias despite a bullish MACD cross. Price is trading below both the 20 and 50 period Simple Moving Averages, and the daily change is negative (-0.10%). Overbought signals from Williams %R (-20.0) and Stochastic K (80.0) suggest potential for downward reversal, reinforced by high current volume with negative price movement as per the AI analysis. The AI's overall trend analysis is BEARISH with MEDIUM confidence, aligning with the price action below SMAs. Given the primary constraint of current unprofitability to sell, the existing position must be held, awaiting a return to profitability or a stop-loss trigger.",8.0,MEDIUM,BEARISH,MEDIUM,HIGH,53.84648315424444,107737.755,107760.39439999999,3.4989325893403667,-0.10000201284080912,31318200.745251734,AGGRESSIVE
2025-08-21T10:07:09.646764,session_20250821_100538_9517,1,ETHUSD,2482.92,0.023158999999999996,-0.0501,0.0,HOLD,HIGH,"The current ETHUSD position is unprofitable (Net P&L: $-0.06), and per the critical fee-aware sell rules, positions must not be sold at a loss unless a stop-loss is triggered. The price of $2482.92 is currently above the calculated 2% stop-loss price of $2435.38. Technical indicators show mixed signals on the 5-minute timeframe; price is holding above the SMA 20 and SMA 50 ($2482.92 vs $2481.31 and $2481.58 respectively), which is bullish, but MACD shows a bearish crossover. Crucially, volume is extremely high (704362.69x average), indicating significant market activity and potential for momentum. However, without 1-hour data, a strong directional trend cannot be confirmed, and the AI trend analysis indicates Neutral with Low Confidence. Given the immediate constraint against selling at a loss, and the presence of extremely high volume suggesting potential for price recovery, a HOLD is the appropriate action, waiting for profitability or a stop-loss trigger.",3.0,LOW,NEUTRAL,LOW,MEDIUM,40.01610305958094,2481.3085,2481.5814,-0.14854085890501842,0.09998226121172124,704362.6863386529,AGGRESSIVE
2025-08-21T10:07:09.646781,session_20250821_100538_9517,1,LINKUSD,18.82231,0.0,0.0,0.0,HOLD,LOW,"The analysis for LINKUSD reveals a market in a state of extreme stagnation, offering no actionable signals for an aggressive trading strategy. All 5-minute timeframe technical indicators, including RSI (50.0), MACD (0.000 for all components), SMA 20 ($18.82), and SMA 50 ($18.82), are perfectly neutral and converged at the current price of $18.82. The daily price change is 0.00%, and volatility indicators such as ATR (0.000) and 20-day Volatility (0.000) are effectively at zero. The AI Trend Analysis confirms a 'NEUTRAL' trend with 'LOW' confidence, explicitly stating ""complete absence of a discernible trend or momentum."" While current volume is notably high (5,000,000), it is not translating into any price movement or volatility, indicating a lack of directional conviction in the market. As an aggressive trading analyst, the priority is to maximize profit through decisive action based on clear momentum and volume signals. However, LINKUSD currently presents no such signals, falling far below the technical score threshold (4+) for a BUY recommendation. Without any clear trend, momentum, or news sentiment to provide direction, initiating a trade would be speculative and contrary to the principles of identifying strong entry points. Given no current position in LINKUSD, a 'HOLD' action is recommended, implying to stay out of the market until a discernible trend or actionable technical signal emerges.",1.0,HIGH,NEUTRAL,LOW,LOW,50.0,18.82231,18.82231,1.8932661725304283e-29,0.0,5000000.0,AGGRESSIVE
2025-08-21T10:07:09.646794,session_20250821_100538_9517,1,LTCUSD,120.42,0.4284579999999996,0.0384,0.0,BUY,HIGH,"The aggressive trading mode prioritizes maximizing profit through decisive action, accepting higher risk for higher potential returns. LTCUSD exhibits strong bullish signals on the 5-minute timeframe: price ($120.42) is decisively above both the SMA 20 ($120.35) and SMA 50 ($120.36), indicating robust short-term upward momentum. The MACD shows a bullish crossover with a positive histogram (0.004), a highly reliable indicator in trending crypto markets. Critically, volume is extraordinarily high (34531.50x average), confirming strong conviction behind the current bullish move. While RSI is neutral (54.5), both Stochastic K (4.3) and Williams %R (-95.7) are deeply oversold. In crypto, these extreme oversold conditions, especially within a bullish trend, often signal a temporary dip preceding further upward movement, aligning with the AI's reasoning of ""potential for further upward movement from a low point."" The AI itself confirms a ""BULLISH"" trend with ""HIGH"" confidence and ""LOW"" risk. Although 1-hour data is unavailable, the combined strength and alignment of multiple short-term indicators, coupled with the AI's high confidence, provides a strong basis for a BUY action to capitalize on expected further upside. The current position is profitable, but the technicals suggest holding and adding for greater returns rather than taking minimal profit.",10.0,HIGH,BULLISH,HIGH,LOW,54.54545454545455,120.354,120.3576,0.003768107109906141,0.0997506234414003,34531.50386822978,AGGRESSIVE
2025-08-21T10:07:09.646806,session_20250821_100538_9517,1,BCHUSD,577.66,0.5213359999999999,-0.0,0.0,HOLD,HIGH,"The existing position for BCHUSD is currently unprofitable with a Net P&L of $-0.01 after accounting for fees, triggering the mandatory ""❌ UNPROFITABLE to sell"" rule. This situation dictates that the position MUST be held, as it does not meet the criteria for a profitable sell and is not at a stop-loss level (0% loss from purchase price, not 2%+). From a technical standpoint for potential new trades, the analysis presents mixed and largely inconclusive signals. While the price is above key moving averages (SMA 20 and SMA 50) and shows a positive daily change (+0.37%), indicating some short-term bullish momentum, critical indicators such as MACD, Williams %R, Stochastic K, ATR, and 20-day Volatility are either zero or unavailable, limiting comprehensive trend assessment. The RSI is neutral at 50.0. The AI trend analysis, despite identifying a ""BULLISH"" trend, assigns ""LOW Confidence"" and ""HIGH Risk,"" specifically citing the ""lack of conclusive signals from numerous advanced indicators"" and a potentially ""weak trend,"" which aligns with the missing data. Given the aggressive trading mode prioritizes momentum and clear signals, the current technical setup is not strong enough to initiate new buy positions due to significant data gaps and low confidence. Therefore, the primary action is to HOLD the current unprofitable position as per critical trading rules.",3.0,HIGH,BULLISH,LOW,HIGH,50.0,575.53,575.53,0.0,0.37009365280697715,5000000.0,AGGRESSIVE
2025-08-21T10:07:09.646818,session_20250821_100538_9517,1,ZECUSD,38.47,1.300714,0.0,0.0,HOLD,MEDIUM,"The current position is unprofitable to sell (Net P&L: $-0.01), which, according to critical fee-aware sell rules, mandates a HOLD unless a 2%+ stop-loss is triggered. No such stop-loss event has occurred. While the AI trend analysis indicates a BULLISH trend with high current volume, this is contradicted by the assessment of being ""overbought,"" having ""weak trend strength,"" and exhibiting extremely low indicated volatility (ATR and 20-day Volatility at 0.000). The 5-minute technical indicators, including RSI at 50.0 and flat MACD values, do not provide a strong enough BUY signal (technical score 3, below the aggressive 4+ threshold). Furthermore, the absence of 1-hour timeframe data prevents crucial medium-term trend confirmation. Therefore, holding is the prudent action to await clearer, stronger bullish conviction or for the existing position to become profitable, aligning with risk management and profitability constraints.",3.0,MEDIUM,BULLISH,MEDIUM,MEDIUM,50.0,38.42,38.42,5.716617771091892e-20,0.13014055179593223,5000000.0,AGGRESSIVE
2025-08-21T10:07:09.646831,session_20250821_100538_9517,1,BATUSD,0.1529,327.011118,0.0,0.0,HOLD,HIGH,"The current position is unprofitable to sell ($0.00 Gross P&L, -$0.01 Net P&L after fees), triggering the mandatory ""CRITICAL FEE-AWARE SELL RULE"" which dictates that positions should not be sold at a loss unless a stop-loss is triggered (no stop-loss condition met here). All available 5-minute technical indicators (RSI 50.0, MACD 0.000, SMAs at current price) and volatility metrics (ATR 0.000, 20-day Volatility 0.000) show extreme market stagnation and zero price movement. The AI Trend Analysis confirms a NEUTRAL trend with HIGH confidence due to complete lack of directional bias. There is no 1-hour data available for trend confirmation, and no news sentiment to influence the decision. Given the complete lack of momentum, volatility, or clear technical signals for either a BUY or SELL, coupled with the unprofitable state of the current position, HOLD is the only viable action.",5.0,HIGH,NEUTRAL,HIGH,LOW,50.0,0.1529,0.1529,4.930380657631324e-32,0.0,5000000.0,AGGRESSIVE
2025-08-21T10:07:09.646845,session_20250821_100538_9517,1,OXTUSD,0.06989,0.0,0.0,0.0,HOLD,LOW,"The price of OXTUSD is completely stagnant at $0.07 with 0.00% daily change and zero volatility as indicated by ATR and 20-day Volatility being 0. All 5-minute timeframe technical indicators are perfectly neutral: RSI is at 50, MACD lines and histogram are flat at 0, and SMA 20 and SMA 50 both converge at the current price. While current volume is 5,000,000, the Volume MA is 0 and there is no corresponding price movement, making volume analysis unreliable for directional cues. The AI Trend Analysis confirms a ""NEUTRAL"" trend with ""HIGH"" confidence, citing the complete lack of discernible movement or signals. There is no 1-hour data available to assess a medium-term trend. In AGGRESSIVE TRADING MODE, we require strong technical signals (score 4+ for BUY, 6- for SELL) and momentum, none of which are present. This asset exhibits no actionable trend or volatility for aggressive trading, leading to a decision to hold and await clearer signals.",5.0,HIGH,NEUTRAL,HIGH,LOW,50.0,0.06989,0.06989,0.0,0.0,5000000.0,AGGRESSIVE
