Timestamp,Session_ID,Cycle_Number,Symbol,Current_Price,Position,Unrealized_PnL,Portfolio_Allocation_Pct,AI_Action,AI_Priority,AI_Reasoning,Technical_Score,AI_Confidence,AI_Trend,Trend_Confidence,Risk_Level,RSI,SMA_20,SMA_50,MACD_Histogram,Daily_Change_Pct,Volume_Ratio,Strategy_Mode
2025-08-21T23:27:29.785030,session_20250821_220904_4013,12,BTCUSD,107700.02,0.0,0.0,0.0,SELL,HIGH,"Operating in AGGRESSIVE TRADING MODE, the current technical analysis indicates a strong bearish tilt despite some short-term bullish momentum from MACD. While MACD Line (7.102) is above its Signal (2.864) with a positive Histogram (4.237), and Stochastic K (80.0) and Williams %R (-20.0) show recent strong buying pressure leading to overbought conditions, these bullish tendencies are significantly countered. The price ($107700.02) is below both the 5-minute SMA 20 ($107775.49) and SMA 50 ($107771.18), indicating short-term weakness. Crucially, the AI Trend Analysis explicitly highlights ""significant bearish signals from high volume accompanying negative price movement and negative OBV confirmation."" The extremely high Current Volume (78,278,514) on a negative Daily Change (-0.10%) confirms this bearish price action with strong conviction. The overbought short-term indicators (Stochastics, Williams %R) also suggest a potential pullback, making a long entry risky. With no 1-hour data available, we rely solely on the 5-minute analysis and the AI's NEUTRAL trend with MEDIUM confidence, which leans bearish due to volume. Given the priority on momentum and volume indicators in aggressive mode, and the prominent bearish volume action overriding some bullish momentum, a SELL (short) recommendation is the decisive action to maximize profit.",-3.0,MEDIUM,NEUTRAL,MEDIUM,MEDIUM,55.55578457035666,107775.4895,107771.17620000002,4.237492944179177,-0.10000201284080912,31068440.190924514,AGGRESSIVE
2025-08-21T23:27:29.785058,session_20250821_220904_4013,12,ETHUSD,2485.41,0.023158999999999996,0.0076,0.0,HOLD,MEDIUM,"The existing position is currently unprofitable to sell, as per mandatory rules (Net P&L After Fees: $-0.00). While aggressive trading mode emphasizes decisive action and maximizing profit, the ""CRITICAL FEE-AWARE SELL RULES"" mandate holding an unprofitable position unless a stop-loss is triggered. For new positions, the 5-minute technical analysis presents conflicting signals: Bullish factors include a positive daily change (+0.20%) and a bullish SMA 20 ($2481.93) above SMA 50 ($2481.88), alongside extremely high volume. However, momentum indicators strongly suggest a short-term pullback with Williams %R (-20.1) and Stochastic K (79.9) indicating significantly overbought conditions, and MACD showing a bearish crossover, which is more reliable in crypto's trending markets. The AI Trend Analysis is NEUTRAL with MEDIUM confidence, explicitly citing the overbought conditions and bearish MACD crossover as reasons for a potential near-term correction or consolidation. The absence of 1-hour timeframe data prevents medium-term trend confirmation, reducing confidence for new aggressive entries. Given the mandatory HOLD for the existing position, the mixed overall technical signals (despite bearish short-term momentum), and the neutral AI trend, the most appropriate action is to HOLD.",2.0,MEDIUM,NEUTRAL,MEDIUM,MEDIUM,54.542124542124625,2481.9285,2481.879,-0.03996889984917164,0.20036767670251246,705959.5736201582,AGGRESSIVE
2025-08-21T23:27:29.785072,session_20250821_220904_4013,12,LINKUSD,18.82231,0.0,0.0,0.0,BUY,MEDIUM,"The AI Trend Analysis indicates a ""WEAK_BULLISH"" trend with low confidence, citing 2 bullish signals against 1 bearish signal, leading to an inferred technical score of 6. Following the AGGRESSIVE TRADING MODE, a technical score of 4+ is actionable for BUY. While the 5-minute timeframe data shows extreme market stagnation with zero price movement, zero volatility (ATR 0.000, 20-day Volatility 0.000), and neutral indicators (RSI 50.0, MACD 0.000, SMAs equal to current price), the system's explicit bullish lean triggers an aggressive entry. Current volume is exceptionally high (5,000,000) relative to its MA, which is unusual for static price action and suggests an underlying dynamic that the AI's internal model is interpreting as bullish, despite the apparent lack of momentum. No 1-hour data is available for medium-term trend confirmation, and no news sentiment data is present. With no current position, this is an entry to maximize profit under an aggressive strategy.",6.0,LOW,BULLISH,LOW,MEDIUM,50.0,18.82231,18.82231,1.8932661725304283e-29,0.0,5000000.0,AGGRESSIVE
2025-08-21T23:27:29.785088,session_20250821_220904_4013,12,LTCUSD,120.42,0.013244999999999618,0.0012,0.0,BUY,HIGH,"LTCUSD exhibits strong bullish momentum indicators on the 5-minute timeframe, aligning with the aggressive trading mode. The price is trading above both the SMA 20 ($120.35) and SMA 50 ($120.36), confirming a short-term uptrend. A bullish MACD crossover is evident with the MACD line (-0.010) above its signal line (-0.013) and a positive MACD Histogram (0.003). Crucially, volume is extraordinarily high with a Volume Ratio of 34535.39x average, providing robust confirmation of the current price action and strong buying interest. Momentum oscillators Williams %R (-95.8) and Stochastic K (4.2) are deeply in oversold territory, suggesting a high probability of an upward bounce. The AI Trend analysis confirms a BULLISH trend with Medium confidence. While no 1-hour data or news is available, the confluence of bullish technicals, high volume, and oversold momentum indicators presents a strong aggressive BUY opportunity. The existing position is currently unprofitable to sell per fee-aware rules, but the strong BUY signal warrants adding to the position to capitalize on expected appreciation and potentially bring the overall position into profitability.",8.0,HIGH,BULLISH,MEDIUM,MEDIUM,50.0,120.348,120.35519999999998,0.0027010741489103193,0.0997506234414003,34535.394433292815,AGGRESSIVE
2025-08-21T23:27:29.785118,session_20250821_220904_4013,12,BCHUSD,577.66,0.5213359999999999,-0.0,0.0,HOLD,MEDIUM,"The current position is unprofitable to sell due to the $0.01 round-trip trading fee, as indicated by the Net P&L of $-0.01. According to mandatory rules, an unprofitable position must be held unless a 2%+ stop-loss is triggered, which is not the case here. For new trades, while the 5-minute chart shows bullish signs with price above SMAs and extremely high volume (5,000,000x average), the AI trend analysis indicates ""weak bullish momentum"" and warns of an ""overbought condition"" with a ""potential for a short-term correction."" Furthermore, crucial 1-hour timeframe data is unavailable, preventing a confirmation of the medium-term trend and reducing overall confidence for aggressive directional trades, especially given the instruction to weight 1-hour trends more heavily. The conflicting signals and absence of a confirmed medium-term trend, despite aggressive mode, do not provide a strong enough conviction for a new BUY, bringing the technical score below the actionable threshold when factoring in these critical caveats. Therefore, the optimal action is to HOLD the existing position and await clearer, less conflicting signals and the resolution of the potential correction.",5.0,MEDIUM,BULLISH,MEDIUM,MEDIUM,50.0,575.53,575.53,0.0,0.37009365280697715,5000000.0,AGGRESSIVE
2025-08-21T23:27:29.785126,session_20250821_220904_4013,12,ZECUSD,38.47,1.300714,0.0,0.0,HOLD,HIGH,"The current position is UNPROFITABLE to sell with a Net P&L of $-0.01 after fees. Per mandatory Fee-Aware Sell Rule #4, I MUST recommend HOLD as no stop-loss trigger (2%+ loss) is met. Furthermore, for considering any new trade, the technical signals are mixed and lack conviction for aggressive action. While the AI trend analysis indicates ""BULLISH"" movement with price above SMAs and high current volume, this is contradicted by the AI's ""LOW"" confidence and explicit warning that the asset is ""overbought (above the upper Bollinger Band),"" suggesting a potential near-term correction. Core momentum indicators like RSI (50.0) and MACD (0.000) are neutral, and volatility metrics (ATR, 20-day Volatility) are 0.000, indicating a lack of clear price movement suitable for aggressive trading. Crucially, the absence of 1-hour timeframe data prevents proper trend confirmation, which is a major constraint.",2.0,LOW,BULLISH,LOW,HIGH,50.0,38.42,38.42,8.293880102760746e-11,0.13014055179593223,5000000.0,AGGRESSIVE
2025-08-21T23:27:29.785133,session_20250821_220904_4013,12,BATUSD,0.1529,327.011118,0.0,0.0,HOLD,LOW,"The market for BATUSD is exhibiting extreme consolidation with a completely stagnant price at $0.15. All technical indicators, including RSI (50.0), MACD (0.000), and SMAs (converging at $0.15), show no momentum or trend, indicating extreme neutrality. Volatility (ATR, 20-day Volatility) is zero, reinforcing the lack of price movement. The AI trend analysis confirms a NEUTRAL trend with HIGH confidence due to this lack of movement and zero discernible momentum. While current volume is 5,000,000 (a large value relative to a Volume MA of 0), this is not translating into any price action, suggesting either a data anomaly or deep market illiquidity/stagnation where volume does not imply movement. Given the ""AGGRESSIVE TRADING MODE,"" decisive action requires clear technical signals (score 4+ for BUY, 6- for SELL), which are entirely absent here. Entering or exiting in such a stagnant market, especially with a $0.01 trading fee per side, would be speculative and lack a clear edge for profit maximization. Furthermore, my current position in BATUSD (327.011118 shares @ $0.15) is explicitly flagged as ""❌ UNPROFITABLE to sell"" with a net P&L of $-0.01 after accounting for the $0.01 round-trip fee. According to mandatory fee-aware sell rules, I MUST recommend HOLD for an unprofitable position unless a 2%+ stop-loss is triggered, which is not the case here. No news sentiment is available to influence this decision.",0.0,HIGH,NEUTRAL,HIGH,MEDIUM,50.0,0.1529,0.1529,4.930380657631324e-32,0.0,5000000.0,AGGRESSIVE
2025-08-21T23:27:29.785141,session_20250821_220904_4013,12,OXTUSD,0.06989,0.0,0.0,0.0,HOLD,LOW,"All available 5-minute technical indicators (RSI 50, MACD 0, price at SMAs) show extreme neutrality, indicating a perfectly flat market with zero price movement. Volatility indicators (ATR 0.000, 20-day Volatility 0.000) confirm a complete lack of price action. The AI Trend Analysis also indicates a 'NEUTRAL' trend with 'HIGH' confidence, citing extreme consolidation. With no 1-hour data for trend confirmation and an absence of any momentum or volatility, there is no actionable signal for either a BUY or a SELL, despite the aggressive trading mode's focus on momentum. Entering a trade in a market with no movement is not conducive to maximizing profit.",1.0,HIGH,NEUTRAL,HIGH,LOW,50.0,0.06989,0.06989,0.0,0.0,5000000.0,AGGRESSIVE
