Timestamp,Session_ID,Cycle_Number,Symbol,Current_Price,Position,Unrealized_PnL,Portfolio_Allocation_Pct,AI_Action,AI_Priority,AI_Reasoning,Technical_Score,AI_Confidence,AI_Trend,Trend_Confidence,Risk_Level,RSI,SMA_20,SMA_50,MACD_Histogram,Daily_Change_Pct,Volume_Ratio,Strategy_Mode
2025-08-18T14:37:28.131347,session_20250818_134834_3361,5,AAPL,231.19,0,0.0,0.0,HOLD,LOW,"The technical analysis for AAPL presents a very strong bullish signal with a perfect 10/10 technical score. The price is trading above all key moving averages (SMA 20, SMA 50, EMA 12, EMA 26), indicating a clear upward trend. A bullish MACD crossover is confirmed with a positive MACD histogram, and the OBV is positive, all supporting accumulation and strong momentum. The AI Trend Analysis also confirms a HIGH confidence BULLISH trend. No news data is available, so there is no negative sentiment to contradict a BUY signal. However, despite these compelling technical indicators, a BUY action is not possible due to portfolio constraints. The current price of AAPL ($231.19) exceeds the available cash ($132.94), making it impossible to purchase even 1 share while maintaining the minimum cash reserve or simply having sufficient funds. Therefore, the recommendation is to HOLD the current 0 shares, as a trade cannot be executed at this time.",5.0,HIGH,BULLISH,HIGH,MEDIUM,58.26086956521746,231.0435,230.86780000000002,0.015220372327891557,0.01297802387956443,-1.0,BALANCED
2025-08-18T14:37:28.131373,session_20250818_134834_3361,5,XOM,0.0,0,0.0,0.0,HOLD,LOW,No valid market data available,0.0,LOW,NEUTRAL,LOW,HIGH,50.0,0.0,0.0,0.0,0.0,0.0,BALANCED
2025-08-18T14:37:28.131382,session_20250818_134834_3361,5,META,766.93,0,0.0,0.0,HOLD,LOW,"While META exhibits strong bullish technical indicators, including its current price being consistently above key moving averages (SMA 20, SMA 50, EMA 12, EMA 26), a clear bullish MACD crossover (MACD Line > MACD Signal with positive histogram), and a high-confidence BULLISH AI trend analysis, the available cash ($132.94) is insufficient to purchase a single share at the current market price of $766.93. Therefore, no trade can be executed at this time, resulting in a HOLD decision despite strong technical BUY signals.",9.0,HIGH,BULLISH,HIGH,MEDIUM,58.243451463789945,766.4114999999999,765.8314000000001,0.12975004803962847,-0.002607731925170545,-1.0,BALANCED
2025-08-18T14:37:28.131390,session_20250818_134834_3361,5,AMZN,230.81,2,-1.219158899999968,48.113482865004585,HOLD,LOW,"Comprehensive technical analysis for AMZN indicates a strong bullish trend with a technical score of 7. Multiple confirming indicators, including a bullish MACD crossover, price trading above all key moving averages (SMA 20, SMA 50, EMA 12, EMA 26), and a bullish Stochastic K over D signal upward momentum. The price is also positioned well within the upper half of the Bollinger Bands. The AI trend analysis confirms a BULLISH trend with medium confidence. No news sentiment is available to alter this technical outlook. However, despite the strong technical BUY signal, a purchase cannot be executed at this time due to insufficient available cash ($132.94) to cover the current price of one share ($230.81) while maintaining the minimum cash reserve ($100). Therefore, the recommended action is to HOLD the current position until sufficient funds are available or technical conditions change.",7.0,MEDIUM,BULLISH,MEDIUM,MEDIUM,52.94117647058823,230.60299999999998,230.4196,0.003361948045478416,0.09106678230702861,-1.0,BALANCED
2025-08-18T14:37:28.131397,session_20250818_134834_3361,5,NFLX,1242.86,0,0.0,0.0,HOLD,LOW,"Due to current portfolio constraints, specifically insufficient available cash ($132.94) to purchase 1 share of NFLX at $1242.86, no trade can be executed. Furthermore, even if funds were available, the stock exhibits significant overbought conditions across RSI (76.4), Williams %R (-13.3), and Stochastic (86.7, 91.8), signaling a high probability of a near-term pullback. The AI trend analysis confirms a BEARISH trend with MEDIUM confidence and HIGH risk, advising against initiating a BUY position in line with the Balanced Trading Mode's emphasis on capital preservation and avoiding high volatility periods. There is no news sentiment available to influence the decision.",3.0,HIGH,BEARISH,MEDIUM,HIGH,76.35983263598197,1240.5679999999998,1242.1302,0.4210087218920376,-0.028152926697833546,-1.0,BALANCED
2025-08-18T14:37:28.131404,session_20250818_134834_3361,5,MSFT,516.2,0,0.0,0.0,HOLD,LOW,"MSFT exhibits strong bullish technical indicators suitable for a BUY, including a bullish MACD crossover (MACD Line -0.252 > MACD Signal -0.387), a positive MACD Histogram (0.134), and price trading above the SMA 20 ($515.88), EMA 12 ($515.92), EMA 26 ($516.17), and the Bollinger Band Middle ($515.88). The AI trend analysis confirms a HIGH confidence BULLISH trend, further strengthening the BUY signal. These multiple confirming indicators result in a high technical score of 7, which meets the requirement for a high-priority BUY under the balanced trading mode. Volatility is low, aligning with the strategy's preference to avoid high volatility periods. No news sentiment data is available to influence the decision. However, despite the strong technical alignment for a BUY, the current available cash ($132.94) is insufficient to purchase 1 share of MSFT at the current price ($516.20). Therefore, a BUY order cannot be executed at this time.",7.0,HIGH,BULLISH,HIGH,LOW,52.53456221198193,515.88,516.6208,0.13422237030506834,0.021314111879713545,-1.0,BALANCED
2025-08-18T14:37:28.131411,session_20250818_134834_3361,5,NVDA,181.91,0,-0.715029450000003,18.96001834403402,SELL,HIGH,"NVDA is currently in an extremely overbought condition, as indicated by multiple confirming technical indicators including RSI (72.0), Bollinger Bands (price above upper band), Williams %R (-9.3), Stochastic K (90.7), and Stochastic D (93.5). The AI Trend Analysis explicitly identifies a BEARISH trend with HIGH risk, citing these overbought conditions and predicting a probable short-term pullback. While MACD and Moving Averages show minor bullishness, they are heavily outweighed by the strong and consistent overbought signals. According to the BALANCED TRADING MODE, a technical score of 4- or less mandates a high-priority SELL, and the multitude of strong bearish indicators aligns perfectly with this criterion. Selling the current 1 share position aligns with capital preservation, reduces exposure to a high-risk overbought asset, and realizes a small profit from the last buy.",2.0,HIGH,BEARISH,MEDIUM,HIGH,71.96969696969649,181.44199999999998,181.4818,0.05484425352012288,0.08252640845070736,-1.0,BALANCED
2025-08-18T14:37:28.131418,session_20250818_134834_3361,5,TSLA,334.45,0,0.0,0.0,HOLD,LOW,"The primary reason for a HOLD decision is insufficient available cash. With only $32.94 available after accounting for the minimum cash reserve, it is not possible to purchase 1 share of TSLA at $334.45. Furthermore, even if funds were available, the technical indicators present a conflicting picture, failing to meet the requirement for strong technical alignment and multiple confirming indicators for a high-priority BUY. While the price is above key short and medium-term moving averages (SMA 20, 50, EMA 12, 26), the MACD histogram is negative, and the MACD line is below its signal line, indicating bearish momentum. The AI trend analysis, despite identifying a ""BULLISH"" trend, notes ""LOW"" confidence due to it being ""largely countered by bearish momentum indicators"" and a ""weak, consolidating trend."" The absence of valid volume data further reduces confidence in any directional move. Given the mixed signals and the critical cash constraint, no actionable trade is advised.",4.0,LOW,BULLISH,LOW,MEDIUM,52.50596658711193,334.39250000000004,333.9004,-0.08944957714751814,0.05983545250560617,-1.0,BALANCED
2025-08-18T14:37:28.131425,session_20250818_134834_3361,5,JPM,0.0,0,0.0,0.0,HOLD,LOW,No valid market data available,0.0,LOW,NEUTRAL,LOW,HIGH,50.0,0.0,0.0,0.0,0.0,0.0,BALANCED
2025-08-18T14:37:28.131432,session_20250818_134834_3361,5,ADBE,356.67,0,0.0,0.0,HOLD,LOW,"The primary reason for a HOLD decision is the portfolio's available cash ($132.94), which is insufficient to purchase 1 share of ADBE at its current price of $356.67, thus preventing any BUY action. Furthermore, even if funds were available, the technical analysis presents a mixed picture that does not meet the stringent requirements of the Balanced Trading Mode for a high-priority BUY. While momentum indicators (Williams %R, Stochastic) are strongly oversold, suggesting a potential short-term bounce, the AI trend analysis is BEARISH, supported by the MACD histogram being negative, a bearish MACD crossover, and the price trading below key short-term moving averages (SMA 20, EMA 12, EMA 26). This conflicting technical alignment, with a prevailing bearish trend despite oversold conditions, lacks the ""multiple confirming indicators"" and ""strong technical alignment"" required for a BUY. No news data is available, so news sentiment does not influence the decision.",4.0,HIGH,BEARISH,MEDIUM,MEDIUM,36.72316384180844,357.108,356.531,-0.0988747009795313,-0.07564296520423092,-1.0,BALANCED
