Timestamp,Session_ID,Cycle_Number,Symbol,Current_Price,Position,Unrealized_PnL,Portfolio_Allocation_Pct,AI_Action,AI_Priority,AI_Reasoning,Technical_Score,AI_Confidence,AI_Trend,Trend_Confidence,Risk_Level,RSI,SMA_20,SMA_50,MACD_Histogram,Daily_Change_Pct,Volume_Ratio,Strategy_Mode
2025-08-22T14:21:29.408206,session_20250822_131922_2405,9,BTCUSD,107915.65,0.00046518,0.2002,0.0,SELL,HIGH,"Operating in aggressive trading mode, the current BTCUSD position is profitable, making a sell action permissible. While there's underlying bullish momentum (price above SMAs, bullish MACD, high volume), the 5-minute timeframe shows strong indicators of an imminent short-term correction. Both Stochastic K (82.6) and Williams %R (-17.4) are deep in overbought territory, which are strong reversal signals in crypto. Crucially, the AI Trend Analysis explicitly states ""extreme overbought conditions"" and predicts ""a high probability of an imminent short-term correction,"" advising ""immediate bearish pressure."" The exceptionally high volume ratio, when combined with these overbought signals, could indicate a climactic top. To maximize profit by securing gains and anticipating a short-term pullback, an immediate sell is warranted.",6.0,HIGH,NEUTRAL,MEDIUM,HIGH,60.0,107748.5345,107756.08140000001,2.3698689893798583,0.20021351899469478,24473994.596973177,AGGRESSIVE
2025-08-22T14:21:29.408233,session_20250822_131922_2405,9,ETHUSD,2480.44,0.040276,-0.0999,0.0,HOLD,HIGH,"The current ETHUSD position has a Net P&L of $-0.11, making it ❌ UNPROFITABLE to sell according to the CRITICAL FEE-AWARE SELL RULES (Rule #4). Therefore, it is mandatory to HOLD the existing shares, as a sell would incur a net loss after fees. From a technical perspective on the 5-minute timeframe, while the MACD shows a bullish cross indicating some positive short-term momentum, price is below key SMA 20 and SMA 50. Furthermore, critical momentum oscillators like Williams %R (-0.1) and Stochastic K (99.9) are in extremely overbought territory. This combination, despite the MACD, strongly suggests an imminent pullback and potential exhaustion of upward momentum, as also noted by the AI trend analysis (NEUTRAL, MEDIUM confidence, citing overbought conditions). Given these predominantly bearish reversal signals for any potential new BUY entries, and the strict mandate to not sell an unprofitable position, HOLD is the only appropriate action for the current shares.",3.0,HIGH,NEUTRAL,MEDIUM,MEDIUM,55.57046979865737,2482.4255000000003,2482.4254,0.18378498237171695,-0.09988239653311497,707034.0211539583,AGGRESSIVE
2025-08-22T14:21:29.408245,session_20250822_131922_2405,9,LINKUSD,18.82231,0.0,0.0,0.0,HOLD,LOW,"All technical indicators across the 5-minute timeframe (RSI at 50.0, MACD components at 0.000, SMAs perfectly aligned with current price) indicate absolute neutrality with no discernible trend, momentum, or price fluctuation. The ATR and 20-day Volatility are both 0.000, further confirming the complete lack of movement. While current volume is 5,000,000, it is not associated with any price change, therefore it does not signal momentum. The AI Trend Analysis explicitly states ""NEUTRAL"" trend with ""HIGH"" confidence and ""LOW"" risk, reinforcing the absence of any actionable signal. In aggressive trading mode, action is taken on clear technical signals for momentum or trend. With no such signals present and no 1-hour data available for broader trend confirmation, the most prudent action is to hold and wait for a clear directional bias to emerge, as entering a position under these conditions would be pure speculation without technical backing. No news sentiment is available.",0.0,HIGH,NEUTRAL,HIGH,LOW,50.0,18.82231,18.82231,5.524941834555236e-20,0.0,5000000.0,AGGRESSIVE
2025-08-22T14:21:29.408256,session_20250822_131922_2405,9,LTCUSD,120.42,3.7406519999999994,0.4489,0.0,BUY,HIGH,"The market for LTCUSD is displaying overwhelmingly strong bullish momentum, confirmed by the AI trend analysis with high confidence. The price is trading above key moving averages (SMA 20 and SMA 50), and the MACD line is above its signal, indicating continued upward pressure. Critically, the Volume Ratio is an astounding 34052.17x average, signifying immense buying interest and robust market strength, which, in an aggressive trading mode, overrides the extremely overbought signals from Williams %R (-0.0) and Stochastic K (100.0). These overbought conditions are often sustained longer in highly trending crypto markets with such significant volume. Given the existing profitable position, the aggressive trading mandate to maximize profit by prioritizing momentum and volume, and the calculated technical score above 4+, adding to the position is the decisive action.",7.0,HIGH,BULLISH,HIGH,MEDIUM,55.55555555555556,120.35999999999999,120.3528,0.0020868833492034087,0.0997506234414003,34052.16798889253,AGGRESSIVE
2025-08-22T14:21:29.408264,session_20250822_131922_2405,9,BCHUSD,577.66,0.259668,0.0,0.0,BUY,HIGH,"BCHUSD displays strong short-term bullish momentum. The price ($577.66) is trading above both the SMA 20 ($575.53) and SMA 50 ($575.53), indicating an upward trend. A positive daily change of +0.37% reinforces this bullish sentiment. Critically, current volume is exceptionally high (5,000,000), signaling robust buying interest and strong momentum, which is a key factor in aggressive trading. The AI Trend Analysis confirms a BULLISH trend with medium confidence, citing the price action relative to moving averages and high volume. While the 1-hour timeframe data is unavailable, forcing reliance on 5-minute analysis, the prevailing bullish signals and momentum indicators meet the criteria for an aggressive BUY action (technical score 5, actionable for 4+). The existing position's unprofitability for immediate selling (due to fees) does not negate initiating a new buy order based on current strong market signals to maximize potential returns, aligning with the aggressive trading mandate.",5.0,MEDIUM,BULLISH,MEDIUM,MEDIUM,50.0,575.53,575.53,0.0,0.37009365280697715,5000000.0,AGGRESSIVE
2025-08-22T14:21:29.408274,session_20250822_131922_2405,9,ZECUSD,38.47,1.299714,0.0,0.0,HOLD,LOW,"The current position for ZECUSD is explicitly flagged as ""❌ UNPROFITABLE to sell"" with a net P&L of $-0.01 due to trading fees. According to mandatory trading rules, a position must be held if it is unprofitable to sell and no stop-loss trigger (2%+ loss) is active. Technical indicators on the 5-minute timeframe are largely flat or show zero activity (RSI 50.0, MACD Histogram 0.000, MACD Line -0.000, MACD Signal -0.000, ATR 0.000, 20-day Volatility 0.000), suggesting extreme stagnation or unreliable data, despite a high current volume (4,576,274). The absence of 1-hour data prevents a comprehensive dual-timeframe analysis for trend confirmation. The AI trend analysis indicates ""BULLISH"" but with ""LOW Confidence"" and ""HIGH Risk"" due to unreliable data. Without clear bullish momentum or profitability to exit, and with no news sentiment to influence the decision, holding is the only permissible action.",3.0,LOW,BULLISH,LOW,HIGH,50.0,38.42,38.42,7.31947222631747e-05,0.13014055179593223,4576273.5,AGGRESSIVE
2025-08-22T14:21:29.408283,session_20250822_131922_2405,9,BATUSD,0.1529,327.011118,0.0,0.0,HOLD,MEDIUM,"The current position is unprofitable to sell (Net P&L $-0.01), triggering mandatory fee-aware sell rule #4, which dictates a HOLD unless a 2%+ stop-loss is activated, which it is not. Furthermore, the market exhibits extreme flatness across all 5-minute technical indicators (RSI 50.0, flat MACD, price exactly on SMAs, zero ATR, zero 20-day Volatility). The AI trend analysis confirms a NEUTRAL trend with HIGH confidence, citing ""no discernible movement or trend."" Despite high current volume, the absence of any price action or volatility means there are no technical signals (neither a BUY score 4+ nor a SELL score 6-) to justify an aggressive entry or exit. Aggressive trading requires momentum, which is entirely absent here. Therefore, the optimal strategy is to hold the existing position and await clearer directional signals before considering new trades.",1.0,HIGH,NEUTRAL,HIGH,MEDIUM,50.0,0.1529,0.1529,1.534963032892296e-19,0.0,5000000.0,AGGRESSIVE
2025-08-22T14:21:29.408303,session_20250822_131922_2405,9,OXTUSD,0.06989,0.0,0.0,0.0,HOLD,LOW,"The aggressive trading mode requires decisive action based on strong technical signals and momentum. OXTUSD on the 5-minute timeframe shows a completely neutral market with 0.00% daily change, zero MACD, RSI at a balanced 50.0, and price perfectly aligned with SMAs. Volume is present (5,000,000) but without any resulting price movement or volatility (ATR and 20-day Volatility are 0.000). There is no 1-hour data available to confirm a medium-term trend. The AI trend analysis explicitly confirms a ""NEUTRAL"" trend with ""HIGH"" confidence. All indicators point to extreme flatness and a complete lack of any discernible bullish or bearish momentum/trend. Since there are no actionable signals (neither technical score 4+ for BUY nor 6- for SELL based on negative momentum), and no news to influence, the most prudent action even for an aggressive trader is to HOLD (i.e., refrain from entering a position) and await clear market direction.",5.0,HIGH,NEUTRAL,HIGH,MEDIUM,50.0,0.06989,0.06989,0.0,0.0,5000000.0,AGGRESSIVE
