Timestamp,Session_ID,Cycle_Number,Symbol,Current_Price,Position,Unrealized_PnL,Portfolio_Allocation_Pct,AI_Action,AI_Priority,AI_Reasoning,Technical_Score,AI_Confidence,AI_Trend,Trend_Confidence,Risk_Level,RSI,SMA_20,SMA_50,MACD_Histogram,Daily_Change_Pct,Volume_Ratio,Strategy_Mode
2025-08-18T13:49:44.999906,session_20250818_134834_3361,1,AAPL,230.98,0,0.0,0.0,HOLD,HIGH,"A BUY action is strictly prohibited due to insufficient available cash ($132.94) to maintain the minimum cash reserve ($100) after purchasing 1 share at $230.98. Furthermore, while MACD and certain EMAs show bullish momentum, the RSI (70.8) indicates significant overbought conditions. The AI trend analysis also confirms a NEUTRAL trend with a MEDIUM confidence, explicitly noting ""strong overbought conditions on oscillators (RSI, DeMarker), suggesting an impending pullback or continued sideways movement."" This combination of conflicting signals, with a strong warning from overbought conditions, does not constitute ""strong technical alignment"" required for a high-priority BUY. Given zero current shares, a SELL action is not applicable. Therefore, HOLD is the only viable and prudent action.",4.0,HIGH,NEUTRAL,MEDIUM,MEDIUM,70.77922077922005,230.7745,231.0296,0.06393231621612824,-0.02164221096827744,-1.0,BALANCED
2025-08-18T13:49:44.999934,session_20250818_134834_3361,1,XOM,0.0,0,0.0,0.0,HOLD,LOW,No valid market data available,0.0,LOW,NEUTRAL,LOW,HIGH,50.0,0.0,0.0,0.0,0.0,0.0,BALANCED
2025-08-18T13:49:44.999946,session_20250818_134834_3361,1,META,766.31,0,0.0,0.0,HOLD,LOW,"A BUY order for META at its current price of $766.31 is not possible as the available cash ($132.94) is insufficient to purchase even 1 share, violating portfolio constraints. Despite generally positive technical indicators (bullish MACD crossover, price above SMA 20 and SMA 50, and a High Confidence BULLISH AI trend analysis), the trade cannot be executed. Capital preservation rules in BALANCED TRADING MODE prevent attempting trades beyond available funds.",7.0,HIGH,BULLISH,HIGH,MEDIUM,55.77299412915808,765.8720000000001,765.15,0.28042613420726087,-0.08475018253886656,-1.0,BALANCED
2025-08-18T13:49:44.999957,session_20250818_134834_3361,1,AMZN,230.55,2,-1.7791588999999703,48.13654870028187,HOLD,MEDIUM,"AMZN displays robust bullish technical indicators, with the current price ($230.55) positioned above the SMA 20 ($230.41) and SMA 50 ($230.19), confirming an uptrend. The MACD signals sustained positive momentum with a bullish alignment. The RSI at 60.6 indicates strong but not overbought conditions, and the price remains comfortably within the Bollinger Bands, above the middle band. The AI Trend analysis strongly corroborates a ""BULLISH"" trend with ""HIGH"" confidence. Volatility is low, aligning with the balanced trading mode's preference to avoid high volatility periods. Based on this strong technical alignment (Technical Score 9), a SELL action is not warranted as per the strategy's requirement for a score of 4- or less for high-priority sells. Furthermore, a BUY action is not feasible due to insufficient available cash ($132.94) which is below the current share price of AMZN ($230.55), making it impossible to execute a trade while maintaining the minimum cash reserve. With no news data available, the decision relies solely on the compelling technical analysis. Therefore, the optimal action is to HOLD the current 2 shares.",9.0,HIGH,BULLISH,HIGH,MEDIUM,60.60606060606121,230.40900000000002,230.188,0.021498259356628135,-0.013010668748374159,-1.0,BALANCED
2025-08-18T13:49:44.999967,session_20250818_134834_3361,1,NFLX,1240.05,0,0.0,0.0,HOLD,LOW,"Due to cash constraints ($132.94 available cash vs. NFLX price of $1240.05) and the requirement to maintain a $100 cash reserve, purchasing 1 share of NFLX is not possible. Additionally, no shares of NFLX are currently held, so a sell action is not possible.",5.0,LOW,BEARISH,MEDIUM,HIGH,47.60348583877961,1240.267,1242.0485999999999,0.15864611117606608,-0.019350313233196196,-1.0,BALANCED
2025-08-18T13:49:44.999978,session_20250818_134834_3361,1,MSFT,515.39,0,0.0,0.0,HOLD,LOW,"Current available cash ($132.94) is insufficient to purchase 1 share of MSFT ($515.39), making a BUY order not feasible under current portfolio constraints ($100 minimum cash reserve also applies). We currently hold 0 shares, so a SELL order is also not possible. From a technical perspective, MSFT is exhibiting strong oversold conditions (RSI 24.1, Williams %R -94.8, Stochastic K 5.2 / D 4.4) coupled with a bullish MACD crossover (Histogram 0.006), indicating potential for a short-term upward rebound. The price is also near the lower Bollinger Band. While these indicators suggest a potential BUY opportunity (technical score 6), the immediate financial constraint overrides any trade action. No news data is available, so it does not influence the decision.",6.0,LOW,BULLISH,MEDIUM,MEDIUM,24.1007194244592,516.341,517.2934,0.005951986082872507,0.0,-1.0,BALANCED
2025-08-18T13:49:44.999986,session_20250818_134834_3361,1,NVDA,181.35,1,-1.2750294500000052,18.932038834951456,HOLD,LOW,"The technical analysis for NVDA indicates a strong state of indecision and a neutral trend. The AI trend analysis explicitly states ""NEUTRAL"" with ""LOW confidence"" due to ""conflicting signals from bearish moving average crosses versus bullish MACD and Parabolic SAR"" and ""inconclusive volume data."" While MACD shows a slight bullish cross and Stochastic K is above D, these signals are weak and largely offset by the price trading below key moving averages (SMA 20, SMA 50, EMA 26). The overall technical score of 5 reflects this neutrality, failing to meet the ""6+"" threshold for a high-priority BUY or the ""4-"" threshold for a high-priority SELL in Balanced Trading Mode. Furthermore, available cash ($132.94) is insufficient to purchase 1 share of NVDA ($181.35), preventing any BUY action, even if the technicals were more compelling. Given the lack of strong confirming indicators, the neutral AI trend, and the financial constraint, holding the current position is the most prudent action to preserve capital and avoid trades during periods of weak technical alignment. No news data is available to influence the decision.",5.0,LOW,NEUTRAL,LOW,MEDIUM,52.5925925925924,181.38100000000003,181.6034,0.0006769487080755948,0.03861429832303242,-1.0,BALANCED
2025-08-18T13:49:44.999996,session_20250818_134834_3361,1,TSLA,334.62,0,0.0,0.0,HOLD,LOW,"A BUY order for TSLA is not feasible at this time due to insufficient available cash ($132.94) compared to the current share price ($334.62). Even if cash were available, the technical picture presents mixed signals: while the AI Trend Analysis indicates a strong BULLISH trend with HIGH confidence, supported by price trading above all key moving averages (SMA 20, SMA 50, EMA 12, EMA 26), momentum indicators such as MACD showing a bearish crossover and negative OBV suggest potential short-term weakness or a slowing of upward momentum. Under ""BALANCED TRADING MODE"", multiple confirming indicators are required for high-priority trades, and the conflicting momentum signals, despite the strong overall trend, would prevent a high-priority BUY. No news data is available, so news sentiment is a neutral factor.",6.0,HIGH,BULLISH,HIGH,MEDIUM,59.06183368869972,334.433,333.5614,-0.009657778835446995,-0.017927572606669735,-1.0,BALANCED
2025-08-18T13:49:45.000006,session_20250818_134834_3361,1,JPM,0.0,0,0.0,0.0,HOLD,LOW,No valid market data available,0.0,LOW,NEUTRAL,LOW,HIGH,50.0,0.0,0.0,0.0,0.0,0.0,BALANCED
2025-08-18T13:49:45.000016,session_20250818_134834_3361,1,ADBE,357.03,0,0.0,0.0,HOLD,LOW,"The technical analysis for ADBE presents a largely neutral picture with mixed signals. The RSI is neutral at 52.6. While EMA 12 is slightly above EMA 26, suggesting a weak bullish bias, the MACD histogram is negative, and the MACD line is below its signal, indicating weak bearish momentum. Both Williams %R and Stochastic indicators are in neutral to slightly bearish territory. The price is consolidating around its short-term moving averages and within the Bollinger Bands, confirming low volatility and no clear directional trend, as also indicated by the AI Trend Analysis (NEUTRAL, MEDIUM confidence). A technical score of 4 does not meet the ""6+"" requirement for a high-priority BUY, nor does it strongly indicate a ""4-"" for a high-priority SELL under the Balanced Trading Mode, which demands multiple confirming indicators and strong technical alignment. Furthermore, a BUY action is not possible due to insufficient available cash ($132.94) to cover the cost of 1 share ($357.03) while maintaining the $100 minimum cash reserve. Without strong confirming technical signals for either direction and the inability to execute a buy trade, a HOLD decision aligns with capital preservation and avoiding trades during periods of weak technical alignment.",4.0,MEDIUM,NEUTRAL,MEDIUM,MEDIUM,52.57731958762851,357.015,356.50199999999995,-0.030235960839834264,0.06165746475714538,-1.0,BALANCED
