Timestamp,Session_ID,Cycle_Number,Symbol,Current_Price,Position,Unrealized_PnL,Portfolio_Allocation_Pct,AI_Action,AI_Priority,AI_Reasoning,Technical_Score,AI_Confidence,AI_Trend,Trend_Confidence,Risk_Level,RSI,SMA_20,SMA_50,MACD_Histogram,Daily_Change_Pct,Volume_Ratio,Strategy_Mode
2025-08-21T23:06:28.105192,session_20250821_220904_4013,9,BTCUSD,107700.02,0.0,0.0,0.0,HOLD,LOW,"The 5-minute timeframe presents conflicting signals. While MACD shows a bearish crossover with a negative histogram and the price is below both the SMA 20 and SMA 50, indicating a weak bearish bias, this is significantly tempered by extreme market flatness (0% daily change) and overbought momentum indicators (Stochastic K at 80.0, Williams %R at -20.0). Furthermore, current volume is astronomically high relative to its moving average, suggesting significant activity, yet there's no corresponding price movement. The AI trend analysis aligns with a 'BEARISH' outlook but explicitly states 'LOW CONFIDENCE' due to these very contradictions and flatness. Given the absence of 1-hour data for trend confirmation and the overall lack of a strong, clear directional signal, especially a positive one to meet the 4+ technical score for a BUY, a decisive entry is not advisable despite the aggressive trading mode. No current position means a SELL is not possible.",3.0,LOW,BEARISH,LOW,MEDIUM,44.44421542964334,107770.098,107769.01980000001,-1.093943198542294,0.0,31257442.0403138,AGGRESSIVE
2025-08-21T23:06:28.105223,session_20250821_220904_4013,9,ETHUSD,2485.41,0.023158999999999996,0.0076,0.0,HOLD,MEDIUM,"The existing position for ETHUSD is currently unprofitable to sell due to the $0.01 round-trip trading fee, as indicated by the ""❌ UNPROFITABLE to sell"" status. Therefore, per mandatory fee-aware sell rules, the current position must be held.",5.0,LOW,NEUTRAL,MEDIUM,MEDIUM,50.0,2481.929,2481.8790000000004,-0.021682842586634946,0.20036767670251246,703039.3947531916,AGGRESSIVE
2025-08-21T23:06:28.105233,session_20250821_220904_4013,9,LINKUSD,18.82231,0.0,0.0,0.0,HOLD,LOW,"All technical indicators across the 5-minute timeframe, including RSI (50.0), MACD (0.000), and SMAs (price precisely at $18.82), show complete stagnation and perfectly neutral momentum. Volatility indicators (ATR, 20-day Volatility) are also at 0.000, confirming a lack of price movement. The AI Trend Analysis further corroborates this, identifying a NEUTRAL trend with HIGH confidence, citing zero price movement and stagnation. No 1-hour data is available for medium-term trend confirmation, and no news sentiment is present. Under AGGRESSIVE TRADING MODE, action is prioritized on momentum and clear signals (Technical Scores 4+ for BUY, 6- for SELL). With all indicators at absolute neutrality, there is no actionable signal to enter a BUY or SELL position, nor any momentum to capitalize on. Entering a stagnant market would contradict the aggressive strategy's focus on maximizing profit through decisive action based on clear directional signals.",0.0,HIGH,NEUTRAL,HIGH,MEDIUM,50.0,18.82231,18.82231,1.8932661725304283e-29,0.0,5000000.0,AGGRESSIVE
2025-08-21T23:06:28.105241,session_20250821_220904_4013,9,LTCUSD,120.42,0.013244999999999618,0.0012,0.0,BUY,HIGH,"The 5-minute timeframe for LTCUSD presents compelling bullish signals, aligning with the aggressive trading mode to maximize profit. We observe a clear bullish MACD crossover (MACD Line -0.004 is above Signal -0.008, with a positive Histogram of 0.003). The price ($120.42) is trading above both the 20-period ($120.34) and 50-period ($120.36) Simple Moving Averages, indicating strong short-term upward momentum. Critically, momentum oscillators Williams %R (-100.0) and Stochastic K (0.0) are deep in oversold territory, which in the crypto context are powerful indicators of an imminent bullish reversal. This is further amplified by an astronomical Current Volume of 32,128,810, representing a Volume Ratio of 34631.40x average, signaling massive buying interest and strong momentum, which is a key priority for aggressive trading. The AI Trend Analysis corroborates this, identifying a BULLISH trend with HIGH confidence. While 1-hour data is unavailable, the robust 5-minute technicals, combined with extreme volume and the aggressive trading mandate, provide sufficient justification for an immediate BUY. The existing position is unprofitable to sell at this moment, but this does not override the strong signals for a new or additional BUY to capitalize on the emerging bullish trend.",10.0,HIGH,BULLISH,HIGH,MEDIUM,50.0,120.34200000000001,120.35520000000001,0.003138677182922737,0.0,34631.39592885297,AGGRESSIVE
2025-08-21T23:06:28.105249,session_20250821_220904_4013,9,BCHUSD,577.66,0.5213359999999999,-0.0,0.0,HOLD,MEDIUM,"The current position of BCHUSD is at a net loss of $-0.01 after accounting for the $0.01 round-trip trading fees, making it unprofitable to sell. Therefore, according to critical fee-aware sell rules, a HOLD recommendation is mandatory to avoid a guaranteed loss. While 5-minute technicals show some bullish momentum with the price (currently $577.66) above both SMA 20 and SMA 50 ($575.53), a positive daily change of +0.37%, and extremely high volume (5,000,000 with a 5000000.00x ratio), other indicators are neutral (RSI 50.0, MACD 0.000). The AI trend analysis is bullish but with LOW confidence and warns of the asset being overbought by Bollinger Bands, suggesting a potential short-term pullback. With no 1-hour data available for medium-term trend confirmation, the overall picture is mixed. Given the aggressive trading mode, we aim for maximum profit, and selling at a guaranteed loss due to fees does not align with this objective. Holding is necessary to await price recovery and a profitable exit point.",5.0,MEDIUM,BULLISH,LOW,HIGH,50.0,575.53,575.53,0.0,0.37009365280697715,5000000.0,AGGRESSIVE
2025-08-21T23:06:28.105255,session_20250821_220904_4013,9,ZECUSD,38.47,1.300714,0.0,0.0,HOLD,MEDIUM,"The current position is ❌ UNPROFITABLE to sell (Net P&L: -$0.01) due to trading fees. According to mandatory fee-aware sell rules, a sell action is not permissible unless it's an emergency stop-loss, which is not triggered here. Analyzing the 5-minute timeframe, ZECUSD shows a slight positive daily change (+0.13%) and the price is marginally above the flat SMA 20 and SMA 50. Key momentum indicators like RSI (50.0) and MACD (0.000) are neutral, indicating no strong immediate directional bias. However, the current volume is exceptionally high (5,000,000, which is 5,000,000x the average), signaling significant market interest and potential for future movement, which aligns with aggressive trading's focus on momentum. The AI Trend Analysis identifies a ""BULLISH"" trend with medium confidence, but critically notes the price is ""above the upper Bollinger Band, indicating an overbought condition and potential for a pullback."" Without 1-hour timeframe data for trend confirmation and given the conflicting signals (high volume vs. overbought warning and neutral core indicators), coupled with the unprofitable state of the existing position, holding is the most prudent action to await clearer, profitable exit conditions or stronger confirmed bullish momentum that overcomes the overbought state.",4.0,MEDIUM,BULLISH,MEDIUM,MEDIUM,50.0,38.42,38.42,6.096567207373383e-11,0.13014055179593223,5000000.0,AGGRESSIVE
2025-08-21T23:06:28.105262,session_20250821_220904_4013,9,BATUSD,0.1529,327.011118,0.0,0.0,HOLD,LOW,"The current position is explicitly marked as ""❌ UNPROFITABLE to sell"" (Net P&L After Fees: $-0.01), which, according to mandatory critical fee-aware sell rules, requires a HOLD unless an emergency stop-loss is triggered, which is not the case here. Furthermore, all available 5-minute technical indicators (RSI 50.0, MACD 0.000, price at SMAs) and volatility metrics (ATR 0.000, 20-day Volatility 0.000) show extreme stagnation and absolute neutrality. The AI trend analysis confirms a NEUTRAL trend with HIGH confidence due to zero movement across all primary indicators. There is no 1-hour data available to provide medium-term direction, and no news sentiment to influence the decision. With no discernible momentum or trend, and an unprofitable sell status, the prudent action is to HOLD.",1.0,HIGH,NEUTRAL,HIGH,LOW,50.0,0.1529,0.1529,4.930380657631324e-32,0.0,5000000.0,AGGRESSIVE
2025-08-21T23:06:28.105269,session_20250821_220904_4013,9,OXTUSD,0.06989,0.0,0.0,0.0,HOLD,LOW,"The market for OXTUSD is experiencing extreme price stagnation, with the current price fixed at $0.07 across both the current and previous close, and a 0.00% daily change. All short-term technical indicators (RSI 50, MACD at 0, and SMAs converged at $0.07) confirm a neutral and trendless environment. Volatility metrics (ATR and 20-day Volatility) are zero, further indicating a complete lack of price movement. While current volume is notably high (5,000,000) compared to a zero Volume MA, this activity has not translated into any price action, negating its potential as a directional momentum indicator. Crucially, the absence of 1-hour timeframe data prevents a comprehensive dual-timeframe analysis and the confirmation of any medium-term trend, which is a critical component for high-confidence decisions. The AI Trend Analysis explicitly corroborates this, labeling the trend as ""NEUTRAL"" with ""HIGH"" confidence in this neutrality. In an aggressive trading mode that prioritizes strong momentum and decisive action based on clear signals, entering a completely stagnant market with no discernible trend or price movement would be purely speculative, does not align with maximizing profit through quick action, and presents no actionable technical signals (technical score 0, far below the 4+ for BUY or 6- for SELL thresholds). Therefore, the prudent action is to HOLD and wait for clear directional signals to emerge.",0.0,LOW,NEUTRAL,HIGH,LOW,50.0,0.06989,0.06989,0.0,0.0,5000000.0,AGGRESSIVE
