Timestamp,Session_ID,Cycle_Number,Symbol,Current_Price,Position,Unrealized_PnL,Portfolio_Allocation_Pct,AI_Action,AI_Priority,AI_Reasoning,Technical_Score,AI_Confidence,AI_Trend,Trend_Confidence,Risk_Level,RSI,SMA_20,SMA_50,MACD_Histogram,Daily_Change_Pct,Volume_Ratio,Strategy_Mode
2025-08-21T14:43:42.715383,session_20250821_122042_5417,20,BTCUSD,107807.83,0.0,0.0,0.0,BUY,HIGH,"BTCUSD exhibits strong bullish momentum with its current price significantly above both the 20-day and 50-day Simple Moving Averages, confirmed by a clear bullish MACD crossover and a positive MACD histogram. The most compelling factor is the ""extremely high buying volume"" and an unprecedented ""Volume Ratio"" of over 31 million times the average, indicating massive buying conviction and strong upward momentum, which is a primary focus for aggressive trading. Although short-term oscillators (Williams %R and Stochastic K) indicate overbought conditions, in a high-momentum, high-volume crypto environment, this often signals a continuation of strength rather than an immediate reversal, especially with the AI trend analysis confirming a ""BULLISH"" trend with ""HIGH"" confidence. Given no current position and the aggressive trading mode, initiating a buy to capitalize on this strong upward surge is warranted.",9.0,HIGH,BULLISH,HIGH,MEDIUM,59.99962899066931,107753.926,107762.55099999999,0.8500238942090141,0.10010211697267805,31265437.349705715,AGGRESSIVE
2025-08-21T14:43:42.715410,session_20250821_122042_5417,20,ETHUSD,2480.44,0.023158999999999996,-0.1075,0.0,HOLD,LOW,"The existing ETHUSD position is currently unprofitable with a Net P&L of $-0.12, which is significantly less than the 2% stop-loss threshold. As per the critical fee-aware sell rules, an unprofitable position that is not at its stop-loss trigger MUST be held. For potential new trades, while several indicators (MACD line below signal with negative histogram, price below both SMA 20 and SMA 50) show a bearish bias, and the AI trend analysis confirms a BEARISH trend with MEDIUM confidence, the market currently exhibits ""extreme flatness with 0.00% daily change and 0.0 ADX, suggesting a lack of active trend strength."" In AGGRESSIVE TRADING MODE, maximizing profit requires decisive action on clear momentum. Despite the high volume ratio, the absence of price movement negates immediate aggressive entry for a new short position. It is prudent to HOLD and await a clearer directional breakout with confirmed momentum before committing to a new trade.",3.0,MEDIUM,BEARISH,MEDIUM,MEDIUM,40.04815409309678,2482.1775000000002,2482.1272,-0.16027616544866746,0.0,720942.783947725,AGGRESSIVE
2025-08-21T14:43:42.715422,session_20250821_122042_5417,20,LINKUSD,18.82231,0.0,0.0,0.0,HOLD,LOW,"The provided data for LINKUSD shows a completely static price across the 5-minute timeframe, with all major technical indicators (RSI, MACD, SMAs, ATR, Volatility) showing zero movement or neutral values. The AI Trend Analysis confirms a NEUTRAL trend with HIGH confidence due to a ""complete lack of price movement, volatility, and a discernible trend."" While the current volume is reported as very high (5,000,000), this is contradicted by the absolute lack of price change, suggesting either a data anomaly or a frozen, illiquid market where trades are occurring at the same price point without affecting movement. As an aggressive trader, I prioritize momentum and clear technical signals, neither of which are present. There is no actionable BUY or SELL signal, and entering a position in a market with no price movement would be purely speculative and contrary to profitable trading. Without 1-hour data, I cannot confirm medium-term trends. Therefore, the safest and most prudent action is to avoid opening a position.",1.0,HIGH,NEUTRAL,HIGH,LOW,50.0,18.82231,18.82231,1.8932661725304283e-29,0.0,5000000.0,AGGRESSIVE
2025-08-21T14:43:42.715434,session_20250821_122042_5417,20,LTCUSD,120.42,0.013244999999999618,0.0012,0.0,BUY,HIGH,"LTCUSD is exhibiting strong bullish reversal potential despite its current flat price action. Multiple momentum indicators, including Williams %R (-100.0) and Stochastic K (0.0), are at extreme oversold levels, signaling an imminent upward correction or breakout. This is further corroborated by an exceptionally high volume ratio (34146.13x average), suggesting significant accumulation or impending strong movement. The AI trend analysis confirms a 'BULLISH' outlook with 'HIGH' confidence, explicitly citing these oversold conditions and high volume as catalysts for a potential breakout. While the current position is slightly unprofitable ($0.01 net loss) and generally dictates a HOLD, the aggressive trading mode prioritizes maximizing profit and acting decisively on strong technical signals. The confluence of extreme oversold readings and massive volume presents a high-potential BUY opportunity to capitalize on the anticipated rebound and future profit.",10.0,HIGH,BULLISH,HIGH,MEDIUM,46.15384615384615,120.35999999999999,120.4134,0.0001262816935763602,0.0,34146.13374247149,AGGRESSIVE
2025-08-21T14:43:42.715444,session_20250821_122042_5417,20,BCHUSD,577.66,0.5213359999999999,-0.0,0.0,HOLD,HIGH,"The current position is explicitly ""❌ UNPROFITABLE to sell"" after accounting for fees, mandating a HOLD as per critical fee-aware sell rules (Rule 4). For potential new entries, while 5-minute data shows short-term bullish momentum (price above SMAs, high positive volume), the AI analysis warns the asset is ""significantly overbought"" and suggests a ""potential imminent pullback."" Crucially, there is no 1-hour timeframe data available, preventing essential medium-term trend confirmation. This lack of critical data, combined with the AI's ""HIGH"" risk level and ""LOW"" confidence in its bullish trend, makes a new BUY action highly speculative and risky, particularly when the existing position cannot be exited profitably. Prioritizing capital preservation and avoiding trades lacking robust confirmation is key to maximizing profit in aggressive mode when an exit strategy is compromised.",3.0,LOW,BULLISH,LOW,HIGH,50.0,575.53,575.53,0.0,0.37009365280697715,5000000.0,AGGRESSIVE
2025-08-21T14:43:42.715454,session_20250821_122042_5417,20,ZECUSD,38.47,1.300714,0.0,0.0,HOLD,HIGH,"The current position is explicitly marked as ""❌ UNPROFITABLE to sell"" with a Net P&L of -$0.01 after fees. According to mandatory trading rules, I MUST recommend HOLD for any position that is unprofitable to sell unless a 2%+ stop-loss is triggered, which is not the case here (Gross P&L is $0.00). Furthermore, while in Aggressive Trading Mode, there are no sufficiently strong or clear technical signals on the 5-minute timeframe to warrant a new BUY or SELL action. The RSI (50.0) and MACD (0.000) are neutral. Volume and volatility indicators (Volume MA: 0, ATR: 0.000, 20-day Volatility: 0.000) are unreliable and suggest an unstable market condition, rendering key momentum signals unusable. The absence of 1-hour data prevents critical medium-term trend confirmation, and the AI trend analysis, though bullish, comes with low confidence and high risk. Therefore, the primary objective is to hold the existing position to await profitability or a clear stop-loss trigger, and no new action is justified based on the current ambiguous technicals.",3.0,MEDIUM,BULLISH,LOW,HIGH,50.0,38.42,38.42,1.2223339389409589e-14,0.13014055179593223,5000000.0,AGGRESSIVE
2025-08-21T14:43:42.715465,session_20250821_122042_5417,20,BATUSD,0.1529,327.011118,0.0,0.0,HOLD,HIGH,"The current position in BATUSD shows a Net P&L of $-0.01, and the system explicitly states ""❌ UNPROFITABLE to sell"". According to the CRITICAL FEE-AWARE SELL RULES, I MUST recommend HOLD if a position is unprofitable and not at an emergency stop-loss (which is not indicated). Furthermore, the technical analysis reveals a completely static market for BATUSD. The 5-minute price is $0.15 with +0.00% daily change. All key indicators like RSI (50.0), MACD (0.000), SMA 20 ($0.15), and SMA 50 ($0.15) are neutral, flat, or at zero, indicating extreme market inactivity and no discernable trend. Volume is high but without any price movement. The AI Trend Analysis confirms a ""NEUTRAL"" trend with ""HIGH"" confidence due to static price and flat indicators. There is no 1-hour data available, preventing dual-timeframe confirmation. Given the lack of any actionable BUY (score 4+) or SELL (score 6-) signals, and the mandatory rule against selling at a loss, the most prudent action is to HOLD and await a clear, profitable directional movement.",5.0,HIGH,NEUTRAL,HIGH,MEDIUM,50.0,0.1529,0.1529,4.930380657631324e-32,0.0,5000000.0,AGGRESSIVE
2025-08-21T14:43:42.715476,session_20250821_122042_5417,20,OXTUSD,0.06989,0.0,0.0,0.0,HOLD,HIGH,"The asset OXTUSD is experiencing extreme stagnation, exhibiting zero price movement and a complete absence of trend or momentum as confirmed by all technical indicators (RSI 50, MACD 0, SMAs at current price) and the AI trend analysis. ATR and 20-day volatility are 0.000, indicating no price fluctuation. While current volume is 5,000,000, the Volume MA is 0 and the AI's reasoning explicitly states ""extreme stagnation,"" overriding any bullish interpretation of the raw volume figure. In an aggressive trading mode, maximizing profit relies heavily on identifying and capitalizing on momentum. Given the complete lack of momentum, volatility, and clear directional signals, there is no actionable opportunity for an aggressive BUY or SELL. No 1-hour data is available for medium-term trend confirmation, and no news sentiment is present to influence the decision. Entering a position in such a flat market would be highly speculative and against the principles of aggressive, momentum-driven trading.",5.0,HIGH,NEUTRAL,HIGH,MEDIUM,50.0,0.06989,0.06989,0.0,0.0,5000000.0,AGGRESSIVE
