Timestamp,Session_ID,Cycle_Number,Symbol,Current_Price,Position,Unrealized_PnL,Portfolio_Allocation_Pct,AI_Action,AI_Priority,AI_Reasoning,Technical_Score,AI_Confidence,AI_Trend,Trend_Confidence,Risk_Level,RSI,SMA_20,SMA_50,MACD_Histogram,Daily_Change_Pct,Volume_Ratio,Strategy_Mode
2025-08-22T13:34:48.658640,session_20250822_131922_2405,3,BTCUSD,107700.02,0.0009285,0.0,0.0,HOLD,MEDIUM,"The existing position of 0.0009285 shares is currently unprofitable to sell (Net P&L $-0.01 after fees) and does not meet the 2%+ stop-loss trigger, therefore a HOLD is mandatory for this position as per critical fee-aware rules. For any new action, technical signals are highly contradictory and lack clarity. While MACD indicators show bullish momentum (MACD Line above Signal, positive Histogram), Stochastic K (82.6) and Williams %R (-17.4) are deeply in overbought territory, aggressively signaling a potential downward correction. Price is also trading below both SMA 20 and SMA 50, adding a bearish bias. The AI Trend Analysis identifies a BEARISH trend with LOW confidence, specifically noting ""extreme price stagnation"" (0.00% daily change) and ""numerous anomalous indicator values"" which introduce significant uncertainty. Given these conflicting signals, the absence of 1-hour data for trend confirmation, and the current price stagnation, there is no high-conviction BUY or SELL opportunity for a new position. The most prudent action is to HOLD the existing position and await clearer, aligned market direction and improved profitability for a potential exit.",5.0,LOW,BEARISH,LOW,HIGH,55.555326538394276,107748.5355,107760.3942,2.412785365360745,0.0,23061202.12422967,AGGRESSIVE
2025-08-22T13:34:48.658682,session_20250822_131922_2405,3,ETHUSD,2482.92,0.040276,0.0,0.0,HOLD,MEDIUM,"The current ETHUSD position is unprofitable with a Net P&L of -$0.01. According to mandatory fee-aware sell rules, an unprofitable position cannot be sold unless it triggers a stop-loss (2%+ loss), which is not the case here. Therefore, the existing position must be held.",5.0,LOW,BULLISH,LOW,MEDIUM,55.54066130473673,2482.6735,2482.3756,-0.039957399064883575,0.0,709886.5774988438,AGGRESSIVE
2025-08-22T13:34:48.658698,session_20250822_131922_2405,3,LINKUSD,18.82231,0.0,0.0,0.0,HOLD,LOW,"All technical indicators (RSI, MACD, SMAs, Williams %R, Stochastic K) are completely flat, neutral, or invalid (""nan"") due to the static price ($18.82) and zero daily change. There is no discernible trend or momentum in the 5-minute timeframe. The crucial 1-hour timeframe data is unavailable, preventing dual timeframe analysis and reliable trend confirmation. Volume analysis shows a high ""Current Volume"" but a ""Volume MA"" of 0, indicating current sustained trading activity is effectively nil, leading to the static price. The AI trend analysis confirms a ""NEUTRAL"" trend with ""LOW"" confidence and ""HIGH"" risk, explicitly stating the price is static and indicators show no activity. No news sentiment is available. While operating in an aggressive trading mode, decisive action requires *actionable signals* and *momentum*. With no momentum, no clear trend, and no valid technical scores above 4+, there is no basis to initiate a BUY. Entering a static market offers no immediate profit potential and constitutes pure speculation without supporting data. Therefore, the prudent aggressive action is to HOLD and await clearer signals or more dynamic price action.",1.0,LOW,NEUTRAL,LOW,HIGH,50.0,18.82231,18.82231,7.415451410907371e-21,0.0,5000000.0,AGGRESSIVE
2025-08-22T13:34:48.658712,session_20250822_131922_2405,3,LTCUSD,120.3,3.3250239999999995,-0.0,0.0,BUY,MEDIUM,"Despite the existing position being currently unprofitable to sell (Net P&L $-0.01 after fees), aggressive trading mode requires decisive action on strong technical signals. The 5-minute timeframe presents compelling oversold conditions, with Williams %R at -100.0 and Stochastic K at 0.0, both indicating a high probability of an imminent bullish reversal. This strong reversal signal is significantly bolstered by an exceptionally high Volume Ratio (34508.21x), suggesting substantial market interest or accumulation during this period of consolidation. While the MACD histogram and line, along with the price being slightly below the SMAs, show a short-term bearish bias, these are often lagging indicators. The aggressive trading strategy prioritizes momentum and volume, especially when coupled with extreme oversold conditions in crypto markets. The AI's analysis also explicitly identifies ""strong oversold signals...suggest potential for a bullish reversal."" The absence of 1-hour timeframe data and the AI's ""LOW"" confidence in the overall ""NEUTRAL"" trend (despite the identified reversal potential) necessitates a Medium priority, acknowledging the inherent high risk of trading without higher timeframe confirmation. No news sentiment is available to confirm or deny this technical outlook.",6.0,MEDIUM,NEUTRAL,LOW,HIGH,45.45454545454546,120.354,120.35040000000001,-0.004439161120789235,0.0,34508.20581497275,AGGRESSIVE
2025-08-22T13:34:48.658719,session_20250822_131922_2405,3,BCHUSD,577.66,0.259668,0.0,0.0,BUY,HIGH,"BCHUSD is exhibiting strong bullish momentum, a key factor for aggressive trading, with current volume at 5,000,000 and an exceptional volume ratio of 5,000,000x average. The price ($577.66) is trading above both the 5-minute SMA 20 ($575.53) and SMA 50 ($575.53), reinforcing short-term bullish sentiment. The AI Trend Analysis confirms a BULLISH trend with MEDIUM confidence, citing price above major moving averages and EMA crossovers. While the AI notes an overbought condition that may lead to a short-term correction, the aggressive trading mode prioritizes high momentum and volume, indicating potential for further upside despite the elevated risk. The calculated technical score of 6 meets the aggressive mode's actionable BUY threshold (4+). Current portfolio constraints allow for additional purchases, and no negative news is present. The existing position's unprofitable status prevents a sell, but the strong technicals justify adding to the position for future profit potential in line with the bullish trend.",6.0,MEDIUM,BULLISH,MEDIUM,MEDIUM,50.0,575.53,575.53,0.0,0.37009365280697715,5000000.0,AGGRESSIVE
2025-08-22T13:34:48.658728,session_20250822_131922_2405,3,ZECUSD,38.47,1.299714,0.0,0.0,HOLD,HIGH,"The current position for ZECUSD is unprofitable to sell, with a Net P&L of $-0.01. According to the critical fee-aware sell rules, I MUST recommend HOLD for any position showing ""❌ UNPROFITABLE to sell"" unless it's an emergency stop-loss, which is not indicated here. While the AI trend is bullish, it comes with low confidence and high risk, and the underlying 5-minute technicals (neutral RSI, flat MACD, zero volatility indicators) are not strong enough to warrant a decisive action or override the unprofitable sell status. Lack of 1-hour data and concerning volatility metrics (ATR 0.000, 20-day Volatility 0.000) contribute to an unstable market assessment. No news sentiment is available to sway the decision. The primary driver is adherence to the mandatory profitability rule for existing positions.",2.0,HIGH,BULLISH,LOW,HIGH,50.0,38.42,38.42,3.6789315843218376e-05,0.13014055179593223,4576273.5,AGGRESSIVE
2025-08-22T13:34:48.658737,session_20250822_131922_2405,3,BATUSD,0.1529,0.0,0.0,0.0,HOLD,LOW,"Technical signals across the 5-minute timeframe are overwhelmingly neutral or indicative of extreme market flatness (RSI 50, flat MACD, price consolidating at SMAs, 0.00% daily change, 0.000 ATR, 0.000 volatility). While the Current Volume is high and the Volume Ratio indicates an extreme surge (5000000.00x), this volume is not accompanied by any price movement or volatility, rendering it an ambiguous signal for momentum and not a clear buy trigger for an aggressive strategy. The AI Trend Analysis, despite labeling the trend as ""BULLISH,"" explicitly states ""LOW Confidence,"" ""HIGH Risk,"" and notes ""weak bullish strength"" due to ""extreme market flatness, zero volatility, and a neutral RSI."" Critically, the absence of 1-hour timeframe data prevents a comprehensive dual-timeframe analysis and robust trend confirmation. The combined technical score (approximately 1.5) falls significantly below the ""4+"" threshold required for a BUY action in aggressive trading mode. Furthermore, with a current price of $0.15 and a fixed trade size of 0.001 shares per order, the $0.01 per-trade fee makes it mathematically impossible to achieve a profitable round-trip trade, as the required price increase to cover fees is astronomically high. This violates the mandatory profitability rules, making any trade unviable.",1.5,HIGH,BULLISH,LOW,HIGH,50.0,0.1529,0.1529,2.0601925083880002e-20,0.0,5000000.0,AGGRESSIVE
2025-08-22T13:34:48.658744,session_20250822_131922_2405,3,OXTUSD,0.06989,0.0,0.0,0.0,HOLD,LOW,"All 5-minute technical indicators including RSI (50.0), MACD (0.000 flat), and SMAs (20 and 50 both at $0.07) show complete neutrality and zero price movement. The AI Trend Analysis confirms a ""NEUTRAL"" trend with ""HIGH"" confidence due to the absolute flatness across all metrics and the absence of any discernible momentum or volatility (ATR and 20-day Volatility are 0.000). While current volume is significantly high (5,000,000) relative to a zero volume MA, this volume is not translating into any price action or trend. The absence of 1-hour timeframe data prevents a medium-term trend confirmation. Under aggressive trading mode, this scenario offers no actionable BUY signal (Technical score is far below 4+) as there is no momentum, trend, or volatility to capitalize on. News sentiment is also unavailable.",1.0,HIGH,NEUTRAL,HIGH,LOW,50.0,0.06989,0.06989,0.0,0.0,5000000.0,AGGRESSIVE
