Timestamp,Session_ID,Cycle_Number,Symbol,Current_Price,Position,Unrealized_PnL,Portfolio_Allocation_Pct,AI_Action,AI_Priority,AI_Reasoning,Technical_Score,AI_Confidence,AI_Trend,Trend_Confidence,Risk_Level,RSI,SMA_20,SMA_50,MACD_Histogram,Daily_Change_Pct,Volume_Ratio,Strategy_Mode
2025-08-21T01:46:10.519997,session_20250821_011837_7606,5,BTCUSD,107700.02,0.0030018399999999995,0.0,0.0,HOLD,MEDIUM,"Current position is unprofitable to sell ($0.01 net P&L loss) and no stop-loss (2%+) has been triggered. Despite a bullish MACD histogram (1.519) and MACD line (3.737 > 2.218), the 5-minute timeframe shows a strong bearish alignment of moving averages (price $107700.02 below SMA20 $107748.53 < SMA50 $107756.08) and severely overbought momentum indicators (Stochastic K=100.0, Williams %R=-0.0). This combination, along with extremely high current volume, strongly suggests a high probability of a downward correction, as corroborated by the AI's BEARISH trend analysis with MEDIUM confidence. Given the ""AGGRESSIVE TRADING MODE"" and the ""CRITICAL FEE-AWARE SELL RULES"" mandating a HOLD for unprofitable positions not hitting a stop-loss, holding is the correct action to wait for price recovery or a clear sell signal at a profit/stop-loss.",4.0,MEDIUM,BEARISH,MEDIUM,HIGH,57.142857142857146,107748.5345,107756.08120000002,1.519286011944566,0.0,21510019.07331412,AGGRESSIVE
2025-08-21T01:46:10.520024,session_20250821_011837_7606,5,ETHUSD,2480.44,0.023158999999999996,-0.1075,0.0,HOLD,MEDIUM,"Current position is unprofitable with a Net P&L of $-0.12, which is less than the required profit threshold ($0.00) and not at the 2% stop-loss trigger. As per the mandatory fee-aware sell rules, an unprofitable position not at stop-loss *must* be held. Technical analysis on the 5-minute timeframe presents mixed signals: price is currently below both the 20 and 50 SMA, indicating a short-term bearish trend. The AI trend analysis confirms this as BEARISH with medium confidence, citing negative price movement supported by high volume. However, momentum indicators like MACD (bullish crossover and positive histogram), Stochastic K (79.9 - overbought), and Williams %R (-20.1 - overbought) show strong underlying bullish momentum. Given these conflicting technical signals, coupled with the critical rule to avoid selling at a loss, the optimal action is to hold the position and await either clearer bullish confirmation or a recovery to profitability.",4.0,MEDIUM,BEARISH,MEDIUM,MEDIUM,57.13463751438455,2481.929,2481.9784,0.0829438910366081,-0.09988239653311497,718102.8548251215,AGGRESSIVE
2025-08-21T01:46:10.520035,session_20250821_011837_7606,5,LINKUSD,18.82231,0.0,0.0,0.0,HOLD,LOW,"The market for LINKUSD is currently completely static, as indicated by all available data. The current price has a 0.00% daily change, and both ATR and 20-day volatility are 0.000. All short-term technical indicators (RSI at 50.0, MACD at 0.000, SMAs matching current price) are strictly neutral, showing no momentum or trend. The AI Trend Analysis explicitly confirms a NEUTRAL trend with HIGH confidence, stating ""All key price-action indicators... show zero movement or volatility, confirming the current price is static at $18.82 with no discernible trend."" Despite the reported current volume being high, the zero volatility and zero MA volume indicate this is not translating into price action, suggesting a frozen market state. As an aggressive trader prioritizing momentum and clear technical signals, there are no actionable BUY or SELL signals present. Without any directional impetus or volatility, entering a trade would be pure speculation, which contradicts the goal of maximizing profit through decisive action based on technical analysis. No news sentiment is available to provide a boost or trigger.",5.0,HIGH,NEUTRAL,HIGH,MEDIUM,50.0,18.82231,18.82231,1.8932661725304283e-29,0.0,5000000.0,AGGRESSIVE
2025-08-21T01:46:10.520045,session_20250821_011837_7606,5,LTCUSD,120.3,0.8436709999999996,-0.0255,0.0,HOLD,HIGH,"The current LTCUSD position has a Net P&L of $-0.04, which is unprofitable to sell as per the ""CRITICAL FEE-AWARE SELL RULES"". Specifically, rule 4 states: ""If current position shows '❌ UNPROFITABLE to sell' above, you MUST recommend HOLD unless it's an emergency stop-loss"". The current loss of $0.03 (approx 0.025%) is far below the 2%+ stop-loss trigger. Therefore, a HOLD recommendation is mandatory to avoid selling at a loss.",5.0,LOW,BEARISH,LOW,MEDIUM,50.0,120.35999999999999,120.36,0.002005594765210063,0.0,33607.79926902162,AGGRESSIVE
2025-08-21T01:46:10.520055,session_20250821_011837_7606,5,BCHUSD,577.66,0.5213359999999999,-0.0,0.0,HOLD,MEDIUM,"The current position is at a net P&L of -$0.01, which is explicitly flagged as ""❌ UNPROFITABLE to sell"" after accounting for fees. According to the critical fee-aware sell rules, I MUST recommend HOLD unless it's an emergency stop-loss, which this is not (not a 2%+ loss). Furthermore, while the 5-minute data shows the price slightly above key moving averages (SMAs), indicating a weak bullish bias, the overall technical picture is severely compromised. There is NO 1-HOUR DATA available, which is critical for medium-term trend confirmation and heavily weighted in analysis. Many vital indicators (Williams %R, Stochastic K, MACD, ATR, 20-day Volatility, Volume MA) are either zero or 'nan', making reliable momentum and volatility analysis impossible. The AI trend analysis, despite identifying as 'BULLISH', has 'LOW' confidence due to ""extensive missing or zero data"", which severely limits the reliability and depth of the analysis. Given the unreliable and incomplete technical data, especially the absence of 1-hour timeframe validation, and the current unprofitable status of the existing position, aggressive new entry is not justified, and selling the current position is prohibited.",2.0,MEDIUM,BULLISH,LOW,MEDIUM,50.0,575.53,575.53,0.0,0.37009365280697715,5000000.0,AGGRESSIVE
2025-08-21T01:46:10.520064,session_20250821_011837_7606,5,ZECUSD,38.47,1.300714,0.0,0.0,HOLD,LOW,"The current position is unprofitable to sell (Net P&L After Fees: $-0.01), and a 2%+ stop-loss has not been triggered from the purchase price of $38.47. According to mandatory fee-aware sell rules, selling an unprofitable position is not permitted unless a stop-loss is hit. Therefore, the position must be held. Technical indicators show a slightly positive daily change and price above SMAs, along with extremely high volume, suggesting some weak bullish momentum. However, the AI trend analysis indicates low confidence and a potential for correction due to being overbought, making it an uncertain time for new entry. Given the primary constraint of an unprofitable open position, HOLD is the only permissible action.",5.0,HIGH,BULLISH,LOW,HIGH,50.0,38.42,38.42,2.524354896707238e-29,0.13014055179593223,5000000.0,AGGRESSIVE
2025-08-21T01:46:10.520073,session_20250821_011837_7606,5,BATUSD,0.1529,327.011118,0.0,0.0,HOLD,HIGH,"The current position is 327.011118 shares @ $0.15. Analysis shows the position is ❌ UNPROFITABLE to sell, with a net P&L of -$0.01 after fees. According to MANDATORY FEE-AWARE SELL RULE #4, if a position is unprofitable to sell, a HOLD recommendation is required unless an emergency stop-loss (2%+ loss) is triggered. The current price of $0.15 is not below the 2% stop-loss threshold ($0.147). Furthermore, all technical indicators (RSI 50.0, MACD all zeros, SMAs at price, ATR 0.000, 20-day Volatility 0.000) are perfectly neutral, indicating extreme price stagnation and no discernible trend or momentum. The AI Trend Analysis confirms a NEUTRAL trend with HIGH confidence due to this complete lack of movement. Volume MA is 0, making the Volume Ratio of 5,000,000.00x misleading as a sign of activity. There is no news available to influence the decision. Therefore, given the clear unprofitability of the current position and the absence of any directional technical signals or stop-loss triggers, holding is the only viable action.",5.0,HIGH,NEUTRAL,HIGH,HIGH,50.0,0.1529,0.1529,4.930380657631324e-32,0.0,5000000.0,AGGRESSIVE
2025-08-21T01:46:10.520082,session_20250821_011837_7606,5,OXTUSD,0.06989,0.0,0.0,0.0,HOLD,LOW,"The market for OXTUSD is extremely flat and devoid of any discernible trend or momentum. All 5-minute technical indicators, including RSI (50.0), MACD (0.000), SMA 20 ($0.07), and SMA 50 ($0.07), are perfectly neutral, indicating no price movement or directional bias. Crucially, there is no 1-hour data available, preventing any medium-term trend confirmation and forcing a reliance solely on the short-term, which shows absolute neutrality. Volume analysis shows zero for Volume MA and zero for ATR and 20-day volatility, reinforcing the lack of market activity. The AI Trend Analysis confirms a ""NEUTRAL"" trend with ""HIGH"" confidence. In aggressive trading mode, while we seek to maximize profit and accept higher risk, this requires *actionable signals*. With zero momentum, no volatility, and a completely flat price, there is no technical basis for a BUY (no score 4+) or SELL action at this time. Entering a position under such conditions would be purely speculative and not aligned with maximizing profit through decisive, signal-driven action. No news data is available to influence the decision. Therefore, the prudent action is to HOLD and wait for a clear directional signal to emerge.",1.0,HIGH,NEUTRAL,HIGH,LOW,50.0,0.06989,0.06989,0.0,0.0,5000000.0,AGGRESSIVE
