Timestamp,Session_ID,Cycle_Number,Symbol,Current_Price,Position,Unrealized_PnL,Portfolio_Allocation_Pct,AI_Action,AI_Priority,AI_Reasoning,Technical_Score,AI_Confidence,AI_Trend,Trend_Confidence,Risk_Level,RSI,SMA_20,SMA_50,MACD_Histogram,Daily_Change_Pct,Volume_Ratio,Strategy_Mode
2025-08-21T12:13:00.572093,session_20250821_115719_3235,3,BTCUSD,107700.02,0.0016104699999999997,0.0,0.0,HOLD,HIGH,"The current position is unequivocally UNPROFITABLE to sell after accounting for trading fees, which mandates a HOLD action as per critical fee-aware sell rules. Technically, the overall sentiment for BTCUSD is bearish. Price is trading below both the 5-minute SMA 20 and SMA 50. The AI trend analysis indicates a BEARISH trend with medium confidence, supported by reasoning that points to a bearish SMA crossover, high volume on negative price movement, and negative OBV. While MACD shows a bullish signal and RSI is neutral, the overbought readings from Williams %R and Stochastic K suggest a potential reversal or continuation of downtrend from an overextended point. The extremely high volume alongside negative price action reinforces the bearish conviction. Given the strong bearish technicals, a new BUY entry is not advised.",3.0,MEDIUM,BEARISH,MEDIUM,MEDIUM,55.55555555555556,107770.09650000001,107771.17540000001,1.8954183711647987,-0.10000201284080912,31430885.601649076,AGGRESSIVE
2025-08-21T12:13:00.572126,session_20250821_115719_3235,3,ETHUSD,2482.93,0.023158999999999996,-0.0499,0.0,BUY,HIGH,"The overall trend for ETHUSD is bullish, supported by price trading above key moving averages (SMA 20 and SMA 50) and a strong bullish MACD crossover with a positive histogram. Volume is exceptionally high, indicating significant buying interest and strong momentum, which is a priority in aggressive trading. While momentum indicators like Williams %R (-1.0) and Stochastic K (99.0) are severely overbought, signaling a potential for a short-term pullback or consolidation, the aggressive trading mode prioritizes capitalizing on strong momentum and volume. Given the current bullish trend and extreme volume, the strategy accepts higher risk for potential higher returns. The current position is unprofitable and per rules, cannot be sold; therefore, a BUY action aims to capitalize on the strong upward momentum and potentially improve the average cost basis of the position.",4.0,MEDIUM,BULLISH,MEDIUM,MEDIUM,59.98389694041906,2481.6805,2481.7304,0.057980936009224326,0.10038541549079122,712836.1176955657,AGGRESSIVE
2025-08-21T12:13:00.572140,session_20250821_115719_3235,3,LINKUSD,18.82231,0.0,0.0,0.0,HOLD,LOW,"All available 5-minute technical indicators (RSI, MACD, SMAs) for LINKUSD show complete stagnation and neutrality, with the price fixed at $18.82. Volume MA is zero, and both ATR and 20-day volatility are 0.000, indicating an extreme lack of price movement or volatility. The AI Trend Analysis confirms a NEUTRAL trend with HIGH confidence due to ""zero movement and complete stagnation."" As an aggressive trader, we prioritize momentum and volume for actionable signals, neither of which are present. With no 1-hour data available to confirm a medium-term trend, and all short-term signals being perfectly flat, there is no technical basis to initiate a BUY (requires score 4+) or SELL (requires score 6-). Entering a position in a completely flat market contradicts the aggressive strategy's focus on decisive action based on strong signals.",2.0,HIGH,NEUTRAL,HIGH,LOW,50.0,18.82231,18.82231,1.8932661725304283e-29,0.0,5000000.0,AGGRESSIVE
2025-08-21T12:13:00.572155,session_20250821_115719_3235,3,LTCUSD,120.3,0.4284579999999996,-0.013,0.0,HOLD,HIGH,"The current LTCUSD position is unprofitable to sell ($0.02 net loss), and the 2%+ stop-loss threshold ($117.92) has not been triggered, which mandates a HOLD action per critical fee-aware sell rules. From a technical perspective, the 5-minute timeframe shows a bearish trend (MACD bearish crossover, price below SMAs) confirmed by the AI trend analysis (BEARISH, MEDIUM confidence). However, this is contradicted by extreme oversold conditions (Williams %R -100, Stochastic K 0), which suggest a potential for a short-term bounce or a pause in the downtrend. The extremely high volume with static price indicates current consolidation and lack of clear directional momentum, further supporting a wait-and-see approach. No news sentiment is available to provide additional confirmation. Given these mixed technical signals and the mandatory hold for an unprofitable position, waiting for a clearer trend or price recovery is prudent before considering any new aggressive action.",5.0,HIGH,BEARISH,MEDIUM,MEDIUM,50.0,120.36000000000001,120.3624,-0.006231548954920733,0.0,34760.20720922714,AGGRESSIVE
2025-08-21T12:13:00.572172,session_20250821_115719_3235,3,BCHUSD,577.66,0.5213359999999999,-0.0,0.0,HOLD,HIGH,"The primary reason for recommending HOLD is that the current BCHUSD position is unprofitable to sell after accounting for trading fees (Net P&L: $-0.01), and it does not meet the 2%+ loss stop-loss threshold. Per the critical fee-aware sell rules, an unprofitable position must be held unless a stop-loss is triggered. From a technical standpoint, the 5-minute analysis shows mixed signals: the AI trend identifies a BULLISH trajectory due to price being above key moving averages and positive volume, but critically notes the asset is ""significantly overbought"" and trading above its upper Bollinger Band, suggesting a potential short-term pullback. Momentum indicators (RSI 50.0, flat MACD) are neutral. The lack of 1-hour timeframe data prevents a robust dual-timeframe confirmation. Given the overbought condition, entering a new BUY is not advisable at this moment. With no strong immediate sell trigger (beyond unprofitability) and conflicting signals, holding the existing position is the prudent action, awaiting a profitable exit point or a clearer technical signal.",4.0,HIGH,BULLISH,LOW,MEDIUM,50.0,575.53,575.53,0.0,0.37009365280697715,5000000.0,AGGRESSIVE
2025-08-21T12:13:00.572185,session_20250821_115719_3235,3,ZECUSD,38.47,1.300714,0.0,0.0,HOLD,HIGH,"The primary reason for recommending HOLD is the mandatory ""CRITICAL FEE-AWARE SELL RULES."" The current position is explicitly marked as ""❌ UNPROFITABLE to sell"" (Net P&L after fees is -$0.01) and does not meet the 2%+ stop-loss trigger. Therefore, selling would result in a guaranteed loss, which is against the directive to maximize profit and avoid unprofitable sells. From a technical perspective, the market shows mixed signals: while ZECUSD exhibits a slight positive daily change (+0.13%) and trades above its 5-minute SMAs with extremely high volume (5,000,000x average), indicating short-term upward momentum, other key indicators are neutral (RSI 50.0, MACD 0.000). Crucially, 1-hour timeframe data is unavailable, preventing a robust medium-term trend confirmation. The AI trend analysis, despite identifying a ""BULLISH"" trend, assigns ""LOW Confidence"" and ""HIGH Risk,"" citing potential overbought conditions and prolonged stagnation, which suggests a fragile uptrend. Furthermore, critical volatility metrics (ATR, 20-day Volatility) show anomalous zero values, making a precise risk assessment challenging. Given these conflicting technical signals and the strict unprofitability constraint, waiting for price recovery is the most strategic move.",3.0,LOW,BULLISH,LOW,HIGH,50.0,38.42,38.42,1.5131761243940946e-17,0.13014055179593223,5000000.0,AGGRESSIVE
2025-08-21T12:13:00.572196,session_20250821_115719_3235,3,BATUSD,0.1529,327.011118,0.0,0.0,HOLD,LOW,"Current position is unprofitable to sell (Net P&L $-0.01) and does not meet the 2%+ stop-loss trigger, thus MANDATORY HOLD per fee-aware sell rules. All available technical indicators on the 5-minute timeframe (RSI 50.0, MACD 0.000, SMAs at $0.15, 0 ATR, 0% daily change) show complete market stagnation and a neutral trend. Despite a high current volume (5,000,000x average), there is no corresponding price movement or volatility, indicating extreme flatness. No 1-hour data is available for broader trend confirmation, and no news sentiment is present. There are no strong technical signals (score < 4) to justify a BUY, nor are there any negative signals (score > 6) to consider a SELL, even if profitability rules allowed. The market exhibits no momentum or clear direction suitable for aggressive entry/exit.",1.0,HIGH,NEUTRAL,HIGH,MEDIUM,50.0,0.1529,0.1529,4.930380657631324e-32,0.0,5000000.0,AGGRESSIVE
2025-08-21T12:13:00.572207,session_20250821_115719_3235,3,OXTUSD,0.06989,0.0,0.0,0.0,HOLD,LOW,"All available 5-minute technical indicators (RSI, MACD, SMAs, ATR, Volatility) are completely flat, neutral, or at zero, indicating no price movement and a complete lack of momentum. The daily change is 0.00%, and the AI trend analysis confirms a ""NEUTRAL"" trend with ""HIGH Confidence"" due to ""extreme consolidation."" Despite the high current volume (5,000,000x average), the absence of any corresponding price action negates its signaling power for directional movement. With no 1-hour data available for medium-term trend confirmation and no news sentiment, there are no actionable signals (neither BUY nor SELL) that meet the aggressive trading mode's criteria (technical score 4+ for BUY, or strong bearish signals for SELL). Entering a position on a completely stagnant asset offers no potential for profit maximization and ties up capital.",5.0,HIGH,NEUTRAL,HIGH,MEDIUM,50.0,0.06989,0.06989,0.0,0.0,5000000.0,AGGRESSIVE
