Timestamp,Session_ID,Cycle_Number,Symbol,Current_Price,Position,Unrealized_PnL,Portfolio_Allocation_Pct,AI_Action,AI_Priority,AI_Reasoning,Technical_Score,AI_Confidence,AI_Trend,Trend_Confidence,Risk_Level,RSI,SMA_20,SMA_50,MACD_Histogram,Daily_Change_Pct,Volume_Ratio,Strategy_Mode
2025-08-21T17:49:14.415248,session_20250821_122042_5417,47,BTCUSD,107700.02,0.0,0.0,0.0,SELL,HIGH,"The 5-minute timeframe data for BTCUSD presents a strong bearish outlook, aligning with the aggressive trading mode to maximize profit from decisive action. The current price ($107700.02) is below both the SMA 20 ($107780.88) and SMA 50 ($107764.71), indicating a clear downtrend. The MACD shows a bearish crossover with the MACD line (-6.121) below its signal line (2.224), and the MACD Histogram (-8.344) is negative, reinforcing strong negative momentum. Both Williams %R (-9.5) and Stochastic K (90.5) are deep in overbought territory, signaling an imminent reversal downwards, which is a stronger sell signal in crypto (>80 for Stochastic K). The AI trend analysis confirms a ""BEARISH"" trend with ""HIGH"" confidence, explicitly citing price below MAs, bearish crossovers, and overbought momentum indicators signaling declines. The exceptionally high current volume (78,801,269) relative to its moving average (Volume Ratio: 31439449.35x) further validates the significant bearish price movement. Given the overwhelming bearish technical signals and the instruction to act decisively when technical scores are low (score 2 is <=6 for SELL), initiating a short position is the appropriate action to capitalize on the anticipated decline.",2.0,HIGH,BEARISH,HIGH,MEDIUM,50.0,107780.87850000002,107764.70640000001,-8.344121477136483,-0.10000201284080912,31439449.3517865,AGGRESSIVE
2025-08-21T17:49:14.415283,session_20250821_122042_5417,47,ETHUSD,2482.93,0.023158999999999996,-0.0499,0.0,HOLD,HIGH,"The current ETHUSD position is unprofitable with a Net P&L of $-0.06, which does not meet the mandatory 2%+ stop-loss trigger. According to the critical fee-aware sell rules, positions must not be sold at a loss unless it is an emergency stop-loss. Therefore, holding the current position is mandatory. Technical analysis shows mixed signals: the price is holding above the SMA 20 ($2482.05) and SMA 50 ($2481.83), indicating a weak bullish bias, and current volume is extremely high at 77,445,875, significantly above average, suggesting potential for future movement. However, momentum indicators like MACD (MACD line -0.080 below Signal 0.037, Histogram -0.116) and Stochastic K (59.9) show bearish crossovers and momentum, consistent with the AI's reasoning of ""bearish momentum signals from MACD and Stochastic crossovers."" The AI trend identifies a ""BULLISH"" trend but with ""LOW"" confidence due to extreme stagnation and conflicting indicators. No news data is available to provide a sentiment boost or trigger. Given the mandatory hold on the unprofitable position and the conflicting technical signals which do not provide a strong enough conviction for a new aggressive buy or sell, holding is the prudent action.",3.0,HIGH,BULLISH,LOW,MEDIUM,44.42454097626558,2482.053,2481.8294,-0.11646419460125626,0.00040275159891432386,712159.8037721902,AGGRESSIVE
2025-08-21T17:49:14.415296,session_20250821_122042_5417,47,LINKUSD,18.82231,0.0,0.0,0.0,HOLD,LOW,"All available technical indicators across the 5-minute timeframe (RSI, MACD, SMAs, Williams %R, Stochastic K, ATR, 20-day Volatility) are perfectly flat and neutral, indicating zero price movement and no volatility. The AI trend analysis confirms a 'NEUTRAL' trend with high confidence, explicitly stating ""zero price movement and no volatility"". Despite the high current volume, it is not translating into any price action or momentum, which overrides volume as a momentum indicator. With no 1-hour data available, we cannot find a medium-term trend. In AGGRESSIVE TRADING MODE, we prioritize momentum and volume for actionable signals, but here, there is no momentum. There are no technical signals meeting the criteria for a BUY (score 4+) or SELL (score 6-). Entering a trade without any directional technical conviction would be purely speculative and does not align with maximizing profit through decisive action when there's no signal to act upon.",0.0,HIGH,NEUTRAL,HIGH,LOW,50.0,18.82231,18.82231,1.8932661725304283e-29,0.0,5000000.0,AGGRESSIVE
2025-08-21T17:49:14.415309,session_20250821_122042_5417,47,LTCUSD,120.42,0.013244999999999618,0.0012,0.0,BUY,HIGH,"LTCUSD exhibits strong oversold conditions indicated by both Williams %R (-95.7) and Stochastic K (4.3), signaling a high probability of a bullish bounce. This potential upward movement is strongly supported by an extraordinary volume ratio of 33854x the average, indicating significant market interest and conviction behind a price change. While MACD shows minor bearish momentum, the overwhelming oversold signals and massive volume take precedence in this aggressive trading mode. Although the current position is unprofitable to sell and will be held per rules, adding new shares is justified to capitalize on the anticipated bounce.",6.0,MEDIUM,BULLISH,LOW,MEDIUM,50.0,120.4935,120.40859999999999,-0.031445525145747236,0.0997506234414003,33854.349948591465,AGGRESSIVE
2025-08-21T17:49:14.415321,session_20250821_122042_5417,47,BCHUSD,577.66,0.5213359999999999,-0.0,0.0,BUY,HIGH,"The current price of BCHUSD is trading above both its 20-period and 50-period Simple Moving Averages, indicating a clear short-term bullish trend. Despite the absence of 1-hour data, the 5-minute timeframe shows positive price movement. The current volume is exceptionally high (5,000,000), suggesting strong buying interest and supporting potential upward momentum, which is a key factor in aggressive trading. While RSI (50.0) and MACD (0.000) are neutral, they do not indicate an overbought condition (contradicting some AI reasoning) or a negative divergence, leaving room for price appreciation. The AI trend analysis also identifies a bullish trend with medium confidence. Given the AGGRESSIVE TRADING MODE, a technical score of 7 (well above the 4+ threshold for BUY) combined with high volume and positive price action strongly justifies adding to the position to maximize profit potential, even though the existing small position is currently unprofitable to sell due to fees. The unprofitable status of the *current* small position does not negate the strong buy signal for *new* shares. We have ample available cash and are well below the max shares per stock.",7.0,MEDIUM,BULLISH,MEDIUM,MEDIUM,50.0,575.53,575.53,0.0,0.37009365280697715,5000000.0,AGGRESSIVE
2025-08-21T17:49:14.415332,session_20250821_122042_5417,47,ZECUSD,38.47,1.300714,0.0,0.0,HOLD,HIGH,"The current position is explicitly stated as ""âŒ UNPROFITABLE to sell"" after accounting for fees, which mandates a HOLD action as per the critical fee-aware sell rules. There is no indication of a 2%+ loss to trigger an emergency stop-loss. While the AI trend analysis indicates a weak bullish bias supported by high volume, the confidence is LOW due to significant missing or zero-value data for critical indicators like ATR, volatility, Williams %R, and Stochastic K. MACD and RSI are currently neutral, contradicting the AI's ""positive MACD crossover."" The lack of 1-hour timeframe data also limits comprehensive trend confirmation. Given the mixed and unreliable technical data, no strong buy or sell signal (technical score is below 4 for BUY and above 6 for SELL) is present to justify initiating a new trade, reinforcing the decision to hold the existing unprofitable position and await clearer market signals or price recovery.",3.0,HIGH,BULLISH,LOW,MEDIUM,50.0,38.42,38.42,4.3737104280138517e-13,0.13014055179593223,5000000.0,AGGRESSIVE
2025-08-21T17:49:14.415345,session_20250821_122042_5417,47,BATUSD,0.1529,327.011118,0.0,0.0,HOLD,MEDIUM,"Current position is unprofitable to sell (Net P&L: $-0.01, Gross P&L: $+0.00), and therefore, selling is prohibited by the CRITICAL FEE-AWARE SELL RULES unless a 2%+ stop-loss is triggered, which is not the case as the current price ($0.15) is equal to the purchase price ($0.15). Technical analysis for BATUSD across the 5-minute timeframe shows extreme consolidation with zero volatility (ATR: 0.000, 20-day Volatility: 0.000) and flat indicators (RSI: 50.0, MACD: 0.000, Price on SMAs). Despite the AI's ""BULLISH"" trend classification, its confidence is LOW, and its reasoning explicitly states ""zero volatility and no discernible trend, making directional signals highly unreliable."" There is no momentum to support an aggressive BUY, and no discernible SELL signal. With no news data available and selling prohibited, holding the current position is the only viable strategy until a clear trend or significant volatility emerges, or the position becomes profitable.",2.0,LOW,BULLISH,LOW,HIGH,50.0,0.1529,0.1529,4.930380657631324e-32,0.0,5000000.0,AGGRESSIVE
2025-08-21T17:49:14.415361,session_20250821_122042_5417,47,OXTUSD,0.06989,0.0,0.0,0.0,HOLD,HIGH,"All short-term technical indicators (RSI, MACD, SMAs, ATR, Volatility) are perfectly neutral or zero, indicating extreme price stagnation and no discernible momentum or trend. While current volume is unusually high, it has not translated into any price movement or volatility, making it a highly unreliable signal for directional action. The lack of 1-hour timeframe data prevents any medium-term trend confirmation, which is critical for making confident directional trades, especially in aggressive mode. Despite the aggressive trading mode, there are absolutely no technical signals (neither buy nor sell, well below the 4+ buy threshold or 6- sell threshold) to justify opening a position, making a HOLD the most prudent decision to avoid high-risk, baseless trades.",1.0,HIGH,NEUTRAL,HIGH,HIGH,50.0,0.06989,0.06989,0.0,0.0,5000000.0,AGGRESSIVE
