Timestamp,Session_ID,Cycle_Number,Symbol,Current_Price,Position,Unrealized_PnL,Portfolio_Allocation_Pct,AI_Action,AI_Priority,AI_Reasoning,Technical_Score,AI_Confidence,AI_Trend,Trend_Confidence,Risk_Level,RSI,SMA_20,SMA_50,MACD_Histogram,Daily_Change_Pct,Volume_Ratio,Strategy_Mode
2025-08-13T18:51:31.677048,session_20250813_180125_7144,5,AAPL,233.13,0,0.0,0.0,HOLD,LOW,"Technical score 5.5 is neutral and does not meet the 6+ threshold for a high-priority BUY. RSI is overbought (74.7) and MACD histogram is negative, indicating mixed signals. News sentiment is neutral (-0.20) and mentions the stock trading slightly lower, aligning with caution. Balanced strategy requires strong technical alignment and avoids buying on negative news.",5.0,MEDIUM,NEUTRAL,LOW,HIGH,74.71264367816099,229.71600000000004,220.9008,-0.199893470347289,0.004289636238843045,-1.0,BALANCED
2025-08-13T18:51:31.677072,session_20250813_180125_7144,5,XOM,106.56,10,0.0,0.10661190400546505,HOLD,LOW,"Despite a strong bullish technical score of 8.5, an attempt to buy 10 shares (the defined trade size) would push the total position from 10 to 20 shares, exceeding the maximum allowed shares per stock (15). Therefore, no BUY order can be placed under current constraints.",5.0,MEDIUM,BULLISH,HIGH,MEDIUM,57.78894472361817,106.31949999999999,106.755,0.05070710416987051,0.2540220152413172,-1.0,BALANCED
2025-08-13T18:51:31.677081,session_20250813_180125_7144,5,META,781.7,6,0.0,0.4692484536096399,HOLD,LOW,"Technical score is 4.5 (Neutral) and does not meet the 6+ threshold for a high-priority BUY. While news sentiment is positive (0.60), the balanced trading mode demands strong technical alignment and multiple confirming indicators. Here, MACD histogram is negative, and RSI is high, contradicting a strong buy signal.",5.0,MEDIUM,NEUTRAL,MEDIUM,MEDIUM,63.985594237695025,780.138,772.9295999999999,-0.6279071519124049,-0.40008154528311324,-1.0,BALANCED
2025-08-13T18:51:31.677087,session_20250813_180125_7144,5,AMZN,224.01,9,0.0,0.2017072011508803,HOLD,LOW,"Technical score 7.5 is bullish and typically a BUY signal. However, news sentiment is neutral/negative (-0.20) with a headline indicating ""Amazon pulls back"" and ""AWS was a bit lackluster"". Balanced strategy avoids BUYs on negative news (sentiment < -0.2) and requires news alignment for high-priority trades. The news contradicts a BUY action.",5.0,MEDIUM,BULLISH,MEDIUM,MEDIUM,64.15804327375349,222.15849999999995,220.47080000000003,0.23113352609801308,-0.2360381223835402,-1.0,BALANCED
2025-08-13T18:51:31.677094,session_20250813_180125_7144,5,NFLX,1211.66,2,0.0,0.24245003680041627,SELL,HIGH,"Technical score is 3.0 (WEAK_BEARISH), meeting the 4- threshold for a high-priority SELL. MACD histogram is strongly negative, and AI Trend is Bearish. No news sentiment is available to contradict this strong bearish signal, aligning with the balanced strategy's focus on strong technical alignment.",5.0,MEDIUM,BEARISH,MEDIUM,MEDIUM,45.175955548072075,1219.2230000000002,1193.8419999999999,-2.355506279838508,-0.7958211203720403,-1.0,BALANCED
2025-08-13T18:51:31.677100,session_20250813_180125_7144,5,MSFT,522.97,9,0.0,0.4709022587646796,HOLD,LOW,"Technical score is 0.0 (STRONG_BEARISH), indicating a strong SELL signal. However, news sentiment is overwhelmingly positive (1.20) with a headline highlighting a ""big upside quarter"" and ""Azure was the star."" The balanced trading mode explicitly states to ""Avoid SELL on strongly positive news (sentiment > +0.5)"". News sentiment overrides the technical signal for capital preservation.",5.0,MEDIUM,BEARISH,HIGH,HIGH,53.19277108433752,526.079,526.1042,-0.3701943191395848,-0.17370390165686192,-1.0,BALANCED
2025-08-13T18:51:31.677105,session_20250813_180125_7144,5,NVDA,181.53,9,0.0,0.163456578835406,SELL,HIGH,"Technical score is 4.0 (WEAK_BEARISH), meeting the 4- threshold for a high-priority SELL. MACD histogram is negative and AI Trend is Bearish. No news sentiment is available to contradict this bearish signal, aligning with the balanced strategy's focus on strong technical alignment.",5.0,MEDIUM,BEARISH,LOW,MEDIUM,43.32425068119893,182.1285,180.90879999999999,-0.281178041278677,0.1323845771967616,-1.0,BALANCED
2025-08-13T18:51:31.677111,session_20250813_180125_7144,5,TSLA,339.92,2,0.0,0.06801711413201517,SELL,HIGH,"Technical score is 2.0 (STRONG_BEARISH), clearly meeting the 4- threshold for a high-priority SELL. MACD histogram is strongly negative, and AI Trend is High Confidence Bearish. No news sentiment is available to contradict this strong bearish signal, aligning with the balanced strategy's focus on strong technical alignment.",5.0,MEDIUM,BEARISH,HIGH,MEDIUM,43.750000000000014,340.84749999999997,327.4738,-0.8605963067227664,-0.30502111684654026,-1.0,BALANCED
2025-08-13T18:51:31.677117,session_20250813_180125_7144,5,JPM,289.97,0,0.0,0.0,HOLD,LOW,"Technical score is 3.0 (WEAK_BEARISH), indicating a potential SELL. However, the portfolio currently holds 0 shares of JPM, and selling is not possible without an existing position or explicit shorting instructions, which are not provided.",5.0,MEDIUM,BEARISH,HIGH,HIGH,52.42290748898687,291.13700000000006,290.6034,-0.3490976422458288,0.5757691373868492,-1.0,BALANCED
2025-08-13T18:51:31.677125,session_20250813_180125_7144,5,ADBE,349.61,8,0.0,0.2798242324275574,HOLD,LOW,"Technical score 5.0 is neutral. While MACD histogram is strongly positive, RSI is highly overbought (76.7). The AI Trend is neutral with high risk. This creates conflicting signals. For a balanced strategy focused on capital preservation and strong technical alignment, these mixed signals do not support a clear BUY or SELL action.",5.0,MEDIUM,NEUTRAL,MEDIUM,HIGH,76.67410714285721,339.608,339.8036,1.6673824182186923,0.4568702948106522,-1.0,BALANCED
