Timestamp,Session_ID,Cycle_Number,Symbol,Current_Price,Position,Unrealized_PnL,Portfolio_Allocation_Pct,AI_Action,AI_Priority,AI_Reasoning,Technical_Score,AI_Confidence,AI_Trend,Trend_Confidence,Risk_Level,RSI,SMA_20,SMA_50,MACD_Histogram,Daily_Change_Pct,Volume_Ratio,Strategy_Mode
2025-08-19T05:29:09.103951,session_20250819_041108_9084,14,AAPL,231.64999389648438,1,-0.23164999389646823,2.3168653155771914,HOLD,HIGH,"The current 1-share position is unprofitable to sell (Net P&L: $-2.41) and does not meet the 2%+ stop-loss threshold. Per the critical fee-aware sell rules, an unprofitable position must be held. Additionally, historical trading context indicates a total of 11 AAPL shares held (10 @ $150.00, 1 @ $231.65), which exceeds the ""Max shares per stock: 10"" constraint, preventing any new BUY orders. While the 5-minute timeframe exhibits a bullish trend with price above key moving averages and a bullish SMA crossover, multiple momentum indicators (RSI at 67.2, Williams %R at -16.0, Stochastic K at 84.0) are in overbought territory. This suggests a potential for short-term consolidation or pullback. The MACD histogram is also very close to zero, indicating weakening bullish momentum. This mixed technical picture, with overbought conditions, does not provide the strong technical alignment (score 6+) required for a high-priority BUY under the balanced trading mode. No news data is available to influence the decision.",3.0,HIGH,BULLISH,HIGH,MEDIUM,67.23861168440506,231.41116943359376,231.05725646972655,0.004393814628044751,0.0,1928880.0,BALANCED
2025-08-19T05:29:09.103977,session_20250819_041108_9084,14,XOM,106.48999786376953,1,-0.10648999786376123,1.0650679430482006,HOLD,HIGH,"The current XOM position is unprofitable (Net P&L: $-2.29) and falls below the required profit threshold for selling. As per the ""CRITICAL FEE-AWARE SELL RULES,"" an unprofitable position must be held unless a stop-loss trigger (2%+ loss) is met, which is not the case here. Therefore, selling is prohibited. Technically, the 5-minute timeframe shows conflicting signals. The price is in a short-term bearish trend, trading below both the SMA 20 and SMA 50, and MACD momentum remains negative. However, key momentum indicators (RSI 14 at 18.5, Williams %R at -94.6, and Stochastic K at 5.4) are all deep in extremely oversold territory, strongly indicating that the downside may be exhausted and a short-term rebound or stabilization is probable. The AI Trend Analysis confirms a NEUTRAL trend with medium confidence, highlighting the bearish price action but also the extreme oversold conditions. Without 1-hour data, dual-timeframe confirmation is not possible, preventing a high-confidence trade decision. Given the ""BALANCED TRADING MODE"" focus on capital preservation and demanding strong technical alignment for high-priority buys (score 6+), the mixed signals do not support adding to the position at this time. The overall situation points to a need for patience and waiting for clearer directional cues or price recovery.",5.0,MEDIUM,NEUTRAL,MEDIUM,MEDIUM,18.519006894473108,106.70347061157227,106.77341583251953,-0.023407074779687828,0.0,1909589.0,BALANCED
2025-08-19T05:29:09.103986,session_20250819_041108_9084,14,META,785.39501953125,0,0.0,0.0,HOLD,MEDIUM,"The technical analysis for META on the 5-minute timeframe indicates a strong bearish trend. The price is consistently below both the SMA 20 ($786.84) and SMA 50 ($787.59), with the SMAs in bearish alignment (SMA 20 < SMA 50). The MACD shows a bearish crossover (MACD Line -0.392 below Signal -0.211) and a negative histogram (-0.181), confirming bearish momentum. The AI trend analysis also indicates a ""BEARISH"" trend with ""HIGH"" confidence and ""HIGH"" risk. While oscillators like Stochastic K (18.2) and Williams %R (-81.8) suggest oversold conditions, potentially hinting at a short-term bounce, the predominant trend indicators and AI analysis outweigh these, as they do not negate the overall downtrend. Crucially, the absence of 1-hour timeframe data prevents a dual-timeframe analysis and alignment confirmation, which is a requirement for high-confidence trades in ""BALANCED TRADING MODE"". The technical score (2) is well below the required 6+ for a high-priority BUY. Given the strong bearish signals, high risk assessment, and the strategy's focus on capital preservation and demanding strong technical alignment across multiple indicators, initiating a BUY position is not advisable. No news data is available.",2.0,MEDIUM,BEARISH,HIGH,HIGH,40.432326858108105,786.8430114746094,787.5943505859375,-0.18117054601110263,0.0,633524.0,BALANCED
2025-08-19T05:29:09.103993,session_20250819_041108_9084,14,AMZN,231.05999755859375,0,0.0,0.0,HOLD,LOW,"The 5-minute timeframe for AMZN shows bullish momentum with price above key moving averages (SMA 20, SMA 50) and a bullish MACD alignment. However, multiple oscillators including RSI (79.3), Williams %R (-26.1), and Stochastic K (73.9) are significantly overbought, indicating a high probability of a near-term pullback or consolidation. Crucially, 1-hour timeframe data is unavailable, which prevents the essential dual-timeframe analysis and trend confirmation required by the trading strategy. The AI trend analysis, while bullish, notes a ""HIGH"" risk level and ""MEDIUM"" confidence due to these overbought conditions and missing critical data. As per the 'BALANCED TRADING MODE', capital preservation is prioritized, demanding multiple confirming indicators and strong technical alignment. The mixed signals from momentum (bullish) and oscillators (overbought), coupled with the absence of medium-term trend confirmation, do not provide the robust technical score (6+ required for high-priority BUY) or alignment necessary to initiate a new BUY position. With no news data to sway the decision, the current setup points to high risk for a new long entry.",4.0,LOW,BULLISH,MEDIUM,HIGH,79.31881946105831,230.84038848876952,230.5868878173828,0.009084394451286754,0.0,1825944.0,BALANCED
2025-08-19T05:29:09.104001,session_20250819_041108_9084,14,NFLX,1238.8900146484375,1,-1.2388900146484048,12.39085422137559,HOLD,LOW,"The current NFLX position is unprofitable to sell (net P&L of $-3.42) and does not meet the 2%+ stop-loss threshold from the purchase price. According to the Critical Fee-Aware Sell Rules, an unprofitable position must be held unless a stop-loss is triggered. While the 5-minute technical indicators show a bullish trend (MACD is positive with MACD line above signal, SMA20 is above SMA50 with price above both, and AI trend analysis indicates HIGH confidence BULLISH sentiment), the RSI is overbought at 72.9. Crucially, 1-hour timeframe data is unavailable, which prevents dual-timeframe confirmation and strong technical alignment required for a high-priority BUY under Balanced Trading Mode. No news sentiment is available to provide additional conviction or risk assessment. Therefore, the most prudent action is to HOLD the existing position and await price recovery or further development in confirming higher timeframe data.",7.0,MEDIUM,BULLISH,HIGH,MEDIUM,72.89245375675233,1237.6134887695312,1237.2256103515624,0.21881703751938558,0.0,150104.0,BALANCED
2025-08-19T05:29:09.104008,session_20250819_041108_9084,14,MSFT,520.1400146484375,0,0.0,0.0,HOLD,LOW,"The AI trend analysis indicates a strong bearish trend with high confidence and high risk. While short-term indicators like RSI (11.9), Williams %R (-75.5), and Stochastic K (24.5) show oversold conditions, suggesting a potential for a short-term bounce, the prevailing trend (price below SMA 20 & 50, negative MACD) remains clearly negative. According to ""BALANCED TRADING MODE"", we must prioritize capital preservation, focus on strong technical alignment, and avoid trades during high-risk periods. Buying into a confirmed bearish trend, even if oversold, goes against these principles, especially without confirmation from a longer timeframe. The critical 1-hour timeframe data is unavailable, preventing a dual timeframe analysis and alignment, which is required for high confidence trades and for weighting medium-term trends more heavily. Without a confirmed shift in the medium-term trend or strong bullish alignment, initiating a BUY trade is not advisable. No news data is available to influence the decision.",3.0,MEDIUM,BEARISH,HIGH,HIGH,11.911426261118365,522.5582580566406,523.360556640625,-0.315885766817216,0.0,2458408.0,BALANCED
2025-08-19T05:29:09.104015,session_20250819_041108_9084,14,NVDA,180.44000244140625,0,0.0,0.0,HOLD,LOW,"The 5-minute timeframe shows severe overbought conditions across multiple key oscillators, including RSI (81.1), Williams %R (-16.4), and Stochastic K (83.6). This indicates that the current upward move is extended and highly vulnerable to a significant pullback, aligning with the AI's assessment of ""HIGH Risk Level"" and ""severe overbought conditions."" While 5-minute MACD and SMA crossovers show short-term bullish momentum, this is heavily outweighed by the extreme overbought state, which contradicts the ""strong technical alignment"" required for a BUY in ""BALANCED TRADING MODE."" Crucially, the absence of 1-hour timeframe data prevents essential medium-term trend confirmation and dual-timeframe alignment, a critical requirement for high-confidence trades and capital preservation. No news data is available. Entering a new position under such high-risk, overbought conditions without medium-term confirmation goes against the principles of capital preservation and avoiding trades during high volatility periods.",4.0,LOW,BULLISH,LOW,HIGH,81.08920650566782,180.06633911132812,180.02973571777343,0.04318354366864644,0.0,6526298.0,BALANCED
2025-08-19T05:29:09.104022,session_20250819_041108_9084,14,TSLA,330.6000061035156,0,0.0,0.0,HOLD,HIGH,"TSLA is exhibiting severely overbought conditions on the 5-minute timeframe across multiple key oscillators, including RSI (74.6), Williams %R (-3.3), and Stochastic K (96.7). This strongly suggests an imminent pullback or correction, aligning with the AI's BEARISH trend analysis and HIGH risk level despite underlying short-term bullish momentum from MACD and moving averages. The balanced trading mode prioritizes capital preservation and demands multiple confirming indicators, which are not present for a safe BUY entry, given the conflicting signals. Furthermore, the absence of 1-hour timeframe data prevents a comprehensive dual timeframe analysis, which is critical for high-confidence trades as per instructions. Entering a new position under these highly conflicted and overbought conditions, with high risk, goes against the 'BALANCED TRADING MODE' principles of avoiding trades during high volatility and focusing on strong technical alignment.",3.0,HIGH,BEARISH,MEDIUM,HIGH,74.60365734018758,329.3165008544922,329.5581958007813,0.15310033967368353,0.0,2608372.0,BALANCED
2025-08-19T05:29:09.104029,session_20250819_041108_9084,14,JPM,290.489990234375,0,0.0,0.0,HOLD,LOW,"The analysis for JPM is constrained by the absence of 1-hour timeframe data, which is critical for confirming medium-term trends and alignment as per the balanced trading mode rules. On the 5-minute timeframe, while the AI trend analysis indicates a BEARISH trend (price below SMAs, bearish MACD crossover), momentum indicators such as RSI (25.1), Stochastic K (22.6), and Williams %R (-77.4) are significantly oversold. This presents conflicting signals: a bearish trend versus an oversold condition suggesting a potential short-term bounce. Given the 'BALANCED TRADING MODE' prioritizes capital preservation, demands multiple confirming indicators, and requires strong technical alignment, these conflicting signals and the lack of a higher timeframe for confirmation mean there is no strong, clear signal for either a BUY (which would be counter-trend and lacks 6+ technical score) or a SELL (no current position, and potentially selling into an oversold bounce). Thus, it does not meet the criteria for a high-priority trade.",3.0,LOW,BEARISH,MEDIUM,MEDIUM,25.130220816156964,290.9899963378906,290.9323937988281,-0.06441966725958807,0.0,525967.0,BALANCED
2025-08-19T05:29:09.104035,session_20250819_041108_9084,14,ADBE,354.9100036621094,0,0.0,0.0,HOLD,MEDIUM,"The 5-minute timeframe indicates a bearish trend with price below both SMA 20 ($356.11) and SMA 50 ($356.30), and a bearish MACD (Line at -0.320 below Signal at -0.147). However, momentum indicators are deeply oversold with RSI at 22.7, Williams %R at -81.1, and Stochastic K at 18.9, suggesting a potential near-term rebound. This creates conflicting signals between the short-term trend and momentum. Critically, there is no 1-hour timeframe data available, which prevents confirming a medium-term trend and achieving the necessary dual-timeframe alignment for a high-confidence trade as per the ""BALANCED TRADING MODE"". The strategy demands multiple confirming indicators and strong technical alignment, which is absent due to the conflicting short-term signals and the lack of medium-term confirmation. Therefore, to prioritize capital preservation and avoid trades during periods of unclear technical alignment, a HOLD recommendation is prudent. No news data is available to influence the decision.",4.0,MEDIUM,BEARISH,MEDIUM,MEDIUM,22.685380065135035,356.1129913330078,356.2974951171875,-0.1733873479302499,0.0,281822.0,BALANCED
