Timestamp,Session_ID,Cycle_Number,Symbol,Current_Price,Position,Unrealized_PnL,Portfolio_Allocation_Pct,AI_Action,AI_Priority,AI_Reasoning,Technical_Score,AI_Confidence,AI_Trend,Trend_Confidence,Risk_Level,RSI,SMA_20,SMA_50,MACD_Histogram,Daily_Change_Pct,Volume_Ratio,Strategy_Mode
2025-08-21T02:52:16.342184,session_20250821_011837_7606,15,BTCUSD,107700.02,0.0030018399999999995,0.0,0.0,HOLD,HIGH,"The overall technical outlook for BTCUSD is strongly bearish. The price is trading below both the 5-minute SMA 20 and SMA 50, indicating a short-term downtrend. MACD shows a bearish crossover with a negative and declining histogram, confirming strong selling momentum. The AI trend analysis also indicates a HIGH confidence BEARISH trend, citing bearish moving average crossovers and high volume with negative OBV suggesting distribution. While Stochastic K is high (75.0), implying potential for a reversal from an uptrend, the dominant signals are bearish. Despite these strong bearish technical signals, the aggressive trading mode's CRITICAL FEE-AWARE SELL RULES mandate that we MUST NOT sell the current position as it is currently unprofitable (Net P&L After Fees: $-0.01) and no 2%+ stop-loss has been triggered. Therefore, the immediate action is to HOLD the existing position and await either a price recovery to profitability or a definite stop-loss trigger.",2.0,HIGH,BEARISH,HIGH,HIGH,42.857142857142854,107748.5345,107753.925,-1.8605452783509975,-0.10000201284080912,21501803.057350777,AGGRESSIVE
2025-08-21T02:52:16.342213,session_20250821_011837_7606,15,ETHUSD,2480.44,0.023158999999999996,-0.1075,0.0,HOLD,HIGH,"The current position is unprofitable (Net P&L: $-0.12) and has not triggered the 2% stop-loss threshold ($2435.38 vs Current Price $2480.44). Per critical trading rules, an unprofitable position not at stop-loss MUST be held. Technical indicators on the 5-minute timeframe are predominantly bearish (RSI 40.0, MACD bearish crossover with negative histogram, price below SMA 20 and SMA 50, AI Trend is BEARISH). Although this would typically suggest a SELL under aggressive trading mode (Technical score 6-), the unprofitable status of the current position overrides this signal. No 1-hour data is available for medium-term trend confirmation, and no news sentiment is present. Given the bearish technicals and low volatility indicating consolidation, there is no strong actionable BUY signal (Technical score is not 4+). Therefore, the mandatory ""UNPROFITABLE to sell"" rule dictates a HOLD for the existing position.",2.0,HIGH,BEARISH,MEDIUM,MEDIUM,39.9839098954147,2481.929,2481.9285999999997,-0.13993506370531986,0.0,708832.7282945818,AGGRESSIVE
2025-08-21T02:52:16.342224,session_20250821_011837_7606,15,LINKUSD,18.82231,0.0,0.0,0.0,HOLD,LOW,"All technical indicators (RSI, MACD, SMAs) are perfectly neutral for the 5-minute timeframe, indicating no discernible trend or momentum. Crucially, the ATR and 20-day Volatility are both 0.000, signifying no price movement whatsoever. While current volume is reported high, the Volume MA is 0, making the volume ratio irrelevant and suggesting static data. There is no 1-hour data or news sentiment to provide directional bias or confirmation. Given the aggressive trading mode prioritizes momentum and clear technical signals, the complete lack of movement and signals makes LINKUSD currently untradeable for profit maximization, as there is no opportunity for price appreciation or depreciation. The AI trend analysis confirms a NEUTRAL trend with LOW confidence and HIGH risk. My technical score is well below the actionable threshold for either BUY or SELL.",0.0,HIGH,N/A,N/A,N/A,50.0,18.82231,18.82231,1.8932661725304283e-29,0.0,5000000.0,AGGRESSIVE
2025-08-21T02:52:16.342236,session_20250821_011837_7606,15,LTCUSD,120.3,0.8436709999999996,-0.0255,0.0,HOLD,MEDIUM,"The current position is unprofitable to sell, as per the mandatory rule to never sell at a loss unless it's a stop-loss trigger (2%+ loss), which is not met here ($0.04 net loss is far less than 2% of position value). Despite a bullish MACD crossover, both Williams %R and Stochastic K indicators are at extremely overbought levels (100.0), strongly suggesting an imminent short-term bearish correction. This is corroborated by the AI trend analysis which explicitly states ""overbought momentum indicators... combined with high volume on negative price movement suggest potential for a short-term bearish correction."" Given the high probability of a pullback and the current unprofitable status of the position, initiating a new BUY is too risky, and selling is prohibited. Therefore, holding the position to await price recovery or clearer direction is the appropriate action.",4.0,MEDIUM,NEUTRAL,MEDIUM,MEDIUM,50.0,120.372,120.3624,0.00558334873369923,-0.09965122072745768,33637.612597460844,AGGRESSIVE
2025-08-21T02:52:16.342249,session_20250821_011837_7606,15,BCHUSD,577.66,0.5213359999999999,-0.0,0.0,HOLD,MEDIUM,"The current position for BCHUSD is unprofitable with a Net P&L of $-0.01 after accounting for trading fees. Per the mandatory fee-aware sell rules, positions showing '❌ UNPROFITABLE to sell' must be held unless a 2%+ stop-loss is triggered, which is not the case here as the gross P&L is approximately breakeven. While the 5-minute timeframe shows some short-term bullish indicators (price above SMAs, positive daily change, extremely high volume supporting the move), momentum indicators (RSI 50.0, MACD 0.000) are neutral. The AI trend is bullish but flagged with low confidence and a warning of overbought conditions despite the neutral RSI. With no 1-hour data available for medium-term trend confirmation and no immediate news catalysts, adhering to the profitability constraint is paramount. Therefore, holding the current position is the required action.",3.0,HIGH,BULLISH,LOW,MEDIUM,50.0,575.53,575.53,0.0,0.37009365280697715,5000000.0,AGGRESSIVE
2025-08-21T02:52:16.342260,session_20250821_011837_7606,15,ZECUSD,38.47,1.300714,0.0,0.0,HOLD,MEDIUM,"The current ZECUSD position is at its purchase price of $38.47. According to the ""CRITICAL FEE-AWARE SELL RULES,"" a sell action is currently ""❌ UNPROFITABLE"" as it would result in a net loss of $0.01 after fees. Therefore, a HOLD recommendation is mandatory as per rule 4, which states that I must recommend HOLD unless it's an emergency stop-loss trigger (which is not the case here).",5.0,LOW,BULLISH,LOW,MEDIUM,50.0,38.42,38.42,2.271919407036514e-28,0.13014055179593223,5000000.0,AGGRESSIVE
2025-08-21T02:52:16.342270,session_20250821_011837_7606,15,BATUSD,0.1529,327.011118,0.0,0.0,HOLD,HIGH,"The current position is unprofitable to sell, showing a Net P&L of -$0.01, which triggers the mandatory ""UNPROFITABLE to sell"" rule. Furthermore, all technical indicators (RSI at 50.0, MACD at 0.000, price at SMAs, ATR at 0.000) show complete stagnation and zero price movement on the 5-minute timeframe. The AI Trend Analysis confirms a NEUTRAL trend with HIGH confidence. Despite high current volume, it has not translated into any price action or volatility. With no actionable signals and a clear mandate against selling at a loss (which is not a 2%+ stop-loss), holding is the only viable strategy to await potential price recovery.",1.0,HIGH,NEUTRAL,HIGH,LOW,50.0,0.1529,0.1529,4.930380657631324e-32,0.0,5000000.0,AGGRESSIVE
2025-08-21T02:52:16.342283,session_20250821_011837_7606,15,OXTUSD,0.06989,0.0,0.0,0.0,HOLD,LOW,"The OXTUSD market exhibits absolute stagnation across all analyzed indicators. The current price is fixed at $0.07 with 0.00% daily change. All momentum indicators (RSI 50.0, MACD Line 0.000, MACD Signal 0.000, MACD Histogram 0.000) are perfectly neutral, and moving averages (SMA 20, SMA 50) have converged at the current price. Volatility metrics (ATR 0.000, 20-day Volatility 0.000) also show zero movement. The AI Trend Analysis confirms a ""NEUTRAL"" trend with ""HIGH"" confidence due to the complete lack of price action. Despite a significant current volume of 5,000,000, this volume does not translate into any price movement or directional signal, making the market untradeable. In aggressive mode, we seek momentum and clear signals, which are entirely absent. Entering a position in a perfectly flat market with trading fees would lead to an immediate loss without any prospect of recovery.",1.0,HIGH,NEUTRAL,HIGH,LOW,50.0,0.06989,0.06989,0.0,0.0,5000000.0,AGGRESSIVE
