Timestamp,Session_ID,Cycle_Number,Symbol,Current_Price,Position,Unrealized_PnL,Portfolio_Allocation_Pct,AI_Action,AI_Priority,AI_Reasoning,Technical_Score,AI_Confidence,AI_Trend,Trend_Confidence,Risk_Level,RSI,SMA_20,SMA_50,MACD_Histogram,Daily_Change_Pct,Volume_Ratio,Strategy_Mode
2025-08-21T02:58:54.983552,session_20250821_011837_7606,16,BTCUSD,107700.02,0.0030018399999999995,0.0,0.0,HOLD,MEDIUM,"The current BTCUSD position is unprofitable with a net P&L of $-0.01, and this loss does not meet the 2%+ stop-loss trigger. Therefore, per mandatory trading rules, the position must be held. Technically, the market presents conflicting signals: a bullish MACD crossover combined with an exceptionally high volume ratio suggests strong recent buying momentum, prioritizing momentum and volume. However, the price remains below bearishly aligned moving averages (SMA20 < SMA50), and short-term oscillators (Stochastic K and Williams %R) are extremely overbought, indicating potential for a pullback or consolidation. Without clear 1-hour data for medium-term trend confirmation, and with these conflicting short-term signals, holding is prudent given the unprofitable state of the current position.",0.0,MEDIUM,BEARISH,MEDIUM,MEDIUM,57.142857142857146,107748.5345,107756.08120000002,0.47883429446817694,0.0,21454489.849004116,AGGRESSIVE
2025-08-21T02:58:54.983582,session_20250821_011837_7606,16,ETHUSD,2480.44,0.023158999999999996,-0.1075,0.0,HOLD,HIGH,"Despite a strong bearish trend confirmed by multiple indicators (price below key moving averages, bearish MACD crossover, and high volume reinforcing the negative price movement as highlighted by the AI), our current position in ETHUSD is showing a net loss of $-0.12, rendering it unprofitable to sell after accounting for trading fees. The current loss percentage (~0.18%) is well below the mandatory 2% stop-loss threshold. According to the critical fee-aware sell rules, an unprofitable position that is not at its stop-loss must be HELD. Therefore, we will hold the existing position, awaiting either a price recovery to profitability or a deeper decline that triggers the stop-loss.",5.0,HIGH,BEARISH,HIGH,HIGH,50.0,2482.053,2481.9782,-0.05645810922530302,-0.09988239653311497,708635.9085042332,AGGRESSIVE
2025-08-21T02:58:54.983594,session_20250821_011837_7606,16,LINKUSD,18.82231,0.0,0.0,0.0,HOLD,HIGH,"All available 5-minute technical indicators (RSI, MACD, SMAs, ATR, Volatility) show zero movement or neutral values, indicating an extremely static market with no discernible trend or momentum. The AI trend analysis confirms a NEUTRAL trend with HIGH confidence due to the lack of any price or volatility movement. There is no 1-hour data available to confirm a medium-term trend. Despite aggressive trading mode, the complete absence of momentum, volatility, or any directional signal makes any trade highly speculative with no potential for profit, especially considering the $0.02 round-trip fee. Entering a position in a frozen market would only incur fees without the possibility of movement.",1.0,HIGH,NEUTRAL,HIGH,MEDIUM,50.0,18.82231,18.82231,1.8932661725304283e-29,0.0,5000000.0,AGGRESSIVE
2025-08-21T02:58:54.983605,session_20250821_011837_7606,16,LTCUSD,120.3,0.8436709999999996,-0.0255,0.0,HOLD,MEDIUM,"The current position is unprofitable (Net P&L: $-0.04) and has not triggered the 2% stop-loss threshold, thus a sale is strictly prohibited by the critical fee-aware sell rules. For potential new aggressive trades, the technical indicators are conflicting and lack clear momentum for decisive action: MACD shows very weak bullish momentum (histogram 0.003), but key oscillators like Williams %R (-0.0) and Stochastic K (100.0) are extremely overbought, strongly suggesting buying exhaustion and a potential near-term bearish reversal, as noted by the AI. The price is also currently below both SMA 20 and SMA 50. The AI trend analysis indicates a NEUTRAL trend with LOW confidence and MEDIUM risk. While current volume is exceptionally high, the price remains stagnant (+0.00% daily change), indicating indecision or a balance between supply and demand without clear direction. Given these mixed signals and the mandatory hold on the existing unprofitable position, waiting for clearer directional momentum or a confirmed breakdown/breakout is prudent, rather than initiating a new high-risk trade.",4.0,LOW,NEUTRAL,LOW,MEDIUM,53.846153846153854,120.36600000000001,120.36,0.0026237816339354466,0.0,33789.80885009969,AGGRESSIVE
2025-08-21T02:58:54.983616,session_20250821_011837_7606,16,BCHUSD,577.66,0.5213359999999999,-0.0,0.0,HOLD,MEDIUM,"Current position is unprofitable to sell (Net P&L $-0.01 after fees), mandating a HOLD as per critical fee-aware sell rules. While the 5-minute timeframe shows immediate bullish momentum with its price above SMAs and exceptionally high volume (contributing to a Technical Score of 4), the AI's analysis explicitly warns of an overbought condition due to the price being above its upper Bollinger Band, indicating a potential for a short-term pullback. Without 1-hour data for broader trend confirmation, and considering the aggressive mode's goal to maximize profit, entering a new position into an explicitly overbought state carries elevated immediate risk. Therefore, maintaining the current position and waiting for a more optimal entry point after a potential pullback is the most prudent action.",4.0,MEDIUM,BULLISH,MEDIUM,MEDIUM,50.0,575.53,575.53,0.0,0.37009365280697715,5000000.0,AGGRESSIVE
2025-08-21T02:58:54.983627,session_20250821_011837_7606,16,ZECUSD,38.47,1.300714,0.0,0.0,HOLD,LOW,"The current position is ❌ UNPROFITABLE to sell, with a Net P&L of -$0.01, which is not a 2%+ stop-loss trigger. Therefore, per CRITICAL FEE-AWARE SELL RULES, an immediate sell is prohibited. Technical analysis on the 5-minute timeframe shows mixed signals. While current volume is extremely high (5,000,000x average), indicating some buying interest, other momentum indicators like MACD and RSI are flat or neutral (MACD 0.000, RSI 50.0). Price is slightly above flat SMAs (20 & 50). The AI trend analysis indicates a ""BULLISH"" trend but with ""LOW Confidence"" and notes ""extremely low volatility"" (ATR and 20-day volatility are 0.000) and an ""overbought Bollinger Band signal,"" suggesting limited immediate upside and potential for a minor pullback. Crucially, 1-hour timeframe data is unavailable, which significantly hinders a comprehensive trend assessment for aggressive action. Given the lack of strong directional conviction for a new BUY and the mandatory HOLD constraint for the existing unprofitable position, holding is the only viable action at this time.",3.0,HIGH,BULLISH,LOW,MEDIUM,50.0,38.42,38.42,2.7767903863779616e-28,0.13014055179593223,5000000.0,AGGRESSIVE
2025-08-21T02:58:54.983637,session_20250821_011837_7606,16,BATUSD,0.1529,327.011118,0.0,0.0,HOLD,HIGH,"The current position is ❌ UNPROFITABLE to sell, with a Net P&L of $-0.01 after accounting for fees. As per mandatory fee-aware sell rules, a HOLD recommendation is required unless a 2%+ stop-loss trigger is met, which is not the case here as the price is at the presumed purchase price ($0.15). Furthermore, the asset exhibits extreme consolidation with zero price movement (Daily Change +0.00%, Current Price $0.15, Previous Close $0.15), zero volatility (ATR 0.000, 20-day Volatility 0.000), and all 5-minute technical indicators (RSI 50.0, MACD 0.000, SMAs at $0.15) are completely neutral. While the AI trend analysis states ""BULLISH,"" its confidence is LOW, and its reasoning clearly highlights ""no price movement, zero volatility,"" making any directional conviction very low. There is no momentum or discernible trend to exploit for either a BUY or SELL action, rendering the aggressive trading mode ineffective.",1.0,HIGH,BULLISH,LOW,LOW,50.0,0.1529,0.1529,4.930380657631324e-32,0.0,5000000.0,AGGRESSIVE
2025-08-21T02:58:54.983648,session_20250821_011837_7606,16,OXTUSD,0.06989,0.0,0.0,0.0,HOLD,LOW,"The market for OXTUSD is completely static, with the price fixed at $0.07 and all technical indicators (RSI, MACD, SMAs, ATR, Volatility) showing perfectly neutral or zero values. The AI trend analysis confirms extreme consolidation and a NEUTRAL trend with HIGH confidence. Despite a reported current volume of 5,000,000, this volume is not causing any price movement, and the zero volatility indicators suggest a lack of true market activity or a data anomaly. In an AGGRESSIVE TRADING MODE, we prioritize momentum and clear signals for decisive action. There are no technical signals whatsoever for a BUY (required technical score 4+) or SELL, as the asset is exhibiting no discernible price action or volatility. Entering a trade under these conditions would immediately incur fees with no potential for immediate profit. It is best to wait for a clear trend, momentum, or volatility to emerge.",0.0,HIGH,NEUTRAL,HIGH,LOW,50.0,0.06989,0.06989,0.0,0.0,5000000.0,AGGRESSIVE
