Timestamp,Session_ID,Cycle_Number,Symbol,Current_Price,Position,Unrealized_PnL,Portfolio_Allocation_Pct,AI_Action,AI_Priority,AI_Reasoning,Technical_Score,AI_Confidence,AI_Trend,Trend_Confidence,Risk_Level,RSI,SMA_20,SMA_50,MACD_Histogram,Daily_Change_Pct,Volume_Ratio,Strategy_Mode
2025-08-19T06:04:26.882850,session_20250819_041108_9084,20,AAPL,231.64999389648438,2,-0.46329998779293646,4.6338379909395755,HOLD,MEDIUM,"The current position of 2 shares is unprofitable to sell with a Net P&L of $-2.64, which is below the mandatory profit threshold and not a stop-loss trigger. Therefore, holding is required by the fee-aware sell rules. While the 5-minute technical analysis shows a strong bullish trend (price above SMA 20 and SMA 50, bullish MACD crossover, and an AI technical score of 9.5/10 with high confidence), momentum indicators such as RSI (67.2), Williams %R (-16.0), and Stochastic K (84.0) are in overbought territory. The AI's own reasoning highlights this, suggesting a ""potential for a short-term pullback."" The absence of 1-hour timeframe data prevents crucial dual-timeframe confirmation, a key requirement for high-priority trades in Balanced Trading Mode. Additionally, the extremely high volume ratio indicates a period of high volatility, which should be avoided as per the strategy. There is no news sentiment available to provide further alignment or mitigate risk for a new high-priority buy. Given these factors, holding the existing unprofitable position and refraining from new purchases until clearer, less volatile conditions and/or a pullback occurs is the most aligned action with the balanced trading mode.",9.5,MEDIUM,BULLISH,HIGH,MEDIUM,67.23861168440506,231.41116943359376,231.05725646972655,0.004393814628044751,0.0,1928880.0,BALANCED
2025-08-19T06:04:26.882876,session_20250819_041108_9084,20,XOM,106.48999786376953,1,-0.10648999786376123,1.0650926198096877,HOLD,MEDIUM,"The current XOM position is unprofitable (Net P&L: $-2.29), falling below the mandatory profit threshold required for a sale. Based on the ""CRITICAL FEE-AWARE SELL RULES,"" a sell is explicitly prohibited as it is not an emergency stop-loss (loss is only $-0.11, far less than 2%). Technical analysis for the 5-minute timeframe shows the stock is extremely oversold, with RSI at 18.5, Williams %R at -94.6, and Stochastic K at 5.4. This strongly suggests an imminent price rebound or reversal, supporting holding the position to await recovery. While MACD and price below SMAs indicate bearish momentum, the extreme oversold conditions are a strong counter-signal for selling at a loss. The absence of 1-hour data prevents comprehensive dual-timeframe analysis and trend confirmation for a new BUY order, and the high volume ratio suggests increased volatility, which is to be avoided in balanced mode. Therefore, holding the existing position is the most prudent action.",5.0,MEDIUM,NEUTRAL,MEDIUM,MEDIUM,18.519006894473108,106.70347061157227,106.77341583251953,-0.023407074779687828,0.0,1909589.0,BALANCED
2025-08-19T06:04:26.882884,session_20250819_041108_9084,20,META,785.39501953125,0,0.0,0.0,HOLD,LOW,"The 5-minute timeframe for META indicates a strong bearish trend with bearishly configured moving averages (SMA20 < SMA50) and negative MACD momentum. This is confirmed by the AI trend analysis, which identifies a BEARISH trend with HIGH confidence. However, short-term oscillators like Williams %R and Stochastic K are deeply oversold, suggesting the potential for a temporary price rebound. Crucially, there is NO 1-HOUR TIMEFRAME DATA available, which prevents comprehensive dual-timeframe analysis. According to the ""CRITICAL DUAL TIMEFRAME INSTRUCTION,"" high confidence is only achievable when both timeframes agree. The ""Balanced Trading Mode"" prioritizes capital preservation, demands multiple confirming indicators across timeframes, and advises avoiding trades during high volatility periods. The extremely high Volume Ratio indicates significant current activity and potential high volatility, further reinforcing the need for caution. Given the missing higher timeframe confirmation, the potential for a short-term bounce from oversold conditions, and the high volatility, entering a new position (either buy or sell) does not align with the strategy's requirements for strong technical alignment and capital preservation. Therefore, a HOLD recommendation is most prudent to await clearer multi-timeframe alignment or a less volatile market condition.",2.0,LOW,BEARISH,HIGH,MEDIUM,40.432326858108105,786.8430114746094,787.5943505859375,-0.18117054601110263,0.0,633524.0,BALANCED
2025-08-19T06:04:26.882892,session_20250819_041108_9084,20,AMZN,231.05999755859375,0,0.0,0.0,HOLD,LOW,"While the 5-minute timeframe shows a strong bullish trend with price trading above key moving averages (SMA 20 > SMA 50) and a bullish MACD crossover, several critical factors prevent an immediate buy recommendation. Firstly, key momentum indicators (RSI 79.3, Williams %R -26.1, Stochastic K 73.9) are deeply in overbought territory, suggesting a high probability of a short-term pullback or consolidation, which is unfavorable for initiating a new long position in a balanced strategy. Secondly, and most critically, there is NO 1-HOUR TIMEFRAME DATA available. The ""BALANCED TRADING MODE"" explicitly states to weight 1-hour trends more heavily for direction and requires timeframe alignment for high confidence trades. Without this crucial medium-term confirmation, a high-priority or even medium-priority trade cannot be made as per strategy rules. Furthermore, the current volume and ATR indicate high volatility, which the strategy aims to avoid for trades. Given the overbought short-term conditions, the absence of medium-term trend confirmation, and high volatility, a cautious HOLD is the most appropriate action to prioritize capital preservation and await clearer, less volatile signals.",5.0,LOW,BULLISH,HIGH,MEDIUM,79.31881946105831,230.84038848876952,230.5868878173828,0.009084394451286754,0.0,1825944.0,BALANCED
2025-08-19T06:04:26.882899,session_20250819_041108_9084,20,NFLX,1238.8900146484375,1,-1.2388900146484048,12.391141307430749,HOLD,LOW,"The current NFLX position is unprofitable, with a net P&L of $-3.42, which is significantly below the $2.18 round-trip fee threshold. According to the critical fee-aware sell rules, we MUST recommend HOLD unless an emergency stop-loss (2%+ loss) is triggered, which is not the case here. While the 5-minute timeframe shows some bullish indicators like MACD momentum and bullish SMA alignment, the RSI is in overbought territory (72.9), suggesting a potential short-term pullback. Crucially, 1-hour timeframe data is unavailable, preventing a comprehensive dual-timeframe analysis as required by the BALANCED TRADING MODE. The AI Trend Analysis also indicates ""MEDIUM"" confidence and ""HIGH"" risk due to the overbought RSI and missing critical trend/volume data for full confirmation. For a BUY action, the strategy requires a technical score of 6+ and multiple confirming indicators, especially across both timeframes, which is not met due to the missing 1-hour data and conflicting signals. Given the unprofitability of the current position and the lack of strong, confirmed bullish signals aligned with the balanced trading strategy's stringent requirements, holding is the most prudent action.",4.0,LOW,BULLISH,MEDIUM,HIGH,72.89245375675233,1237.6134887695312,1237.2256103515624,0.21881703751938558,0.0,150104.0,BALANCED
2025-08-19T06:04:26.882907,session_20250819_041108_9084,20,MSFT,520.1400146484375,0,0.0,0.0,HOLD,LOW,"The 5-minute analysis for MSFT presents conflicting signals, preventing a high-confidence trade according to the Balanced Trading Mode. While the stock shows a clear bearish trend with price trading below both the SMA 20 ($522.56) and SMA 50 ($523.36), and MACD lines and histogram are negative (-0.749, -0.316), indicating negative momentum, the oscillators (RSI at 11.9, Williams %R at -75.5, Stochastic K at 24.5) are all deeply oversold. This suggests a potential for a short-term bounce, but not necessarily a reversal of the underlying bearish trend. The AI trend analysis confirms a ""BEARISH"" trend with ""MEDIUM"" confidence and ""HIGH"" risk, explicitly noting the conflict between the bearish trend and oversold conditions. With no 1-hour data available, there is no higher timeframe confirmation. The Balanced Trading Mode demands strong technical alignment, multiple confirming indicators, and prioritizes capital preservation, avoiding trades during high volatility or high risk. The current mixed signals and high-risk assessment do not meet these criteria for a BUY. Furthermore, there is no news data to influence the decision. A BUY recommendation would require a technical score of 6+ and clearer alignment, which is not present. Given no current position, the most prudent action is to wait for clearer directional signals or stronger technical alignment before considering a trade.",3.0,MEDIUM,BEARISH,MEDIUM,HIGH,11.911426261118365,522.5582580566406,523.360556640625,-0.315885766817216,0.0,2458408.0,BALANCED
2025-08-19T06:04:26.882914,session_20250819_041108_9084,20,NVDA,180.44000244140625,0,0.0,0.0,HOLD,LOW,"The 5-minute timeframe shows an established bullish trend with price above key moving averages and a bullish MACD signal. However, critical momentum indicators including RSI (81.1), Williams %R (-16.4), and Stochastic K (83.6) are all in extreme overbought territory, strongly suggesting an imminent pullback or consolidation. The AI trend analysis explicitly notes a ""HIGH"" risk level due to these overbought conditions. Furthermore, the absence of 1-hour timeframe data prevents a comprehensive dual-timeframe analysis and alignment, which is critical for high-confidence trades in BALANCED TRADING MODE. Entering a long position under these conflicting and high-risk conditions does not align with the strategy's emphasis on capital preservation, multiple confirming indicators, and strong technical alignment. Waiting for a more favorable entry point after a potential pullback or for clearer multi-timeframe confirmation is prudent.",2.0,LOW,BULLISH,MEDIUM,HIGH,81.08920650566782,180.06633911132812,180.02973571777343,0.04318354366864644,0.0,6526298.0,BALANCED
2025-08-19T06:04:26.882921,session_20250819_041108_9084,20,TSLA,330.6000061035156,0,0.0,0.0,HOLD,LOW,"The analysis presents conflicting signals, making a high-confidence trade impossible under the BALANCED TRADING MODE. While the 5-minute timeframe shows some short-term bullish momentum (MACD bullish crossover, price above SMA 20 and SMA 50), the technical indicators (RSI at 74.6, Williams %R at -3.3, Stochastic K at 96.7) indicate extreme overbought conditions. The AI Trend Analysis explicitly identifies a ""BEARISH"" trend with ""HIGH"" risk, citing these overbought conditions as indicative of an impending pullback or significant correction. Critically, there is NO 1-HOUR TIMEFRAME DATA available, which prevents dual timeframe analysis and adherence to the rule of weighting 1-hour trends more heavily for direction and requiring alignment for high confidence. The BALANCED TRADING MODE prioritizes capital preservation, demands multiple confirming indicators, and advises avoiding trades during high volatility or without strong technical alignment. Here, indicators are conflicting (short-term momentum vs. extreme overbought), volatility is high (volume ratio), and dual-timeframe alignment is impossible. Initiating a BUY position is too risky given the overbought state and bearish AI outlook. While the overbought conditions could suggest a SELL (short), the strategy primarily focuses on long positions, and the conflicting short-term bullish momentum, combined with the lack of medium-term confirmation, makes even a short position too ambiguous for a high-priority trade under the given constraints. Therefore, the most prudent action is to HOLD cash and wait for clearer, more aligned signals, especially with the absence of crucial 1-hour data.",3.0,LOW,BEARISH,MEDIUM,HIGH,74.60365734018758,329.3165008544922,329.5581958007813,0.15310033967368353,0.0,2608372.0,BALANCED
2025-08-19T06:04:26.882928,session_20250819_041108_9084,20,JPM,290.489990234375,0,0.0,0.0,HOLD,LOW,"The 5-minute timeframe for JPM shows a bearish trend with price trading below both the SMA 20 and SMA 50, and MACD indicating bearish momentum. However, multiple momentum indicators (RSI, Stochastic K, Williams %R) are significantly oversold, suggesting selling pressure might be exhausting and a short-term bounce is possible. This creates conflicting signals; the primary trend is bearish, while oscillators suggest a potential counter-trend bounce. Crucially, no 1-hour timeframe data is available, which prevents dual-timeframe analysis and alignment, a mandatory requirement for high-confidence trades in 'BALANCED TRADING MODE'. The strategy demands strong technical alignment and a technical score of 6+ for a BUY, neither of which are met given the conflicting 5-minute signals and absence of higher timeframe confirmation. Capital preservation and adherence to the balanced strategy's rules, which prioritize clear, confirming signals, dictate no action at this time.",3.0,LOW,BEARISH,MEDIUM,MEDIUM,25.130220816156964,290.9899963378906,290.9323937988281,-0.06441966725958807,0.0,525967.0,BALANCED
2025-08-19T06:04:26.882934,session_20250819_041108_9084,20,ADBE,354.9100036621094,0,0.0,0.0,HOLD,LOW,"The technical analysis for ADBE presents conflicting signals in the 5-minute timeframe. While the price is in a short-term downtrend, confirmed by bearish SMA alignment (price below SMA 20 and SMA 50) and negative MACD indicators, key momentum oscillators (RSI at 22.7, Williams %R at -81.1, and Stochastic K at 18.9) are all indicating deeply oversold conditions. This suggests a potential for a short-term bounce or reversal. However, a critical limitation is the complete absence of 1-hour timeframe data. Our balanced trading mode mandates weighing 1-hour trends more heavily and achieving high confidence only when both timeframes agree. Without medium-term trend confirmation, and with the existing conflict between short-term trend and momentum indicators, there is no strong technical alignment to justify a BUY signal, especially considering the ""BALANCED TRADING MODE"" which prioritizes capital preservation and requires a technical score of 6+ for high-priority BUYs. The lack of news sentiment also means there's no external catalyst to override the technical ambiguity. Therefore, the prudent action is to HOLD and await clearer signals, such as a confirmed reversal pattern or the availability of medium-term data for trend confirmation.",4.0,LOW,BEARISH,MEDIUM,MEDIUM,22.685380065135035,356.1129913330078,356.2974951171875,-0.1733873479302499,0.0,281822.0,BALANCED
