Timestamp,Session_ID,Cycle_Number,Symbol,Current_Price,Position,Unrealized_PnL,Portfolio_Allocation_Pct,AI_Action,AI_Priority,AI_Reasoning,Technical_Score,AI_Confidence,AI_Trend,Trend_Confidence,Risk_Level,RSI,SMA_20,SMA_50,MACD_Histogram,Daily_Change_Pct,Volume_Ratio,Strategy_Mode
2025-08-21T03:12:10.008230,session_20250821_011837_7606,18,BTCUSD,107700.02,0.0030018399999999995,0.0,0.0,HOLD,MEDIUM,"Despite strong bearish technical signals from MACD (Line: -9.766, Histogram: -5.563) and key moving averages (current price $107700.02 below SMA 20: $107753.93 and SMA 50: $107758.24), coupled with an AI trend analysis indicating a MEDIUM confidence BEARISH trend, we are currently holding an unprofitable position. The current position profitability analysis explicitly states ""❌ UNPROFITABLE to sell"" with a net P&L of $-0.01. According to the mandatory critical fee-aware sell rules, we MUST recommend HOLD unless a 2%+ stop-loss is triggered, which is not the case here (gross P&L is $0.00). Therefore, we will hold the position and wait for price recovery or a valid stop-loss trigger before considering an exit.",3.0,HIGH,BEARISH,MEDIUM,MEDIUM,42.857142857142854,107753.925,107758.2374,-5.562708404634558,0.0,21525032.346887536,AGGRESSIVE
2025-08-21T03:12:10.008260,session_20250821_011837_7606,18,ETHUSD,2485.41,0.023158999999999996,0.0076,0.0,HOLD,MEDIUM,"The primary reason for recommending HOLD is that the current ETHUSD position is explicitly listed as ""❌ UNPROFITABLE to sell"" after accounting for trading fees (Net P&L After Fees: $-0.00), and it has not triggered the 2%+ stop-loss threshold. According to the mandatory fee-aware sell rules, I MUST recommend HOLD for existing positions under these conditions.",5.0,LOW,BEARISH,MEDIUM,HIGH,42.873563218390416,2481.9289999999996,2481.9782,-0.02784355256991254,0.09988199425678608,706465.283808823,AGGRESSIVE
2025-08-21T03:12:10.008273,session_20250821_011837_7606,18,LINKUSD,18.82231,0.0,0.0,0.0,HOLD,LOW,"Despite ""AGGRESSIVE TRADING MODE ACTIVE"", the data for LINKUSD shows an extreme absence of price movement and a discernible trend. All key indicators (RSI: 50.0, MACD: 0.000, SMA 20/50: $18.82, ATR: 0.000, 20-day Volatility: 0.000) are perfectly neutral or zero. While current volume is high at 5,000,000 (5000000.00x average), it has not translated into any price change, indicating inert trading or a data anomaly rather than directional momentum. The AI Trend Analysis confirms a NEUTRAL trend with HIGH confidence and LOW risk, due to the lack of movement. As an aggressive trader prioritizing momentum and clear technical signals, there is no actionable setup to maximize profit or accept risk for potential returns in this flat market. Entering a position without a discernible trend or momentum goes against the principles of exploiting market imbalances.",5.0,HIGH,NEUTRAL,HIGH,LOW,50.0,18.82231,18.82231,1.8932661725304283e-29,0.0,5000000.0,AGGRESSIVE
2025-08-21T03:12:10.008284,session_20250821_011837_7606,18,LTCUSD,120.3,0.8436709999999996,-0.0255,0.0,HOLD,HIGH,"The current position is unprofitable (Net P&L $-0.04) and below the mandatory profit threshold for selling, as indicated by the ""❌ UNPROFITABLE to sell"" status. The current loss of only 0.0249% is significantly below the 2%+ stop-loss trigger, thus mandating a HOLD as per aggressive trading rules. While the AI trend analysis indicates a BEARISH trend with medium confidence, supported by price being below SMAs and bearish MACD signals in the 5-minute timeframe, both the Stochastic K (0.0) and Williams %R (-100.0) show extreme oversold conditions. This confluence of high selling volume and extreme oversold readings could signal a potential for a near-term bounce or reversal, providing a basis to hold and await price recovery rather than realizing a loss. No news sentiment is available to influence the decision.",3.0,MEDIUM,BEARISH,MEDIUM,MEDIUM,45.45454545454546,120.35999999999999,120.3576,-0.002893565271478529,-0.09965122072745768,34086.370928933364,AGGRESSIVE
2025-08-21T03:12:10.008296,session_20250821_011837_7606,18,BCHUSD,577.66,0.5213359999999999,-0.0,0.0,BUY,MEDIUM,"The 5-minute timeframe indicates short-term bullish momentum with the current price of $577.66 trading above both the SMA 20 ($575.53) and SMA 50 ($575.53). Current volume is exceptionally high at 5,000,000, which in an aggressive trading mode with a focus on momentum and volume, is a strong signal for potential upward movement, despite the unusual Volume MA of 0. While RSI is neutral at 50.0 and MACD is flat, these do not negate the bullish signals from price action and volume. The AI trend analysis also identifies a ""BULLISH"" trend, albeit with medium confidence and some contradictory reasoning regarding being ""overbought"" (which is not supported by RSI 50.0). As there is no negative news to trigger a SELL and the current position is unprofitable to sell ($-0.01 net P&L), adding to the position is aligned with the aggressive strategy to maximize profit and capitalize on identified momentum.",5.0,MEDIUM,BULLISH,MEDIUM,HIGH,50.0,575.53,575.53,0.0,0.37009365280697715,5000000.0,AGGRESSIVE
2025-08-21T03:12:10.008306,session_20250821_011837_7606,18,ZECUSD,38.47,1.300714,0.0,0.0,HOLD,HIGH,"The primary reason for recommending HOLD is the mandatory ""CRITICAL FEE-AWARE SELL RULE"" which states that if the current position is ""❌ UNPROFITABLE to sell"" (as is the case here with a Net P&L of $-0.01), a HOLD action is required unless a stop-loss (2%+ loss) is triggered, which it is not.",5.0,LOW,BULLISH,LOW,MEDIUM,50.0,38.42,38.42,5.301145283085199e-28,0.13014055179593223,5000000.0,AGGRESSIVE
2025-08-21T03:12:10.008316,session_20250821_011837_7606,18,BATUSD,0.1529,327.011118,0.0,0.0,HOLD,HIGH,"The current position is explicitly designated as ""UNPROFITABLE to sell"" (Net P&L After Fees: $-0.01) based on the provided profitability analysis. According to the CRITICAL FEE-AWARE SELL RULES, an unprofitable position must be HELD unless an emergency stop-loss (2%+ loss) is triggered. The current price ($0.15) is equal to the purchase price ($0.15), meaning no stop-loss condition has been met. Furthermore, all technical indicators (RSI, MACD, SMAs, ATR, Volatility) are completely flat or at zero, indicating a strong lack of momentum or discernible trend on the 5-minute timeframe. There is no 1-hour data for medium-term confirmation. The AI trend analysis confirms a ""NEUTRAL"" trend with ""HIGH"" confidence. No news sentiment is available to provide additional bias. The very high current volume with a zero moving average and zero volatility is highly anomalous and does not provide actionable momentum in this context.",1.0,HIGH,NEUTRAL,HIGH,LOW,50.0,0.1529,0.1529,4.930380657631324e-32,0.0,5000000.0,AGGRESSIVE
2025-08-21T03:12:10.008327,session_20250821_011837_7606,18,OXTUSD,0.06989,0.0,0.0,0.0,HOLD,LOW,"All 5-minute technical indicators including RSI (50.0), MACD (flat at 0.000), SMA 20 ($0.07), and SMA 50 ($0.07) are perfectly neutral and show no price movement or momentum. Volatility indicators (ATR and 20-day Volatility) are also zero, confirming an extreme lack of price action. The AI trend analysis rates the trend as NEUTRAL with HIGH confidence, citing the flatness of all major indicators. Despite a current volume of 5,000,000, the zero volume MA and zero volatility indicate this volume is not translating into any price change. There is no 1-hour data to provide a medium-term trend. In aggressive trading mode, while we seek to maximize profit, there is no discernible trend or momentum to exploit for a BUY signal (which requires a technical score of 4+). Entering a position under these conditions would be pure speculation without any technical edge. No news data is available to influence the decision.",0.0,HIGH,NEUTRAL,HIGH,LOW,50.0,0.06989,0.06989,0.0,0.0,5000000.0,AGGRESSIVE
