Timestamp,Session_ID,Cycle_Number,Symbol,Current_Price,Position,Unrealized_PnL,Portfolio_Allocation_Pct,AI_Action,AI_Priority,AI_Reasoning,Technical_Score,AI_Confidence,AI_Trend,Trend_Confidence,Risk_Level,RSI,SMA_20,SMA_50,MACD_Histogram,Daily_Change_Pct,Volume_Ratio,Strategy_Mode
2025-08-19T05:23:14.044405,session_20250819_041108_9084,13,AAPL,231.64999389648438,1,-0.23164999389646823,2.3168653155771914,HOLD,LOW,"The current position is UNPROFITABLE to sell (Net P&L $-2.41) and is not at the 2% stop-loss threshold. According to the ""CRITICAL FEE-AWARE SELL RULES"", a SELL is prohibited, mandating a HOLD for the existing position. While 5-minute technicals are strongly bullish (price above SMAs, bullish MACD, high volume, and AI confirming a 'BULLISH' trend with 'HIGH' confidence), momentum indicators (RSI 67.2, Williams %R -16.0, Stochastic K 84.0) show AAPL is in overbought territory, indicating a potential for a short-term pullback. Crucially, there is NO 1-HOUR TIMEFRAME DATA available. The 'BALANCED TRADING MODE' prioritizes weighting 1-hour trends more heavily and requires timeframe alignment for high-confidence trades. Without this essential medium-term confirmation, and with short-term overbought conditions, initiating a new BUY trade would contradict the strategy's capital preservation priority and demand for strong technical alignment across multiple timeframes. No news data available to influence the decision.",9.0,LOW,BULLISH,HIGH,MEDIUM,67.23861168440506,231.41116943359376,231.05725646972655,0.004393814628044751,0.0,1928880.0,BALANCED
2025-08-19T05:23:14.044431,session_20250819_041108_9084,13,XOM,106.48999786376953,1,-0.10648999786376123,1.0650679430482006,HOLD,LOW,"The primary reason for HOLD is that the current position for XOM is significantly unprofitable (Net P&L: $-2.29) and has not yet reached the 2%+ stop-loss threshold, making a sell action strictly against the critical fee-aware sell rules. Furthermore, while 5-minute technical indicators such as RSI (18.5), Williams %R (-94.6), and Stochastic K (5.4) show extreme oversold conditions, strongly suggesting an imminent bounce, the stock remains in a short-term bearish trend with price below key moving averages (SMA 20: $106.70, SMA 50: $106.77) and a bearish MACD. Crucially, there is no 1-hour timeframe data available, which prevents comprehensive dual-timeframe analysis and alignment. Without medium-term trend confirmation, initiating a new BUY trade would contradict the 'Balanced Trading Mode' principles of demanding multiple confirming indicators across *both* timeframes and prioritizing capital preservation by avoiding trades without strong technical alignment. News sentiment is not available, therefore it does not influence the decision.",5.0,LOW,NEUTRAL,MEDIUM,MEDIUM,18.519006894473108,106.70347061157227,106.77341583251953,-0.023407074779687828,0.0,1909589.0,BALANCED
2025-08-19T05:23:14.044440,session_20250819_041108_9084,13,META,785.39501953125,0,0.0,0.0,HOLD,LOW,"Comprehensive analysis indicates highly unreliable market data for META. Crucially, the 1-hour timeframe data is unavailable, preventing the necessary dual-timeframe confirmation for a high-confidence trade, as per the balanced trading mode strategy. The 5-minute data shows a static daily change of 0.00% and a Volume MA of 0, which severely limits the reliability of current market dynamics. While some indicators (Price below SMAs, bearish MACD crossover) suggest a bearish lean, momentum indicators (Stochastic, Williams %R) are deeply oversold, hinting at a potential bounce. The AI Trend Analysis explicitly states ""Confidence: LOW"" due to these data limitations. Given the balanced trading mode's emphasis on capital preservation, requiring multiple confirming indicators, and avoiding trades during periods of high volatility or unreliable data, initiating any position under these conditions would be high risk and contrary to the strategy. Without reliable and complete data, especially the critical 1-hour timeframe, a HOLD recommendation is warranted to preserve capital.",4.0,LOW,BEARISH,LOW,MEDIUM,40.432326858108105,786.8430114746094,787.5943505859375,-0.18117054601110263,0.0,633524.0,BALANCED
2025-08-19T05:23:14.044448,session_20250819_041108_9084,13,AMZN,231.05999755859375,0,0.0,0.0,HOLD,LOW,"The 5-minute timeframe shows a short-term bullish trend with price above key moving averages and a bullish MACD cross. However, momentum indicators such as RSI (79.3), Stochastic K (73.9), and Williams %R (-26.1) are all significantly overbought, indicating a high probability of a near-term pullback or consolidation. The AI trend analysis, while bullish, explicitly warns of a ""HIGH"" risk level due to these overbought conditions and notes that momentum indicators ""suggesting a potential for pullback or consolidation."" Crucially, no 1-hour timeframe data is available, preventing the essential dual-timeframe confirmation required by the balanced trading mode for high-confidence trades. The 'BALANCED TRADING MODE' prioritizes capital preservation, requires a technical score of 6+ for a high-priority BUY, demands multiple confirming indicators, and advises avoiding trades during high volatility/risk periods. Given the overbought momentum, the high AI risk assessment, and the lack of multi-timeframe confirmation, the conditions do not meet the criteria for a safe or high-priority BUY. Remaining in HOLD is the most prudent action.",3.0,HIGH,BULLISH,MEDIUM,HIGH,79.31881946105831,230.84038848876952,230.5868878173828,0.009084394451286754,0.0,1825944.0,BALANCED
2025-08-19T05:23:14.044465,session_20250819_041108_9084,13,NFLX,1238.8900146484375,1,-1.2388900146484048,12.39085422137559,HOLD,MEDIUM,"The existing NFLX position is currently unprofitable with a Net P&L of $-3.42, which is below the critical $2.18 profitability threshold and not a 2%+ loss to trigger a stop-loss. Per the critical fee-aware sell rules, an unprofitable position must be held. For adding to the position or initiating a new trade, while the 5-minute timeframe shows bullish indicators (price above bullish-aligned SMA 20 and SMA 50, positive MACD with bullish crossover), the RSI (14) is overbought at 72.9, indicating potential for a near-term pullback. Crucially, 1-hour timeframe data is unavailable, which is a major constraint as the ""BALANCED TRADING MODE"" requires weighting 1-hour trends more heavily and demands dual-timeframe alignment for high-confidence trades. The AI's analysis also flags a ""HIGH Risk"" despite a ""BULLISH"" trend, and its confidence is only ""MEDIUM"" due to the overbought RSI and lack of dual timeframe. Without the necessary medium-term trend confirmation and with short-term overbought conditions and high AI risk, initiating a new BUY order does not meet the strategy's requirements for strong technical alignment and capital preservation. Therefore, the prudent action is to HOLD the current position and await more confirming data or better entry points.",5.0,MEDIUM,BULLISH,MEDIUM,HIGH,72.89245375675233,1237.6134887695312,1237.2256103515624,0.21881703751938558,0.0,150104.0,BALANCED
2025-08-19T05:23:14.044472,session_20250819_041108_9084,13,MSFT,520.1400146484375,0,0.0,0.0,HOLD,LOW,"The 5-minute timeframe for MSFT presents conflicting technical signals. The stock is in a clear bearish trend, with price trading below the SMA 20 ($522.56) and SMA 50 ($523.36), and MACD line below its signal line (-0.749 vs -0.433). This is further confirmed by the AI trend analysis identifying a 'BEARISH' trend with 'MEDIUM' confidence and 'HIGH' risk. However, multiple momentum indicators, including RSI (11.9), Williams %R (-75.5), and Stochastic K (24.5), show severely oversold conditions, suggesting a strong potential for a short-term rebound.",5.0,LOW,BEARISH,MEDIUM,HIGH,11.911426261118365,522.5582580566406,523.360556640625,-0.315885766817216,0.0,2458408.0,BALANCED
2025-08-19T05:23:14.044480,session_20250819_041108_9084,13,NVDA,180.44000244140625,0,0.0,0.0,HOLD,LOW,"While short-term 5-minute indicators like MACD (positive histogram and cross, line above signal) and price relative to SMAs (price $180.44 above SMA 20 at $180.07 and SMA 50 at $180.03) suggest bullish momentum, this is severely contradicted by multiple overbought oscillators. RSI (14) at 81.1, Williams %R at -16.4, and Stochastic K at 83.6 all indicate the stock is highly overextended. The AI trend analysis identifies the trend as NEUTRAL with a HIGH risk level, explicitly stating a ""high likelihood of an imminent correction or consolidation"" due to these overbought conditions. Given the ""BALANCED TRADING MODE"" which prioritizes capital preservation, demands multiple confirming indicators, and avoids trades during high volatility, entering a BUY position at such an elevated and overbought level is contrary to the strategy's risk management principles. The lack of 1-hour timeframe data also prevents robust dual-timeframe confirmation, further reducing confidence for any high-priority trade. No news sentiment is available to sway the decision. As there is no current position, the recommendation is to HOLD and avoid entry.",3.0,MEDIUM,NEUTRAL,MEDIUM,HIGH,81.08920650566782,180.06633911132812,180.02973571777343,0.04318354366864644,0.0,6526298.0,BALANCED
2025-08-19T05:23:14.044488,session_20250819_041108_9084,13,TSLA,330.6000061035156,0,0.0,0.0,HOLD,MEDIUM,"A BUY action is not recommended due to several critical factors. The 1-hour timeframe data is unavailable, which prevents dual timeframe analysis and confirmation, making any high-confidence directional trade impossible as per the trading strategy. On the 5-minute timeframe, while MACD and price above SMAs show short-term bullish momentum, TSLA is severely overbought across multiple oscillators (RSI at 74.6, Williams %R at -3.3, Stochastic K at 96.7). The AI trend analysis confirms a BEARISH outlook with MEDIUM confidence and HIGH risk, explicitly stating a high probability of an imminent price pullback due to overbought conditions. Furthermore, the volume ratio is extremely high, indicating high volatility, which the balanced trading mode seeks to avoid. There is no strong technical alignment for a BUY, as the overbought signals strongly contradict a continued upward trend. Capital preservation is prioritized, and entering a position under these conditions (overbought, high volatility, predicted pullback, no dual-timeframe confirmation) would be highly risky and counter to the balanced trading mode's principles.",3.0,HIGH,BEARISH,MEDIUM,HIGH,74.60365734018758,329.3165008544922,329.5581958007813,0.15310033967368353,0.0,2608372.0,BALANCED
2025-08-19T05:23:14.044494,session_20250819_041108_9084,13,JPM,290.489990234375,0,0.0,0.0,HOLD,LOW,"The 5-minute analysis shows JPM trading below its SMA 20 and SMA 50, with bearish MACD signals (MACD Line -0.091, MACD Signal -0.027, Histogram -0.064), supporting a short-term bearish trend. However, multiple momentum indicators (RSI at 25.1, Williams %R at -77.4, Stochastic K at 22.6) are deeply oversold, suggesting a potential short-term rebound or reversal. The AI trend analysis confirms a 'BEARISH' trend but with 'LOW Confidence' due to these oversold conditions. Crucially, there is no 1-hour timeframe data available, preventing dual timeframe confirmation and strong technical alignment. In 'BALANCED TRADING MODE', the strategy demands multiple confirming indicators and strong technical alignment, which is not present due to the conflicting signals between trend and momentum. With no clear directional confirmation and given the absence of a current position, a 'HOLD' recommendation is prudent to prioritize capital preservation and avoid trades during periods of ambiguity.",4.0,LOW,BEARISH,LOW,MEDIUM,25.130220816156964,290.9899963378906,290.9323937988281,-0.06441966725958807,0.0,525967.0,BALANCED
2025-08-19T05:23:14.044501,session_20250819_041108_9084,13,ADBE,354.9100036621094,0,0.0,0.0,HOLD,LOW,"The 5-minute timeframe analysis for ADBE presents conflicting signals. While the AI Trend analysis identifies a BEARISH trend with price below key moving averages and negative MACD momentum, multiple oscillators (RSI at 22.7, Williams %R at -81.1, Stochastic K at 18.9) are deeply oversold. This indicates a potential for a short-term rebound, contradicting the bearish momentum. Critically, there is NO 1-HOUR TIMEFRAME DATA available. The ""BALANCED TRADING MODE"" requires weighting 1-hour trends more heavily and demands ""multiple confirming indicators"" and ""strong technical alignment"" across both timeframes, explicitly stating ""High confidence only when both timeframes agree."" Without the crucial 1-hour data, we cannot establish a medium-term trend, achieve dual-timeframe alignment, or confidently confirm any directional signal. News sentiment is not available, so it cannot provide additional risk assessment. Given the conflicting short-term signals, the absence of medium-term trend confirmation, and the balanced strategy's emphasis on capital preservation and strong alignment, entering a new position is not advisable at this time.",3.0,LOW,BEARISH,MEDIUM,MEDIUM,22.685380065135035,356.1129913330078,356.2974951171875,-0.1733873479302499,0.0,281822.0,BALANCED
