Timestamp,Session_ID,Cycle_Number,Symbol,Current_Price,Position,Unrealized_PnL,Portfolio_Allocation_Pct,AI_Action,AI_Priority,AI_Reasoning,Technical_Score,AI_Confidence,AI_Trend,Trend_Confidence,Risk_Level,RSI,SMA_20,SMA_50,MACD_Histogram,Daily_Change_Pct,Volume_Ratio,Strategy_Mode
2025-08-21T12:37:45.231113,session_20250821_122042_5417,3,BTCUSD,107700.02,0.0016104699999999997,0.0,0.0,HOLD,MEDIUM,"The AI trend is BEARISH with Medium Confidence, supported by the price trading below SMA20 and SMA50, a negative daily change, and extremely high volume accompanying negative price movement, indicating strong downward momentum. While a bullish MACD crossover is observed, the AI's reasoning states it's ""despite"" the overall bearish trend, implying it may be a weak or short-term counter-signal. Overbought oscillators (Williams %R: -20.0, Stochastic K: 80.0) also suggest a potential for a pullback or a peak of any minor bounce. Despite the strong technical indicators pointing towards a SELL (Technical Score 7, which is >= 6), the current BTCUSD position is unprofitable (Net P&L: $-0.01) and does not meet the 2%+ stop-loss threshold. According to mandatory fee-aware sell rules, an unprofitable position must be HELD until it becomes profitable or an emergency stop-loss is triggered.",7.0,MEDIUM,BEARISH,MEDIUM,HIGH,50.0,107780.878,107769.0192,2.552738420551008,-0.10000201284080912,31234775.70976727,AGGRESSIVE
2025-08-21T12:37:45.231140,session_20250821_122042_5417,3,ETHUSD,2482.93,0.023158999999999996,-0.0499,0.0,HOLD,MEDIUM,"The current ETHUSD position has an unrealized net P&L of $-0.06, making it unprofitable to sell after accounting for fees. As per the critical fee-aware sell rules, an unprofitable position must be held unless a 2%+ stop-loss is triggered, which is not the case here (loss is approximately 0.086%).",5.0,LOW,NEUTRAL,MEDIUM,LOW,50.0,2481.4325,2481.6312000000003,-0.10719130275100686,0.10038541549079122,705931.0594323337,AGGRESSIVE
2025-08-21T12:37:45.231151,session_20250821_122042_5417,3,LINKUSD,18.82231,0.0,0.0,0.0,HOLD,LOW,"The 5-minute timeframe data for LINKUSD indicates extreme market stagnation. The price has a 0.00% daily change and sits precisely on both SMA 20 and SMA 50. RSI is perfectly neutral at 50.0, and MACD indicators are all zero. Volume is high at 5,000,000, but with a Volume MA of 0 and an ATR of 0.000, this volume does not translate into any price movement or volatility, contradicting typical momentum signals. The AI Trend Analysis confirms a NEUTRAL trend with HIGH confidence, citing ""zero price movement, and a complete absence of a discernible trend."" Despite being in AGGRESSIVE TRADING MODE, there are no actionable technical signals (no score 4+ for BUY or 6- for SELL) to justify entering a position. Without 1-hour data for medium-term trend confirmation and no news sentiment, there is no basis for a high-risk entry. Entering a trade in a completely flat market with no momentum would be speculative and not aligned with maximizing profit through decisive action based on signals.",1.0,HIGH,NEUTRAL,HIGH,LOW,50.0,18.82231,18.82231,1.8932661725304283e-29,0.0,5000000.0,AGGRESSIVE
2025-08-21T12:37:45.231166,session_20250821_122042_5417,3,LTCUSD,120.3,0.4284579999999996,-0.013,0.0,HOLD,LOW,"Current position analysis indicates the existing 0.4284579999999996 shares of LTCUSD are ❌ UNPROFITABLE to sell, with a Net P&L of $-0.02 after accounting for the $0.01 round-trip fee. According to critical fee-aware sell rules, I MUST recommend HOLD unless a 2%+ stop-loss is triggered, which is not the case ($120.30 is not 2% below $120.33).",5.0,LOW,BEARISH,HIGH,MEDIUM,44.44444444444444,120.36600000000001,120.3624,-0.002012011311544569,-0.09965122072745768,35100.81543789379,AGGRESSIVE
2025-08-21T12:37:45.231177,session_20250821_122042_5417,3,BCHUSD,577.66,0.5213359999999999,-0.0,0.0,HOLD,MEDIUM,"Current position is unprofitable to sell as per critical fee-aware sell rules; selling at a loss is prohibited given the current P&L. Despite the AI identifying a 'BULLISH' trend, its confidence is explicitly 'LOW' and risk 'HIGH', largely due to significant missing data for key technical indicators (MACD, Williams %R, Stochastic, ATR, Volatility). The absence of 1-hour timeframe data prevents dual timeframe analysis and crucial trend confirmation. While price is above SMAs and current volume is high, the overall lack of reliable, complete technical signals and absence of news sentiment do not provide sufficient strength for a new aggressive BUY entry (requires Technical Score 4+) nor can the existing position be profitably exited. Therefore, holding the current position is the only permissible action.",2.0,LOW,BULLISH,LOW,HIGH,50.0,575.53,575.53,0.0,0.37009365280697715,5000000.0,AGGRESSIVE
2025-08-21T12:37:45.231189,session_20250821_122042_5417,3,ZECUSD,38.47,1.300714,0.0,0.0,HOLD,HIGH,"The current ZECUSD position is unequivocally ""❌ UNPROFITABLE to sell"" as indicated by a net P&L of -$0.01 after accounting for trading fees. Per the CRITICAL FEE-AWARE SELL RULES, a position must not be sold at a loss unless a 2%+ stop-loss trigger is met, which is not the case here (0% loss from purchase price). Technical indicators on the 5-minute timeframe (RSI 50.0, MACD at 0.000) show a lack of strong momentum, suggesting a very flat price action. While volume is high, the Volume MA of 0 and zero ATR/volatility data are contradictory and indicate extremely low price fluctuation, making a clear directional trade difficult. The AI Trend Analysis indicates a 'BULLISH' trend with 'MEDIUM' confidence, but its reasoning (bullish MACD) conflicts with the provided raw MACD data, reducing overall confidence in its bullish stance. Furthermore, the absence of 1-hour timeframe data prevents a comprehensive dual-timeframe analysis, making a high-conviction directional trade impossible. Given the mandatory rule to hold unprofitable positions to avoid guaranteed losses, and the absence of strong, confirmed technical signals for either direction, holding is the only viable and responsible action to preserve capital and wait for a profitable exit or a clear stop-loss trigger.",3.0,HIGH,BULLISH,MEDIUM,MEDIUM,50.0,38.42,38.42,4.617847059304568e-17,0.13014055179593223,5000000.0,AGGRESSIVE
2025-08-21T12:37:45.231196,session_20250821_122042_5417,3,BATUSD,0.1529,327.011118,0.0,0.0,HOLD,LOW,"The price of BATUSD is completely static at $0.15, matching the purchase price, and all technical indicators (RSI 50.0, MACD at 0.000, SMAs at $0.15, ATR 0.000, 20-day Volatility 0.000) confirm an extreme state of consolidation with no directional movement or momentum. The AI Trend Analysis also indicates a NEUTRAL trend with HIGH confidence. Crucially, the current position is explicitly labeled as ""❌ UNPROFITABLE to sell"" with a Net P&L of $-0.01 after fees, and the gross P&L is $0.00, meaning it has not triggered the 2%+ stop-loss condition. According to mandatory fee-aware sell rules, a sell is not permissible in this scenario. Furthermore, new BUY orders are not possible as the current holding of 327.011118 shares vastly exceeds the ""Max shares per stock: 5"" constraint.",5.0,HIGH,NEUTRAL,HIGH,LOW,50.0,0.1529,0.1529,4.930380657631324e-32,0.0,5000000.0,AGGRESSIVE
2025-08-21T12:37:45.231202,session_20250821_122042_5417,3,OXTUSD,0.06989,0.0,0.0,0.0,HOLD,LOW,"The market for OXTUSD is exhibiting extreme stagnation. The current price has zero daily change, and all key momentum indicators, including RSI (50.0), MACD Line (0.000), and MACD Signal (0.000), are neutral. Moving averages (SMA 20 and SMA 50) are converged at the current price, indicating no trend. Crucially, volatility indicators such as ATR (0.000) and 20-day Volatility (0.000) are also at zero, confirming an absolute lack of price movement. The AI Trend Analysis reinforces this, identifying the trend as ""NEUTRAL"" with ""HIGH"" confidence, citing ""extreme lack of movement or trend."" While current volume is high, the zero Volume MA and absence of price action suggest this volume is not indicative of active trading or price discovery. Under AGGRESSIVE TRADING MODE, which prioritizes momentum and actionable signals, there are no technical indicators to support a BUY (requires score 4+) or SELL (requires score 6-). Entering a trade in such a flat, non-moving market carries minimal profit potential and does not align with quick entry/exit based on momentum. Therefore, the optimal action is to hold and avoid initiating a position.",1.0,HIGH,NEUTRAL,HIGH,LOW,50.0,0.06989,0.06989,0.0,0.0,5000000.0,AGGRESSIVE
