Timestamp,Session_ID,Cycle_Number,Symbol,Current_Price,Position,Unrealized_PnL,Portfolio_Allocation_Pct,AI_Action,AI_Priority,AI_Reasoning,Technical_Score,AI_Confidence,AI_Trend,Trend_Confidence,Risk_Level,RSI,SMA_20,SMA_50,MACD_Histogram,Daily_Change_Pct,Volume_Ratio,Strategy_Mode
2025-08-21T22:52:44.239009,session_20250821_220904_4013,7,BTCUSD,107700.02,0.0,0.0,0.0,SELL,HIGH,"The AI trend analysis indicates a NEUTRAL trend with LOW confidence, however, the explicit mention of ""bearish volume confirmation (OBV)"" coupled with the price trading below both the SMA 20 ($107775.49) and SMA 50 ($107771.18) and a negative daily change (-0.10%) points to significant underlying selling pressure. While momentum indicators like MACD (positive histogram, line above signal), Williams %R (-20.0), and Stochastic K (80.0) show strong bullish momentum and are in overbought territory, this strength is failing to push the price above key short-term moving averages. In an aggressive trading mode, ""overbought"" conditions, especially when price action is bearish and confirmed by ""bearish volume"", can signal an imminent correction or exhaustion of buying pressure. Furthermore, the historical context shows strong recent selling activity for BTCUSD (""last: SELL"", ""Today's Trades: 9 Sells, 0 Buys""). We have no current position, allowing for an immediate SELL (initiate short) action to capitalize on the bearish price signals, confirmed volume, and historical selling momentum.",7.0,HIGH,NEUTRAL,LOW,MEDIUM,57.14247856792695,107775.4885,107771.17599999999,2.759610444600855,-0.10000201284080912,31290776.9658738,AGGRESSIVE
2025-08-21T22:52:44.239040,session_20250821_220904_4013,7,ETHUSD,2482.92,0.023158999999999996,-0.0501,0.0,HOLD,LOW,"The current ETHUSD position is unprofitable (Net P&L: $-0.06) and does not meet the mandatory criteria for a profitable sale or a 2%+ stop-loss trigger. Therefore, holding the existing position is required as per CRITICAL FEE-AWARE SELL RULE #4. Furthermore, the market exhibits a NEUTRAL trend with HIGH confidence and zero daily change/volatility, as confirmed by AI analysis. Technical indicators on the 5-minute timeframe are mostly neutral (RSI 44.5, Stochastic K 59.9, Williams %R -40.1), despite a slight bearish lean from the MACD histogram (-0.065). There is no strong momentum or volume signal to justify initiating a new BUY (requires technical score 4+) or aggressively selling (requires technical score 6-) under the active trading mode, nor is there any news sentiment to influence a decisive action.",0.0,HIGH,NEUTRAL,HIGH,LOW,44.454382826475616,2481.929,2481.8790000000004,-0.06497096761995157,0.0,704101.4233952997,AGGRESSIVE
2025-08-21T22:52:44.239053,session_20250821_220904_4013,7,LINKUSD,18.82231,0.0,0.0,0.0,HOLD,LOW,"The market for LINKUSD is experiencing extreme stagnation, with zero price movement (Daily Change +0.00%, Current Price, Previous Close, SMA 20, SMA 50 all at $18.82), collapsed volatility (ATR 0.000, 20-day Volatility 0.000), and all momentum indicators (RSI 50.0, MACD Line/Signal/Histogram 0.000) flat. Despite a numerically high current volume (5,000,000), this volume is not translating into any price action, rendering it ineffective for directional trading and creating significant data contradictions. The AI trend analysis, while labeling the trend ""WEAK_BULLISH,"" explicitly states ""LOW"" confidence due to ""extreme stagnation... making any directional conviction highly speculative and unreliable."" Aggressive trading requires prioritizing momentum and volume for decisive action, neither of which are present in a meaningful, actionable way here. With no 1-hour data available for trend confirmation and no news sentiment to influence the decision, there is no technical basis or confirmed momentum to justify a BUY or SELL action. Entering such a stagnant market would be pure speculation, directly contradicting the goal of maximizing profit through informed, decisive action based on signals.",0.0,LOW,WEAK_BULLISH,LOW,LOW,50.0,18.82231,18.82231,1.8932661725304283e-29,0.0,5000000.0,AGGRESSIVE
2025-08-21T22:52:44.239063,session_20250821_220904_4013,7,LTCUSD,120.3,0.013244999999999618,-0.0004,0.0,BUY,HIGH,"An aggressive BUY is recommended based on strong short-term momentum and volume indicators, despite the absence of 1-hour data and the AI's low confidence. Williams %R at -100.0 and Stochastic K at 0.0 indicate extreme oversold conditions, signaling a high probability of an imminent upward reversal, which aligns with aggressive trading strategies. Further confirmation comes from a bullish MACD crossover (MACD Line -0.002 > MACD Signal -0.005, with a positive Histogram of 0.003). Crucially, the current volume is an astonishing 34644.30x its average, signifying a massive surge in market activity that often accompanies significant price reversals from oversold levels. While the price is currently below short-term SMAs, and the AI notes a neutral trend, the prioritized momentum and volume signals for an aggressive strategy strongly point to a short-term bounce or reversal. The existing unprofitable position will be held, as it does not meet the criteria for a profitable or stop-loss triggered sell.",8.0,HIGH,NEUTRAL,LOW,HIGH,50.0,120.34200000000001,120.3528,0.0025574386454501226,-0.09965122072745768,34644.299499148576,AGGRESSIVE
2025-08-21T22:52:44.239070,session_20250821_220904_4013,7,BCHUSD,577.66,0.5213359999999999,-0.0,0.0,HOLD,MEDIUM,"The current position is unprofitable to sell (Net P&L: $-0.01), and there is no 2%+ stop-loss trigger, making a SELL action impossible per mandatory trading rules. For a BUY, while the price is above its SMAs and there's extremely high volume (Volume Ratio: 5,000,000x average), which are bullish momentum signals, the RSI is neutral (50.0) and MACD indicators are flat (0.000). Crucially, there is no 1-hour timeframe data available, which prevents proper dual timeframe analysis and significantly reduces confidence in any sustained trend. Additionally, other critical volatility indicators like ATR and 20-day Volatility are zero, which is inconsistent with the reported positive daily change and high volume, suggesting incomplete or conflicting data. The AI also flags the asset as potentially overbought by Bollinger Bands and assigns a LOW confidence to its BULLISH trend due to these conflicting signals and missing data. The calculated technical score of +1 is well below the '4+' threshold required for an aggressive BUY action. Therefore, the most prudent action is to HOLD the existing unprofitable position and wait for clearer, more confirmed signals across multiple indicators and timeframes.",1.0,LOW,BULLISH,LOW,MEDIUM,50.0,575.53,575.53,0.0,0.37009365280697715,5000000.0,AGGRESSIVE
2025-08-21T22:52:44.239077,session_20250821_220904_4013,7,ZECUSD,38.47,1.300714,0.0,0.0,HOLD,LOW,"Current position for ZECUSD is at $38.47 with a Net P&L of $-0.01, making it ❌ UNPROFITABLE to sell per mandatory trading rules. The stop-loss trigger (2%+ loss from purchase price of $38.47, which is $37.7006) has not been met as the current price is $38.47. Therefore, a HOLD is mandatory.",5.0,LOW,BULLISH,MEDIUM,HIGH,50.0,38.42,38.42,4.8396143260295035e-11,0.13014055179593223,5000000.0,AGGRESSIVE
2025-08-21T22:52:44.239085,session_20250821_220904_4013,7,BATUSD,0.1529,327.011118,0.0,0.0,HOLD,LOW,"The current position of 327.011118 shares is unprofitable to sell (Net P&L After Fees: $-0.01), and no stop-loss condition (2%+ loss) has been met. As per critical trading rules, an unprofitable position must be held unless a stop-loss is triggered. Furthermore, all 5-minute technical indicators (RSI 50.0, MACD values at 0.000, SMAs at $0.15, ATR 0.000, and 20-day Volatility 0.000) indicate extreme price consolidation with no discernible trend or momentum. The AI's assessment of ""LOW Confidence"" and ""HIGH Risk"" due to contradictions with raw data is accurate. 1-hour timeframe data is unavailable, preventing medium-term trend confirmation. Volume data is anomalous (5,000,000 current with 0 MA), making it an unreliable momentum indicator. There are no clear BUY or SELL signals, and no news sentiment to influence the decision. Given the mandatory rule to hold unprofitable positions and the complete lack of actionable technical signals, HOLD is the only compliant action.",5.0,LOW,WEAK_BULLISH,LOW,HIGH,50.0,0.1529,0.1529,4.930380657631324e-32,0.0,5000000.0,AGGRESSIVE
2025-08-21T22:52:44.239092,session_20250821_220904_4013,7,OXTUSD,0.06989,0.0,0.0,0.0,HOLD,LOW,"The market data for OXTUSD exhibits extreme stagnation across all available 5-minute technical indicators. Price has zero daily change, zero volatility (ATR and 20-day Volatility are 0.000), and all momentum indicators (RSI at 50.0, MACD Line, Signal, and Histogram at 0.000) are perfectly neutral. Moving Averages (SMA 20 and SMA 50) are converged at $0.07. While current volume is 5,000,000, the Volume MA is 0, making the volume ratio misleading and indicating potentially unreliable volume data or extreme illiquidity prior to this moment. The AI Trend Analysis confirms a ""NEUTRAL"" trend with ""HIGH"" confidence due to ""extreme stagnation."" Crucially, there is no 1-hour data available for medium-term trend confirmation, a critical directive. In an aggressive trading mode, action is taken based on strong momentum and clear signals. With all indicators flat and no discernible trend or volatility, there is no actionable signal (neither BUY with TS 4+ nor SELL with TS 6-). Entering a position under these conditions offers no profit potential and carries high risk from a lack of liquidity or sudden, unpredictable moves. We must wait for a clear trend or significant price movement to emerge.",0.0,HIGH,NEUTRAL,HIGH,MEDIUM,50.0,0.06989,0.06989,0.0,0.0,5000000.0,AGGRESSIVE
