Timestamp,Session_ID,Cycle_Number,Symbol,Current_Price,Position,Unrealized_PnL,Portfolio_Allocation_Pct,AI_Action,AI_Priority,AI_Reasoning,Technical_Score,AI_Confidence,AI_Trend,Trend_Confidence,Risk_Level,RSI,SMA_20,SMA_50,MACD_Histogram,Daily_Change_Pct,Volume_Ratio,Strategy_Mode
2025-08-21T02:18:58.554658,session_20250821_011837_7606,10,BTCUSD,107700.02,0.0030018399999999995,0.0,0.0,HOLD,LOW,"Current position is unprofitable to sell, with a Net P&L of $-0.01 after fees. According to the critical fee-aware sell rules, an unprofitable position cannot be sold unless a stop-loss trigger is met, which is not the case here. Technical analysis on the 5-minute timeframe indicates a strong bearish bias for BTCUSD: price is trading below both the SMA 20 and SMA 50, and key momentum indicators (Williams %R at -0.0 and Stochastic K at 100.0) show extreme overbought conditions, signaling an imminent downside reversal. The AI trend analysis also confirms a BEARISH trend with MEDIUM confidence, citing these factors despite a conflicting bullish MACD. Given the strong bearish technical signals (Technical Score 2) and the current unprofitable status of the held position, initiating a new BUY is not advised. The current position must be held, awaiting a price recovery to achieve profitability or a stop-loss event.",2.0,MEDIUM,BEARISH,MEDIUM,MEDIUM,57.142857142857146,107743.144,107756.08119999999,9.269378469938843,-0.10000201284080912,21481899.41987093,AGGRESSIVE
2025-08-21T02:18:58.554687,session_20250821_011837_7606,10,ETHUSD,2480.44,0.023158999999999996,-0.1075,0.0,HOLD,MEDIUM,"The current ETHUSD position is unprofitable (Net P&L $-0.12) and not at the 2%+ stop-loss threshold, therefore, according to mandatory trading rules, it is UNPROFITABLE to sell and MUST be held. For a new trade, the technical outlook is mixed and lacks strong directional conviction for an aggressive entry. The AI trend analysis indicates a BEARISH trend with LOW confidence. While 5-minute MACD shows a weak bullish crossover (line above signal), price remains below both SMA 20 and SMA 50, indicating short-term bearishness. Williams %R and Stochastic K are nearing overbought levels, suggesting potential downside reversal. Critically, the absence of 1-hour timeframe data prevents a comprehensive dual timeframe analysis and reliable trend confirmation, making high-confidence action difficult. Although volume is exceptionally high, the lack of clear directional momentum (flat MACD, conflicting oscillators) combined with a bearish AI trend means there is no compelling technical signal to initiate a new BUY order, nor to take action on the existing position other than holding. No news sentiment is available to provide a boost or trigger.",4.0,LOW,BEARISH,LOW,MEDIUM,50.0,2481.8044999999997,2481.9285999999997,0.008321302260565079,0.0,713025.4894196758,AGGRESSIVE
2025-08-21T02:18:58.554699,session_20250821_011837_7606,10,LINKUSD,18.82231,0.0,0.0,0.0,HOLD,LOW,"All available 5-minute technical indicators (RSI, MACD, SMAs, Williams %R, Stochastic K) show extreme flatness and zero price movement at $18.82. Despite a high current volume of 5,000,000, the Volume MA of 0 and zero daily price change, coupled with 0.000 ATR and 20-day volatility, indicate a market with no discernible price action or momentum. The AI Trend Analysis confirms this, stating a NEUTRAL trend with HIGH confidence due to ""zero movement and extreme flatness"" across all primary indicators. Critically, there is no 1-hour timeframe data available, preventing any medium-term trend confirmation. In an aggressive trading mode, momentum and clear signals are prioritized, but no such signals exist here to meet the 4+ technical score for a BUY or 6- for a SELL. Without any price movement or technical bias, and no news sentiment to influence, taking a position would be pure speculation rather than a data-driven trade.",0.0,HIGH,NEUTRAL,HIGH,LOW,50.0,18.82231,18.82231,1.8932661725304283e-29,0.0,5000000.0,AGGRESSIVE
2025-08-21T02:18:58.554711,session_20250821_011837_7606,10,LTCUSD,120.3,0.8436709999999996,-0.0255,0.0,HOLD,HIGH,"The current LTCUSD position is unprofitable to sell (Net P&L: $-0.04) and does not meet the 2% stop-loss threshold, which mandates holding the position as per critical fee-aware sell rules. Technical analysis on the 5-minute timeframe shows a prevailing bearish trend, with price below key moving averages (SMA 20 & 50) and MACD indicating bearish momentum (MACD Line: -0.002, Signal: 0.001, Histogram: -0.003). While Williams %R (-100.0) and Stochastic K (0.0) are at extreme oversold levels, typically suggesting a potential for a bounce, the AI trend analysis maintains a BEARISH outlook with MEDIUM confidence. This is further reinforced by the extraordinarily high volume (33532.15x average) observed on negative price movement, which, as per aggressive mode, prioritizes momentum and volume. Without 1-hour data, broader trend confirmation is unavailable. Therefore, despite the oversold conditions, the current momentum and AI analysis do not support a new BUY, and a SELL is prohibited by current unprofitability. The only valid action is to HOLD and await either a recovery to profitability or a definitive stop-loss trigger.",3.0,MEDIUM,BEARISH,MEDIUM,MEDIUM,46.15384615384615,120.35999999999999,120.3624,-0.0030633153966089645,-0.09965122072745768,33532.14599412912,AGGRESSIVE
2025-08-21T02:18:58.554721,session_20250821_011837_7606,10,BCHUSD,577.66,0.5213359999999999,-0.0,0.0,HOLD,HIGH,"The current position in BCHUSD is unprofitable to sell after accounting for trading fees, showing a Net P&L of $-0.01. According to the Critical Fee-Aware Sell Rules, I am explicitly mandated to recommend HOLD for positions that are unprofitable to sell unless a 2%+ stop-loss is triggered, which is not the case here as the gross P&L is $0.00. While the 5-minute data shows some bullish signs like the current price being above SMA 20 and SMA 50, and high current volume, there is extensive missing data for critical momentum indicators (MACD, Williams %R, Stochastic K) and volatility (ATR, 20-day Volatility). The 1-hour timeframe data is also unavailable, limiting the ability to confirm a medium-term trend. The AI trend analysis indicates a BULLISH trend with MEDIUM confidence and HIGH risk, also noting the missing data. Given the mandatory rule to hold unprofitable positions, and the lack of strong, clear technical signals due to missing data for either a strong buy or a stop-loss sell, HOLD is the only appropriate action at this time.",3.0,HIGH,BULLISH,MEDIUM,HIGH,50.0,575.53,575.53,0.0,0.37009365280697715,5000000.0,AGGRESSIVE
2025-08-21T02:18:58.554731,session_20250821_011837_7606,10,ZECUSD,38.47,1.300714,0.0,0.0,HOLD,HIGH,"The current ZECUSD position is explicitly marked as ""❌ UNPROFITABLE to sell"" with a Net P&L of $-0.01. According to mandatory fee-aware sell rules, a position showing this status MUST be held unless an emergency stop-loss (2%+ loss from purchase price) is triggered, which is not the case ($38.47 purchase price, $38.47 current price). Therefore, an immediate sell is prohibited regardless of other factors. Technical indicators are highly ambiguous and contradictory, showing zero ATR and 20-day Volatility despite a reported +0.13% daily change and high current volume, making the data unreliable for decisive action. RSI is neutral (50.0), and MACD is flat (0.000). While price is slightly above SMAs, the overall data integrity is compromised, leading to a low AI confidence and high risk assessment. No news sentiment is available to sway the decision. Given the unprofitability and unreliable technicals, HOLD is the only prudent action.",3.0,HIGH,BULLISH,LOW,HIGH,50.0,38.42,38.42,5.679798517591285e-29,0.13014055179593223,5000000.0,AGGRESSIVE
2025-08-21T02:18:58.554741,session_20250821_011837_7606,10,BATUSD,0.1529,327.011118,0.0,0.0,HOLD,HIGH,"The current price of BATUSD is $0.15, matching its previous close and daily change of +0.00%, indicating extreme price stagnation. All available 5-minute technical indicators (RSI 50.0, MACD histogram, line, and signal at 0.000, and price aligned with both SMA 20 and SMA 50) are perfectly neutral, showing no discernible momentum or trend. Volume and volatility metrics (ATR 0.000, 20-day Volatility 0.000) also confirm a complete lack of price movement, despite a high current volume number that appears anomalous given the zero Volume MA. The AI Trend Analysis explicitly categorizes the trend as NEUTRAL with HIGH confidence. Crucially, the current position is explicitly stated as ""❌ UNPROFITABLE to sell"" with a Net P&L of $-0.01. According to the ""CRITICAL FEE-AWARE SELL RULES (MANDATORY),"" I MUST recommend HOLD as the position is unprofitable and does not meet the 2%+ stop-loss trigger. There is no news data available to influence the decision. Given the complete lack of technical signals for entry/exit and the mandatory rule to avoid unprofitable sales, holding is the only viable action.",5.0,HIGH,NEUTRAL,HIGH,LOW,50.0,0.1529,0.1529,4.930380657631324e-32,0.0,5000000.0,AGGRESSIVE
2025-08-21T02:18:58.554753,session_20250821_011837_7606,10,OXTUSD,0.06989,0.0,0.0,0.0,HOLD,LOW,"The market for OXTUSD shows complete stagnation across all indicators. The price is flat at $0.07 with 0.00% daily change. All 5-minute technical indicators (RSI, MACD, SMAs) are neutral, showing no momentum or trend. Volume and volatility indicators (Volume MA, ATR, 20-day Volatility) are zero, confirming a lack of any meaningful activity. The AI Trend Analysis explicitly states ""NEUTRAL"" trend with ""HIGH"" confidence due to ""complete market stagnation."" There is no 1-hour data available for medium-term trend confirmation. For an aggressive trading strategy that prioritizes momentum and decisive action, the current data provides no actionable signals for either buying or selling, as there is no discernible trend, volatility, or price movement to exploit. Entering a position would be purely speculative without any technical basis, which goes against the principles of momentum-driven trading.",5.0,HIGH,NEUTRAL,HIGH,LOW,50.0,0.06989,0.06989,0.0,0.0,5000000.0,AGGRESSIVE
