Timestamp,Session_ID,Cycle_Number,Symbol,Current_Price,Position,Unrealized_PnL,Portfolio_Allocation_Pct,AI_Action,AI_Priority,AI_Reasoning,Technical_Score,AI_Confidence,AI_Trend,Trend_Confidence,Risk_Level,RSI,SMA_20,SMA_50,MACD_Histogram,Daily_Change_Pct,Volume_Ratio,Strategy_Mode
2025-08-23T10:31:56.785780,session_20250823_072225_4445,27,BTCUSD,107700.02,1.8600000000000127e-06,-0.0,0.0,HOLD,MEDIUM,"The 5-minute timeframe analysis for BTCUSD reveals a strong bearish technical outlook. Price is trading below both the 20-period and 50-period Simple Moving Averages, and the MACD line is below its signal line with a negative histogram, confirming robust bearish momentum. The AI Trend Analysis also indicates a BEARISH trend with medium confidence. Despite these strong bearish signals, which would typically trigger a SELL in aggressive trading mode, the current position's profitability analysis shows a Net P&L After Fees of $-0.01, making it ""UNPROFITABLE to sell."" According to the CRITICAL FEE-AWARE SELL RULES, an unprofitable position must be HELD unless an emergency stop-loss (2%+ loss from purchase price) is triggered, which is not the case here. Therefore, we are compelled to HOLD the position and await a price recovery to achieve profitability or a significant loss to trigger a stop-loss. No 1-hour data or news sentiment is available to influence the decision.",8.0,HIGH,BEARISH,MEDIUM,MEDIUM,33.33436388931776,107748.535,107749.61299999998,-8.480503874851511,0.0,30702651.349708147,AGGRESSIVE
2025-08-23T10:31:56.785807,session_20250823_072225_4445,27,ETHUSD,2482.92,0.040276,0.0,0.0,HOLD,MEDIUM,"The current ETHUSD position is unprofitable to sell (Net P&L: $-0.01), which, according to the critical fee-aware sell rules, mandates a HOLD unless an emergency stop-loss (2%+ loss) is triggered, which it is not. Technically, the 5-minute chart presents a mixed picture. Price is above SMA 20 and SMA 50, and MACD shows a bullish cross with a positive histogram (MACD Line 0.626 > Signal 0.290), indicating short-term upward momentum. However, Stochastic K (99.8) and Williams %R (-0.2) are both in extremely overbought territory, signaling potential exhaustion and high risk of a reversal or correction. The AI trend analysis aligns with this, indicating a BULLISH trend with LOW confidence and HIGH risk due to these conflicting signals and flat price action (0% daily change) despite high volume. In an aggressive trading mode, while bullish indicators exist, the severe overbought conditions and high reversal risk outweigh the immediate desire to add to the position or initiate a new BUY. The mandatory HOLD rule for the existing unprofitable position is paramount.",4.0,LOW,BULLISH,LOW,HIGH,50.0,2482.5495,2481.9303999999997,0.3353299560100421,0.0,711437.3153951599,AGGRESSIVE
2025-08-23T10:31:56.785820,session_20250823_072225_4445,27,LINKUSD,18.82231,0.0,0.0,0.0,HOLD,LOW,"The 5-minute timeframe data for LINKUSD exhibits extreme market flatness and zero volatility across all key indicators (RSI 50, MACD flat at 0, price exactly on SMA 20 and SMA 50, ATR 0, 20-day Volatility 0). This suggests no discernible trend or momentum, making it unsuitable for an aggressive trading strategy focused on momentum. Crucially, there is no 1-hour timeframe data available, which is explicitly weighted more heavily for trend direction and confirmation. While the AI trend analysis states 'BULLISH', it simultaneously reports 'LOW Confidence' and 'HIGH Risk', admitting that this conflicts with the 'extreme market flatness with zero volatility and no trend strength from raw data'. This internal contradiction and the lack of supporting technicals make the AI's bullish call unreliable. The volume data is also anomalous, showing 5,000,000 current volume against a 0 Volume MA, which is concerning and difficult to interpret as a momentum signal. Given the absence of clear bullish momentum, the lack of a higher timeframe for confirmation, and the highly conflicting AI analysis, there is no actionable BUY signal (technical score is well below the 4+ threshold required for a BUY in aggressive mode). With no current position, the prudent action is to HOLD and wait for clearer technical signals and volatility to emerge.",1.0,LOW,BULLISH,LOW,HIGH,50.0,18.82231,18.82231,2.5939172100886832e-08,0.0,5000000.0,AGGRESSIVE
2025-08-23T10:31:56.785828,session_20250823_072225_4445,27,LTCUSD,120.3,1.6645869999999992,-0.0,0.0,HOLD,LOW,"The current position is unprofitable to sell (Net P&L: $-0.01), and according to critical fee-aware sell rules, I MUST recommend HOLD unless an emergency stop-loss (2%+ loss) is triggered, which it is not. For any new action, the technical signals are highly conflicting, leading to significant market indecision. While Stochastic K (0.0) and Williams %R (-100.0) indicate extremely oversold conditions suggesting a potential bounce, the MACD exhibits bearish momentum (MACD Line: -0.005, MACD Signal: -0.001), and the price ($120.30) is below both the SMA 20 ($120.37) and SMA 50 ($120.36). Furthermore, the AI trend analysis indicates a ""BEARISH"" trend with ""LOW"" confidence, noting high volume accompanied negative price movement. Crucially, the absence of 1-hour timeframe data prevents a higher-timeframe trend confirmation, which is essential for confident, decisive action, especially in an aggressive trading mode. Given these mixed signals and the mandatory ""unprofitable to sell"" rule, a HOLD is the most prudent action. Neither the technical buy score (4+) nor sell score (6-) thresholds are met due to the conflicting indicators and lack of medium-term trend confirmation.",5.0,LOW,BEARISH,LOW,MEDIUM,50.0,120.36599999999999,120.3624,-0.003841499658476794,-0.09965122072745768,33980.64580035461,AGGRESSIVE
2025-08-23T10:31:56.785834,session_20250823_072225_4445,27,BCHUSD,577.66,0.259668,0.0,0.0,BUY,HIGH,"The AI trend analysis indicates a HIGH confidence BULLISH trend with an 8/10 overall bullish score, supported by the price trading above key moving averages (SMA 20 & 50) on the 5-minute timeframe. Crucially, current volume is exceptionally high (5,000,000) and the volume ratio is an astounding 5,000,000x average, signaling powerful buying momentum in line with aggressive trading priorities. While the AI notes the price is currently overbought, for an aggressive trading strategy focused on maximizing profit and accepting higher risk, the overwhelming momentum and strong bullish trend outweigh this short-term caution, making it an opportune time to enter or add to a position. The existing unprofitable position ($-0.01 net P&L) will be held as per critical fee-aware sell rules.",8.0,HIGH,BULLISH,HIGH,MEDIUM,50.0,575.53,575.53,2.5521554909669298e-22,0.37009365280697715,5000000.0,AGGRESSIVE
2025-08-23T10:31:56.785841,session_20250823_072225_4445,27,ZECUSD,38.05,1.299714,-0.5459,0.0,HOLD,MEDIUM,"The current position is unprofitable to sell (Net P&L after fees is $-0.56, not meeting the mandatory profit threshold or 2%+ stop-loss trigger). For new actions, the 1-hour timeframe data is unavailable, making it impossible to confirm a medium-term trend and reducing overall confidence as per critical instructions. While the 5-minute data shows a -1.07% daily change and the price is below SMAs ($38.05 vs $38.46), suggesting short-term bearishness, RSI is neutral (50.0) and MACD is flat. Crucially, the AI Trend Analysis indicates 'BEARISH' but with 'LOW Confidence' due to ""severe lack of reliable data for most indicators"". The volume analysis is also compromised with Volume MA at 0. Without strong, confident technical signals supported by both timeframes, and with the existing unprofitable position, HOLD is the most prudent action. Aggressive mode requires decisive action based on *clear* signals, which are absent here due to data limitations.",4.0,LOW,BEARISH,LOW,HIGH,50.0,38.46,38.46,1.833020519900936e-06,-1.0660426417056779,5000000.0,AGGRESSIVE
2025-08-23T10:31:56.785847,session_20250823_072225_4445,27,BATUSD,0.1529,327.011118,0.0,0.0,HOLD,HIGH,"The current position of 327.011118 shares is unprofitable to sell, with a Net P&L After Fees of $-0.01. According to the CRITICAL FEE-AWARE SELL RULES, an unprofitable position that is not at a 2%+ stop-loss trigger MUST be HELD. Furthermore, the market for BATUSD is exhibiting extreme flatness across all available technical indicators. The 5-minute timeframe shows zero daily price change, RSI at a neutral 50.0, all MACD components at 0.000, and SMAs converged at $0.15. Volatility indicators (ATR, 20-day Volatility) are also 0.000. The AI Trend Analysis confirms a ""NEUTRAL"" trend with ""HIGH"" confidence due to ""extreme consolidation and an absence of a discernible trend."" There is no news data available to influence the decision. In aggressive trading mode, we prioritize momentum and clear trends, neither of which are present. Therefore, initiating new BUY or SELL orders is not advisable. The primary action for the existing position is to HOLD until the market develops a clear direction or the position becomes profitable for a fee-aware exit.",5.0,HIGH,NEUTRAL,HIGH,MEDIUM,50.0,0.1529,0.1529,1.6455523924510768e-09,0.0,5000000.0,AGGRESSIVE
2025-08-23T10:31:56.785853,session_20250823_072225_4445,27,OXTUSD,0.06989,0.0,0.0,0.0,HOLD,LOW,"The market for OXTUSD is completely flat with a 0.00% daily change and a current price of $0.07. All key technical indicators across the 5-minute timeframe (RSI 50, MACD lines and histogram at 0.000, SMAs converged at $0.07, ATR and 20-day volatility at 0.000) show a complete lack of momentum, trend, and volatility. While current volume is high at 5,000,000, it is not translating into any price movement, and the Volume MA of 0 suggests an anomalous data point or extremely illiquid historical activity. The AI Trend Analysis confirms a ""NEUTRAL"" trend with ""HIGH"" confidence, citing the flat price, converged MAs, and zero momentum/volatility indicators. There are no technical signals (neither buy nor sell) that meet the aggressive trading mode's thresholds (BUY 4+, SELL 6-), and no news sentiment is available to provide a catalyst. In an aggressive trading mode, lacking any directional momentum, volatility, or actionable technical signals, the decisive action is to refrain from trading and await a clear market direction.",0.0,HIGH,NEUTRAL,HIGH,LOW,50.0,0.06989,0.06989,0.0,0.0,5000000.0,AGGRESSIVE
