Timestamp,Session_ID,Cycle_Number,Symbol,Current_Price,Position,Unrealized_PnL,Portfolio_Allocation_Pct,AI_Action,AI_Priority,AI_Reasoning,Technical_Score,AI_Confidence,AI_Trend,Trend_Confidence,Risk_Level,RSI,SMA_20,SMA_50,MACD_Histogram,Daily_Change_Pct,Volume_Ratio,Strategy_Mode
2025-08-13T16:53:14.285612,session_20250813_165131_4131,1,AAPL,232.92,10,0.0,0.23300016137551963,HOLD,LOW,"Although the technical score is 7.5 (WEAK_BULLISH), conflicting indicators (high RSI at 69.8, negative MACD histogram at -0.160) combined with the ""HIGH risk"" AI Trend prevent a high-priority BUY. The balanced trading mode requires strong technical alignment and multiple confirming indicators, which are not present for a BUY signal here. No news sentiment to impact decision.",7.5,MEDIUM,BULLISH,MEDIUM,HIGH,69.82456140350882,229.369,219.74939999999998,-0.1596349928398979,0.10314595152139448,-1.0,BALANCED
2025-08-13T16:53:14.285643,session_20250813_165131_4131,1,XOM,106.03,10,0.0,0.10606649111560341,HOLD,LOW,"The stock has a neutral technical score of 5/10 and a neutral AI trend. There are no strong bullish or bearish signals from RSI, MACD, or Bollinger bands to warrant a trade in balanced mode. No news sentiment to impact decision.",5.0,HIGH,NEUTRAL,MEDIUM,MEDIUM,50.793650793650826,106.3365,106.804,0.010837203186605388,0.04717871296470764,-1.0,BALANCED
2025-08-13T16:53:14.285659,session_20250813_165131_4131,1,META,781.03,6,0.0,0.4687792788230863,HOLD,LOW,"The stock shows a neutral technical score of 4.5/10 and a neutral AI trend. MACD histogram is slightly negative, but there are no compelling signals for a trade based on the balanced trading mode's requirements for strong alignment. No news sentiment to impact decision.",4.5,HIGH,NEUTRAL,MEDIUM,MEDIUM,60.283238216021964,778.6600000000001,772.5028,-0.07554311816541492,-0.3966128497462205,-1.0,BALANCED
2025-08-13T16:53:14.285673,session_20250813_165131_4131,1,AMZN,224.16,9,0.0,0.20181343189310852,HOLD,LOW,"The stock exhibits very strong bullish technicals with a score of 10/10 (STRONG_BULLISH), healthy RSI (61.1), positive MACD, and a HIGH confidence BULLISH AI trend (MEDIUM risk). This would normally be a HIGH-priority BUY. However, due to portfolio constraints, buying 10 shares would exceed the maximum allowed 15 shares per stock (current 9 shares + 10 shares = 19 shares). Therefore, no BUY order can be placed. No news sentiment to impact decision.",10.0,HIGH,BULLISH,HIGH,MEDIUM,61.10056925996208,221.97000000000003,220.0054,0.21328346080775612,0.3446886610859977,-1.0,BALANCED
2025-08-13T16:53:14.285684,session_20250813_165131_4131,1,NFLX,1218.85,2,0.0,0.24385389549420583,HOLD,LOW,"The stock has a neutral technical score of 4.5/10, a negative MACD histogram, and a low confidence neutral AI trend. There are no strong confirming indicators for either a BUY or SELL signal. No news sentiment to impact decision.",4.5,HIGH,NEUTRAL,LOW,MEDIUM,48.713131692654414,1218.567,1191.8998000000001,-1.5975281049109356,-0.2724639578458291,-1.0,BALANCED
2025-08-13T16:53:14.285696,session_20250813_165131_4131,1,MSFT,525.38,9,0.0,0.47300473254818587,HOLD,LOW,"While the technical score of 4/10 is WEAK_BEARISH, meeting the criterion for a high-priority SELL consideration, the MACD histogram is positive (0.232), which contradicts the bearish score and AI trend. This lack of multiple confirming indicators and strong technical alignment prevents a SELL order in the balanced trading mode. No news sentiment to impact decision.",4.0,MEDIUM,BEARISH,MEDIUM,MEDIUM,48.9467849223947,525.9784999999999,526.6682,0.23229289493531735,-0.48490358752889706,-1.0,BALANCED
2025-08-13T16:53:14.285707,session_20250813_165131_4131,1,NVDA,179.52,9,0.0,0.16162360498505907,HOLD,LOW,"The technical score of 4/10 (WEAK_BEARISH) and negative MACD histogram suggest a bearish outlook. However, the RSI (32.9) is near oversold levels, and the price is at the lower Bollinger band, indicating potential for a bounce or exhaustion of selling pressure. Additionally, the AI Trend indicates ""HIGH risk,"" which the balanced trading mode advises avoiding. These conflicting signals and high risk prevent a SELL order. No news sentiment to impact decision.",4.0,MEDIUM,BEARISH,MEDIUM,HIGH,32.857142857143,182.25500000000002,180.812,-0.40606538586217117,-0.509864774994451,-1.0,BALANCED
2025-08-13T16:53:14.285718,session_20250813_165131_4131,1,TSLA,339.56,2,0.0,0.06793537248554994,HOLD,LOW,"The stock has a strong bearish technical score of 2/10 and a strongly negative MACD histogram. While this aligns for a SELL, the AI Trend indicates ""HIGH risk,"" and the balanced trading mode explicitly avoids trades during high volatility periods. This overrides any potential SELL action. No news sentiment to impact decision.",2.0,HIGH,BEARISH,HIGH,HIGH,42.43379571248421,339.79900000000004,326.193,-0.7072701668309866,-0.4952380952380946,-1.0,BALANCED
2025-08-13T16:53:14.285748,session_20250813_165131_4131,1,JPM,288.59,0,0.0,0.0,HOLD,LOW,"The stock exhibits bearish technicals with a score of 3/10 (WEAK_BEARISH) and a bearish AI trend. This would typically qualify for a SELL consideration. However, as there are 0 shares held in the portfolio, a SELL order (implying reduction of a long position) cannot be executed. No news sentiment to impact decision.",3.0,HIGH,BEARISH,MEDIUM,MEDIUM,45.25139664804472,291.11400000000003,290.7606,-0.14266699672792083,-0.9745050269361533,-1.0,BALANCED
2025-08-13T16:53:14.285760,session_20250813_165131_4131,1,ADBE,348.35,8,0.0,0.2787759100640985,HOLD,LOW,"This stock presents highly conflicting technical signals. While the technical score is 4/10 (WEAK_BEARISH) and the AI Trend is BEARISH (HIGH risk), the RSI is significantly overbought (71.7) and the MACD histogram is strongly positive (1.537), indicating strong recent bullish momentum. The price is also at the upper Bollinger band. This lack of strong technical alignment and the high-risk AI trend prevent any trade in the balanced trading mode. No news sentiment to impact decision.",4.0,HIGH,BEARISH,MEDIUM,HIGH,71.71979243884363,338.802,339.4816,1.536595781932672,0.8132198877119877,-1.0,BALANCED
