Timestamp,Session_ID,Cycle_Number,Symbol,Current_Price,Position,Unrealized_PnL,Portfolio_Allocation_Pct,AI_Action,AI_Priority,AI_Reasoning,Technical_Score,AI_Confidence,AI_Trend,Trend_Confidence,Risk_Level,RSI,SMA_20,SMA_50,MACD_Histogram,Daily_Change_Pct,Volume_Ratio,Strategy_Mode
2025-08-21T23:48:06.503167,session_20250821_220904_4013,15,BTCUSD,107700.02,0.0,0.0,0.0,HOLD,MEDIUM,"Despite several short-term bearish indicators (MACD histogram negative, MACD line below signal, price below both SMA 20 and SMA 50, and AI identifying a BEARISH trend with MEDIUM confidence), the critical factor is the ""extreme stagnation with zero daily price change and zero standard deviation."" This explicitly signals a lack of active trend movement. While current volume is exceptionally high (Volume Ratio: 30953912.86x average), this, combined with zero price movement, indicates a significant standoff or distribution/accumulation at a single price point rather than clear momentum. In Aggressive Trading Mode, profitability relies on decisive action within trending markets. Without active momentum, initiating a trade would incur fees ($0.01) with little immediate profit potential and high risk of being trapped in a flat market. Neither BUY (score 0) nor SELL (score 4) signals meet the aggressive actionable thresholds (4+ for BUY, 6- for SELL). Therefore, the most prudent aggressive strategy is to HOLD, preserving capital and awaiting a clear directional break from the current stagnation.",4.0,MEDIUM,BEARISH,MEDIUM,HIGH,50.0,107764.70800000001,107762.55120000002,-7.030239586356446,0.0,30953912.858813144,AGGRESSIVE
2025-08-21T23:48:06.503200,session_20250821_220904_4013,15,ETHUSD,2485.41,0.023158999999999996,0.0076,0.0,HOLD,MEDIUM,"For the existing position of 0.023158999999999996 shares, a HOLD action is mandatory as the net P&L after accounting for round-trip fees is $-0.00, making it ""❌ UNPROFITABLE to sell"" as per the critical fee-aware sell rules. For any new trade consideration, while the 5-minute timeframe indicates a strong bullish trend with price trading above key moving averages, positive MACD momentum (MACD Line 0.333 > Signal 0.086, Histogram 0.247), and exceptionally high volume (704753.20x average), the asset is simultaneously showing strong signs of being significantly overbought (Williams %R at -0.1, Stochastic K at 99.9). The AI trend analysis, despite confirming a ""BULLISH"" trend, explicitly warns of a ""high probability of a short-term pullback or consolidation"" due to these overbought conditions. Given the aggressive trading mode's emphasis on maximizing profit and accepting higher risk, it is prudent to exercise caution on new entries. Buying into a highly overbought market, especially with a high probability of a pullback, increases the risk of immediate unrealized losses, making it challenging to achieve profitability after the $0.01 trading fee. Therefore, it is advisable to HOLD and await a more opportune entry point following a potential consolidation or pullback to ensure a better risk-reward profile, aligning with the goal of maximizing profit.",6.0,MEDIUM,BULLISH,MEDIUM,MEDIUM,58.3473295263685,2482.0525000000002,2481.879,0.2465242812629191,0.1002851481320293,704753.1976849895,AGGRESSIVE
2025-08-21T23:48:06.503212,session_20250821_220904_4013,15,LINKUSD,18.82231,0.0,0.0,0.0,HOLD,LOW,"The market for LINKUSD is entirely static, with the current price, previous close, SMA 20, and SMA 50 all at $18.82. All key price-sensitive indicators including RSI (50.0), MACD (0.000), ATR (0.000), and 20-day Volatility (0.000) register as neutral or zero, indicating a complete absence of price movement and volatility. While current volume is 5,000,000, the Volume MA is 0, which, coupled with zero volatility and a perfectly flat price, strongly suggests a frozen or test market, not an active trading environment. The AI trend analysis confirms a 'NEUTRAL' trend with 'HIGH' confidence due to this lack of activity. No 1-hour data is available for medium-term trend confirmation, and no news sentiment is present. Under aggressive trading mode, decisive action is based on potential profit and clear signals. With no price movement, momentum, or technical signals (bullish or bearish), there is no identifiable opportunity to maximize profit. Entering a trade in a completely static market would only incur fees without any prospect of return. Therefore, the prudent action is to hold cash and await actionable signals.",0.0,HIGH,NEUTRAL,HIGH,LOW,50.0,18.82231,18.82231,1.8932661725304283e-29,0.0,5000000.0,AGGRESSIVE
2025-08-21T23:48:06.503224,session_20250821_220904_4013,15,LTCUSD,120.42,0.013244999999999618,0.0012,0.0,BUY,HIGH,"Despite the absence of 1-hour timeframe data, the 5-minute chart exhibits strong bullish momentum indicators aligning with the aggressive trading strategy. The current price of $120.42 is trading above both the SMA 20 ($120.35) and SMA 50 ($120.36), indicating short-term upward pressure. Crucially, the volume is extremely high, with a Volume Ratio of 34234.66x average, signaling significant market interest and potential for a strong move, which is a priority for aggressive trading. Furthermore, both Williams %R at -100.0 and Stochastic K at 0.0 are deeply oversold, strongly suggesting an imminent upward reversal, a powerful signal in crypto markets. The AI Trend Analysis corroborates this with a MEDIUM confidence BULLISH trend. While MACD shows a bearish crossover, the overwhelming bullish signals from price action, volume, and oversold momentum indicators, especially under aggressive trading, outweigh this. The current position is unprofitable to sell, thus it must be held, but these strong signals warrant initiating a new buy for additional shares.",5.0,MEDIUM,BULLISH,MEDIUM,MEDIUM,50.0,120.354,120.3576,-0.007494243813599963,0.0997506234414003,34234.66065134487,AGGRESSIVE
2025-08-21T23:48:06.503234,session_20250821_220904_4013,15,BCHUSD,577.66,0.5213359999999999,-0.0,0.0,HOLD,LOW,"The current position for BCHUSD is unprofitable to sell, with a Net P&L of $-0.01 after accounting for fees. According to mandatory trading rules, we must HOLD unprofitable positions unless a 2%+ stop-loss trigger is met, which is not the case here. While 5-minute data shows price above key moving averages ($577.66 vs SMA 20/50 at $575.53) and extremely high volume (5,000,000), suggesting short-term bullish momentum, the RSI is neutral at 50.0, and MACD indicators are flat (0.000). Crucially, there is no 1-hour timeframe data available, which prevents comprehensive dual timeframe analysis and limits overall conviction. The AI trend is bullish but with low confidence and high risk. Given the primary constraint of an unprofitable existing position and the lack of strong, confirmed technical signals or news, the most prudent action is to HOLD the current position and await more favorable conditions or a stop-loss trigger.",3.0,LOW,BULLISH,LOW,HIGH,50.0,575.53,575.53,0.0,0.37009365280697715,5000000.0,AGGRESSIVE
2025-08-21T23:48:06.503248,session_20250821_220904_4013,15,ZECUSD,38.47,1.300714,0.0,0.0,HOLD,MEDIUM,"The current position is UNPROFITABLE to sell, with a net P&L of $-0.01 after accounting for trading fees. As per mandatory fee-aware sell rules, I must recommend HOLD unless there is a 2%+ stop-loss trigger, which is not present. From a technical perspective, the 5-minute timeframe shows neutral momentum with RSI at 50.0 and MACD at 0.000. While the price is slightly above SMAs and current volume is exceptionally high, suggesting some interest, there are no clear bullish or bearish signals strong enough to warrant an aggressive BUY or SELL action. The AI trend analysis indicates ""BULLISH"" but with ""LOW"" confidence and contradictory reasoning (e.g., ""overbought"" while RSI is 50), making it unreliable. Without 1-hour data for trend confirmation and given the neutral short-term indicators, waiting for clearer signals or a profitable exit point is the prudent approach, especially with the current unprofitability of the position.",5.0,MEDIUM,BULLISH,LOW,MEDIUM,50.0,38.42,38.42,1.128439033851834e-10,0.13014055179593223,5000000.0,AGGRESSIVE
2025-08-21T23:48:06.503264,session_20250821_220904_4013,15,BATUSD,0.1529,327.011118,0.0,0.0,HOLD,LOW,"The current BATUSD position is explicitly indicated as ""UNPROFITABLE to sell"" (Net P&L After Fees: $-0.01). According to the mandatory fee-aware sell rules, a position with ""❌ UNPROFITABLE to sell"" must be held unless it triggers an emergency stop-loss (which is not the case here as the price is at the purchase price). Furthermore, the available 5-minute technical data shows extreme flatness across all key indicators: RSI (14) is neutral at 50.0, MACD histogram, line, and signal are all 0.000, and SMAs (20 and 50) are at the current price of $0.15. ATR and 20-day Volatility are 0.000, indicating no price movement or volatility. While current volume is high, the volume ratio is based on a zero Moving Average, and this high volume is not correlated with any price change, suggesting a stalled market. The AI trend analysis reports a ""BULLISH"" trend but with ""LOW confidence,"" which is insufficient to generate an actionable signal in this flat environment. No strong technical BUY or SELL signals are present, and aggressive trading mode requirements for momentum are not met. Given the unprofitability of the current position and the lack of a stop-loss trigger, holding is the only permissible action.",1.0,HIGH,BULLISH,LOW,LOW,50.0,0.1529,0.1529,4.930380657631324e-32,0.0,5000000.0,AGGRESSIVE
2025-08-21T23:48:06.503280,session_20250821_220904_4013,15,OXTUSD,0.06989,0.0,0.0,0.0,HOLD,HIGH,"All available technical indicators (RSI, MACD, SMAs, ATR, and Volatility) are completely flat, converging at the current price of $0.07. This signifies zero volatility, no discernible trend, and an extreme state of consolidation, as confirmed by the AI Trend Analysis (NEUTRAL, HIGH confidence). Despite an aggressive trading mode, there are no actionable technical signals (neither bullish for BUY nor bearish for SELL) to justify entering a position. The high current volume against a zero Volume MA is a notable anomaly but does not provide a directional cue. No news data is available to influence the decision. Entering a trade in a market with no momentum or clear direction would be purely speculative and high risk without corresponding potential for returns based on technicals.",0.0,HIGH,NEUTRAL,HIGH,MEDIUM,50.0,0.06989,0.06989,0.0,0.0,5000000.0,AGGRESSIVE
