Timestamp,Session_ID,Cycle_Number,Symbol,Current_Price,Position,Unrealized_PnL,Portfolio_Allocation_Pct,AI_Action,AI_Priority,AI_Reasoning,Technical_Score,AI_Confidence,AI_Trend,Trend_Confidence,Risk_Level,RSI,SMA_20,SMA_50,MACD_Histogram,Daily_Change_Pct,Volume_Ratio,Strategy_Mode
2025-08-19T05:05:13.374830,session_20250819_041108_9084,10,AAPL,231.64999389648438,0,0.0,0.0,HOLD,LOW,"While the 5-minute timeframe for AAPL shows a bullish trend with price above key moving averages (SMA 20, SMA 50) and a positive MACD crossover, several critical factors prevent a BUY recommendation under the BALANCED TRADING MODE. Momentum indicators such as Williams %R (-16.0) and Stochastic K (84.0), along with RSI (67.2), indicate overbought conditions, suggesting an increased risk of an immediate pullback. More critically, there is no 1-hour timeframe data available, which is essential for confirming the medium-term trend and achieving the required ""strong technical alignment"" and ""high confidence"" for high-priority trades in a balanced strategy. Without dual timeframe alignment and with short-term overbought signals, the conditions do not meet the strict criteria for capital preservation and high-conviction entry.",1.0,LOW,BULLISH,HIGH,MEDIUM,67.23861168440506,231.41116943359376,231.05725646972655,0.004393814628044751,0.0,1928880.0,BALANCED
2025-08-19T05:05:13.374856,session_20250819_041108_9084,10,XOM,106.48999786376953,1,-0.10648999786376123,1.0650432674301415,HOLD,HIGH,"The primary reason for a HOLD recommendation is the ""❌ UNPROFITABLE to sell"" status of the current XOM position, with a net P&L of $-2.29. According to critical fee-aware sell rules, positions should not be sold at a loss unless a 2%+ stop-loss trigger is met, which is not the case here (-0.10% loss). Preference is to HOLD over unprofitable SELL to wait for price recovery.",5.0,LOW,NEUTRAL,LOW,MEDIUM,18.519006894473108,106.70347061157227,106.77341583251953,-0.023407074779687828,0.0,1909589.0,BALANCED
2025-08-19T05:05:13.374864,session_20250819_041108_9084,10,META,785.39501953125,0,0.0,0.0,HOLD,HIGH,"The 5-minute technical analysis for META indicates a strong bearish short-term trend. The price is currently trading below both the SMA 20 ($786.84) and SMA 50 ($787.59), confirming downward price action. MACD shows significant negative momentum with the histogram at -0.181 and the MACD line (-0.392) below its signal line (-0.211), suggesting a bearish crossover and strengthening sell signal. RSI is at 40.4, leaning bearish. While momentum oscillators like Williams %R (-81.8) and Stochastic K (18.2) are in oversold territory, suggesting a potential short-term bounce, they do not override the prevailing bearish trend and momentum indicated by the moving averages and MACD. The AI trend analysis confirms a ""BEARISH"" trend with ""MEDIUM"" confidence.",5.0,LOW,BEARISH,MEDIUM,MEDIUM,40.432326858108105,786.8430114746094,787.5943505859375,-0.18117054601110263,0.0,633524.0,BALANCED
2025-08-19T05:05:13.374871,session_20250819_041108_9084,10,AMZN,231.05999755859375,0,0.0,0.0,HOLD,LOW,"While the 5-minute chart shows a clear bullish trend with price above SMAs and MACD line above its signal, all key momentum indicators (RSI 79.3, Williams %R -26.1, Stochastic K 73.9) are significantly overbought. This indicates a high probability of a short-term pullback or consolidation, which contradicts the 'BALANCED TRADING MODE' principle of prioritizing capital preservation and avoiding trades during periods of high reversal risk. Furthermore, there is no 1-hour timeframe data available, preventing critical dual-timeframe confirmation and limiting overall confidence as per the trading instructions. A buy at this level does not meet the requirement for strong technical alignment for a balanced strategy.",3.0,LOW,BULLISH,MEDIUM,MEDIUM,79.31881946105831,230.84038848876952,230.5868878173828,0.009084394451286754,0.0,1825944.0,BALANCED
2025-08-19T05:05:13.374877,session_20250819_041108_9084,10,NFLX,1238.8900146484375,1,-1.2388900146484048,12.390567148622921,HOLD,HIGH,"Your current position in NFLX is unprofitable, showing a net P&L of $-3.42 after accounting for round-trip fees. Per the critical fee-aware sell rules, you MUST hold this position as it is not profitable to sell and has not triggered a 2%+ stop-loss (current loss is ~0.1%). While the 5-minute technicals show bullish momentum with MACD line above signal, positive MACD histogram, and price above both SMA 20 and SMA 50, the RSI (72.9) is in the overbought region, suggesting a potential for a short-term pullback or consolidation. Crucially, there is no 1-hour timeframe data available, preventing a comprehensive dual-timeframe analysis and confirmation of the medium-term trend. This lack of longer-term confirmation, combined with the overbought short-term conditions, means that even if a BUY was being considered (which it's not due to current position), it would not meet the ""strong technical alignment"" or ""multiple confirming indicators"" criteria for a high-priority BUY in Balanced Trading Mode. No news data is available to influence the decision. Therefore, the only prudent action is to HOLD the current unprofitable position and wait for either a recovery to profitability or a stop-loss trigger.",6.0,HIGH,BULLISH,MEDIUM,MEDIUM,72.89245375675233,1237.6134887695312,1237.2256103515624,0.21881703751938558,0.0,150104.0,BALANCED
2025-08-19T05:05:13.374885,session_20250819_041108_9084,10,MSFT,520.1400146484375,0,0.0,0.0,HOLD,LOW,"The 5-minute timeframe for MSFT presents conflicting signals. While the AI trend analysis and moving averages (Price < SMA20 < SMA50) clearly indicate a strong bearish trend with negative MACD momentum, several key oscillators (RSI at 11.9, Williams %R at -75.5, Stochastic K at 24.5) are simultaneously showing extremely oversold conditions. This suggests a high potential for a short-term bounce or consolidation, counteracting the bearish momentum. Crucially, there is NO 1-HOUR TIMEFRAME DATA available, which is a mandatory component for medium-term trend confirmation and for achieving high confidence in a trade, as per the strategy's dual timeframe instruction. The ""BALANCED TRADING MODE"" prioritizes capital preservation, demands multiple *confirming* indicators, and strong technical alignment, while avoiding trades during periods of unclear signals. Without medium-term confirmation and with conflicting short-term indicators, there is no strong technical alignment for either a BUY or a SELL. Additionally, no news sentiment is available to provide critical risk assessment or alignment for high-priority trades. Therefore, the safest and most prudent action is to HOLD and wait for clearer directional signals, resolution of the oversold conditions, or the availability of medium-term data for proper dual timeframe analysis.",5.0,LOW,BEARISH,HIGH,MEDIUM,11.911426261118365,522.5582580566406,523.360556640625,-0.315885766817216,0.0,2458408.0,BALANCED
2025-08-19T05:05:13.374893,session_20250819_041108_9084,10,NVDA,180.44000244140625,0,0.0,0.0,HOLD,HIGH,"The 5-minute technicals present a mixed picture. While MACD and SMA alignment indicate short-term bullish momentum, multiple key oscillators (RSI at 81.1, Williams %R at -16.4, Stochastic K at 83.6) show extreme overbought conditions, strongly suggesting an imminent pullback or consolidation. The AI Trend Analysis corroborates this, classifying the trend as NEUTRAL with HIGH risk. Crucially, 1-hour timeframe data is unavailable, preventing a robust dual-timeframe confirmation of a sustained trend, which is a requirement for high confidence trades. Under the BALANCED TRADING MODE, capital preservation is prioritized, demanding strong technical alignment and avoiding trades during high volatility or conflicting signals. Entering a BUY position under these severely overbought and high-risk conditions, without medium-term trend confirmation, would contradict the strategy's core tenets. A SELL is not yet warranted as there are no definitive bearish reversal signals, only overbought status. Therefore, the most prudent action is to HOLD and observe.",4.0,HIGH,NEUTRAL,MEDIUM,HIGH,81.08920650566782,180.06633911132812,180.02973571777343,0.04318354366864644,0.0,6526298.0,BALANCED
2025-08-19T05:05:13.374902,session_20250819_041108_9084,10,TSLA,330.6000061035156,0,0.0,0.0,HOLD,LOW,"Despite strong short-term bullish momentum indicated by MACD and price above moving averages, TSLA is severely overbought across multiple critical oscillators (RSI at 74.6, Williams %R at -3.3, and Stochastic K at 96.7) on the 5-minute timeframe. The AI Trend Analysis explicitly identifies a ""BEARISH"" trend with ""MEDIUM"" confidence and ""HIGH"" risk, citing these overbought conditions and signaling a high probability of an imminent price correction or pullback. Furthermore, the absence of 1-hour timeframe data prevents crucial medium-term trend confirmation and dual-timeframe alignment, which is a key requirement for high-confidence trades in BALANCED TRADING MODE. The strategy prioritizes capital preservation, demands multiple confirming indicators, and avoids trades during high volatility or without strong technical alignment. Entering a new long position under these overextended and contradictory technical conditions would violate the capital preservation principles and high-risk aversion of the balanced mode.",3.0,LOW,BEARISH,MEDIUM,HIGH,74.60365734018758,329.3165008544922,329.5581958007813,0.15310033967368353,0.0,2608372.0,BALANCED
2025-08-19T05:05:13.374908,session_20250819_041108_9084,10,JPM,290.489990234375,0,0.0,0.0,HOLD,LOW,"The 5-minute technicals present conflicting signals. Price is currently below key moving averages (SMA 20 & 50) with bearish MACD momentum, indicating a short-term downtrend. However, critical momentum oscillators like RSI (25.1), Williams %R (-77.4), and Stochastic K (22.6) are deeply oversold, suggesting a potential short-term rebound. The AI trend analysis confirms a BEARISH trend but acknowledges these oversold conditions. Crucially, the absence of 1-hour timeframe data prevents a comprehensive dual-timeframe analysis, which is essential for strong trend confirmation and achieving high confidence trades in the BALANCED TRADING MODE. The strategy mandates strong technical alignment and caution during conflicting signals or missing critical data. Given the lack of confirming indicators across multiple timeframes and the conflicting signals within the 5-minute chart, initiating a trade is not aligned with capital preservation and steady growth objectives. No news sentiment is available to provide additional context.",5.0,LOW,BEARISH,MEDIUM,MEDIUM,25.130220816156964,290.9899963378906,290.9323937988281,-0.06441966725958807,0.0,525967.0,BALANCED
2025-08-19T05:05:13.374915,session_20250819_041108_9084,10,ADBE,354.9100036621094,0,0.0,0.0,HOLD,LOW,"The 5-minute timeframe analysis shows ADBE in a short-term downtrend, with the current price ($354.91) below both the SMA 20 ($356.11) and SMA 50 ($356.30), and a bearish MACD (Line: -0.320, Signal: -0.147, Histogram: -0.173). This is consistent with the AI trend analysis identifying a 'BEARISH' trend. While momentum indicators (RSI 22.7, Williams %R -81.1, Stochastic K 18.9) are deeply oversold, suggesting a potential for a near-term bounce, these alone do not constitute strong technical alignment or multiple confirming indicators for a BUY in a 'BALANCED TRADING MODE', where capital preservation is prioritized. Oversold conditions can persist in a strong downtrend.",5.0,LOW,BEARISH,MEDIUM,MEDIUM,22.685380065135035,356.1129913330078,356.2974951171875,-0.1733873479302499,0.0,281822.0,BALANCED
