Timestamp,Session_ID,Cycle_Number,Symbol,Current_Price,Position,Unrealized_PnL,Portfolio_Allocation_Pct,AI_Action,AI_Priority,AI_Reasoning,Technical_Score,AI_Confidence,AI_Trend,Trend_Confidence,Risk_Level,RSI,SMA_20,SMA_50,MACD_Histogram,Daily_Change_Pct,Volume_Ratio,Strategy_Mode
2025-08-22T01:34:36.592397,session_20250821_220904_4013,30,BTCUSD,107807.83,0.0,0.0,0.0,HOLD,MEDIUM,"While the current price is above the 5-minute SMA 20 and SMA 50, indicating some short-term support, the momentum indicators are predominantly bearish. The MACD histogram is negative (-6.039) and the MACD Line (-1.235) is significantly below the Signal Line (4.804), signifying strong bearish momentum and a bearish crossover. This is a critical signal for crypto's trending markets. Furthermore, an extremely high volume ratio (30942172.45x average) on a negligible daily price change (-0.00%) points towards significant selling pressure or distribution, aligning with the AI's ""BEARISH"" trend. Prioritizing momentum and volume indicators as per aggressive mode, the strong bearish MACD and high volume outweigh the price position above SMAs for an entry decision. With no 1-hour data for medium-term trend confirmation and no positive news to provide a strong BUY boost, initiating a BUY is not advisable at this time.",2.0,MEDIUM,BEARISH,LOW,MEDIUM,45.454698764703316,107770.0975,107766.86300000001,-6.038816770430756,-9.275763242043724e-06,30942172.44872141,AGGRESSIVE
2025-08-22T01:34:36.592426,session_20250821_220904_4013,30,ETHUSD,2480.44,0.023158999999999996,-0.1075,0.0,HOLD,LOW,"The current ETHUSD position is unprofitable (Net P&L -$0.12) and not at a 2%+ stop-loss threshold ($2435.38), thus preventing a sell recommendation as per mandatory fee-aware rules. The 5-minute technical indicators present a mixed and low-conviction outlook: MACD and price relative to SMAs exhibit a bearish bias, but RSI, Stochastic, and Williams %R are all neutral, indicating no strong momentum or overbought/oversold conditions. The AI trend analysis confirms a BEARISH outlook but with LOW confidence, further undermining the conviction for aggressive action. Despite an extremely high current volume, the 0.00% daily price change suggests a very flat market, making momentum signals ambiguous. Without 1-hour data for trend confirmation and given the low confidence in the AI trend and conflicting short-term signals, there's no strong technical or news-driven signal to override the critical HOLD constraint on an unprofitable position.",4.0,LOW,BEARISH,LOW,MEDIUM,50.0,2481.9285,2481.9788,-0.12794915948554753,0.0,697565.5204454003,AGGRESSIVE
2025-08-22T01:34:36.592437,session_20250821_220904_4013,30,LINKUSD,18.82231,0.0,0.0,0.0,HOLD,LOW,"All available technical indicators (RSI 50.0, MACD components at 0.000, SMA 20/50 at $18.82, ATR 0.000, 20-day Volatility 0.000) show extreme flatness, indicating a complete lack of price movement, momentum, and trend for LINKUSD. The AI Trend Analysis confirms this with a NEUTRAL trend and HIGH confidence. While a significant current volume is reported, it is not translating into any price action or volatility. In an aggressive trading mode, profit maximization relies on identifiable price movement or a clear trend. With a perfectly stagnant market, there are no actionable BUY (score 4+) or SELL (score 6-) signals, and attempting to trade would incur fees without any potential for return. No news sentiment is available to sway this assessment.",0.0,HIGH,NEUTRAL,HIGH,MEDIUM,50.0,18.82231,18.82231,1.8932661725304283e-29,0.0,5000000.0,AGGRESSIVE
2025-08-22T01:34:36.592451,session_20250821_220904_4013,30,LTCUSD,120.3,0.013244999999999618,-0.0004,0.0,BUY,HIGH,"The 5-minute timeframe presents a strong confluence of short-term bullish reversal signals. MACD has just undergone a bullish crossover (MACD Line -0.012 > MACD Signal -0.016) with a positive histogram, indicating increasing upward momentum. Critically, both Williams %R (-100.0) and Stochastic K (0.0) are deeply oversold, which are considered strong buy signals in crypto markets for potential bounces. This aggressive trading mode prioritizes momentum indicators, and these signals are compelling for a short-term entry. Furthermore, the exceptionally high Current Volume (32,126,840) at 33653x the average suggests a significant event, potentially capitulation volume preceding a reversal, which aligns with the oversold conditions. While the AI trend is BEARISH and price is below short-term SMAs, its reasoning acknowledges the potential for a ""near-term bounce or reversal"" due to these momentum oscillators. The absence of 1-hour data limits medium-term trend confirmation, but the short-term signals are strong enough for an aggressive BUY action. The existing position is currently unprofitable to sell (Net P&L After Fees: $-0.01) and will be held as per fee-aware sell rules, with this BUY order adding to the position to capitalize on the anticipated bounce.",5.5,MEDIUM,BEARISH,MEDIUM,MEDIUM,50.0,120.36000000000001,120.4158,0.003950350906645302,-0.09965122072745768,33653.180404471655,AGGRESSIVE
2025-08-22T01:34:36.592465,session_20250821_220904_4013,30,BCHUSD,577.66,0.5213359999999999,-0.0,0.0,BUY,MEDIUM,"The 5-minute data indicates a bullish breakout with the price trading above both the SMA 20 and SMA 50, supported by significantly high current volume (5,000,000). The AI trend analysis confirms this as a ""bullish breakout on high volume,"" which aligns with prioritizing momentum and volume in aggressive trading mode, and the calculated technical score of 4 meets the actionable threshold for a BUY. However, the AI also issues a critical warning of an ""overbought condition above the upper Bollinger Band, indicating a high potential for a reversal."" This, coupled with the AI's ""LOW"" confidence and the complete absence of 1-hour timeframe data (which is weighted more heavily for trend confirmation), introduces significant risk. Despite these strong cautionary signals, the aggressive trading mode active and the presence of momentum indicators justify a cautious BUY, accepting the higher risk for potential short-term returns. The existing unprofitable position will remain held as per the critical fee-aware sell rules.",4.0,LOW,BULLISH,LOW,HIGH,50.0,575.53,575.53,0.0,0.37009365280697715,5000000.0,AGGRESSIVE
2025-08-22T01:34:36.592478,session_20250821_220904_4013,30,ZECUSD,38.47,1.300714,0.0,0.0,HOLD,LOW,"The current position for ZECUSD is unprofitable to sell, with a Net P&L After Fees of $-0.01, therefore, per mandatory fee-aware sell rules, we MUST HOLD unless an emergency stop-loss is triggered (which is not the case here). For a new BUY entry, while the 5-minute price is slightly above SMAs ($38.47 > $38.42), most other short-term indicators (RSI 50, MACD 0.000) are neutral. Crucially, the volume analysis shows a high current volume but a zero Volume MA, and both ATR and 20-day Volatility are zero, indicating significant data reliability concerns and market uncertainty, as highlighted by the AI. The AI's ""BULLISH"" trend is qualified with ""LOW Confidence"" and ""HIGH Risk."" With no 1-hour data available for medium-term trend confirmation and unreliable short-term momentum signals, the technical basis for a BUY is weak (score below 4+ required for aggressive buy). Therefore, HOLD is the only permissible and prudent action given the current position's unprofitability and the lack of strong, reliable signals for either buying or selling.",3.0,LOW,BULLISH,LOW,HIGH,50.0,38.42,38.42,5.680063771243469e-10,0.13014055179593223,5000000.0,AGGRESSIVE
2025-08-22T01:34:36.592486,session_20250821_220904_4013,30,BATUSD,0.1529,327.011118,0.0,0.0,HOLD,HIGH,"The market for BATUSD is exhibiting extreme stagnation with 0.00% daily change, zero volatility (ATR 0.000, 20-day Volatility 0.000), and all key 5-minute technical indicators (RSI 50.0, MACD 0.000, SMAs at current price) indicating a neutral trend with no discernible momentum. The AI trend analysis confirms this, identifying a NEUTRAL trend with HIGH confidence due to extreme consolidation. The absence of 1-hour timeframe data prevents a comprehensive dual timeframe assessment for trend confirmation. Crucially, the current position is unprofitable to sell (Net P&L After Fees: $-0.01) and does not meet the stop-loss trigger (2%+ loss). According to the CRITICAL FEE-AWARE SELL RULES, an unprofitable position with this status MUST be held unless it's an emergency stop-loss. There are no strong technical signals (momentum, volume-driven price action) to justify a BUY or SELL for a new position under the AGGRESSIVE TRADING MODE.",2.0,HIGH,NEUTRAL,HIGH,MEDIUM,50.0,0.1529,0.1529,4.930380657631324e-32,0.0,5000000.0,AGGRESSIVE
2025-08-22T01:34:36.592493,session_20250821_220904_4013,30,OXTUSD,0.06989,0.0,0.0,0.0,HOLD,LOW,"All 5-minute technical indicators (RSI, MACD, SMAs, Williams %R, Stochastic K) are at perfectly neutral levels or are undefined, indicating zero price movement, zero volatility, and a complete lack of trend or momentum. The AI Trend Analysis explicitly states a NEUTRAL trend with HIGH confidence due to flat indicators. Despite a reported current volume of 5,000,000, the Volume MA is 0 and ATR/Volatility are 0, which contradicts price movement and indicates a data anomaly or an isolated volume spike without subsequent price action. There is no 1-hour timeframe data available to confirm any medium-term trend, forcing reliance solely on the extremely flat 5-minute data. The aggressive trading mode requires momentum and volume-driven signals, which are entirely absent here. With a technical score far below the 4+ threshold for a BUY, and no current position to sell, the appropriate action is to HOLD.",1.0,HIGH,NEUTRAL,HIGH,MEDIUM,50.0,0.06989,0.06989,0.0,0.0,5000000.0,AGGRESSIVE
