Timestamp,Session_ID,Cycle_Number,Symbol,Current_Price,Position,Unrealized_PnL,Portfolio_Allocation_Pct,AI_Action,AI_Priority,AI_Reasoning,Technical_Score,AI_Confidence,AI_Trend,Trend_Confidence,Risk_Level,RSI,SMA_20,SMA_50,MACD_Histogram,Daily_Change_Pct,Volume_Ratio,Strategy_Mode
2025-08-20T00:29:37.005585,session_20250819_235240_1250,6,BTCUSD,107807.83,0.0,0.0,0.0,HOLD,LOW,"The current 5-minute data for BTCUSD presents conflicting signals. While the price remains above the SMA20 and SMA50, indicating a short-term bullish bias and aligning with the AI's low-confidence ""BULLISH"" trend, the MACD indicators show a bearish crossover and negative histogram, pointing to a loss of upward momentum. Other key short-term indicators such as RSI (55.6), Williams %R (-47.7), and Stochastic K (52.3) are in neutral territory, lacking strong directional conviction. The absence of 1-hour timeframe data prevents a comprehensive dual-timeframe analysis, which is critical for confirming medium-term trends and increasing trade confidence in crypto's volatile environment. Given these mixed technical signals, low AI confidence in the trend, and the inability to confirm with a higher timeframe, a clear high-priority BUY signal is not present. It is prudent to HOLD and await stronger technical alignment or confirmation of the broader trend.",0.5,LOW,BULLISH,LOW,MEDIUM,55.555441044614675,107780.87850000002,107771.17520000001,-2.177389303548906,0.10010211697267805,30912331.43505366,BALANCED
2025-08-20T00:29:37.005611,session_20250819_235240_1250,6,ETHUSD,2480.44,0.0,0.0,0.0,SELL,HIGH,"The 5-minute timeframe data for ETHUSD indicates a strong bearish trend. The price is consistently trading below both the 20-period ($2481.93) and 50-period ($2481.98) Simple Moving Averages, with the SMA 20 also positioned below the SMA 50, which signifies clear downward pressure. Further reinforcing this bearish outlook, the MACD shows a distinct bearish crossover (MACD Line at -0.123 below Signal Line at -0.016) with a negative histogram (-0.107), confirming the prevailing downtrend. The AI Trend Analysis corroborates this, identifying a BEARISH trend with MEDIUM confidence. While short-term oscillators like RSI (44.4), Williams %R (-40.1), and Stochastic K (59.9) are currently neutral, the dominant trend-following indicators (SMAs, MACD) provide strong bearish signals. This comprehensive alignment of multiple technical indicators across the available timeframe meets the crypto-adjusted threshold for a high-priority SELL, despite the absence of 1-hour data. No news data is available, so the decision is based purely on technical analysis, which shows strong bearish momentum.",3.2,MEDIUM,BEARISH,MEDIUM,HIGH,44.444444444444436,2481.9285,2481.9778,-0.10662833099755306,0.0,704690.3671182578,BALANCED
2025-08-20T00:29:37.005622,session_20250819_235240_1250,6,LINKUSD,18.82231,0.0,0.0,0.0,HOLD,LOW,"All available 5-minute technical indicators (RSI, MACD, Williams %R, Stochastic K) are either NaN or zero, indicating no discernible price movement or momentum. Both SMA 20 and SMA 50 are converged at the current price, and volatility measures (ATR, 20-day Volatility) are zero. The AI Trend Analysis confirms ""complete price stagnation and no discernible trend or momentum"" with a NEUTRAL trend and HIGH confidence. With no 1-hour data available to provide a medium-term directional bias, and the 5-minute data showing a completely flat market, there are no technical signals whatsoever to support a BUY or SELL action. Attempting to trade in such conditions is not viable due to the absence of price movement required for profit, especially after accounting for trading fees.",1.0,HIGH,NEUTRAL,HIGH,LOW,,18.82231,18.82231,1.8932661725304283e-29,0.0,5000000.0,BALANCED
2025-08-20T00:29:37.005633,session_20250819_235240_1250,6,LTCUSD,120.3,0.0,0.0,0.0,HOLD,LOW,"The critical 1-hour timeframe data is unavailable, which is essential for establishing a reliable medium-term trend and heavily weighting directional analysis. This absence significantly impacts trading confidence. While short-term momentum indicators (Stochastic K at 6.3, Williams %R at -93.7, and a bullish MACD crossover) suggest extreme oversold conditions and a potential for an imminent bounce or reversal, the price remains below key short-term moving averages (SMA 20 and SMA 50), indicating a current bearish bias. Furthermore, the AI's analysis notes ""high volume on negative movement,"" which, despite oversold indicators, suggests persistent selling pressure or strong bearish conviction. The AI trend analysis explicitly rates the trend as NEUTRAL with LOW Confidence and a HIGH Risk Level, making it imprudent to initiate a new position given the conflicting signals and lack of robust multi-timeframe confirmation. A technical score below the 5+ threshold for high-priority BUY, combined with the AI's cautious assessment, warrants a HOLD decision to await clearer market direction and more complete data.",4.0,LOW,NEUTRAL,LOW,HIGH,55.55555555555556,120.35999999999999,120.4042,0.007591893781409929,-0.09965122072745768,34114.40269398085,BALANCED
2025-08-20T00:29:37.005642,session_20250819_235240_1250,6,BCHUSD,577.66,0.0,0.0,0.0,HOLD,HIGH,"Comprehensive analysis is severely hampered by extensive missing and zero data across both 5-minute and 1-hour timeframes, making reliable technical assessment impossible. Critical indicators such as RSI, MACD, Williams %R, Stochastic K, ATR, and 20-day Volatility are unavailable or zero. Furthermore, 1-hour timeframe data, crucial for medium-term trend confirmation, is completely absent, directly violating the instruction to weight it heavily. While the price is currently above its SMA 20 and SMA 50, this single bullish signal is insufficient for a confident trade given the lack of any confirming momentum or volatility indicators. The AI trend analysis explicitly states ""LOW Confidence"" and ""HIGH Risk"" due to missing data and warns of the asset being ""significantly overbought,"" suggesting a potential correction. Without reliable data to assess technical strength, confirming indicators, or dual-timeframe alignment, opening a new position would be highly speculative and against prudent risk management principles, even in the crypto-adjusted trading mode.",3.0,HIGH,BULLISH,LOW,HIGH,,575.53,575.53,0.0,0.37009365280697715,5000000.0,BALANCED
2025-08-20T00:29:37.005651,session_20250819_235240_1250,6,ZECUSD,38.47,0.0,0.0,0.0,HOLD,LOW,"Critical technical indicators such as RSI, Williams %R, Stochastic K, MACD values, ATR, and 20-day volatility are either missing (nan) or report unusual zero values. This severely compromises the reliability and comprehensiveness of any technical analysis. Furthermore, essential 1-hour timeframe data is unavailable, preventing a robust dual-timeframe analysis and trend confirmation, which is crucial for decision-making. While the AI trend analysis indicates ""BULLISH"" momentum with high volume, it also explicitly states ""LOW"" confidence and ""HIGH"" risk due to the extensive data integrity issues, advising that the analysis is severely limited. Attempting a trade with such unreliable and incomplete information would be speculative. It is prudent to await valid and comprehensive data before making any trading decision.",1.0,LOW,BULLISH,LOW,HIGH,,38.42,38.42,2.524354896707238e-29,0.13014055179593223,5000000.0,BALANCED
2025-08-20T00:29:37.005661,session_20250819_235240_1250,6,XLMUSD,0.0,0.0,0.0,0.0,HOLD,LOW,No valid market data available,0.0,LOW,NEUTRAL,LOW,HIGH,50.0,0.0,0.0,0.0,0.0,0.0,BALANCED
2025-08-20T00:29:37.005687,session_20250819_235240_1250,6,BATUSD,0.1529,0.0,0.0,0.0,HOLD,LOW,"The asset, BATUSD, is exhibiting extreme price stagnation with a 0.00% daily change and zero volatility (ATR 0.000, 20-day Volatility 0.000). All short-term technical indicators (RSI, Williams %R, Stochastic K) are undefined or flatlined (MACD at 0.000) due to the complete lack of price movement. The AI Trend Analysis confirms a NEUTRAL trend with HIGH confidence, explicitly stating ""complete absence of directional movement."" Furthermore, critical 1-hour timeframe data is unavailable, preventing comprehensive dual-timeframe analysis and trend confirmation. Given the absolute lack of any technical signals or price action, it is impossible to meet the crypto-adjusted technical score thresholds (5+ for BUY, 5- for SELL) for any directional trade. Entering or exiting a position under these conditions would be speculative without any technical basis.",0.0,LOW,NEUTRAL,HIGH,LOW,,0.1529,0.1529,4.930380657631324e-32,0.0,5000000.0,BALANCED
2025-08-20T00:29:37.005701,session_20250819_235240_1250,6,OXTUSD,0.06989,0.0,0.0,0.0,HOLD,LOW,"The data for OXTUSD indicates an extremely stagnant and potentially illiquid market. All technical indicators across the 5-minute timeframe (RSI, MACD, SMAs, Williams %R, Stochastic K) are either undefined (nan) or show zero movement. The ATR and 20-day volatility are also zero, confirming no price action. While current volume is high, the Volume Moving Average is 0, suggesting historical illiquidity, and this volume has not translated into any price movement. No 1-hour data is available for medium-term trend confirmation. The AI trend analysis explicitly states a NEUTRAL trend with LOW confidence and HIGH risk due to this stagnation. With no actionable technical signals to support a BUY or SELL, and no current position held, initiating a trade is not advisable. Furthermore, the extremely small trade size (0.001 shares) at the current price ($0.07) would yield a trade value of $0.00007, making any profitable trade impossible due to the $0.01 trading fee.",0.0,HIGH,NEUTRAL,LOW,HIGH,,0.06989,0.06989,0.0,0.0,5000000.0,BALANCED
2025-08-20T00:29:37.005714,session_20250819_235240_1250,6,1INCHUSD,0.0,0.0,0.0,0.0,HOLD,LOW,No valid market data available,0.0,LOW,NEUTRAL,LOW,HIGH,50.0,0.0,0.0,0.0,0.0,0.0,BALANCED
