Timestamp,Session_ID,Cycle_Number,Symbol,Current_Price,Position,Unrealized_PnL,Portfolio_Allocation_Pct,AI_Action,AI_Priority,AI_Reasoning,Technical_Score,AI_Confidence,AI_Trend,Trend_Confidence,Risk_Level,RSI,SMA_20,SMA_50,MACD_Histogram,Daily_Change_Pct,Volume_Ratio,Strategy_Mode
2025-08-19T03:09:32.132363,session_20250819_023908_5567,6,AAPL,231.64999389648438,0,-0.23164999389646823,2.3165782717406156,SELL,MEDIUM,"A SELL recommendation is issued for AAPL primarily to address a critical portfolio constraint violation. The portfolio currently holds 11 shares of AAPL (1 share @ $231.88 and 10 shares @ $150.00), which exceeds the ""Max shares per stock: 10"" constraint. The specific 1-share position highlighted in the ""Current Position Profitability Analysis"" is unprofitable (Net P&L: $-2.41) and thus, per the mandatory rule, CANNOT be sold at this time. To comply with the maximum share constraint while adhering to the unprofitable sell rule, 1 share from the highly profitable 10-share block (purchased at $150.00) must be sold. Selling 1 share from this profitable block will bring the total shares held to 10 and result in a significant net profit.",5.0,LOW,BULLISH,MEDIUM,MEDIUM,67.23861168440506,231.41116943359376,231.05725646972655,0.004393814628044751,0.0,1928880.0,BALANCED
2025-08-19T03:09:32.132391,session_20250819_023908_5567,6,XOM,106.48999786376953,1,-0.10648999786376123,1.064935988382329,HOLD,LOW,"The current XOM position is unprofitable to sell (Net P&L: $-2.29 after fees) and has not triggered the 2%+ stop-loss threshold from the purchase price. According to the ""CRITICAL FEE-AWARE SELL RULES,"" an unprofitable position must be held unless a stop-loss is triggered. For new trade considerations, while 5-minute technical indicators (RSI 18.5, Williams %R -94.6, Stochastic K 5.4) are deeply oversold and suggest a potential bullish rebound, the price is currently trading below the SMA 20 and SMA 50, and the MACD shows a bearish crossover, indicating a short-term bearish bias. Critically, there is no 1-hour timeframe data available, which prevents comprehensive dual-timeframe analysis and confirmation, a core requirement for high-priority trades in ""BALANCED TRADING MODE."" This lack of longer-term confirmation, combined with the conflicting short-term signals (bearish trend vs. oversold oscillators), leads to a neutral stance as recommended by the AI trend analysis. Without strong technical alignment across multiple timeframes and confirming indicators, a new BUY or SELL is not advisable under the capital preservation focus of the balanced mode.",5.0,LOW,NEUTRAL,MEDIUM,MEDIUM,18.519006894473108,106.70347061157227,106.77341583251953,-0.023407074779687828,0.0,1909589.0,BALANCED
2025-08-19T03:09:32.132399,session_20250819_023908_5567,6,META,785.39501953125,0,0.0,0.0,HOLD,HIGH,"META exhibits strong bearish technical signals on the 5-minute timeframe. The price ($785.40) is firmly below both the SMA 20 ($786.84) and SMA 50 ($787.59), indicating a clear downtrend. The MACD is bearish, with the MACD line (-0.392) below its signal line (-0.211) and a negative histogram. The AI trend analysis confirms a ""BEARISH"" trend with ""HIGH"" confidence and ""STRONG_BEARISH"" strength, stating that price is below key moving averages. While momentum indicators like Williams %R (-81.8) and Stochastic K (18.2) suggest oversold conditions, the AI reasoning indicates these often signal only a potential short-term bounce within a broader downtrend, not a trend reversal suitable for a BUY. The ""BALANCED TRADING MODE"" prioritizes capital preservation and requires a technical score of 6+ for high-priority BUYs, with multiple confirming indicators. The current technical landscape is overwhelmingly bearish, failing to meet the criteria for a BUY. Furthermore, the absence of 1-hour timeframe data prevents crucial medium-term trend confirmation, which is essential for high-confidence trades in this mode. No news data is available to influence the decision. Entering a long position against such a strong bearish trend would contradict the strategy's risk-averse nature.",2.0,HIGH,BEARISH,HIGH,MEDIUM,40.432326858108105,786.8430114746094,787.5943505859375,-0.18117054601110263,0.0,633524.0,BALANCED
2025-08-19T03:09:32.132406,session_20250819_023908_5567,6,AMZN,231.05999755859375,0,0.0,0.0,HOLD,LOW,"The 5-minute timeframe shows a bullish trend with price strongly above key moving averages (SMA 20, SMA 50) and a positive MACD, confirming a short-term upward bias. However, this bullish sentiment is heavily contradicted by multiple momentum indicators: RSI (79.3), Williams %R (-26.1), and Stochastic K (73.9) are all significantly overbought. This indicates a high probability of a near-term pullback or consolidation, which presents substantial risk for a new long position. The AI trend analysis also highlights this conflict, noting a BULLISH trend but with only MEDIUM confidence and a HIGH risk level. Critically, the absence of 1-hour timeframe data prevents a comprehensive dual-timeframe analysis and the confirmation of the medium-term trend, which is a mandatory requirement for high-confidence trades in this balanced mode. The strategy emphasizes avoiding trades during high volatility/risk periods, and the high AI risk assessment, combined with the extreme volume ratio, signals elevated market risk. Given the strong overbought conditions, the lack of medium-term trend confirmation, and the high risk level, initiating a BUY trade does not align with the capital preservation and steady growth objectives of the Balanced Trading Mode.",3.0,LOW,BULLISH,MEDIUM,HIGH,79.31881946105831,230.84038848876952,230.5868878173828,0.009084394451286754,0.0,1825944.0,BALANCED
2025-08-19T03:09:32.132412,session_20250819_023908_5567,6,NFLX,1238.8900146484375,0,0.0,0.0,HOLD,LOW,"The 5-minute timeframe for NFLX shows several bullish signals, including the current price being above both the SMA 20 and SMA 50, and a positive MACD (line above signal). The AI trend analysis also indicates a BULLISH trend with MEDIUM confidence, citing strong moving average and MACD signals. However, the Relative Strength Index (RSI) is at 72.9, indicating **overbought conditions**, which suggests a high potential for a short-term pullback or consolidation. Critically, there is **no 1-hour timeframe data available**, which means we cannot confirm the medium-term trend. The Balanced Trading Mode prioritizes capital preservation, demands multiple confirming indicators across timeframes, and requires strong technical alignment for high-priority trades. The overbought RSI, combined with the absence of crucial medium-term trend confirmation, makes initiating a new BUY position too risky at this time, as it conflicts with the ""capital preservation"" and ""demand multiple confirming indicators"" principles. A high-priority BUY requires a technical score of 6+ and strong dual-timeframe alignment, neither of which can be met due to the overbought RSI and missing 1-hour data. Therefore, holding is the most prudent action.",5.0,MEDIUM,BULLISH,MEDIUM,MEDIUM,72.89245375675233,1237.6134887695312,1237.2256103515624,0.21881703751938558,0.0,150104.0,BALANCED
2025-08-19T03:09:32.132419,session_20250819_023908_5567,6,MSFT,520.1400146484375,0,0.0,0.0,HOLD,LOW,"The AI trend analysis indicates a strong BEARISH trend with HIGH confidence, supported by price trading firmly below the SMA 20 and SMA 50, and MACD indicators showing negative momentum. While RSI, Williams %R, and Stochastic are in oversold territory, typically suggesting a potential bounce, the dominant technical signals and the high-confidence bearish AI trend are not conducive for a BUY in a balanced trading mode focused on capital preservation and strong technical alignment. Furthermore, the absence of 1-hour timeframe data prevents a comprehensive dual timeframe analysis, which is critical for high-confidence trades. Given no existing position and the clear bearish signals, entering a new BUY position would be counter-trend and against the core principles of the balanced strategy.",2.0,LOW,BEARISH,HIGH,HIGH,11.911426261118365,522.5582580566406,523.360556640625,-0.315885766817216,0.0,2458408.0,BALANCED
2025-08-19T03:09:32.132426,session_20250819_023908_5567,6,NVDA,180.44000244140625,0,0.0,0.0,HOLD,LOW,"The 5-minute timeframe indicates a bullish trend with price above SMAs and positive MACD. However, crucial momentum indicators (RSI at 81.1, Stochastic K at 83.6, Williams %R at -16.4) are severely overbought, which the AI analysis confirms, indicating a strong likelihood of a near-term pullback or consolidation. The AI also assigns a HIGH risk level. The absence of 1-hour timeframe data prevents dual-timeframe alignment and confirmation of the medium-term trend, making a high-confidence trade impossible. Initiating a BUY position at severely overbought conditions with a high risk assessment contradicts the balanced trading mode's emphasis on capital preservation, avoiding high volatility, and requiring strong technical alignment from multiple confirming indicators. No news data is available.",3.0,LOW,BULLISH,MEDIUM,HIGH,81.08920650566782,180.06633911132812,180.02973571777343,0.04318354366864644,0.0,6526298.0,BALANCED
2025-08-19T03:09:32.132433,session_20250819_023908_5567,6,TSLA,330.6000061035156,0,0.0,0.0,HOLD,LOW,"The 5-minute timeframe for TSLA shows conflicting signals. While MACD indicates bullish momentum (MACD Line 0.170 above Signal 0.017, positive histogram 0.153) and the price is trading above both SMA 20 ($329.32) and SMA 50 ($329.56), several key momentum indicators are severely overbought. RSI (14) at 74.6, Williams %R at -3.3, and Stochastic K at 96.7 all suggest that the asset is due for a pullback or correction. The AI Trend Analysis corroborates this, labeling the trend as BEARISH with MEDIUM confidence and HIGH risk, specifically citing the severely overbought conditions and an imminent pullback. Without 1-hour timeframe data, a medium-term trend cannot be confirmed, which prevents a high-confidence directional trade.",5.0,LOW,BEARISH,MEDIUM,HIGH,74.60365734018758,329.3165008544922,329.5581958007813,0.15310033967368353,0.0,2608372.0,BALANCED
2025-08-19T03:09:32.132440,session_20250819_023908_5567,6,JPM,290.489990234375,0,0.0,0.0,HOLD,LOW,"The lack of 1-hour timeframe data severely limits the ability to confirm a medium-term trend, which is a critical requirement for high-conviction trades in Balanced Trading Mode. While 5-minute momentum indicators (RSI 25.1, Williams %R -77.4, Stochastic K 22.6) suggest JPM is significantly oversold and due for a potential short-term bounce, the price remains below both SMA 20 ($290.99) and SMA 50 ($290.93), and MACD shows bearish momentum (MACD Line -0.091, Histogram -0.064). The AI trend analysis indicates a BEARISH trend with LOW confidence, specifically noting the absence of dual timeframe analysis and conflicting signals. Given the balanced strategy's focus on capital preservation, demanding multiple confirming indicators, and avoiding trades during high volatility periods (20-day volatility at 0.280 is notable), entering a BUY position on mixed short-term signals without longer-term confirmation is too risky.",3.0,LOW,BEARISH,LOW,MEDIUM,25.130220816156964,290.9899963378906,290.9323937988281,-0.06441966725958807,0.0,525967.0,BALANCED
2025-08-19T03:09:32.132447,session_20250819_023908_5567,6,ADBE,354.9100036621094,0,0.0,0.0,HOLD,LOW,"Analysis indicates a lack of strong technical alignment for a BUY trade. While momentum indicators (RSI 22.7, Williams %R -81.1, Stochastic K 18.9) are deeply oversold, suggesting a potential short-term bounce, the overall trend from the AI analysis is BEARISH with LOW confidence and HIGH risk. Price remains below key moving averages (SMA 20 & 50), and MACD shows continued negative momentum, creating contradictory signals rather than confirming ones. Crucially, no 1-hour timeframe data is available, preventing the required dual-timeframe analysis and robust trend confirmation. The balanced trading mode prioritizes capital preservation, demands multiple confirming indicators, and avoids high volatility, none of which are sufficiently met. No news data is available for risk assessment or signal alignment.",3.0,LOW,BEARISH,LOW,HIGH,22.685380065135035,356.1129913330078,356.2974951171875,-0.1733873479302499,0.0,281822.0,BALANCED
