Timestamp,Session_ID,Cycle_Number,Symbol,Current_Price,Position,Unrealized_PnL,Portfolio_Allocation_Pct,AI_Action,AI_Priority,AI_Reasoning,Technical_Score,AI_Confidence,AI_Trend,Trend_Confidence,Risk_Level,RSI,SMA_20,SMA_50,MACD_Histogram,Daily_Change_Pct,Volume_Ratio,Strategy_Mode
2025-08-20T01:58:32.439660,session_20250820_013440_6979,4,BTCUSD,107807.83,0.0,0.0,0.0,HOLD,LOW,"The 20-day Volatility of 52.758% is significantly above the 20% threshold defined as ""EXTREME volatility"" for crypto trading. According to the BALANCED CRYPTO TRADING MODE, trades must be avoided during extreme volatility. While the 5-minute technicals show mixed signals (price above SMAs but momentum indicators like MACD, Stochastic K, and Williams %R suggesting bearish momentum and overbought conditions), and the AI trend analysis indicates a low-confidence bearish outlook, the overriding factor is the extreme market volatility. Without 1-hour data for trend confirmation and given the mandate to avoid trades in such volatile conditions, the best course of action is to refrain from opening a new position.",3.0,HIGH,BEARISH,LOW,MEDIUM,42.85733214962425,107770.097,107769.0192,-6.030406475695795,-9.275763242043724e-06,30627707.953357585,BALANCED
2025-08-20T01:58:32.439688,session_20250820_013440_6979,4,ETHUSD,2482.93,0.0,0.0,0.0,HOLD,MEDIUM,"The analysis for ETHUSD indicates a strong consolidation phase with 0.00% daily price change and low overall volatility (20-day Volatility: 1.266%). While the current price is slightly above the flat SMA 20 and SMA 50, providing a minor bullish lean, the MACD line remains below its signal line with a negative histogram, suggesting underlying bearish momentum. The RSI (50.0), Williams %R (-40.1), and Stochastic K (59.9) are all in neutral territory, providing no strong directional signals. The AI trend analysis explicitly states 'NEUTRAL' with 'MEDIUM' confidence, citing the consolidation and conflicting MACD signals. As per the crypto-adjusted trading rules, a high-priority BUY or SELL requires a technical score of 5+, which is not met due to the lack of clear, confirming indicators for a sustained move in either direction. Without strong technical alignment or supporting news sentiment, a prudent approach is to wait for a clearer trend to emerge.",5.0,MEDIUM,NEUTRAL,MEDIUM,MEDIUM,50.0,2481.804,2481.9778,-0.05675997387436465,0.00040275159891432386,709424.2371770572,BALANCED
2025-08-20T01:58:32.439701,session_20250820_013440_6979,4,LINKUSD,18.82231,0.0,0.0,0.0,HOLD,LOW,"All provided technical indicators (RSI, MACD, SMAs, Williams %R, Stochastic K, ATR, and 20-day Volatility) for the 5-minute timeframe are either static (0.000 or identical price values) or unavailable (NaN). This indicates a complete absence of price movement, trend, or discernible volatility, making it impossible to identify any actionable technical signals (e.g., crossovers, overbought/oversold conditions). The AI Trend Analysis corroborates this, stating a ""NEUTRAL"" trend with ""HIGH"" confidence due to ""static values"" and ""absence of activity."" Furthermore, 1-hour timeframe data is unavailable, preventing the necessary medium-term trend confirmation. With no news data available and a lack of any dynamic technical information, there is no basis for a BUY or SELL decision according to the crypto-adjusted trading rules.",1.0,HIGH,NEUTRAL,HIGH,LOW,,18.82231,18.82231,1.8932661725304283e-29,0.0,5000000.0,BALANCED
2025-08-20T01:58:32.439715,session_20250820_013440_6979,4,LTCUSD,120.3,0.001,0.0,0.0,BUY,HIGH,"The 5-minute timeframe shows extremely oversold conditions, with Williams %R at -100.0 and Stochastic K at 0.0, which are strong signals for an imminent bounce, especially in crypto-adjusted analysis where such extremes are highly significant. The AI Trend Analysis supports this, explicitly stating these indicators ""suggest an imminent bounce back towards a neutral range."" While MACD shows a bearish crossover and daily change is slightly negative, the consolidating moving averages and neutral RSI indicate a lack of strong downtrend. The exceptionally high volume could also precede a reversal. With no negative news sentiment, the strong technical buy signals from momentum indicators take precedence, qualifying for a high-priority BUY given the crypto-adjusted thresholds.",6.5,MEDIUM,NEUTRAL,MEDIUM,MEDIUM,48.74476987447695,120.4645,120.40900000000002,-0.030087047081006554,-0.09965122072745768,34325.26113634959,BALANCED
2025-08-20T01:58:32.439730,session_20250820_013440_6979,4,BCHUSD,577.66,0.0,0.0,0.0,HOLD,LOW,"The analysis for BCHUSD is severely hampered by the lack of crucial data points. There is no 1-hour timeframe data available, which is critical for establishing a robust medium-term trend, as per the trading instructions. Furthermore, key 5-minute technical indicators such as RSI, MACD, Williams %R, and Stochastic K are all unavailable ('nan' or '0.000'), making a comprehensive short-term momentum and oscillator assessment impossible. Volatility measures (ATR, 20-day Volatility) are also missing. While the 5-minute price is currently above its SMAs and the AI Trend Analysis is ""BULLISH,"" the AI's confidence is explicitly ""LOW"" due to the missing data and it warns the asset is ""overbought by the Bollinger Bands,"" suggesting a potential pullback. High current volume is noted, but the Volume MA is 0, rendering the volume ratio meaningless. Given the overwhelming absence of critical technical indicators and higher timeframe data, the technical strength does not meet the ""5+"" threshold required for a high-priority BUY in crypto-adjusted mode. No news data is available to influence the decision. Therefore, it is prudent to hold and not initiate a position due to the high uncertainty and unreliable technical signals.",3.0,LOW,BULLISH,LOW,MEDIUM,,575.53,575.53,0.0,0.37009365280697715,5000000.0,BALANCED
2025-08-20T01:58:32.439741,session_20250820_013440_6979,4,ZECUSD,38.47,0.0,0.0,0.0,HOLD,LOW,"A comprehensive analysis for ZECUSD is severely hampered by a critical lack of data across both timeframes and key indicators. There is no 1-hour timeframe data available, which is paramount for assessing medium-term trends and carries more weight than 5-minute data according to the rules. Furthermore, crucial 5-minute momentum indicators such as RSI, Williams %R, and Stochastic K are all 'nan', making it impossible to gauge overbought/oversold conditions or momentum. MACD indicators are effectively flat (0.000). Volatility indicators (ATR and 20-day Volatility) are also 0.000, indicating either no price movement or data unreliability, both of which are major red flags. While the price is slightly above its 20-day and 50-day SMAs, hinting at a weak bullish bias, this single indicator is insufficient given the absence of all other confirming signals. The AI's own analysis states ""extreme uncertainty and a lack of confirmed direction"" and notes the absence of valid momentum and trend strength indicators. Given the crypto-adjusted requirements for 2-3 confirming indicators and a technical score of 5+ for a high-priority BUY, the data provided does not support any actionable trade with reasonable confidence or a calculable technical score. Trading under such conditions would be excessively high risk.",2.0,LOW,BULLISH,LOW,HIGH,,38.42,38.42,2.524354896707238e-29,0.13014055179593223,5000000.0,BALANCED
2025-08-20T01:58:32.439760,session_20250820_013440_6979,4,BATUSD,0.1529,0.0,0.0,0.0,HOLD,LOW,"The market for BATUSD is exhibiting extreme stagnation. The price has remained completely static at $0.15 with a 0.00% daily change. All key technical indicators (RSI, Williams %R, Stochastic K) are 'NaN' (Not a Number), and MACD is at zero, indicating a complete absence of price movement or momentum. Volatility indicators like ATR and 20-day Volatility are also at 0.000, reinforcing the lack of any price action. While current volume is high, the Volume MA is zero, rendering the volume ratio meaningless and suggesting a lack of historical liquidity or active trading that affects price. The AI trend analysis correctly identifies a NEUTRAL trend with HIGH risk, specifically citing market stagnation and the absence of a discernible trend. With no price movement, any trade would be immediately unprofitable due to the $0.01 trading fee per trade. There are no technical signals for either a buy or sell, making any trade highly speculative and without basis.",1.0,HIGH,NEUTRAL,HIGH,HIGH,,0.1529,0.1529,4.930380657631324e-32,0.0,5000000.0,BALANCED
2025-08-20T01:58:32.439766,session_20250820_013440_6979,4,OXTUSD,0.06989,0.0,0.0,0.0,HOLD,LOW,"The asset OXTUSD exhibits completely static price action, with the current price holding firm at $0.07 and a 0.00% daily change. All critical momentum and volatility indicators, including RSI, MACD Histogram, MACD Line, MACD Signal, Williams %R, Stochastic K, ATR, and 20-day Volatility, are either NaN or register zero, indicating an absolute absence of price movement or discernible trend. The AI Trend Analysis explicitly identifies this as a ""NEUTRAL"" trend with ""LOW"" confidence, reasoning that it suggests ""extreme consolidation or a halted market."" Without any price action, volatility, or technical signals, there is no viable trading opportunity or risk to manage. Initiating a trade under these conditions is not feasible.",1.0,HIGH,NEUTRAL,LOW,LOW,,0.06989,0.06989,0.0,0.0,5000000.0,BALANCED
